,number,value,datetime_start,datetime_complete,duration,params_Bayes_prior_positive,params_Bayes_var_smoothing,params_GB_ccp_alpha,params_GB_criterion,params_GB_learning_rate,params_GB_loss,params_GB_max_depth,params_GB_max_features,params_GB_min_impurity_decrease,params_GB_min_samples_leaf,params_GB_min_samples_split,params_GB_n_estimators,params_GB_subsample,params_GB_tol,params_GB_validation_fraction,params_Method,params_SVM_C,params_SVM_coef0,params_SVM_decision_function_shape,params_SVM_degree,params_SVM_gamma,params_SVM_kernel,params_SVM_shrinking,params_SVM_tol,params_Tree_ccp_alpha,params_Tree_criterion,params_Tree_max_features,params_Tree_min_impurity_decrease,params_Tree_min_samples_leaf,params_Tree_min_samples_split,params_Tree_min_weight_fraction_leaf,params_Tree_splitter,params_kNN_algorithm,params_kNN_leaf_size,params_kNN_n_neighbors,params_kNN_p,params_kNN_weights,state
1861,1861,0.8614814814814815,2023-03-02 00:31:49.483847,2023-03-02 00:31:50.206124,0 days 00:00:00.722277,0.12983723461375796,0.9354621922477848,,,,,,,,,,,,,,Bayes,,,,,,,,,,,,,,,,,,,,,,COMPLETE
1862,1862,0.5,2023-03-02 00:31:49.703894,2023-03-02 00:31:51.883431,0 days 00:00:02.179537,,,176.5505801471827,friedman_mse,9.307674791964647,exponential,29.0,0.003172980041008966,579.597249201259,0.07225702487652044,0.757573677319623,256.0,0.6292427753858816,0.8642736148488334,0.12109490196444261,Gradient Boosting,,,,,,,,,,,,,,,,,,,,,,COMPLETE
1863,1863,0.8668518518518519,2023-03-02 00:31:49.742895,2023-03-02 00:31:50.387099,0 days 00:00:00.644204,0.0006348246690276969,0.22996615757282904,,,,,,,,,,,,,,Bayes,,,,,,,,,,,,,,,,,,,,,,COMPLETE
1864,1864,0.5,2023-03-02 00:31:49.870900,2023-03-02 00:31:55.054390,0 days 00:00:05.183490,,,970.303023938475,friedman_mse,3.508873308806273,exponential,29.0,0.5418312470393801,236.06458553117744,0.06445936425550317,0.03742839654620833,590.0,0.6175643122650893,0.42564396740431343,0.8837348417558226,Gradient Boosting,,,,,,,,,,,,,,,,,,,,,,COMPLETE
1865,1865,0.5,2023-03-02 00:31:49.939918,2023-03-02 00:31:53.028140,0 days 00:00:03.088222,,,183.96736903425165,friedman_mse,9.420114702178061,exponential,29.0,0.6187048735254386,101.65801992495193,0.12397570341416467,0.7709672974021644,584.0,0.6284638806671102,0.8587794777244324,0.11875610320603025,Gradient Boosting,,,,,,,,,,,,,,,,,,,,,,COMPLETE
1866,1866,0.8662962962962963,2023-03-02 00:31:49.963918,2023-03-02 00:31:50.741722,0 days 00:00:00.777804,0.30823404832898643,0.24608914006984897,,,,,,,,,,,,,,Bayes,,,,,,,,,,,,,,,,,,,,,,COMPLETE
1867,1867,0.8640740740740741,2023-03-02 00:31:50.150942,2023-03-02 00:31:50.832800,0 days 00:00:00.681858,0.30945632849381804,0.41305046992859995,,,,,,,,,,,,,,Bayes,,,,,,,,,,,,,,,,,,,,,,COMPLETE
1868,1868,0.8690740740740741,2023-03-02 00:31:50.222125,2023-03-02 00:31:50.858799,0 days 00:00:00.636674,0.19585183860842537,0.03049080094592902,,,,,,,,,,,,,,Bayes,,,,,,,,,,,,,,,,,,,,,,COMPLETE
1869,1869,0.5,2023-03-02 00:31:50.390099,2023-03-02 00:31:57.437343,0 days 00:00:07.047244,,,170.0867884506631,friedman_mse,3.4256930456008927,exponential,32.0,0.791364205703006,119.70335961679712,0.23146303301237534,0.044224056897360864,687.0,0.6018399345225317,0.4317627003574725,0.24225560404118962,Gradient Boosting,,,,,,,,,,,,,,,,,,,,,,COMPLETE
1870,1870,0.5,2023-03-02 00:31:50.746722,2023-03-02 00:31:51.498331,0 days 00:00:00.751609,,,,,,,,,,,,,,,,Tree,,,,,,,,,267.1912609793907,entropy,0.641145856237993,392.6944058668582,0.3996779463190212,0.6463536845211557,0.025959490087885617,random,,,,,,COMPLETE
1871,1871,0.5,2023-03-02 00:31:50.838801,2023-03-02 00:31:53.835538,0 days 00:00:02.996737,,,944.8426263375554,friedman_mse,9.322389242280057,exponential,32.0,0.9252526846514174,243.72076197660283,0.49894235380842267,0.5694431666179837,727.0,0.261092183401716,0.38825212365814427,0.2472674139147769,Gradient Boosting,,,,,,,,,,,,,,,,,,,,,,COMPLETE
1872,1872,0.5,2023-03-02 00:31:50.870800,2023-03-02 00:31:53.489353,0 days 00:00:02.618553,,,979.035442469436,friedman_mse,3.9365132302436763,exponential,1.0,0.007588779678540769,225.44882201253063,0.23415532368878747,0.03206753699101539,588.0,0.23786520504574482,0.41255749705983424,0.11654011528716013,Gradient Boosting,,,,,,,,,,,,,,,,,,,,,,COMPLETE
1873,1873,0.5,2023-03-02 00:31:51.505332,2023-03-02 00:31:52.614440,0 days 00:00:01.109108,,,512.9411701905277,friedman_mse,3.4340155323287753,exponential,1.0,0.9178589096358751,122.66564540052485,0.12028697463260243,0.7794372345754669,94.0,0.2516017719010665,0.5433640974643872,0.890759209565642,Gradient Boosting,,,,,,,,,,,,,,,,,,,,,,COMPLETE
1874,1874,0.8690740740740741,2023-03-02 00:31:51.887431,2023-03-02 00:31:52.372667,0 days 00:00:00.485236,0.25134622599511414,0.12243010898314777,,,,,,,,,,,,,,Bayes,,,,,,,,,,,,,,,,,,,,,,COMPLETE
1875,1875,0.8618518518518519,2023-03-02 00:31:52.377668,2023-03-02 00:31:52.850142,0 days 00:00:00.472474,0.6938871430254745,0.8549165708115722,,,,,,,,,,,,,,Bayes,,,,,,,,,,,,,,,,,,,,,,COMPLETE
1876,1876,0.8627777777777778,2023-03-02 00:31:52.618438,2023-03-02 00:31:53.178651,0 days 00:00:00.560213,0.6936789081575628,0.6001391660449527,,,,,,,,,,,,,,Bayes,,,,,,,,,,,,,,,,,,,,,,COMPLETE
1877,1877,0.8688888888888889,2023-03-02 00:31:52.856139,2023-03-02 00:31:53.363353,0 days 00:00:00.507214,0.7492478320713664,0.0819431286420648,,,,,,,,,,,,,,Bayes,,,,,,,,,,,,,,,,,,,,,,COMPLETE
1878,1878,0.8688888888888889,2023-03-02 00:31:52.928139,2023-03-02 00:31:53.388352,0 days 00:00:00.460213,0.039938466151363865,0.08123326756876126,,,,,,,,,,,,,,Bayes,,,,,,,,,,,,,,,,,,,,,,COMPLETE
1879,1879,0.8624074074074074,2023-03-02 00:31:53.035141,2023-03-02 00:31:53.532353,0 days 00:00:00.497212,0.3366140484469961,0.7937136188367875,,,,,,,,,,,,,,Bayes,,,,,,,,,,,,,,,,,,,,,,COMPLETE
1880,1880,0.8648148148148148,2023-03-02 00:31:53.182653,2023-03-02 00:31:53.568352,0 days 00:00:00.385699,0.0198359483878285,0.3506266142069142,,,,,,,,,,,,,,Bayes,,,,,,,,,,,,,,,,,,,,,,COMPLETE
1881,1881,0.8688888888888888,2023-03-02 00:31:53.369353,2023-03-02 00:31:53.782540,0 days 00:00:00.413187,0.9969508288067843,0.1562590343659022,,,,,,,,,,,,,,Bayes,,,,,,,,,,,,,,,,,,,,,,COMPLETE
1882,1882,0.8690740740740741,2023-03-02 00:31:53.406352,2023-03-02 00:31:53.758540,0 days 00:00:00.352188,0.022770299662849745,0.1532002082665957,,,,,,,,,,,,,,Bayes,,,,,,,,,,,,,,,,,,,,,,COMPLETE
1883,1883,0.8638888888888889,2023-03-02 00:31:53.493353,2023-03-02 00:31:53.884540,0 days 00:00:00.391187,0.02250094941620235,0.45698829802228397,,,,,,,,,,,,,,Bayes,,,,,,,,,,,,,,,,,,,,,,COMPLETE
1884,1884,0.8687037037037038,2023-03-02 00:31:53.535356,2023-03-02 00:31:54.011538,0 days 00:00:00.476182,0.026926648738359427,0.040870031835275,,,,,,,,,,,,,,Bayes,,,,,,,,,,,,,,,,,,,,,,COMPLETE
1885,1885,0.8690740740740741,2023-03-02 00:31:53.573355,2023-03-02 00:31:54.075538,0 days 00:00:00.502183,0.23016272266239154,0.14587742122609826,,,,,,,,,,,,,,Bayes,,,,,,,,,,,,,,,,,,,,,,COMPLETE
1886,1886,0.8690740740740741,2023-03-02 00:31:53.765541,2023-03-02 00:31:54.213643,0 days 00:00:00.448102,0.6626979333059442,0.12124565946988225,,,,,,,,,,,,,,Bayes,,,,,,,,,,,,,,,,,,,,,,COMPLETE
1887,1887,0.8690740740740741,2023-03-02 00:31:53.795656,2023-03-02 00:31:54.231233,0 days 00:00:00.435577,0.1453222753794463,0.1173285289598389,,,,,,,,,,,,,,Bayes,,,,,,,,,,,,,,,,,,,,,,COMPLETE
1888,1888,0.8690740740740741,2023-03-02 00:31:53.839538,2023-03-02 00:31:54.282230,0 days 00:00:00.442692,0.19632863851949475,0.11510642862353564,,,,,,,,,,,,,,Bayes,,,,,,,,,,,,,,,,,,,,,,COMPLETE
1889,1889,0.8629629629629629,2023-03-02 00:31:53.888540,2023-03-02 00:31:54.328231,0 days 00:00:00.439691,0.27084160414950476,0.6658018659493039,,,,,,,,,,,,,,Bayes,,,,,,,,,,,,,,,,,,,,,,COMPLETE
1890,1890,0.866111111111111,2023-03-02 00:31:54.014538,2023-03-02 00:31:54.375231,0 days 00:00:00.360693,0.2740023068105852,0.3290864765392665,,,,,,,,,,,,,,Bayes,,,,,,,,,,,,,,,,,,,,,,COMPLETE
1891,1891,0.8690740740740741,2023-03-02 00:31:54.079538,2023-03-02 00:31:54.428839,0 days 00:00:00.349301,0.9636294070265997,0.12017946862634482,,,,,,,,,,,,,,Bayes,,,,,,,,,,,,,,,,,,,,,,COMPLETE
1892,1892,0.8694444444444445,2023-03-02 00:31:54.219231,2023-03-02 00:31:54.577840,0 days 00:00:00.358609,0.974431078599966,0.09217169058075622,,,,,,,,,,,,,,Bayes,,,,,,,,,,,,,,,,,,,,,,COMPLETE
1893,1893,0.8633333333333333,2023-03-02 00:31:54.236230,2023-03-02 00:31:54.625838,0 days 00:00:00.389608,0.2901175388703027,0.6942310517709236,,,,,,,,,,,,,,Bayes,,,,,,,,,,,,,,,,,,,,,,COMPLETE
1894,1894,0.8635185185185185,2023-03-02 00:31:54.285231,2023-03-02 00:31:54.728392,0 days 00:00:00.443161,0.2717705825674288,0.6984413255753879,,,,,,,,,,,,,,Bayes,,,,,,,,,,,,,,,,,,,,,,COMPLETE
1895,1895,0.8633333333333333,2023-03-02 00:31:54.331231,2023-03-02 00:31:54.807390,0 days 00:00:00.476159,0.3250844625839693,0.6982023214071222,,,,,,,,,,,,,,Bayes,,,,,,,,,,,,,,,,,,,,,,COMPLETE
1896,1896,0.8694444444444445,2023-03-02 00:31:54.378231,2023-03-02 00:31:54.877392,0 days 00:00:00.499161,0.47976378091586475,0.08852984669476142,,,,,,,,,,,,,,Bayes,,,,,,,,,,,,,,,,,,,,,,COMPLETE
1897,1897,0.8694444444444445,2023-03-02 00:31:54.435839,2023-03-02 00:31:54.971390,0 days 00:00:00.535551,0.3263212017340302,0.09181974960141048,,,,,,,,,,,,,,Bayes,,,,,,,,,,,,,,,,,,,,,,COMPLETE
1898,1898,0.8633333333333333,2023-03-02 00:31:54.583839,2023-03-02 00:31:55.321493,0 days 00:00:00.737654,0.3253091275447704,0.49342564795040905,,,,,,,,,,,,,,Bayes,,,,,,,,,,,,,,,,,,,,,,COMPLETE
1899,1899,0.5,2023-03-02 00:31:54.628841,2023-03-02 00:31:55.297494,0 days 00:00:00.668653,,,,,,,,,,,,,,,,Tree,,,,,,,,,419.45255999286854,entropy,0.3887697808671543,993.9892132212731,0.45019592073641934,0.7110638140147223,0.23485557657316078,best,,,,,,COMPLETE
1900,1900,0.5,2023-03-02 00:31:54.731390,2023-03-02 00:31:55.271492,0 days 00:00:00.540102,,,,,,,,,,,,,,,,Tree,,,,,,,,,194.65820000975793,entropy,0.6031749496958436,442.57765499928706,0.4226078808277913,0.69872389661105,0.17997570278847225,best,,,,,,COMPLETE
1901,1901,0.5,2023-03-02 00:31:54.809390,2023-03-02 00:31:55.417493,0 days 00:00:00.608103,,,,,,,,,,,,,,,,Tree,,,,,,,,,356.9769539426919,entropy,0.612897252228817,39.324380135000865,0.38279688660387523,0.6941671196063244,0.3567831506605019,best,,,,,,COMPLETE
1902,1902,0.5,2023-03-02 00:31:54.880391,2023-03-02 00:31:55.463492,0 days 00:00:00.583101,,,,,,,,,,,,,,,,Tree,,,,,,,,,351.33147289327917,entropy,0.7285019237007764,34.60385190492286,0.37605320972592327,0.7209087585467926,0.35617160397192826,best,,,,,,COMPLETE
1903,1903,0.8616666666666667,2023-03-02 00:31:54.974392,2023-03-02 00:31:55.546492,0 days 00:00:00.572100,0.06994093145123745,0.8797556896419321,,,,,,,,,,,,,,Bayes,,,,,,,,,,,,,,,,,,,,,,COMPLETE
1904,1904,0.8668518518518519,2023-03-02 00:31:55.065390,2023-03-02 00:31:55.597492,0 days 00:00:00.532102,0.41741128219568463,0.29559844613133535,,,,,,,,,,,,,,Bayes,,,,,,,,,,,,,,,,,,,,,,COMPLETE
1905,1905,0.8683333333333333,2023-03-02 00:31:55.285492,2023-03-02 00:31:55.667496,0 days 00:00:00.382004,0.41611995844081073,0.06553450664295882,,,,,,,,,,,,,,Bayes,,,,,,,,,,,,,,,,,,,,,,COMPLETE
1906,1906,0.8631481481481482,2023-03-02 00:31:55.300493,2023-03-02 00:31:55.837911,0 days 00:00:00.537418,0.0822497390377668,0.7429839378154557,,,,,,,,,,,,,,Bayes,,,,,,,,,,,,,,,,,,,,,,COMPLETE
1907,1907,0.8633333333333333,2023-03-02 00:31:55.327493,2023-03-02 00:31:55.768611,0 days 00:00:00.441118,0.061909234463900724,0.7217807542306702,,,,,,,,,,,,,,Bayes,,,,,,,,,,,,,,,,,,,,,,COMPLETE
1908,1908,0.8685185185185185,2023-03-02 00:31:55.425492,2023-03-02 00:31:55.867909,0 days 00:00:00.442417,0.5029839174413455,0.06805633786833858,,,,,,,,,,,,,,Bayes,,,,,,,,,,,,,,,,,,,,,,COMPLETE
1909,1909,0.8675925925925927,2023-03-02 00:31:55.466495,2023-03-02 00:31:55.935558,0 days 00:00:00.469063,0.9073764474241475,0.17621141103734284,,,,,,,,,,,,,,Bayes,,,,,,,,,,,,,,,,,,,,,,COMPLETE
1910,1910,0.8675925925925927,2023-03-02 00:31:55.552492,2023-03-02 00:31:56.015699,0 days 00:00:00.463207,0.9098827331460645,0.1796344350427041,,,,,,,,,,,,,,Bayes,,,,,,,,,,,,,,,,,,,,,,COMPLETE
1911,1911,0.8646296296296296,2023-03-02 00:31:55.601495,2023-03-02 00:31:56.111703,0 days 00:00:00.510208,0.09235999806160893,0.3777789477294504,,,,,,,,,,,,,,Bayes,,,,,,,,,,,,,,,,,,,,,,COMPLETE
1912,1912,0.8688888888888889,2023-03-02 00:31:55.672492,2023-03-02 00:31:56.279509,0 days 00:00:00.607017,0.09149125564947995,0.039038881468863126,,,,,,,,,,,,,,Bayes,,,,,,,,,,,,,,,,,,,,,,COMPLETE
1913,1913,0.8690740740740741,2023-03-02 00:31:55.771612,2023-03-02 00:31:56.323509,0 days 00:00:00.551897,0.25554690861174595,0.02724591674704429,,,,,,,,,,,,,,Bayes,,,,,,,,,,,,,,,,,,,,,,COMPLETE
1914,1914,0.8685185185185185,2023-03-02 00:31:55.841909,2023-03-02 00:31:56.477031,0 days 00:00:00.635122,0.09493499080464163,0.041718408822228575,,,,,,,,,,,,,,Bayes,,,,,,,,,,,,,,,,,,,,,,COMPLETE
1915,1915,0.8687037037037038,2023-03-02 00:31:55.882026,2023-03-02 00:31:56.461031,0 days 00:00:00.579005,0.048171593521991185,0.03460200316501341,,,,,,,,,,,,,,Bayes,,,,,,,,,,,,,,,,,,,,,,COMPLETE
1916,1916,0.8688888888888889,2023-03-02 00:31:55.940560,2023-03-02 00:31:56.563036,0 days 00:00:00.622476,0.3857855991001359,0.03825312048124613,,,,,,,,,,,,,,Bayes,,,,,,,,,,,,,,,,,,,,,,COMPLETE
1917,1917,0.8524074074074074,2023-03-02 00:31:56.018701,2023-03-02 00:31:56.345032,0 days 00:00:00.326331,,,,,,,,,,,,,,,,kNN,,,,,,,,,,,,,,,,,ball_tree,125.0,115.0,214.0,distance,COMPLETE
1918,1918,0.8477777777777777,2023-03-02 00:31:56.116713,2023-03-02 00:31:56.755197,0 days 00:00:00.638484,,,,,,,,,,,,,,,,kNN,,,,,,,,,,,,,,,,,ball_tree,339.0,368.0,207.0,distance,COMPLETE
1919,1919,0.8688888888888888,2023-03-02 00:31:56.282510,2023-03-02 00:31:56.723033,0 days 00:00:00.440523,0.23923820224786027,0.07448932292456234,,,,,,,,,,,,,,Bayes,,,,,,,,,,,,,,,,,,,,,,COMPLETE
1920,1920,0.8688888888888888,2023-03-02 00:31:56.327509,2023-03-02 00:31:56.784200,0 days 00:00:00.456691,0.046497225050172626,0.07292081863349345,,,,,,,,,,,,,,Bayes,,,,,,,,,,,,,,,,,,,,,,COMPLETE
1921,1921,0.8688888888888888,2023-03-02 00:31:56.452032,2023-03-02 00:31:56.800199,0 days 00:00:00.348167,0.7205149228663386,0.07636328810094993,,,,,,,,,,,,,,Bayes,,,,,,,,,,,,,,,,,,,,,,COMPLETE
1922,1922,0.8635185185185186,2023-03-02 00:31:56.471034,2023-03-02 00:31:56.799198,0 days 00:00:00.328164,0.3865273458661789,0.47836791082806146,,,,,,,,,,,,,,Bayes,,,,,,,,,,,,,,,,,,,,,,COMPLETE
1923,1923,0.8635185185185185,2023-03-02 00:31:56.496032,2023-03-02 00:31:56.861198,0 days 00:00:00.365166,0.2993160401049312,0.5501099876184135,,,,,,,,,,,,,,Bayes,,,,,,,,,,,,,,,,,,,,,,COMPLETE
1924,1924,0.8644444444444445,2023-03-02 00:31:56.566033,2023-03-02 00:31:57.133093,0 days 00:00:00.567060,0.8674513573627165,0.3914323255363439,,,,,,,,,,,,,,Bayes,,,,,,,,,,,,,,,,,,,,,,COMPLETE
1925,1925,0.8633333333333333,2023-03-02 00:31:56.727034,2023-03-02 00:31:57.417830,0 days 00:00:00.690796,0.14997698458270226,0.5106646979550171,,,,,,,,,,,,,,Bayes,,,,,,,,,,,,,,,,,,,,,,COMPLETE
1926,1926,0.8633333333333333,2023-03-02 00:31:56.762198,2023-03-02 00:31:57.495338,0 days 00:00:00.733140,0.15171533324007166,0.5032040240582513,,,,,,,,,,,,,,Bayes,,,,,,,,,,,,,,,,,,,,,,COMPLETE
1927,1927,0.6494444444444445,2023-03-02 00:31:56.802198,2023-03-02 00:31:57.309303,0 days 00:00:00.507105,,,,,,,,,,,,,,,,SVM,29.293658782286997,18.374498864104595,ovr,,auto,sigmoid,False,0.4556322682578656,,,,,,,,,,,,,,COMPLETE
1928,1928,0.5,2023-03-02 00:31:56.819200,2023-03-02 00:31:57.276301,0 days 00:00:00.457101,,,,,,,,,,,,,,,,SVM,34.16969324594044,24.868759610727547,ovr,,auto,sigmoid,False,0.4471301451400185,,,,,,,,,,,,,,COMPLETE
1929,1929,0.8690740740740741,2023-03-02 00:31:56.834198,2023-03-02 00:31:57.529337,0 days 00:00:00.695139,0.6694190086064463,0.10437930830930789,,,,,,,,,,,,,,Bayes,,,,,,,,,,,,,,,,,,,,,,COMPLETE
1930,1930,0.5020370370370371,2023-03-02 00:31:56.981836,2023-03-02 00:31:57.265303,0 days 00:00:00.283467,,,,,,,,,,,,,,,,SVM,14.308491497981755,20.0273008249982,ovr,,auto,sigmoid,False,0.18003675390608304,,,,,,,,,,,,,,COMPLETE
1931,1931,0.8690740740740741,2023-03-02 00:31:57.146146,2023-03-02 00:31:57.656867,0 days 00:00:00.510721,0.20301553302060435,0.10461769990540158,,,,,,,,,,,,,,Bayes,,,,,,,,,,,,,,,,,,,,,,COMPLETE
1932,1932,0.8690740740740741,2023-03-02 00:31:57.271302,2023-03-02 00:31:57.744865,0 days 00:00:00.473563,0.18848279614433397,0.10296392762281421,,,,,,,,,,,,,,Bayes,,,,,,,,,,,,,,,,,,,,,,COMPLETE
1933,1933,0.8690740740740741,2023-03-02 00:31:57.296302,2023-03-02 00:31:57.803912,0 days 00:00:00.507610,0.17785838867927695,0.10212621344634655,,,,,,,,,,,,,,Bayes,,,,,,,,,,,,,,,,,,,,,,COMPLETE
1934,1934,0.8690740740740741,2023-03-02 00:31:57.408834,2023-03-02 00:31:57.829914,0 days 00:00:00.421080,0.12001957670202988,0.13021881399071134,,,,,,,,,,,,,,Bayes,,,,,,,,,,,,,,,,,,,,,,COMPLETE
1935,1935,0.8688888888888889,2023-03-02 00:31:57.451338,2023-03-02 00:31:57.746865,0 days 00:00:00.295527,0.17583627065148666,0.13462996806574795,,,,,,,,,,,,,,Bayes,,,,,,,,,,,,,,,,,,,,,,COMPLETE
1936,1936,0.8627777777777778,2023-03-02 00:31:57.466337,2023-03-02 00:31:57.804913,0 days 00:00:00.338576,0.4676241641942839,0.6500550927769602,,,,,,,,,,,,,,Bayes,,,,,,,,,,,,,,,,,,,,,,COMPLETE
1937,1937,0.8614814814814814,2023-03-02 00:31:57.516340,2023-03-02 00:31:57.977915,0 days 00:00:00.461575,0.17800517226740137,0.9134896560805152,,,,,,,,,,,,,,Bayes,,,,,,,,,,,,,,,,,,,,,,COMPLETE
1938,1938,0.8688888888888889,2023-03-02 00:31:57.542864,2023-03-02 00:31:58.029912,0 days 00:00:00.487048,0.17601165267802493,0.13891984640646268,,,,,,,,,,,,,,Bayes,,,,,,,,,,,,,,,,,,,,,,COMPLETE
1939,1939,0.8668518518518519,2023-03-02 00:31:57.661865,2023-03-02 00:31:58.144915,0 days 00:00:00.483050,0.11803795458188154,0.30964575059706434,,,,,,,,,,,,,,Bayes,,,,,,,,,,,,,,,,,,,,,,COMPLETE
1940,1940,0.8688888888888888,2023-03-02 00:31:57.751534,2023-03-02 00:31:58.236913,0 days 00:00:00.485379,0.5376567470831145,0.08602999588159574,,,,,,,,,,,,,,Bayes,,,,,,,,,,,,,,,,,,,,,,COMPLETE
1941,1941,0.8668518518518519,2023-03-02 00:31:57.768915,2023-03-02 00:31:58.232913,0 days 00:00:00.463998,0.11975644134282457,0.30194875335170684,,,,,,,,,,,,,,Bayes,,,,,,,,,,,,,,,,,,,,,,COMPLETE
1942,1942,0.8631481481481482,2023-03-02 00:31:57.816912,2023-03-02 00:31:58.255793,0 days 00:00:00.438881,0.7969466091645643,0.5808646663787754,,,,,,,,,,,,,,Bayes,,,,,,,,,,,,,,,,,,,,,,COMPLETE
1943,1943,0.8664814814814815,2023-03-02 00:31:57.832916,2023-03-02 00:31:58.256318,0 days 00:00:00.423402,0.2539073107819984,0.32115094239579756,,,,,,,,,,,,,,Bayes,,,,,,,,,,,,,,,,,,,,,,COMPLETE
1944,1944,0.8683333333333333,2023-03-02 00:31:57.864914,2023-03-02 00:31:58.330600,0 days 00:00:00.465686,0.22562862407394202,0.06491927659740751,,,,,,,,,,,,,,Bayes,,,,,,,,,,,,,,,,,,,,,,COMPLETE
1945,1945,0.8688888888888888,2023-03-02 00:31:57.992913,2023-03-02 00:31:58.398600,0 days 00:00:00.405687,0.2304465171897693,0.08391217907388444,,,,,,,,,,,,,,Bayes,,,,,,,,,,,,,,,,,,,,,,COMPLETE
1946,1946,0.8688888888888888,2023-03-02 00:31:58.032913,2023-03-02 00:31:58.415598,0 days 00:00:00.382685,0.5475430630698291,0.0836389154744604,,,,,,,,,,,,,,Bayes,,,,,,,,,,,,,,,,,,,,,,COMPLETE
1947,1947,0.8681481481481481,2023-03-02 00:31:58.147913,2023-03-02 00:31:58.621120,0 days 00:00:00.473207,0.23192083904134883,0.06043029090535526,,,,,,,,,,,,,,Bayes,,,,,,,,,,,,,,,,,,,,,,COMPLETE
1948,1948,0.8690740740740741,2023-03-02 00:31:58.237915,2023-03-02 00:31:58.730119,0 days 00:00:00.492204,0.5771674270576458,0.11478733304497832,,,,,,,,,,,,,,Bayes,,,,,,,,,,,,,,,,,,,,,,COMPLETE
1949,1949,0.8614814814814815,2023-03-02 00:31:58.257365,2023-03-02 00:31:58.734119,0 days 00:00:00.476754,0.3117219952904354,0.9175610165080956,,,,,,,,,,,,,,Bayes,,,,,,,,,,,,,,,,,,,,,,COMPLETE
1950,1950,0.8690740740740741,2023-03-02 00:31:58.282599,2023-03-02 00:31:58.784250,0 days 00:00:00.501651,0.8800588368140494,0.11902654698650958,,,,,,,,,,,,,,Bayes,,,,,,,,,,,,,,,,,,,,,,COMPLETE
1951,1951,0.867962962962963,2023-03-02 00:31:58.305599,2023-03-02 00:31:58.767252,0 days 00:00:00.461653,0.9503161673698574,0.2107591263391846,,,,,,,,,,,,,,Bayes,,,,,,,,,,,,,,,,,,,,,,COMPLETE
1952,1952,0.862962962962963,2023-03-02 00:31:58.334598,2023-03-02 00:31:58.782252,0 days 00:00:00.447654,0.2996050452857496,0.7752071389119417,,,,,,,,,,,,,,Bayes,,,,,,,,,,,,,,,,,,,,,,COMPLETE
1953,1953,0.8690740740740741,2023-03-02 00:31:58.402601,2023-03-02 00:31:58.882794,0 days 00:00:00.480193,0.3065577993721025,0.11620628626692246,,,,,,,,,,,,,,Bayes,,,,,,,,,,,,,,,,,,,,,,COMPLETE
1954,1954,0.8624074074074074,2023-03-02 00:31:58.418599,2023-03-02 00:31:58.922793,0 days 00:00:00.504194,0.3416339002733532,0.8181019330479946,,,,,,,,,,,,,,Bayes,,,,,,,,,,,,,,,,,,,,,,COMPLETE
1955,1955,0.8690740740740741,2023-03-02 00:31:58.630122,2023-03-02 00:31:58.979794,0 days 00:00:00.349672,0.34047954413194526,0.11887346557899937,,,,,,,,,,,,,,Bayes,,,,,,,,,,,,,,,,,,,,,,COMPLETE
1956,1956,0.8644444444444445,2023-03-02 00:31:58.739120,2023-03-02 00:31:59.279866,0 days 00:00:00.540746,0.03792280421776372,0.3972643643874635,,,,,,,,,,,,,,Bayes,,,,,,,,,,,,,,,,,,,,,,COMPLETE
1957,1957,0.8690740740740741,2023-03-02 00:31:58.751119,2023-03-02 00:31:59.217795,0 days 00:00:00.466676,0.5964006112636346,0.1534097056956567,,,,,,,,,,,,,,Bayes,,,,,,,,,,,,,,,,,,,,,,COMPLETE
1958,1958,0.8692592592592593,2023-03-02 00:31:58.770250,2023-03-02 00:31:59.260795,0 days 00:00:00.490545,0.3353863272550146,0.09340945677540434,,,,,,,,,,,,,,Bayes,,,,,,,,,,,,,,,,,,,,,,COMPLETE
1959,1959,0.8690740740740741,2023-03-02 00:31:58.807251,2023-03-02 00:31:59.334866,0 days 00:00:00.527615,0.3442979239402132,0.15085021623753228,,,,,,,,,,,,,,Bayes,,,,,,,,,,,,,,,,,,,,,,COMPLETE
1960,1960,0.8688888888888888,2023-03-02 00:31:58.822250,2023-03-02 00:31:59.297867,0 days 00:00:00.475617,0.04035789654149747,0.1583817151173456,,,,,,,,,,,,,,Bayes,,,,,,,,,,,,,,,,,,,,,,COMPLETE
1961,1961,0.8633333333333333,2023-03-02 00:31:58.887793,2023-03-02 00:31:59.405868,0 days 00:00:00.518075,0.343314473083625,0.7267225910055204,,,,,,,,,,,,,,Bayes,,,,,,,,,,,,,,,,,,,,,,COMPLETE
