,number,value,datetime_start,datetime_complete,duration,params_Bayes_prior_positive,params_Bayes_var_smoothing,params_GB_ccp_alpha,params_GB_criterion,params_GB_learning_rate,params_GB_loss,params_GB_max_depth,params_GB_max_features,params_GB_min_impurity_decrease,params_GB_min_samples_leaf,params_GB_min_samples_split,params_GB_n_estimators,params_GB_subsample,params_GB_tol,params_GB_validation_fraction,params_Method,params_SVM_C,params_SVM_coef0,params_SVM_decision_function_shape,params_SVM_degree,params_SVM_gamma,params_SVM_kernel,params_SVM_shrinking,params_SVM_tol,params_Tree_ccp_alpha,params_Tree_criterion,params_Tree_max_features,params_Tree_min_impurity_decrease,params_Tree_min_samples_leaf,params_Tree_min_samples_split,params_Tree_min_weight_fraction_leaf,params_Tree_splitter,params_kNN_algorithm,params_kNN_leaf_size,params_kNN_n_neighbors,params_kNN_p,params_kNN_weights,state
1962,1962,0.8664814814814815,2023-03-02 00:31:58.925794,2023-03-02 00:31:59.465866,0 days 00:00:00.540072,0.044787847038052414,0.24124217233147122,,,,,,,,,,,,,,Bayes,,,,,,,,,,,,,,,,,,,,,,COMPLETE
1963,1963,0.8692592592592593,2023-03-02 00:31:58.983796,2023-03-02 00:31:59.781847,0 days 00:00:00.798051,0.038266262454183936,0.09677547203583824,,,,,,,,,,,,,,Bayes,,,,,,,,,,,,,,,,,,,,,,COMPLETE
1964,1964,0.8681481481481481,2023-03-02 00:31:59.219798,2023-03-02 00:31:59.901767,0 days 00:00:00.681969,0.032560828283300404,0.19733927534390933,,,,,,,,,,,,,,Bayes,,,,,,,,,,,,,,,,,,,,,,COMPLETE
1965,1965,0.8324074074074074,2023-03-02 00:31:59.264794,2023-03-02 00:31:59.948766,0 days 00:00:00.683972,,,,,,,,,,,,,,,,kNN,,,,,,,,,,,,,,,,,kd_tree,404.0,220.0,363.0,distance,COMPLETE
1966,1966,0.8366666666666667,2023-03-02 00:31:59.282866,2023-03-02 00:31:59.951767,0 days 00:00:00.668901,,,,,,,,,,,,,,,,kNN,,,,,,,,,,,,,,,,,kd_tree,254.0,217.0,362.0,distance,COMPLETE
1967,1967,0.8681481481481481,2023-03-02 00:31:59.316867,2023-03-02 00:32:00.013288,0 days 00:00:00.696421,0.9282158108414531,0.052452097436053315,,,,,,,,,,,,,,Bayes,,,,,,,,,,,,,,,,,,,,,,COMPLETE
1968,1968,0.855,2023-03-02 00:31:59.355869,2023-03-02 00:32:00.096289,0 days 00:00:00.740420,,,,,,,,,,,,,,,,kNN,,,,,,,,,,,,,,,,,kd_tree,361.0,394.0,101.0,distance,COMPLETE
1969,1969,0.8546296296296296,2023-03-02 00:31:59.423865,2023-03-02 00:31:59.861767,0 days 00:00:00.437902,,,,,,,,,,,,,,,,kNN,,,,,,,,,,,,,,,,,kd_tree,254.0,65.0,141.0,distance,COMPLETE
1970,1970,0.8683333333333334,2023-03-02 00:31:59.489866,2023-03-02 00:32:00.052288,0 days 00:00:00.562422,0.014619003547823892,0.04851610790044155,,,,,,,,,,,,,,Bayes,,,,,,,,,,,,,,,,,,,,,,COMPLETE
1971,1971,0.8681481481481481,2023-03-02 00:31:59.785545,2023-03-02 00:32:00.247807,0 days 00:00:00.462262,0.2594836959427483,0.05540150663431043,,,,,,,,,,,,,,Bayes,,,,,,,,,,,,,,,,,,,,,,COMPLETE
1972,1972,0.8614814814814814,2023-03-02 00:31:59.863765,2023-03-02 00:32:00.351948,0 days 00:00:00.488183,0.516789480093549,0.8889625437054283,,,,,,,,,,,,,,Bayes,,,,,,,,,,,,,,,,,,,,,,COMPLETE
1973,1973,0.8692592592592593,2023-03-02 00:31:59.904764,2023-03-02 00:32:00.388948,0 days 00:00:00.484184,0.06767463579657514,0.01584491187139682,,,,,,,,,,,,,,Bayes,,,,,,,,,,,,,,,,,,,,,,COMPLETE
1974,1974,0.8692592592592593,2023-03-02 00:31:59.953764,2023-03-02 00:32:00.390948,0 days 00:00:00.437184,0.06945069733340878,0.016200629951745094,,,,,,,,,,,,,,Bayes,,,,,,,,,,,,,,,,,,,,,,COMPLETE
1975,1975,0.8601851851851852,2023-03-02 00:31:59.969288,2023-03-02 00:32:00.466956,0 days 00:00:00.497668,0.01547289158467738,0.9969279952053836,,,,,,,,,,,,,,Bayes,,,,,,,,,,,,,,,,,,,,,,COMPLETE
1976,1976,0.8631481481481482,2023-03-02 00:32:00.015288,2023-03-02 00:32:00.500956,0 days 00:00:00.485668,0.13932816345176605,0.6164127630031129,,,,,,,,,,,,,,Bayes,,,,,,,,,,,,,,,,,,,,,,COMPLETE
1977,1977,0.8629629629629629,2023-03-02 00:32:00.055291,2023-03-02 00:32:00.522965,0 days 00:00:00.467674,0.5160418442446221,0.6087796326334636,,,,,,,,,,,,,,Bayes,,,,,,,,,,,,,,,,,,,,,,COMPLETE
1978,1978,0.8690740740740741,2023-03-02 00:32:00.100291,2023-03-02 00:32:00.583971,0 days 00:00:00.483680,0.06983108638678695,0.018673701945574425,,,,,,,,,,,,,,Bayes,,,,,,,,,,,,,,,,,,,,,,COMPLETE
1979,1979,0.8688888888888888,2023-03-02 00:32:00.260807,2023-03-02 00:32:00.735947,0 days 00:00:00.475140,0.1441881172136305,0.07143116302555279,,,,,,,,,,,,,,Bayes,,,,,,,,,,,,,,,,,,,,,,COMPLETE
1980,1980,0.8664814814814815,2023-03-02 00:32:00.353950,2023-03-02 00:32:00.843000,0 days 00:00:00.489050,0.0007936222854521982,0.25621342097541144,,,,,,,,,,,,,,Bayes,,,,,,,,,,,,,,,,,,,,,,COMPLETE
1981,1981,0.8688888888888888,2023-03-02 00:32:00.392951,2023-03-02 00:32:00.879001,0 days 00:00:00.486050,0.2873100880025022,0.07301941389088742,,,,,,,,,,,,,,Bayes,,,,,,,,,,,,,,,,,,,,,,COMPLETE
1982,1982,0.8618518518518519,2023-03-02 00:32:00.405958,2023-03-02 00:32:00.899861,0 days 00:00:00.493903,0.8206846659174521,0.8396692734771605,,,,,,,,,,,,,,Bayes,,,,,,,,,,,,,,,,,,,,,,COMPLETE
1983,1983,0.8611111111111112,2023-03-02 00:32:00.468956,2023-03-02 00:32:00.971541,0 days 00:00:00.502585,0.2924822008709177,0.9568259660201581,,,,,,,,,,,,,,Bayes,,,,,,,,,,,,,,,,,,,,,,COMPLETE
1984,1984,0.8692592592592593,2023-03-02 00:32:00.504958,2023-03-02 00:32:01.039016,0 days 00:00:00.534058,0.2893727609996722,0.0933783887600902,,,,,,,,,,,,,,Bayes,,,,,,,,,,,,,,,,,,,,,,COMPLETE
1985,1985,0.8648148148148148,2023-03-02 00:32:00.534966,2023-03-02 00:32:01.006016,0 days 00:00:00.471050,0.0006263329432582426,0.3485421338010033,,,,,,,,,,,,,,Bayes,,,,,,,,,,,,,,,,,,,,,,COMPLETE
1986,1986,0.8694444444444445,2023-03-02 00:32:00.586966,2023-03-02 00:32:01.108014,0 days 00:00:00.521048,0.28795892390535927,0.09514077315644826,,,,,,,,,,,,,,Bayes,,,,,,,,,,,,,,,,,,,,,,COMPLETE
1987,1987,0.8692592592592593,2023-03-02 00:32:00.737948,2023-03-02 00:32:01.164015,0 days 00:00:00.426067,0.7737068533013217,0.0938529149802236,,,,,,,,,,,,,,Bayes,,,,,,,,,,,,,,,,,,,,,,COMPLETE
1988,1988,0.8629629629629629,2023-03-02 00:32:00.846003,2023-03-02 00:32:01.358044,0 days 00:00:00.512041,0.820281418286515,0.6360103982244832,,,,,,,,,,,,,,Bayes,,,,,,,,,,,,,,,,,,,,,,COMPLETE
1989,1989,0.862962962962963,2023-03-02 00:32:00.884000,2023-03-02 00:32:01.373045,0 days 00:00:00.489045,0.2173250881027819,0.7579856564897728,,,,,,,,,,,,,,Bayes,,,,,,,,,,,,,,,,,,,,,,COMPLETE
1990,1990,0.8690740740740741,2023-03-02 00:32:00.903541,2023-03-02 00:32:01.360045,0 days 00:00:00.456504,0.2093677311537403,0.13230864110793497,,,,,,,,,,,,,,Bayes,,,,,,,,,,,,,,,,,,,,,,COMPLETE
1991,1991,0.8690740740740741,2023-03-02 00:32:00.975015,2023-03-02 00:32:01.469044,0 days 00:00:00.494029,0.26185782839814364,0.12938980475653422,,,,,,,,,,,,,,Bayes,,,,,,,,,,,,,,,,,,,,,,COMPLETE
1992,1992,0.8631481481481482,2023-03-02 00:32:01.010015,2023-03-02 00:32:01.500046,0 days 00:00:00.490031,0.6381020248851572,0.5764984671872643,,,,,,,,,,,,,,Bayes,,,,,,,,,,,,,,,,,,,,,,COMPLETE
1993,1993,0.8690740740740741,2023-03-02 00:32:01.042015,2023-03-02 00:32:01.514043,0 days 00:00:00.472028,0.495630418761779,0.13181522540736776,,,,,,,,,,,,,,Bayes,,,,,,,,,,,,,,,,,,,,,,COMPLETE
1994,1994,0.8618518518518519,2023-03-02 00:32:01.124014,2023-03-02 00:32:01.547046,0 days 00:00:00.423032,0.09739467789692935,0.8476179837110687,,,,,,,,,,,,,,Bayes,,,,,,,,,,,,,,,,,,,,,,COMPLETE
1995,1995,0.8664814814814814,2023-03-02 00:32:01.167219,2023-03-02 00:32:01.576045,0 days 00:00:00.408826,0.44319371775630884,0.26802851358850444,,,,,,,,,,,,,,Bayes,,,,,,,,,,,,,,,,,,,,,,COMPLETE
1996,1996,0.8624074074074074,2023-03-02 00:32:01.362046,2023-03-02 00:32:01.609046,0 days 00:00:00.247000,0.7495693895343817,0.8276519034848342,,,,,,,,,,,,,,Bayes,,,,,,,,,,,,,,,,,,,,,,COMPLETE
1997,1997,0.8664814814814814,2023-03-02 00:32:01.378044,2023-03-02 00:32:01.609046,0 days 00:00:00.231002,0.2596082506014591,0.2720179574065454,,,,,,,,,,,,,,Bayes,,,,,,,,,,,,,,,,,,,,,,COMPLETE
1998,1998,0.8685185185185185,2023-03-02 00:32:01.403044,2023-03-02 00:32:01.613045,0 days 00:00:00.210001,0.2558749563316126,0.07042710969539506,,,,,,,,,,,,,,Bayes,,,,,,,,,,,,,,,,,,,,,,COMPLETE
1999,1999,0.864074074074074,2023-03-02 00:32:01.472043,2023-03-02 00:32:01.619043,0 days 00:00:00.147000,0.10114373039131519,0.4457943947965236,,,,,,,,,,,,,,Bayes,,,,,,,,,,,,,,,,,,,,,,COMPLETE
