,number,value,datetime_start,datetime_complete,duration,params_Bayes_prior_positive,params_Bayes_var_smoothing,params_GB_ccp_alpha,params_GB_criterion,params_GB_learning_rate,params_GB_loss,params_GB_max_depth,params_GB_max_features,params_GB_min_impurity_decrease,params_GB_min_samples_leaf,params_GB_min_samples_split,params_GB_n_estimators,params_GB_subsample,params_GB_tol,params_GB_validation_fraction,params_Method,params_SVM_C,params_SVM_coef0,params_SVM_decision_function_shape,params_SVM_degree,params_SVM_gamma,params_SVM_kernel,params_SVM_shrinking,params_SVM_tol,params_Tree_ccp_alpha,params_Tree_criterion,params_Tree_max_features,params_Tree_min_impurity_decrease,params_Tree_min_samples_leaf,params_Tree_min_samples_split,params_Tree_min_weight_fraction_leaf,params_Tree_splitter,params_kNN_algorithm,params_kNN_leaf_size,params_kNN_n_neighbors,params_kNN_p,params_kNN_weights,state
301,301,0.8690740740740741,2023-03-02 00:30:27.964101,2023-03-02 00:30:28.103101,0 days 00:00:00.139000,0.11702132824665948,0.127648656116745,,,,,,,,,,,,,,Bayes,,,,,,,,,,,,,,,,,,,,,,COMPLETE
302,302,0.846111111111111,2023-03-02 00:30:27.994101,2023-03-02 00:30:28.288617,0 days 00:00:00.294516,,,,,,,,,,,,,,,,SVM,73.27304845288843,,ovo,,,linear,True,0.22217933878100543,,,,,,,,,,,,,,COMPLETE
303,303,0.8631481481481482,2023-03-02 00:30:28.002103,2023-03-02 00:30:28.134103,0 days 00:00:00.132000,0.17548460620015255,0.5799362146061837,,,,,,,,,,,,,,Bayes,,,,,,,,,,,,,,,,,,,,,,COMPLETE
304,304,0.8475925925925926,2023-03-02 00:30:28.034101,2023-03-02 00:30:28.346617,0 days 00:00:00.312516,,,,,,,,,,,,,,,,SVM,79.47396636716438,,ovo,,,linear,True,0.25031313650513987,,,,,,,,,,,,,,COMPLETE
305,305,0.8677777777777778,2023-03-02 00:30:28.059101,2023-03-02 00:30:28.180619,0 days 00:00:00.121518,0.06500009937642044,0.17158994453046422,,,,,,,,,,,,,,Bayes,,,,,,,,,,,,,,,,,,,,,,COMPLETE
306,306,0.8629629629629629,2023-03-02 00:30:28.074101,2023-03-02 00:30:28.194618,0 days 00:00:00.120517,0.06362544238094413,0.6508567389682727,,,,,,,,,,,,,,Bayes,,,,,,,,,,,,,,,,,,,,,,COMPLETE
307,307,0.8629629629629629,2023-03-02 00:30:28.090102,2023-03-02 00:30:28.215617,0 days 00:00:00.125515,0.06537324159021168,0.6360599634979498,,,,,,,,,,,,,,Bayes,,,,,,,,,,,,,,,,,,,,,,COMPLETE
308,308,0.862962962962963,2023-03-02 00:30:28.105103,2023-03-02 00:30:28.233617,0 days 00:00:00.128514,0.17592027128692217,0.7658689131039988,,,,,,,,,,,,,,Bayes,,,,,,,,,,,,,,,,,,,,,,COMPLETE
309,309,0.8690740740740741,2023-03-02 00:30:28.137103,2023-03-02 00:30:28.267618,0 days 00:00:00.130515,0.05899874888533424,0.1444921652644355,,,,,,,,,,,,,,Bayes,,,,,,,,,,,,,,,,,,,,,,COMPLETE
310,310,0.5,2023-03-02 00:30:28.147101,2023-03-02 00:30:28.196619,0 days 00:00:00.049518,,,,,,,,,,,,,,,,SVM,79.31750559941086,-26.782161537529525,ovo,,auto,sigmoid,True,0.20163393748897784,,,,,,,,,,,,,,COMPLETE
311,311,0.8687037037037038,2023-03-02 00:30:28.183617,2023-03-02 00:30:28.306619,0 days 00:00:00.123002,0.17624701107802548,0.04104354283667663,,,,,,,,,,,,,,Bayes,,,,,,,,,,,,,,,,,,,,,,COMPLETE
312,312,0.8687037037037038,2023-03-02 00:30:28.199618,2023-03-02 00:30:28.346617,0 days 00:00:00.146999,0.17603318815419103,0.041108113090054924,,,,,,,,,,,,,,Bayes,,,,,,,,,,,,,,,,,,,,,,COMPLETE
313,313,0.8685185185185185,2023-03-02 00:30:28.204617,2023-03-02 00:30:28.324617,0 days 00:00:00.120000,0.3031244817744108,0.043677871816492034,,,,,,,,,,,,,,Bayes,,,,,,,,,,,,,,,,,,,,,,COMPLETE
314,314,0.8683333333333334,2023-03-02 00:30:28.221617,2023-03-02 00:30:28.336617,0 days 00:00:00.115000,0.11747777547055023,0.04838425436060689,,,,,,,,,,,,,,Bayes,,,,,,,,,,,,,,,,,,,,,,COMPLETE
315,315,0.8685185185185185,2023-03-02 00:30:28.235617,2023-03-02 00:30:28.372618,0 days 00:00:00.137001,0.1138625327534048,0.04340314949679122,,,,,,,,,,,,,,Bayes,,,,,,,,,,,,,,,,,,,,,,COMPLETE
316,316,0.8681481481481481,2023-03-02 00:30:28.271618,2023-03-02 00:30:28.405616,0 days 00:00:00.133998,0.37252579740859365,0.059202741273280894,,,,,,,,,,,,,,Bayes,,,,,,,,,,,,,,,,,,,,,,COMPLETE
317,317,0.8690740740740741,2023-03-02 00:30:28.290619,2023-03-02 00:30:28.445729,0 days 00:00:00.155110,0.11069961410833602,0.11836761903897638,,,,,,,,,,,,,,Bayes,,,,,,,,,,,,,,,,,,,,,,COMPLETE
318,318,0.8690740740740741,2023-03-02 00:30:28.309618,2023-03-02 00:30:28.502729,0 days 00:00:00.193111,0.36710115863946396,0.11677610028693688,,,,,,,,,,,,,,Bayes,,,,,,,,,,,,,,,,,,,,,,COMPLETE
319,319,0.8690740740740741,2023-03-02 00:30:28.327617,2023-03-02 00:30:28.498731,0 days 00:00:00.171114,0.12015752607248577,0.08642918609448307,,,,,,,,,,,,,,Bayes,,,,,,,,,,,,,,,,,,,,,,COMPLETE
320,320,0.8690740740740741,2023-03-02 00:30:28.340617,2023-03-02 00:30:28.533730,0 days 00:00:00.193113,0.11170621938446607,0.07799950419890979,,,,,,,,,,,,,,Bayes,,,,,,,,,,,,,,,,,,,,,,COMPLETE
321,321,0.8690740740740741,2023-03-02 00:30:28.350618,2023-03-02 00:30:28.536729,0 days 00:00:00.186111,0.3665125585023854,0.0866222928760503,,,,,,,,,,,,,,Bayes,,,,,,,,,,,,,,,,,,,,,,COMPLETE
322,322,0.8688888888888888,2023-03-02 00:30:28.357617,2023-03-02 00:30:28.529732,0 days 00:00:00.172115,0.4300871951182226,0.08393217042704175,,,,,,,,,,,,,,Bayes,,,,,,,,,,,,,,,,,,,,,,COMPLETE
323,323,0.8694444444444445,2023-03-02 00:30:28.375618,2023-03-02 00:30:28.566728,0 days 00:00:00.191110,0.34884425359846066,0.08855664260381994,,,,,,,,,,,,,,Bayes,,,,,,,,,,,,,,,,,,,,,,COMPLETE
324,324,0.867962962962963,2023-03-02 00:30:28.409618,2023-03-02 00:30:28.598730,0 days 00:00:00.189112,0.5289961490777819,0.2062953858437197,,,,,,,,,,,,,,Bayes,,,,,,,,,,,,,,,,,,,,,,COMPLETE
325,325,0.5,2023-03-02 00:30:28.447732,2023-03-02 00:30:28.488730,0 days 00:00:00.040998,,,,,,,,,,,,,,,,Tree,,,,,,,,,838.2833480348992,gini,0.6097315875438606,846.3023403676491,0.4073522240058213,0.5314485360693719,0.25497962833424065,random,,,,,,COMPLETE
326,326,0.8677777777777778,2023-03-02 00:30:28.493731,2023-03-02 00:30:28.651729,0 days 00:00:00.157998,0.14804728805800663,0.21435384575099914,,,,,,,,,,,,,,Bayes,,,,,,,,,,,,,,,,,,,,,,COMPLETE
327,327,0.8690740740740741,2023-03-02 00:30:28.503732,2023-03-02 00:30:28.646730,0 days 00:00:00.142998,0.0801048835376018,0.14663543459891487,,,,,,,,,,,,,,Bayes,,,,,,,,,,,,,,,,,,,,,,COMPLETE
328,328,0.8603703703703703,2023-03-02 00:30:28.511729,2023-03-02 00:30:28.676728,0 days 00:00:00.164999,0.08187425566660801,0.9813223940051727,,,,,,,,,,,,,,Bayes,,,,,,,,,,,,,,,,,,,,,,COMPLETE
329,329,0.8690740740740741,2023-03-02 00:30:28.534731,2023-03-02 00:30:28.678729,0 days 00:00:00.143998,0.08030578884319939,0.1418767299771591,,,,,,,,,,,,,,Bayes,,,,,,,,,,,,,,,,,,,,,,COMPLETE
330,330,0.8690740740740741,2023-03-02 00:30:28.539730,2023-03-02 00:30:28.714729,0 days 00:00:00.174999,0.08196085456966518,0.1434529437022324,,,,,,,,,,,,,,Bayes,,,,,,,,,,,,,,,,,,,,,,COMPLETE
331,331,0.8690740740740741,2023-03-02 00:30:28.544729,2023-03-02 00:30:28.698732,0 days 00:00:00.154003,0.08233700691967373,0.1488155197984669,,,,,,,,,,,,,,Bayes,,,,,,,,,,,,,,,,,,,,,,COMPLETE
332,332,0.8675925925925927,2023-03-02 00:30:28.568730,2023-03-02 00:30:28.723728,0 days 00:00:00.154998,0.3316063445491096,0.18013741066431366,,,,,,,,,,,,,,Bayes,,,,,,,,,,,,,,,,,,,,,,COMPLETE
333,333,0.8683333333333333,2023-03-02 00:30:28.601730,2023-03-02 00:30:28.756730,0 days 00:00:00.155000,0.1481552381096024,0.06525255042071529,,,,,,,,,,,,,,Bayes,,,,,,,,,,,,,,,,,,,,,,COMPLETE
334,334,0.8685185185185185,2023-03-02 00:30:28.649730,2023-03-02 00:30:28.811730,0 days 00:00:00.162000,0.30824125095779414,0.06668098563238012,,,,,,,,,,,,,,Bayes,,,,,,,,,,,,,,,,,,,,,,COMPLETE
335,335,0.8683333333333333,2023-03-02 00:30:28.653729,2023-03-02 00:30:28.806732,0 days 00:00:00.153003,0.29122288057687973,0.06609486298744124,,,,,,,,,,,,,,Bayes,,,,,,,,,,,,,,,,,,,,,,COMPLETE
336,336,0.8683333333333333,2023-03-02 00:30:28.678729,2023-03-02 00:30:28.830734,0 days 00:00:00.152005,0.2963215543018458,0.06492635845790036,,,,,,,,,,,,,,Bayes,,,,,,,,,,,,,,,,,,,,,,COMPLETE
337,337,0.8690740740740741,2023-03-02 00:30:28.685730,2023-03-02 00:30:28.862729,0 days 00:00:00.176999,0.3016245876973862,0.1116709320478308,,,,,,,,,,,,,,Bayes,,,,,,,,,,,,,,,,,,,,,,COMPLETE
338,338,0.8692592592592594,2023-03-02 00:30:28.701730,2023-03-02 00:30:28.850728,0 days 00:00:00.148998,0.31697980291332606,0.10898941850187814,,,,,,,,,,,,,,Bayes,,,,,,,,,,,,,,,,,,,,,,COMPLETE
339,339,0.8692592592592594,2023-03-02 00:30:28.717730,2023-03-02 00:30:28.860730,0 days 00:00:00.143000,0.32690134942976345,0.10986080949057422,,,,,,,,,,,,,,Bayes,,,,,,,,,,,,,,,,,,,,,,COMPLETE
340,340,0.8690740740740741,2023-03-02 00:30:28.727730,2023-03-02 00:30:28.889731,0 days 00:00:00.162001,0.23388032953160565,0.11167260856681512,,,,,,,,,,,,,,Bayes,,,,,,,,,,,,,,,,,,,,,,COMPLETE
341,341,0.8690740740740741,2023-03-02 00:30:28.761731,2023-03-02 00:30:28.928731,0 days 00:00:00.167000,0.2960719572252782,0.11353140353338931,,,,,,,,,,,,,,Bayes,,,,,,,,,,,,,,,,,,,,,,COMPLETE
342,342,0.8694444444444445,2023-03-02 00:30:28.808730,2023-03-02 00:30:28.978830,0 days 00:00:00.170100,0.02727194273060262,0.09517744360909576,,,,,,,,,,,,,,Bayes,,,,,,,,,,,,,,,,,,,,,,COMPLETE
343,343,0.8692592592592593,2023-03-02 00:30:28.813732,2023-03-02 00:30:28.976830,0 days 00:00:00.163098,0.23261284069536114,0.09256185974850512,,,,,,,,,,,,,,Bayes,,,,,,,,,,,,,,,,,,,,,,COMPLETE
344,344,0.8692592592592592,2023-03-02 00:30:28.832730,2023-03-02 00:30:28.998829,0 days 00:00:00.166099,0.22742990630612292,0.12559484797578535,,,,,,,,,,,,,,Bayes,,,,,,,,,,,,,,,,,,,,,,COMPLETE
345,345,0.8692592592592593,2023-03-02 00:30:28.857732,2023-03-02 00:30:29.068830,0 days 00:00:00.211098,0.2653826662240795,0.09704496852085769,,,,,,,,,,,,,,Bayes,,,,,,,,,,,,,,,,,,,,,,COMPLETE
346,346,0.8694444444444445,2023-03-02 00:30:28.866729,2023-03-02 00:30:29.073831,0 days 00:00:00.207102,0.3245272426362033,0.08937266556461469,,,,,,,,,,,,,,Bayes,,,,,,,,,,,,,,,,,,,,,,COMPLETE
347,347,0.8694444444444445,2023-03-02 00:30:28.876730,2023-03-02 00:30:29.067830,0 days 00:00:00.191100,0.3269946808723861,0.09451032335871665,,,,,,,,,,,,,,Bayes,,,,,,,,,,,,,,,,,,,,,,COMPLETE
348,348,0.864074074074074,2023-03-02 00:30:28.891732,2023-03-02 00:30:29.114833,0 days 00:00:00.223101,0.31136374959264196,0.4450486178136493,,,,,,,,,,,,,,Bayes,,,,,,,,,,,,,,,,,,,,,,COMPLETE
349,349,0.8640740740740741,2023-03-02 00:30:28.930730,2023-03-02 00:30:29.141830,0 days 00:00:00.211100,0.2683842361708054,0.41156534422588814,,,,,,,,,,,,,,Bayes,,,,,,,,,,,,,,,,,,,,,,COMPLETE
350,350,0.5,2023-03-02 00:30:28.980830,2023-03-02 00:30:29.069831,0 days 00:00:00.089001,,,,,,,,,,,,,,,,Tree,,,,,,,,,672.1526462702757,entropy,0.9947375756730248,152.68992276422279,0.21514729368086347,0.8415245872944832,0.10486928602385509,best,,,,,,COMPLETE
351,351,0.5,2023-03-02 00:30:28.983831,2023-03-02 00:30:29.066831,0 days 00:00:00.083000,,,,,,,,,,,,,,,,Tree,,,,,,,,,680.2240151855269,entropy,0.7705690020955225,139.3621204277814,0.21913985332964303,0.5445569555783476,0.09982527039494965,random,,,,,,COMPLETE
352,352,0.8694444444444445,2023-03-02 00:30:29.003830,2023-03-02 00:30:29.198830,0 days 00:00:00.195000,0.021606239330340005,0.08941676362963077,,,,,,,,,,,,,,Bayes,,,,,,,,,,,,,,,,,,,,,,COMPLETE
353,353,0.8694444444444445,2023-03-02 00:30:29.070830,2023-03-02 00:30:29.224829,0 days 00:00:00.153999,0.3314861815261102,0.09198364252566528,,,,,,,,,,,,,,Bayes,,,,,,,,,,,,,,,,,,,,,,COMPLETE
354,354,0.8694444444444445,2023-03-02 00:30:29.074830,2023-03-02 00:30:29.221829,0 days 00:00:00.146999,0.33306229843089113,0.08978988904511483,,,,,,,,,,,,,,Bayes,,,,,,,,,,,,,,,,,,,,,,COMPLETE
355,355,0.8692592592592593,2023-03-02 00:30:29.083830,2023-03-02 00:30:29.229829,0 days 00:00:00.145999,0.3215329276478523,0.09682763354884824,,,,,,,,,,,,,,Bayes,,,,,,,,,,,,,,,,,,,,,,COMPLETE
356,356,0.8694444444444445,2023-03-02 00:30:29.093831,2023-03-02 00:30:29.254831,0 days 00:00:00.161000,0.02549804125625499,0.09507261880613561,,,,,,,,,,,,,,Bayes,,,,,,,,,,,,,,,,,,,,,,COMPLETE
357,357,0.8664814814814814,2023-03-02 00:30:29.104832,2023-03-02 00:30:29.259830,0 days 00:00:00.154998,0.3358153866519272,0.26994012245177756,,,,,,,,,,,,,,Bayes,,,,,,,,,,,,,,,,,,,,,,COMPLETE
358,358,0.8666666666666667,2023-03-02 00:30:29.116829,2023-03-02 00:30:29.275830,0 days 00:00:00.159001,0.34573366714552056,0.2389082453232299,,,,,,,,,,,,,,Bayes,,,,,,,,,,,,,,,,,,,,,,COMPLETE
359,359,0.8694444444444445,2023-03-02 00:30:29.143831,2023-03-02 00:30:29.296830,0 days 00:00:00.152999,0.34395043897120064,0.09218691929702691,,,,,,,,,,,,,,Bayes,,,,,,,,,,,,,,,,,,,,,,COMPLETE
360,360,0.8687037037037038,2023-03-02 00:30:29.203830,2023-03-02 00:30:29.363831,0 days 00:00:00.160001,0.02342585281356794,0.08275862807756051,,,,,,,,,,,,,,Bayes,,,,,,,,,,,,,,,,,,,,,,COMPLETE
361,361,0.8688888888888889,2023-03-02 00:30:29.226831,2023-03-02 00:30:29.384831,0 days 00:00:00.158000,0.34500835977261207,0.08189856054859869,,,,,,,,,,,,,,Bayes,,,,,,,,,,,,,,,,,,,,,,COMPLETE
362,362,0.8688888888888888,2023-03-02 00:30:29.233830,2023-03-02 00:30:29.397832,0 days 00:00:00.164002,0.35483268009168295,0.07710429001077734,,,,,,,,,,,,,,Bayes,,,,,,,,,,,,,,,,,,,,,,COMPLETE
363,363,0.8687037037037038,2023-03-02 00:30:29.237833,2023-03-02 00:30:29.382831,0 days 00:00:00.144998,0.01770354908121031,0.08293744036414788,,,,,,,,,,,,,,Bayes,,,,,,,,,,,,,,,,,,,,,,COMPLETE
364,364,0.8687037037037038,2023-03-02 00:30:29.261831,2023-03-02 00:30:29.430829,0 days 00:00:00.168998,0.030527707796702303,0.08250087854127015,,,,,,,,,,,,,,Bayes,,,,,,,,,,,,,,,,,,,,,,COMPLETE
365,365,0.8688888888888889,2023-03-02 00:30:29.264956,2023-03-02 00:30:29.424832,0 days 00:00:00.159876,0.0139191066891984,0.08150121378898885,,,,,,,,,,,,,,Bayes,,,,,,,,,,,,,,,,,,,,,,COMPLETE
366,366,0.8688888888888888,2023-03-02 00:30:29.280830,2023-03-02 00:30:29.431829,0 days 00:00:00.150999,0.02116680684477704,0.0860465754076494,,,,,,,,,,,,,,Bayes,,,,,,,,,,,,,,,,,,,,,,COMPLETE
367,367,0.8687037037037038,2023-03-02 00:30:29.299830,2023-03-02 00:30:29.466608,0 days 00:00:00.166778,0.34389588278139355,0.08308275417468818,,,,,,,,,,,,,,Bayes,,,,,,,,,,,,,,,,,,,,,,COMPLETE
368,368,0.8633333333333334,2023-03-02 00:30:29.365829,2023-03-02 00:30:29.521607,0 days 00:00:00.155778,0.022741643459388793,0.5319852666445304,,,,,,,,,,,,,,Bayes,,,,,,,,,,,,,,,,,,,,,,COMPLETE
369,369,0.8681481481481481,2023-03-02 00:30:29.386831,2023-03-02 00:30:29.543609,0 days 00:00:00.156778,0.35621527363831884,0.054430332384585306,,,,,,,,,,,,,,Bayes,,,,,,,,,,,,,,,,,,,,,,COMPLETE
370,370,0.8681481481481481,2023-03-02 00:30:29.390833,2023-03-02 00:30:29.559608,0 days 00:00:00.168775,0.3897974797195809,0.060517280600857024,,,,,,,,,,,,,,Bayes,,,,,,,,,,,,,,,,,,,,,,COMPLETE
371,371,0.8681481481481481,2023-03-02 00:30:29.406830,2023-03-02 00:30:29.565609,0 days 00:00:00.158779,0.3837335541843517,0.05694370491730735,,,,,,,,,,,,,,Bayes,,,,,,,,,,,,,,,,,,,,,,COMPLETE
372,372,0.8681481481481481,2023-03-02 00:30:29.427829,2023-03-02 00:30:29.592608,0 days 00:00:00.164779,0.40832543289600415,0.055924908062671745,,,,,,,,,,,,,,Bayes,,,,,,,,,,,,,,,,,,,,,,COMPLETE
373,373,0.8679629629629629,2023-03-02 00:30:29.434832,2023-03-02 00:30:29.599608,0 days 00:00:00.164776,0.34115928696255593,0.06302284965706202,,,,,,,,,,,,,,Bayes,,,,,,,,,,,,,,,,,,,,,,COMPLETE
374,374,0.8648148148148148,2023-03-02 00:30:29.441832,2023-03-02 00:30:29.594609,0 days 00:00:00.152777,0.3916194506644469,0.3542613240037661,,,,,,,,,,,,,,Bayes,,,,,,,,,,,,,,,,,,,,,,COMPLETE
375,375,0.8681481481481481,2023-03-02 00:30:29.468608,2023-03-02 00:30:29.638607,0 days 00:00:00.169999,0.37381648612919594,0.05210239639934945,,,,,,,,,,,,,,Bayes,,,,,,,,,,,,,,,,,,,,,,COMPLETE
376,376,0.8692592592592592,2023-03-02 00:30:29.523608,2023-03-02 00:30:29.688610,0 days 00:00:00.165002,0.32335214113386884,0.12514948840344853,,,,,,,,,,,,,,Bayes,,,,,,,,,,,,,,,,,,,,,,COMPLETE
377,377,0.8690740740740741,2023-03-02 00:30:29.548607,2023-03-02 00:30:29.703609,0 days 00:00:00.155002,0.3224187405020077,0.1289482968368255,,,,,,,,,,,,,,Bayes,,,,,,,,,,,,,,,,,,,,,,COMPLETE
378,378,0.8692592592592592,2023-03-02 00:30:29.561608,2023-03-02 00:30:29.753607,0 days 00:00:00.191999,0.32603971196098047,0.12364397517979465,,,,,,,,,,,,,,Bayes,,,,,,,,,,,,,,,,,,,,,,COMPLETE
379,379,0.8690740740740741,2023-03-02 00:30:29.567609,2023-03-02 00:30:29.767608,0 days 00:00:00.199999,0.3166864216146118,0.12890421004460065,,,,,,,,,,,,,,Bayes,,,,,,,,,,,,,,,,,,,,,,COMPLETE
380,380,0.8690740740740741,2023-03-02 00:30:29.596608,2023-03-02 00:30:29.816609,0 days 00:00:00.220001,0.3141636200142726,0.12221880736769429,,,,,,,,,,,,,,Bayes,,,,,,,,,,,,,,,,,,,,,,COMPLETE
381,381,0.8690740740740741,2023-03-02 00:30:29.600609,2023-03-02 00:30:29.815608,0 days 00:00:00.214999,0.3231911173247079,0.12236151047039077,,,,,,,,,,,,,,Bayes,,,,,,,,,,,,,,,,,,,,,,COMPLETE
382,382,0.8690740740740741,2023-03-02 00:30:29.607608,2023-03-02 00:30:29.814745,0 days 00:00:00.207137,0.3092182998720036,0.1307178973443985,,,,,,,,,,,,,,Bayes,,,,,,,,,,,,,,,,,,,,,,COMPLETE
383,383,0.8692592592592593,2023-03-02 00:30:29.640608,2023-03-02 00:30:29.868607,0 days 00:00:00.227999,0.0007572373592509637,0.09815047508704645,,,,,,,,,,,,,,Bayes,,,,,,,,,,,,,,,,,,,,,,COMPLETE
384,384,0.8151851851851851,2023-03-02 00:30:29.691609,2023-03-02 00:30:29.768607,0 days 00:00:00.076998,,,,,,,,,,,,,,,,SVM,46.436451333760964,14.941843231191,ovr,,auto,sigmoid,False,0.8319798535070762,,,,,,,,,,,,,,COMPLETE
385,385,0.8146296296296296,2023-03-02 00:30:29.709610,2023-03-02 00:30:29.806608,0 days 00:00:00.096998,,,,,,,,,,,,,,,,SVM,48.045923171548786,12.291981359285964,ovr,,auto,sigmoid,False,0.8403832498279589,,,,,,,,,,,,,,COMPLETE
386,386,0.8153703703703704,2023-03-02 00:30:29.757608,2023-03-02 00:30:29.851609,0 days 00:00:00.094001,,,,,,,,,,,,,,,,SVM,46.40820814081744,10.518726305096676,ovr,,auto,sigmoid,False,0.802452679125425,,,,,,,,,,,,,,COMPLETE
387,387,0.8681481481481481,2023-03-02 00:30:29.771609,2023-03-02 00:30:29.944608,0 days 00:00:00.172999,0.002950923969582145,0.19811604354834803,,,,,,,,,,,,,,Bayes,,,,,,,,,,,,,,,,,,,,,,COMPLETE
388,388,0.8692592592592593,2023-03-02 00:30:29.787607,2023-03-02 00:30:29.951608,0 days 00:00:00.164001,0.04815527491277481,0.09624385511683684,,,,,,,,,,,,,,Bayes,,,,,,,,,,,,,,,,,,,,,,COMPLETE
389,389,0.8677777777777778,2023-03-02 00:30:29.817607,2023-03-02 00:30:29.972330,0 days 00:00:00.154723,0.03966823387219804,0.16458637976090768,,,,,,,,,,,,,,Bayes,,,,,,,,,,,,,,,,,,,,,,COMPLETE
390,390,0.867962962962963,2023-03-02 00:30:29.824608,2023-03-02 00:30:29.975484,0 days 00:00:00.150876,0.044925781625506825,0.18854991746695668,,,,,,,,,,,,,,Bayes,,,,,,,,,,,,,,,,,,,,,,COMPLETE
391,391,0.8692592592592593,2023-03-02 00:30:29.829608,2023-03-02 00:30:30.011744,0 days 00:00:00.182136,0.001431479251536208,0.0969555531146902,,,,,,,,,,,,,,Bayes,,,,,,,,,,,,,,,,,,,,,,COMPLETE
392,392,0.8675925925925927,2023-03-02 00:30:29.833608,2023-03-02 00:30:29.991747,0 days 00:00:00.158139,0.0028298656885909143,0.17725825007960055,,,,,,,,,,,,,,Bayes,,,,,,,,,,,,,,,,,,,,,,COMPLETE
393,393,0.8692592592592593,2023-03-02 00:30:29.854608,2023-03-02 00:30:30.008746,0 days 00:00:00.154138,0.24885312598482637,0.09826274481109348,,,,,,,,,,,,,,Bayes,,,,,,,,,,,,,,,,,,,,,,COMPLETE
394,394,0.8677777777777778,2023-03-02 00:30:29.871611,2023-03-02 00:30:30.037943,0 days 00:00:00.166332,0.25198028088509083,0.17254542292274333,,,,,,,,,,,,,,Bayes,,,,,,,,,,,,,,,,,,,,,,COMPLETE
395,395,0.8687037037037038,2023-03-02 00:30:29.946608,2023-03-02 00:30:30.110943,0 days 00:00:00.164335,0.28701583123126734,0.0357645469497873,,,,,,,,,,,,,,Bayes,,,,,,,,,,,,,,,,,,,,,,COMPLETE
396,396,0.8688888888888888,2023-03-02 00:30:29.957608,2023-03-02 00:30:30.116945,0 days 00:00:00.159337,0.2870648962413639,0.07245180697435152,,,,,,,,,,,,,,Bayes,,,,,,,,,,,,,,,,,,,,,,COMPLETE
397,397,0.8631481481481482,2023-03-02 00:30:29.977059,2023-03-02 00:30:30.138942,0 days 00:00:00.161883,0.36041281428830607,0.7356133809346008,,,,,,,,,,,,,,Bayes,,,,,,,,,,,,,,,,,,,,,,COMPLETE
398,398,0.8685185185185185,2023-03-02 00:30:29.980749,2023-03-02 00:30:30.178944,0 days 00:00:00.198195,0.2834614892110998,0.07003978068128128,,,,,,,,,,,,,,Bayes,,,,,,,,,,,,,,,,,,,,,,COMPLETE
399,399,0.8688888888888888,2023-03-02 00:30:29.998748,2023-03-02 00:30:30.183946,0 days 00:00:00.185198,0.2825852858468425,0.07452687696205021,,,,,,,,,,,,,,Bayes,,,,,,,,,,,,,,,,,,,,,,COMPLETE
400,400,0.8687037037037036,2023-03-02 00:30:30.013746,2023-03-02 00:30:30.221949,0 days 00:00:00.208203,0.3558841877856807,0.07105919315917658,,,,,,,,,,,,,,Bayes,,,,,,,,,,,,,,,,,,,,,,COMPLETE
401,401,0.8690740740740741,2023-03-02 00:30:30.020747,2023-03-02 00:30:30.258666,0 days 00:00:00.237919,0.8523450272231151,0.02696935979738048,,,,,,,,,,,,,,Bayes,,,,,,,,,,,,,,,,,,,,,,COMPLETE
402,402,0.8690740740740741,2023-03-02 00:30:30.039943,2023-03-02 00:30:30.285667,0 days 00:00:00.245724,0.7346481074706042,0.029084057213079564,,,,,,,,,,,,,,Bayes,,,,,,,,,,,,,,,,,,,,,,COMPLETE
403,403,0.5,2023-03-02 00:30:30.113944,2023-03-02 00:30:30.192944,0 days 00:00:00.079000,,,,,,,,,,,,,,,,Tree,,,,,,,,,875.9653216164131,gini,0.28669152263794806,462.93639178910286,0.3133954173820599,0.2014568738428374,0.2860546253432771,best,,,,,,COMPLETE
404,404,0.5,2023-03-02 00:30:30.119943,2023-03-02 00:30:32.136815,0 days 00:00:02.016872,,,463.8256504886406,friedman_mse,2.2535770757875655,exponential,17.0,0.6813986023061341,189.58916656852944,0.15260983227067235,0.18311281045387495,566.0,0.7774648348556343,0.4605645709520416,0.9885355968928918,Gradient Boosting,,,,,,,,,,,,,,,,,,,,,,COMPLETE
405,405,0.5,2023-03-02 00:30:30.150943,2023-03-02 00:30:30.242945,0 days 00:00:00.092002,,,,,,,,,,,,,,,,Tree,,,,,,,,,488.80096404141506,gini,0.10067580826750855,607.3084014782261,0.31752419269181037,0.20399285597356087,0.3077980729002556,best,,,,,,COMPLETE
406,406,0.8692592592592593,2023-03-02 00:30:30.185943,2023-03-02 00:30:30.463668,0 days 00:00:00.277725,0.6926744579147226,0.09957157995283508,,,,,,,,,,,,,,Bayes,,,,,,,,,,,,,,,,,,,,,,COMPLETE
