,number,value,datetime_start,datetime_complete,duration,params_Bayes_prior_positive,params_Bayes_var_smoothing,params_GB_ccp_alpha,params_GB_criterion,params_GB_learning_rate,params_GB_loss,params_GB_max_depth,params_GB_max_features,params_GB_min_impurity_decrease,params_GB_min_samples_leaf,params_GB_min_samples_split,params_GB_n_estimators,params_GB_subsample,params_GB_tol,params_GB_validation_fraction,params_Method,params_SVM_C,params_SVM_coef0,params_SVM_decision_function_shape,params_SVM_degree,params_SVM_gamma,params_SVM_kernel,params_SVM_shrinking,params_SVM_tol,params_Tree_ccp_alpha,params_Tree_criterion,params_Tree_max_features,params_Tree_min_impurity_decrease,params_Tree_min_samples_leaf,params_Tree_min_samples_split,params_Tree_min_weight_fraction_leaf,params_Tree_splitter,params_kNN_algorithm,params_kNN_leaf_size,params_kNN_n_neighbors,params_kNN_p,params_kNN_weights,state
928,928,0.8683333333333334,2023-03-02 00:30:52.885316,2023-03-02 00:30:53.097333,0 days 00:00:00.212017,0.8520851693106897,0.04738331745819343,,,,,,,,,,,,,,Bayes,,,,,,,,,,,,,,,,,,,,,,COMPLETE
929,929,0.8614814814814815,2023-03-02 00:30:52.896321,2023-03-02 00:30:53.110334,0 days 00:00:00.214013,0.29623094252210125,0.9334360299359237,,,,,,,,,,,,,,Bayes,,,,,,,,,,,,,,,,,,,,,,COMPLETE
930,930,0.867962962962963,2023-03-02 00:30:52.938317,2023-03-02 00:30:53.156334,0 days 00:00:00.218017,0.266124041071654,0.2019631609828711,,,,,,,,,,,,,,Bayes,,,,,,,,,,,,,,,,,,,,,,COMPLETE
931,931,0.8685185185185185,2023-03-02 00:30:52.948317,2023-03-02 00:30:53.172335,0 days 00:00:00.224018,0.8519556467787766,0.04517399228931125,,,,,,,,,,,,,,Bayes,,,,,,,,,,,,,,,,,,,,,,COMPLETE
932,932,0.862037037037037,2023-03-02 00:30:52.972317,2023-03-02 00:30:53.159333,0 days 00:00:00.187016,0.2684188409281503,0.8333419996884627,,,,,,,,,,,,,,Bayes,,,,,,,,,,,,,,,,,,,,,,COMPLETE
933,933,0.8601851851851852,2023-03-02 00:30:52.984318,2023-03-02 00:30:53.158335,0 days 00:00:00.174017,0.8526334091642992,0.9962756939715787,,,,,,,,,,,,,,Bayes,,,,,,,,,,,,,,,,,,,,,,COMPLETE
934,934,0.8685185185185185,2023-03-02 00:30:52.998317,2023-03-02 00:30:53.215334,0 days 00:00:00.217017,0.37333991189539,0.04554335919496288,,,,,,,,,,,,,,Bayes,,,,,,,,,,,,,,,,,,,,,,COMPLETE
935,935,0.8648148148148147,2023-03-02 00:30:53.100333,2023-03-02 00:30:53.315950,0 days 00:00:00.215617,0.37597465270850783,0.38693590254604454,,,,,,,,,,,,,,Bayes,,,,,,,,,,,,,,,,,,,,,,COMPLETE
936,936,0.8690740740740741,2023-03-02 00:30:53.116336,2023-03-02 00:30:53.316947,0 days 00:00:00.200611,0.4207992569954534,5.44040408594626e-05,,,,,,,,,,,,,,Bayes,,,,,,,,,,,,,,,,,,,,,,COMPLETE
937,937,0.8688888888888888,2023-03-02 00:30:53.160334,2023-03-02 00:30:53.379776,0 days 00:00:00.219442,0.36863485145010905,0.08452620579307268,,,,,,,,,,,,,,Bayes,,,,,,,,,,,,,,,,,,,,,,COMPLETE
938,938,0.8690740740740741,2023-03-02 00:30:53.167334,2023-03-02 00:30:53.380780,0 days 00:00:00.213446,0.3826387463647722,0.0783605921517812,,,,,,,,,,,,,,Bayes,,,,,,,,,,,,,,,,,,,,,,COMPLETE
939,939,0.8690740740740741,2023-03-02 00:30:53.174333,2023-03-02 00:30:53.389777,0 days 00:00:00.215444,0.41047534763288795,0.07915547344952234,,,,,,,,,,,,,,Bayes,,,,,,,,,,,,,,,,,,,,,,COMPLETE
940,940,0.8690740740740741,2023-03-02 00:30:53.186335,2023-03-02 00:30:53.432778,0 days 00:00:00.246443,0.06358736818878473,0.08084650064426954,,,,,,,,,,,,,,Bayes,,,,,,,,,,,,,,,,,,,,,,COMPLETE
941,941,0.8629629629629629,2023-03-02 00:30:53.220335,2023-03-02 00:30:53.370780,0 days 00:00:00.150445,0.07212940376814461,0.645906005856242,,,,,,,,,,,,,,Bayes,,,,,,,,,,,,,,,,,,,,,,COMPLETE
942,942,0.8690740740740741,2023-03-02 00:30:53.319949,2023-03-02 00:30:53.621780,0 days 00:00:00.301831,0.06897041092510113,0.11311987378834655,,,,,,,,,,,,,,Bayes,,,,,,,,,,,,,,,,,,,,,,COMPLETE
943,943,0.8692592592592594,2023-03-02 00:30:53.326947,2023-03-02 00:30:53.611779,0 days 00:00:00.284832,0.5674967915173367,0.10982859469268033,,,,,,,,,,,,,,Bayes,,,,,,,,,,,,,,,,,,,,,,COMPLETE
944,944,0.8666666666666667,2023-03-02 00:30:53.374778,2023-03-02 00:30:53.671777,0 days 00:00:00.296999,0.05670680947149802,0.25286499855374234,,,,,,,,,,,,,,Bayes,,,,,,,,,,,,,,,,,,,,,,COMPLETE
945,945,0.8692592592592594,2023-03-02 00:30:53.383779,2023-03-02 00:30:53.671777,0 days 00:00:00.287998,0.21400749062351518,0.11050624789949197,,,,,,,,,,,,,,Bayes,,,,,,,,,,,,,,,,,,,,,,COMPLETE
946,946,0.8690740740740741,2023-03-02 00:30:53.392778,2023-03-02 00:30:53.673777,0 days 00:00:00.280999,0.04962037580079687,0.11439193952769583,,,,,,,,,,,,,,Bayes,,,,,,,,,,,,,,,,,,,,,,COMPLETE
947,947,0.8690740740740741,2023-03-02 00:30:53.399777,2023-03-02 00:30:53.669779,0 days 00:00:00.270002,0.03958514540952966,0.111750374422788,,,,,,,,,,,,,,Bayes,,,,,,,,,,,,,,,,,,,,,,COMPLETE
948,948,0.862962962962963,2023-03-02 00:30:53.435777,2023-03-02 00:30:53.739777,0 days 00:00:00.304000,0.22833581300242348,0.7675184776827675,,,,,,,,,,,,,,Bayes,,,,,,,,,,,,,,,,,,,,,,COMPLETE
949,949,0.8614814814814814,2023-03-02 00:30:53.615779,2023-03-02 00:30:53.910404,0 days 00:00:00.294625,0.5417921886861439,0.8927008612557883,,,,,,,,,,,,,,Bayes,,,,,,,,,,,,,,,,,,,,,,COMPLETE
950,950,0.862962962962963,2023-03-02 00:30:53.623778,2023-03-02 00:30:53.887407,0 days 00:00:00.263629,0.21184399325421924,0.7802133600930335,,,,,,,,,,,,,,Bayes,,,,,,,,,,,,,,,,,,,,,,COMPLETE
951,951,0.8514814814814815,2023-03-02 00:30:53.673777,2023-03-02 00:30:54.045403,0 days 00:00:00.371626,,,,,,,,,,,,,,,,kNN,,,,,,,,,,,,,,,,,brute,53.0,159.0,253.0,distance,COMPLETE
952,952,0.8618518518518519,2023-03-02 00:30:53.681781,2023-03-02 00:30:53.997404,0 days 00:00:00.315623,0.30306953379682067,0.8383348135089789,,,,,,,,,,,,,,Bayes,,,,,,,,,,,,,,,,,,,,,,COMPLETE
953,953,0.8677777777777778,2023-03-02 00:30:53.689778,2023-03-02 00:30:53.991403,0 days 00:00:00.301625,0.2566422548099157,0.16339159503166434,,,,,,,,,,,,,,Bayes,,,,,,,,,,,,,,,,,,,,,,COMPLETE
954,954,0.8374074074074074,2023-03-02 00:30:53.697778,2023-03-02 00:30:54.151963,0 days 00:00:00.454185,,,,,,,,,,,,,,,,kNN,,,,,,,,,,,,,,,,,brute,265.0,287.0,250.0,distance,COMPLETE
955,955,0.5,2023-03-02 00:30:53.754777,2023-03-02 00:30:54.089403,0 days 00:00:00.334626,,,,,,,,,,,,,,,,Tree,,,,,,,,,23.401707919947512,entropy,0.5859418387779354,8.718063005203987,0.2562161094292941,0.3603476163377603,0.15807280022837059,random,,,,,,COMPLETE
956,956,0.8429629629629629,2023-03-02 00:30:53.890404,2023-03-02 00:30:54.334058,0 days 00:00:00.443654,,,,,,,,,,,,,,,,kNN,,,,,,,,,,,,,,,,,brute,58.0,359.0,240.0,distance,COMPLETE
957,957,0.5,2023-03-02 00:30:53.914406,2023-03-02 00:30:54.220962,0 days 00:00:00.306556,,,,,,,,,,,,,,,,Tree,,,,,,,,,930.2997516500072,entropy,0.696645365490089,314.45939757469944,0.2580055775774768,0.35266530650587896,0.20343508214029238,random,,,,,,COMPLETE
958,958,0.8397222222222221,2023-03-02 00:30:53.999402,2023-03-02 00:30:54.260965,0 days 00:00:00.261563,,,,,,,,,,,,,,,,kNN,,,,,,,,,,,,,,,,,kd_tree,278.0,169.0,797.0,distance,COMPLETE
959,959,0.5,2023-03-02 00:30:54.010405,2023-03-02 00:30:54.298057,0 days 00:00:00.287652,,,,,,,,,,,,,,,,Tree,,,,,,,,,828.3692740597659,entropy,0.7134706818453191,327.454254081436,0.3715016172004168,0.9957529156884734,0.22238670254522,random,,,,,,COMPLETE
960,960,0.8648148148148148,2023-03-02 00:30:54.063404,2023-03-02 00:30:54.278963,0 days 00:00:00.215559,0.3524668391653621,0.34846997882384423,,,,,,,,,,,,,,Bayes,,,,,,,,,,,,,,,,,,,,,,COMPLETE
961,961,0.8688888888888889,2023-03-02 00:30:54.091404,2023-03-02 00:30:54.321059,0 days 00:00:00.229655,0.024407846701556712,0.13663665289825444,,,,,,,,,,,,,,Bayes,,,,,,,,,,,,,,,,,,,,,,COMPLETE
962,962,0.8668518518518519,2023-03-02 00:30:54.156964,2023-03-02 00:30:54.377660,0 days 00:00:00.220696,0.0205553344724313,0.29296819046567835,,,,,,,,,,,,,,Bayes,,,,,,,,,,,,,,,,,,,,,,COMPLETE
963,963,0.8685185185185185,2023-03-02 00:30:54.223964,2023-03-02 00:30:54.450660,0 days 00:00:00.226696,0.3497142600884552,0.06687991796659203,,,,,,,,,,,,,,Bayes,,,,,,,,,,,,,,,,,,,,,,COMPLETE
964,964,0.8690740740740741,2023-03-02 00:30:54.263963,2023-03-02 00:30:54.490660,0 days 00:00:00.226697,0.3501270671035745,0.023879969158886294,,,,,,,,,,,,,,Bayes,,,,,,,,,,,,,,,,,,,,,,COMPLETE
965,965,0.8690740740740741,2023-03-02 00:30:54.284641,2023-03-02 00:30:54.489660,0 days 00:00:00.205019,0.1737277166175418,0.023039128910123483,,,,,,,,,,,,,,Bayes,,,,,,,,,,,,,,,,,,,,,,COMPLETE
966,966,0.8690740740740741,2023-03-02 00:30:54.301061,2023-03-02 00:30:54.490660,0 days 00:00:00.189599,0.01523945835785322,0.026430829244124848,,,,,,,,,,,,,,Bayes,,,,,,,,,,,,,,,,,,,,,,COMPLETE
967,967,0.8694444444444445,2023-03-02 00:30:54.326059,2023-03-02 00:30:54.630660,0 days 00:00:00.304601,0.13786672948857603,0.09102021103371712,,,,,,,,,,,,,,Bayes,,,,,,,,,,,,,,,,,,,,,,COMPLETE
968,968,0.8664814814814814,2023-03-02 00:30:54.342061,2023-03-02 00:30:54.639660,0 days 00:00:00.297599,0.28254813346600627,0.27755771592472556,,,,,,,,,,,,,,Bayes,,,,,,,,,,,,,,,,,,,,,,COMPLETE
969,969,0.864074074074074,2023-03-02 00:30:54.380661,2023-03-02 00:30:54.744660,0 days 00:00:00.363999,0.28704941083271934,0.46734296823261157,,,,,,,,,,,,,,Bayes,,,,,,,,,,,,,,,,,,,,,,COMPLETE
970,970,0.8677777777777778,2023-03-02 00:30:54.453663,2023-03-02 00:30:54.849732,0 days 00:00:00.396069,0.28271496282739056,0.16970289480817236,,,,,,,,,,,,,,Bayes,,,,,,,,,,,,,,,,,,,,,,COMPLETE
971,971,0.5,2023-03-02 00:30:54.493660,2023-03-02 00:30:55.510974,0 days 00:00:01.017314,,,152.5667690313718,squared_error,8.891215170273874,deviance,36.0,0.00465467252143692,781.557149403643,0.4625337336634693,0.5310666379697533,145.0,0.18809432941952137,0.5971432789972695,0.5427070804821668,Gradient Boosting,,,,,,,,,,,,,,,,,,,,,,COMPLETE
972,972,0.5,2023-03-02 00:30:54.499661,2023-03-02 00:30:55.480971,0 days 00:00:00.981310,,,381.37708082693825,squared_error,7.310875970624862,deviance,35.0,0.25699566899360765,768.4485837900208,0.4491083584822574,0.5303047228383362,125.0,0.1985473603634867,0.5985074303823579,0.5291971489551673,Gradient Boosting,,,,,,,,,,,,,,,,,,,,,,COMPLETE
973,973,0.864074074074074,2023-03-02 00:30:54.507661,2023-03-02 00:30:54.936731,0 days 00:00:00.429070,0.2842216036583486,0.44371528028558416,,,,,,,,,,,,,,Bayes,,,,,,,,,,,,,,,,,,,,,,COMPLETE
974,974,0.5,2023-03-02 00:30:54.633661,2023-03-02 00:30:55.638971,0 days 00:00:01.005310,,,399.3124166543552,squared_error,9.025655237650664,deviance,35.0,0.2024259801620355,790.3193442258132,0.4570838105801831,0.5438972491820926,150.0,0.19491573783827248,0.5700662879425914,0.54157010130028,Gradient Boosting,,,,,,,,,,,,,,,,,,,,,,COMPLETE
975,975,0.5,2023-03-02 00:30:54.642661,2023-03-02 00:30:56.639111,0 days 00:00:01.996450,,,418.0058721866302,squared_error,9.012534317153833,deviance,35.0,0.20468352365818243,758.4047178484174,0.4430586753323003,0.5378298429527688,640.0,0.05734376767140509,0.6579100513786625,0.534169740151248,Gradient Boosting,,,,,,,,,,,,,,,,,,,,,,COMPLETE
976,976,0.5,2023-03-02 00:30:54.758662,2023-03-02 00:30:55.709970,0 days 00:00:00.951308,,,391.639660053359,squared_error,8.813131056535646,deviance,35.0,0.21456189965089445,811.6338241290007,0.4572382607680715,0.49532271871852074,157.0,0.02898675192021971,0.5738287788357515,0.5324306907602993,Gradient Boosting,,,,,,,,,,,,,,,,,,,,,,COMPLETE
977,977,0.8438888888888888,2023-03-02 00:30:54.853734,2023-03-02 00:30:55.455974,0 days 00:00:00.602240,,,,,,,,,,,,,,,,SVM,96.75139147333492,,ovr,,,linear,False,0.9362604622491362,,,,,,,,,,,,,,COMPLETE
978,978,0.5,2023-03-02 00:30:54.945733,2023-03-02 00:30:55.757972,0 days 00:00:00.812239,,,413.9037271103068,squared_error,3.802578011021447,deviance,26.0,0.5607078090993916,770.3029921958383,0.4457452711522282,0.5148429283589572,120.0,0.1869209078213247,0.6138841041624077,0.5380481291667113,Gradient Boosting,,,,,,,,,,,,,,,,,,,,,,COMPLETE
979,979,0.5,2023-03-02 00:30:55.461971,2023-03-02 00:30:57.152671,0 days 00:00:01.690700,,,922.6159910001693,friedman_mse,4.1276918002333955,deviance,9.0,0.04479524430471804,700.5388786813944,0.031970917539491966,0.4622281457736145,645.0,0.0012901282953103888,0.6974907190100644,0.3401260705861923,Gradient Boosting,,,,,,,,,,,,,,,,,,,,,,COMPLETE
980,980,0.8629629629629629,2023-03-02 00:30:55.497973,2023-03-02 00:30:55.845083,0 days 00:00:00.347110,0.307470950035162,0.6132426340761574,,,,,,,,,,,,,,Bayes,,,,,,,,,,,,,,,,,,,,,,COMPLETE
981,981,0.8690740740740741,2023-03-02 00:30:55.525971,2023-03-02 00:30:55.976772,0 days 00:00:00.450801,0.2529288630038891,0.14810528055593256,,,,,,,,,,,,,,Bayes,,,,,,,,,,,,,,,,,,,,,,COMPLETE
982,982,0.8690740740740741,2023-03-02 00:30:55.644971,2023-03-02 00:30:56.039766,0 days 00:00:00.394795,0.25536308336375096,0.14999076427516578,,,,,,,,,,,,,,Bayes,,,,,,,,,,,,,,,,,,,,,,COMPLETE
983,983,0.8662962962962963,2023-03-02 00:30:55.718972,2023-03-02 00:30:56.092769,0 days 00:00:00.373797,0.48883337469679367,0.32319498162192695,,,,,,,,,,,,,,Bayes,,,,,,,,,,,,,,,,,,,,,,COMPLETE
984,984,0.8694444444444445,2023-03-02 00:30:55.761971,2023-03-02 00:30:56.121766,0 days 00:00:00.359795,0.255648880951593,0.09184272857301577,,,,,,,,,,,,,,Bayes,,,,,,,,,,,,,,,,,,,,,,COMPLETE
985,985,0.8633333333333334,2023-03-02 00:30:55.848083,2023-03-02 00:30:56.222841,0 days 00:00:00.374758,0.0005426841933558193,0.6990019276676129,,,,,,,,,,,,,,Bayes,,,,,,,,,,,,,,,,,,,,,,COMPLETE
986,986,0.8683333333333333,2023-03-02 00:30:55.980768,2023-03-02 00:30:56.255842,0 days 00:00:00.275074,0.4420628689261517,0.06485136845778354,,,,,,,,,,,,,,Bayes,,,,,,,,,,,,,,,,,,,,,,COMPLETE
987,987,0.8679629629629629,2023-03-02 00:30:56.044767,2023-03-02 00:30:56.330529,0 days 00:00:00.285762,0.9839132916044636,0.06306365884158258,,,,,,,,,,,,,,Bayes,,,,,,,,,,,,,,,,,,,,,,COMPLETE
988,988,0.8692592592592593,2023-03-02 00:30:56.096767,2023-03-02 00:30:56.398097,0 days 00:00:00.301330,0.6808612295195638,0.09335886007206384,,,,,,,,,,,,,,Bayes,,,,,,,,,,,,,,,,,,,,,,COMPLETE
989,989,0.8614814814814814,2023-03-02 00:30:56.129765,2023-03-02 00:30:56.400097,0 days 00:00:00.270332,0.149119939286924,0.8908927596921994,,,,,,,,,,,,,,Bayes,,,,,,,,,,,,,,,,,,,,,,COMPLETE
990,990,0.862962962962963,2023-03-02 00:30:56.226842,2023-03-02 00:30:56.532097,0 days 00:00:00.305255,0.963007889500552,0.749905101035234,,,,,,,,,,,,,,Bayes,,,,,,,,,,,,,,,,,,,,,,COMPLETE
991,991,0.8633333333333334,2023-03-02 00:30:56.269844,2023-03-02 00:30:56.560234,0 days 00:00:00.290390,0.4728678374958095,0.5735487550814244,,,,,,,,,,,,,,Bayes,,,,,,,,,,,,,,,,,,,,,,COMPLETE
992,992,0.8635185185185185,2023-03-02 00:30:56.334527,2023-03-02 00:30:56.641112,0 days 00:00:00.306585,0.085869667597132,0.5554446217739899,,,,,,,,,,,,,,Bayes,,,,,,,,,,,,,,,,,,,,,,COMPLETE
993,993,0.8690740740740741,2023-03-02 00:30:56.401097,2023-03-02 00:30:56.735111,0 days 00:00:00.334014,0.8249280982049646,0.1226143327478224,,,,,,,,,,,,,,Bayes,,,,,,,,,,,,,,,,,,,,,,COMPLETE
994,994,0.8614814814814814,2023-03-02 00:30:56.415097,2023-03-02 00:30:56.724113,0 days 00:00:00.309016,0.08397917107198316,0.9084591423049235,,,,,,,,,,,,,,Bayes,,,,,,,,,,,,,,,,,,,,,,COMPLETE
995,995,0.8664814814814815,2023-03-02 00:30:56.538100,2023-03-02 00:30:56.830578,0 days 00:00:00.292478,0.20268907645575243,0.24030916969155558,,,,,,,,,,,,,,Bayes,,,,,,,,,,,,,,,,,,,,,,COMPLETE
996,996,0.8631481481481482,2023-03-02 00:30:56.572110,2023-03-02 00:30:56.843576,0 days 00:00:00.271466,0.08209185519495324,0.5211014818072183,,,,,,,,,,,,,,Bayes,,,,,,,,,,,,,,,,,,,,,,COMPLETE
997,997,0.8633333333333333,2023-03-02 00:30:56.643111,2023-03-02 00:30:56.949100,0 days 00:00:00.305989,0.2341642054943425,0.49584445068331345,,,,,,,,,,,,,,Bayes,,,,,,,,,,,,,,,,,,,,,,COMPLETE
998,998,0.867962962962963,2023-03-02 00:30:56.651111,2023-03-02 00:30:56.939099,0 days 00:00:00.287988,0.3923084035303839,0.1957842421958244,,,,,,,,,,,,,,Bayes,,,,,,,,,,,,,,,,,,,,,,COMPLETE
999,999,0.8631481481481481,2023-03-02 00:30:56.728110,2023-03-02 00:30:57.063240,0 days 00:00:00.335130,0.17190117615227424,0.6282211905584022,,,,,,,,,,,,,,Bayes,,,,,,,,,,,,,,,,,,,,,,COMPLETE
1000,1000,0.8692592592592593,2023-03-02 00:30:56.737110,2023-03-02 00:30:57.049237,0 days 00:00:00.312127,0.19815299778227702,0.09896603928060256,,,,,,,,,,,,,,Bayes,,,,,,,,,,,,,,,,,,,,,,COMPLETE
1001,1001,0.5410185185185185,2023-03-02 00:30:56.832576,2023-03-02 00:30:57.090670,0 days 00:00:00.258094,,,,,,,,,,,,,,,,SVM,12.331369337470655,-1.8457246970247927,ovo,76.0,scale,poly,True,0.6346423561537583,,,,,,,,,,,,,,COMPLETE
1002,1002,0.8692592592592593,2023-03-02 00:30:56.849576,2023-03-02 00:30:57.227669,0 days 00:00:00.378093,0.12875776586008342,0.0994036511427899,,,,,,,,,,,,,,Bayes,,,,,,,,,,,,,,,,,,,,,,COMPLETE
1003,1003,0.5,2023-03-02 00:30:56.942096,2023-03-02 00:30:57.192668,0 days 00:00:00.250572,,,,,,,,,,,,,,,,SVM,9.622482193692399,-10.194372307610502,ovr,77.0,scale,poly,False,0.47608244692192786,,,,,,,,,,,,,,COMPLETE
1004,1004,0.8690740740740741,2023-03-02 00:30:56.952100,2023-03-02 00:30:57.306668,0 days 00:00:00.354568,0.312653056695116,0.07738297938120212,,,,,,,,,,,,,,Bayes,,,,,,,,,,,,,,,,,,,,,,COMPLETE
1005,1005,0.8683333333333334,2023-03-02 00:30:57.055238,2023-03-02 00:30:57.354408,0 days 00:00:00.299170,0.3131399391909302,0.050147093706409775,,,,,,,,,,,,,,Bayes,,,,,,,,,,,,,,,,,,,,,,COMPLETE
1006,1006,0.5,2023-03-02 00:30:57.066239,2023-03-02 00:30:57.273670,0 days 00:00:00.207431,,,,,,,,,,,,,,,,SVM,7.179036448342167,75.29502821810328,ovo,75.0,scale,poly,True,0.5436816232887585,,,,,,,,,,,,,,COMPLETE
1007,1007,0.8690740740740741,2023-03-02 00:30:57.095670,2023-03-02 00:30:57.366407,0 days 00:00:00.270737,0.13112367196815974,0.131338936543169,,,,,,,,,,,,,,Bayes,,,,,,,,,,,,,,,,,,,,,,COMPLETE
1008,1008,0.8631481481481481,2023-03-02 00:30:57.155671,2023-03-02 00:30:57.487082,0 days 00:00:00.331411,0.3166057031665821,0.686185999992017,,,,,,,,,,,,,,Bayes,,,,,,,,,,,,,,,,,,,,,,COMPLETE
1009,1009,0.8681481481481481,2023-03-02 00:30:57.195669,2023-03-02 00:30:57.517083,0 days 00:00:00.321414,0.13183208821092016,0.05162285879338543,,,,,,,,,,,,,,Bayes,,,,,,,,,,,,,,,,,,,,,,COMPLETE
1010,1010,0.860925925925926,2023-03-02 00:30:57.229670,2023-03-02 00:30:57.544084,0 days 00:00:00.314414,0.31863089972965253,0.97365473348172,,,,,,,,,,,,,,Bayes,,,,,,,,,,,,,,,,,,,,,,COMPLETE
1011,1011,0.8614814814814815,2023-03-02 00:30:57.276670,2023-03-02 00:30:57.587083,0 days 00:00:00.310413,0.0323806973317088,0.9443362799735315,,,,,,,,,,,,,,Bayes,,,,,,,,,,,,,,,,,,,,,,COMPLETE
1012,1012,0.8688888888888888,2023-03-02 00:30:57.309669,2023-03-02 00:30:57.619639,0 days 00:00:00.309970,0.32196805649253896,0.07427549344848455,,,,,,,,,,,,,,Bayes,,,,,,,,,,,,,,,,,,,,,,COMPLETE
1013,1013,0.8692592592592592,2023-03-02 00:30:57.358408,2023-03-02 00:30:57.664641,0 days 00:00:00.306233,0.7936214297801344,0.1246991655777806,,,,,,,,,,,,,,Bayes,,,,,,,,,,,,,,,,,,,,,,COMPLETE
1014,1014,0.865,2023-03-02 00:30:57.453085,2023-03-02 00:30:57.690640,0 days 00:00:00.237555,0.030713891751342787,0.3597568068893166,,,,,,,,,,,,,,Bayes,,,,,,,,,,,,,,,,,,,,,,COMPLETE
1015,1015,0.8692592592592592,2023-03-02 00:30:57.489084,2023-03-02 00:30:57.692639,0 days 00:00:00.203555,0.035088344395791726,0.12352833024308985,,,,,,,,,,,,,,Bayes,,,,,,,,,,,,,,,,,,,,,,COMPLETE
1016,1016,0.8692592592592592,2023-03-02 00:30:57.520086,2023-03-02 00:30:57.753640,0 days 00:00:00.233554,0.87660429758626,0.12390874324885795,,,,,,,,,,,,,,Bayes,,,,,,,,,,,,,,,,,,,,,,COMPLETE
1017,1017,0.8690740740740741,2023-03-02 00:30:57.547084,2023-03-02 00:30:57.764639,0 days 00:00:00.217555,0.03993745008677319,0.11453290815264056,,,,,,,,,,,,,,Bayes,,,,,,,,,,,,,,,,,,,,,,COMPLETE
1018,1018,0.8694444444444445,2023-03-02 00:30:57.595083,2023-03-02 00:30:57.828401,0 days 00:00:00.233318,0.09923841211279508,0.08993446021682078,,,,,,,,,,,,,,Bayes,,,,,,,,,,,,,,,,,,,,,,COMPLETE
1019,1019,0.8694444444444445,2023-03-02 00:30:57.621641,2023-03-02 00:30:57.846800,0 days 00:00:00.225159,0.15968018357118857,0.08916800049085788,,,,,,,,,,,,,,Bayes,,,,,,,,,,,,,,,,,,,,,,COMPLETE
1020,1020,0.8664814814814815,2023-03-02 00:30:57.666641,2023-03-02 00:30:57.926798,0 days 00:00:00.260157,0.050341345516210445,0.25643106001365507,,,,,,,,,,,,,,Bayes,,,,,,,,,,,,,,,,,,,,,,COMPLETE
1021,1021,0.8644444444444445,2023-03-02 00:30:57.693639,2023-03-02 00:30:57.902800,0 days 00:00:00.209161,0.05638812288336581,0.3907682403936037,,,,,,,,,,,,,,Bayes,,,,,,,,,,,,,,,,,,,,,,COMPLETE
1022,1022,0.8627777777777779,2023-03-02 00:30:57.700639,2023-03-02 00:30:57.901800,0 days 00:00:00.201161,0.7138298370190106,0.6594057510405,,,,,,,,,,,,,,Bayes,,,,,,,,,,,,,,,,,,,,,,COMPLETE
1023,1023,0.867037037037037,2023-03-02 00:30:57.758639,2023-03-02 00:30:58.001800,0 days 00:00:00.243161,0.738442638352266,0.22836676518326537,,,,,,,,,,,,,,Bayes,,,,,,,,,,,,,,,,,,,,,,COMPLETE
1024,1024,0.8666666666666666,2023-03-02 00:30:57.767639,2023-03-02 00:30:57.983798,0 days 00:00:00.216159,0.10947448326174898,0.28022310497886554,,,,,,,,,,,,,,Bayes,,,,,,,,,,,,,,,,,,,,,,COMPLETE
1025,1025,0.8625925925925927,2023-03-02 00:30:57.831041,2023-03-02 00:30:58.058799,0 days 00:00:00.227758,0.40141227790982426,0.7873540126973535,,,,,,,,,,,,,,Bayes,,,,,,,,,,,,,,,,,,,,,,COMPLETE
1026,1026,0.8685185185185185,2023-03-02 00:30:57.849798,2023-03-02 00:30:58.081797,0 days 00:00:00.231999,0.22271903769384338,0.06811208187364656,,,,,,,,,,,,,,Bayes,,,,,,,,,,,,,,,,,,,,,,COMPLETE
1027,1027,0.8677777777777778,2023-03-02 00:30:57.904798,2023-03-02 00:30:58.133798,0 days 00:00:00.229000,0.39965966769493233,0.17427424141797349,,,,,,,,,,,,,,Bayes,,,,,,,,,,,,,,,,,,,,,,COMPLETE
1028,1028,0.8685185185185185,2023-03-02 00:30:57.914800,2023-03-02 00:30:58.145798,0 days 00:00:00.230998,0.24107543672393617,0.0678303823602511,,,,,,,,,,,,,,Bayes,,,,,,,,,,,,,,,,,,,,,,COMPLETE
1029,1029,0.8685185185185185,2023-03-02 00:30:57.929800,2023-03-02 00:30:58.135800,0 days 00:00:00.206000,0.23722982822133795,0.06948973881206882,,,,,,,,,,,,,,Bayes,,,,,,,,,,,,,,,,,,,,,,COMPLETE
