,number,value,datetime_start,datetime_complete,duration,params_Bayes_prior_positive,params_Bayes_var_smoothing,params_GB_ccp_alpha,params_GB_criterion,params_GB_learning_rate,params_GB_loss,params_GB_max_depth,params_GB_max_features,params_GB_min_impurity_decrease,params_GB_min_samples_leaf,params_GB_min_samples_split,params_GB_n_estimators,params_GB_subsample,params_GB_tol,params_GB_validation_fraction,params_Method,params_SVM_C,params_SVM_coef0,params_SVM_decision_function_shape,params_SVM_degree,params_SVM_gamma,params_SVM_kernel,params_SVM_shrinking,params_SVM_tol,params_Tree_ccp_alpha,params_Tree_criterion,params_Tree_max_features,params_Tree_min_impurity_decrease,params_Tree_min_samples_leaf,params_Tree_min_samples_split,params_Tree_min_weight_fraction_leaf,params_Tree_splitter,params_kNN_algorithm,params_kNN_leaf_size,params_kNN_n_neighbors,params_kNN_p,params_kNN_weights,state
199,199,0.8688888888888889,2023-03-02 00:30:22.987838,2023-03-02 00:30:23.096846,0 days 00:00:00.109008,0.12343876861747494,0.13609030925503995,,,,,,,,,,,,,,Bayes,,,,,,,,,,,,,,,,,,,,,,COMPLETE
200,200,0.8688888888888889,2023-03-02 00:30:23.002835,2023-03-02 00:30:23.101846,0 days 00:00:00.099011,0.1336924722289106,0.13506319297913946,,,,,,,,,,,,,,Bayes,,,,,,,,,,,,,,,,,,,,,,COMPLETE
201,201,0.8690740740740741,2023-03-02 00:30:23.005835,2023-03-02 00:30:23.114850,0 days 00:00:00.109015,0.13364322090034297,0.14252357772213098,,,,,,,,,,,,,,Bayes,,,,,,,,,,,,,,,,,,,,,,COMPLETE
202,202,0.8692592592592594,2023-03-02 00:30:23.075846,2023-03-02 00:30:23.184847,0 days 00:00:00.109001,0.13397701412549087,0.11085342310208467,,,,,,,,,,,,,,Bayes,,,,,,,,,,,,,,,,,,,,,,COMPLETE
203,203,0.8692592592592594,2023-03-02 00:30:23.088846,2023-03-02 00:30:23.207847,0 days 00:00:00.119001,0.13099303234738835,0.11045244962911263,,,,,,,,,,,,,,Bayes,,,,,,,,,,,,,,,,,,,,,,COMPLETE
204,204,0.8690740740740741,2023-03-02 00:30:23.091846,2023-03-02 00:30:23.203847,0 days 00:00:00.112001,0.13489720011627135,0.1122811871124875,,,,,,,,,,,,,,Bayes,,,,,,,,,,,,,,,,,,,,,,COMPLETE
205,205,0.8690740740740741,2023-03-02 00:30:23.103846,2023-03-02 00:30:23.213848,0 days 00:00:00.110002,0.08699834746621113,0.11638445587164505,,,,,,,,,,,,,,Bayes,,,,,,,,,,,,,,,,,,,,,,COMPLETE
206,206,0.8690740740740741,2023-03-02 00:30:23.110847,2023-03-02 00:30:23.204848,0 days 00:00:00.094001,0.0841907655559829,0.1117026785288694,,,,,,,,,,,,,,Bayes,,,,,,,,,,,,,,,,,,,,,,COMPLETE
207,207,0.8690740740740741,2023-03-02 00:30:23.117848,2023-03-02 00:30:23.243846,0 days 00:00:00.125998,0.08420932071285442,0.11173759557788364,,,,,,,,,,,,,,Bayes,,,,,,,,,,,,,,,,,,,,,,COMPLETE
208,208,0.8690740740740741,2023-03-02 00:30:23.126846,2023-03-02 00:30:23.236846,0 days 00:00:00.110000,0.10086006084085346,0.11277176309410686,,,,,,,,,,,,,,Bayes,,,,,,,,,,,,,,,,,,,,,,COMPLETE
209,209,0.8681481481481481,2023-03-02 00:30:23.186847,2023-03-02 00:30:23.306847,0 days 00:00:00.120000,0.16146901639730377,0.05984594633754815,,,,,,,,,,,,,,Bayes,,,,,,,,,,,,,,,,,,,,,,COMPLETE
210,210,0.8685185185185185,2023-03-02 00:30:23.209848,2023-03-02 00:30:23.342849,0 days 00:00:00.133001,0.15740924896150987,0.04156695038794202,,,,,,,,,,,,,,Bayes,,,,,,,,,,,,,,,,,,,,,,COMPLETE
211,211,0.8687037037037038,2023-03-02 00:30:23.210847,2023-03-02 00:30:23.328853,0 days 00:00:00.118006,0.16340815969700706,0.041009608051417144,,,,,,,,,,,,,,Bayes,,,,,,,,,,,,,,,,,,,,,,COMPLETE
212,212,0.867962962962963,2023-03-02 00:30:23.219849,2023-03-02 00:30:23.343850,0 days 00:00:00.124001,0.14947787813201466,0.19555831555806835,,,,,,,,,,,,,,Bayes,,,,,,,,,,,,,,,,,,,,,,COMPLETE
213,213,0.8687037037037038,2023-03-02 00:30:23.226847,2023-03-02 00:30:23.332851,0 days 00:00:00.106004,0.16125416134216455,0.040959105376025415,,,,,,,,,,,,,,Bayes,,,,,,,,,,,,,,,,,,,,,,COMPLETE
214,214,0.8687037037037038,2023-03-02 00:30:23.243846,2023-03-02 00:30:23.385635,0 days 00:00:00.141789,0.16171784582607124,0.04108859338789246,,,,,,,,,,,,,,Bayes,,,,,,,,,,,,,,,,,,,,,,COMPLETE
215,215,0.8679629629629629,2023-03-02 00:30:23.248847,2023-03-02 00:30:23.378297,0 days 00:00:00.129450,0.15668940969980133,0.06276712333406714,,,,,,,,,,,,,,Bayes,,,,,,,,,,,,,,,,,,,,,,COMPLETE
216,216,0.8675925925925927,2023-03-02 00:30:23.308847,2023-03-02 00:30:23.446634,0 days 00:00:00.137787,0.30872520739030995,0.1833879894330434,,,,,,,,,,,,,,Bayes,,,,,,,,,,,,,,,,,,,,,,COMPLETE
217,217,0.8692592592592593,2023-03-02 00:30:23.337850,2023-03-02 00:30:23.462634,0 days 00:00:00.124784,0.31515841535182726,0.09708912040972284,,,,,,,,,,,,,,Bayes,,,,,,,,,,,,,,,,,,,,,,COMPLETE
218,218,0.8694444444444445,2023-03-02 00:30:23.344849,2023-03-02 00:30:23.490635,0 days 00:00:00.145786,0.3165128478573163,0.09464862044349971,,,,,,,,,,,,,,Bayes,,,,,,,,,,,,,,,,,,,,,,COMPLETE
219,219,0.8692592592592593,2023-03-02 00:30:23.362848,2023-03-02 00:30:23.468634,0 days 00:00:00.105786,0.11072291452813973,0.09394198358171119,,,,,,,,,,,,,,Bayes,,,,,,,,,,,,,,,,,,,,,,COMPLETE
220,220,0.8692592592592593,2023-03-02 00:30:23.370848,2023-03-02 00:30:23.489635,0 days 00:00:00.118787,0.32864058293871995,0.09639242106878543,,,,,,,,,,,,,,Bayes,,,,,,,,,,,,,,,,,,,,,,COMPLETE
221,221,0.8675925925925927,2023-03-02 00:30:23.384118,2023-03-02 00:30:23.505634,0 days 00:00:00.121516,0.11314852184637453,0.18315250731347493,,,,,,,,,,,,,,Bayes,,,,,,,,,,,,,,,,,,,,,,COMPLETE
222,222,0.8666666666666667,2023-03-02 00:30:23.391635,2023-03-02 00:30:23.495633,0 days 00:00:00.103998,0.11641560212528627,0.3192383011543122,,,,,,,,,,,,,,Bayes,,,,,,,,,,,,,,,,,,,,,,COMPLETE
223,223,0.8685185185185185,2023-03-02 00:30:23.448636,2023-03-02 00:30:23.671633,0 days 00:00:00.222997,0.11115384331010437,0.06699757758825127,,,,,,,,,,,,,,Bayes,,,,,,,,,,,,,,,,,,,,,,COMPLETE
224,224,0.8690740740740741,2023-03-02 00:30:23.465634,2023-03-02 00:30:23.688633,0 days 00:00:00.222999,0.2621385700442254,0.07788162904410594,,,,,,,,,,,,,,Bayes,,,,,,,,,,,,,,,,,,,,,,COMPLETE
225,225,0.5,2023-03-02 00:30:23.473635,2023-03-02 00:30:26.253076,0 days 00:00:02.779441,,,791.9713708060989,squared_error,9.819658126569799,deviance,30.0,0.33025662416944807,305.3330074774804,0.19875097476124165,0.3931061291192749,772.0,0.27493627608394877,0.7954792419045165,0.23610452885583288,Gradient Boosting,,,,,,,,,,,,,,,,,,,,,,COMPLETE
226,226,0.8681481481481481,2023-03-02 00:30:23.500635,2023-03-02 00:30:23.769634,0 days 00:00:00.268999,0.232054778998645,0.06337742360562634,,,,,,,,,,,,,,Bayes,,,,,,,,,,,,,,,,,,,,,,COMPLETE
227,227,0.8685185185185185,2023-03-02 00:30:23.509635,2023-03-02 00:30:23.813634,0 days 00:00:00.303999,0.2595898557908135,0.06762543849455771,,,,,,,,,,,,,,Bayes,,,,,,,,,,,,,,,,,,,,,,COMPLETE
228,228,0.8681481481481481,2023-03-02 00:30:23.524633,2023-03-02 00:30:23.833634,0 days 00:00:00.309001,0.19629094531176638,0.06400333471368072,,,,,,,,,,,,,,Bayes,,,,,,,,,,,,,,,,,,,,,,COMPLETE
229,229,0.5,2023-03-02 00:30:23.534635,2023-03-02 00:30:26.308076,0 days 00:00:02.773441,,,549.1630667670971,squared_error,9.712193577301397,deviance,30.0,0.32517094042460365,328.88352454437694,0.21606946966378981,0.7305818002243871,749.0,0.24688579533099664,0.7982159676398215,0.5978211036604749,Gradient Boosting,,,,,,,,,,,,,,,,,,,,,,COMPLETE
230,230,0.5,2023-03-02 00:30:23.674633,2023-03-02 00:30:26.231076,0 days 00:00:02.556443,,,798.7017282476472,squared_error,9.510103585608391,deviance,30.0,0.3472501733527148,360.82921840562494,0.2179008244918345,0.7206528860632656,711.0,0.2849844431702736,0.7553620689914559,0.2421695205291302,Gradient Boosting,,,,,,,,,,,,,,,,,,,,,,COMPLETE
231,231,0.5,2023-03-02 00:30:23.693634,2023-03-02 00:30:26.423766,0 days 00:00:02.730132,,,797.8944732745628,squared_error,9.62186366140075,deviance,31.0,0.3328820621788488,346.012248771632,0.20422413773520254,0.7349914283030562,742.0,0.2822610778967628,0.49929117513734905,0.22620528909842186,Gradient Boosting,,,,,,,,,,,,,,,,,,,,,,COMPLETE
232,232,0.8688888888888889,2023-03-02 00:30:23.781634,2023-03-02 00:30:24.236817,0 days 00:00:00.455183,0.19036794543151608,0.0070655755108502,,,,,,,,,,,,,,Bayes,,,,,,,,,,,,,,,,,,,,,,COMPLETE
233,233,0.5,2023-03-02 00:30:23.804634,2023-03-02 00:30:23.960815,0 days 00:00:00.156181,,,,,,,,,,,,,,,,Tree,,,,,,,,,666.6426286529858,entropy,0.828629533412844,774.5010845481906,0.0030676910230551246,0.23434173399085034,0.3723306190533938,best,,,,,,COMPLETE
234,234,0.5,2023-03-02 00:30:23.827636,2023-03-02 00:30:26.499181,0 days 00:00:02.671545,,,793.323028148178,squared_error,6.664400037486846,deviance,30.0,0.31559297653038115,355.95498291397007,0.21797400945896933,0.7188519833403031,707.0,0.26702478026811305,0.7533497181764706,0.20798933898267313,Gradient Boosting,,,,,,,,,,,,,,,,,,,,,,COMPLETE
235,235,0.5,2023-03-02 00:30:23.841634,2023-03-02 00:30:26.581178,0 days 00:00:02.739544,,,788.408902499451,squared_error,9.599713566343404,deviance,28.0,0.34410162990171894,367.2664256261846,0.2155514524340534,0.4231444550452514,754.0,0.2732488665680738,0.805521805175968,0.589270408719461,Gradient Boosting,,,,,,,,,,,,,,,,,,,,,,COMPLETE
236,236,0.8692592592592593,2023-03-02 00:30:23.972816,2023-03-02 00:30:24.399406,0 days 00:00:00.426590,0.19106703378910056,0.015458831512134036,,,,,,,,,,,,,,Bayes,,,,,,,,,,,,,,,,,,,,,,COMPLETE
237,237,0.5,2023-03-02 00:30:24.244815,2023-03-02 00:30:26.744748,0 days 00:00:02.499933,,,771.101105592208,squared_error,9.473125598812633,deviance,30.0,0.35918537396624023,373.80307316589136,0.2136967647082672,0.7362445893616324,756.0,0.36231884174694107,0.7524908013211061,0.22133574562611713,Gradient Boosting,,,,,,,,,,,,,,,,,,,,,,COMPLETE
238,238,0.5,2023-03-02 00:30:24.407407,2023-03-02 00:30:26.882750,0 days 00:00:02.475343,,,809.6584572791791,squared_error,9.669852238530627,deviance,31.0,0.35234572992818347,355.4432230359565,0.2149762302569258,0.7277596982172534,707.0,0.345799718302806,0.7860572735084611,0.21503877961683993,Gradient Boosting,,,,,,,,,,,,,,,,,,,,,,COMPLETE
239,239,0.8690740740740741,2023-03-02 00:30:26.240075,2023-03-02 00:30:26.509179,0 days 00:00:00.269104,0.07337288312979065,0.12095266964475457,,,,,,,,,,,,,,Bayes,,,,,,,,,,,,,,,,,,,,,,COMPLETE
240,240,0.8692592592592593,2023-03-02 00:30:26.260077,2023-03-02 00:30:26.530180,0 days 00:00:00.270103,0.06520943031129822,0.09809086473196302,,,,,,,,,,,,,,Bayes,,,,,,,,,,,,,,,,,,,,,,COMPLETE
241,241,0.8692592592592593,2023-03-02 00:30:26.314079,2023-03-02 00:30:26.566178,0 days 00:00:00.252099,0.07230094775941773,0.09960048292851058,,,,,,,,,,,,,,Bayes,,,,,,,,,,,,,,,,,,,,,,COMPLETE
242,242,0.8692592592592593,2023-03-02 00:30:26.434181,2023-03-02 00:30:26.660178,0 days 00:00:00.225997,0.0662161931329723,0.0975111620665027,,,,,,,,,,,,,,Bayes,,,,,,,,,,,,,,,,,,,,,,COMPLETE
243,243,0.8692592592592592,2023-03-02 00:30:26.511180,2023-03-02 00:30:26.727181,0 days 00:00:00.216001,0.03364106649527232,0.12668966373931945,,,,,,,,,,,,,,Bayes,,,,,,,,,,,,,,,,,,,,,,COMPLETE
244,244,0.8690740740740741,2023-03-02 00:30:26.524179,2023-03-02 00:30:26.722179,0 days 00:00:00.198000,0.23572857666359984,0.1182170858708741,,,,,,,,,,,,,,Bayes,,,,,,,,,,,,,,,,,,,,,,COMPLETE
245,245,0.8690740740740741,2023-03-02 00:30:26.542178,2023-03-02 00:30:26.768750,0 days 00:00:00.226572,0.2347539023577211,0.1206675816412915,,,,,,,,,,,,,,Bayes,,,,,,,,,,,,,,,,,,,,,,COMPLETE
246,246,0.8692592592592592,2023-03-02 00:30:26.572178,2023-03-02 00:30:26.792749,0 days 00:00:00.220571,0.2249566528579554,0.12452187761907793,,,,,,,,,,,,,,Bayes,,,,,,,,,,,,,,,,,,,,,,COMPLETE
247,247,0.8690740740740741,2023-03-02 00:30:26.584178,2023-03-02 00:30:26.789749,0 days 00:00:00.205571,0.2291874599511889,0.12225883958924247,,,,,,,,,,,,,,Bayes,,,,,,,,,,,,,,,,,,,,,,COMPLETE
248,248,0.8688888888888888,2023-03-02 00:30:26.664180,2023-03-02 00:30:26.860752,0 days 00:00:00.196572,0.10355390368588153,0.08540453921796475,,,,,,,,,,,,,,Bayes,,,,,,,,,,,,,,,,,,,,,,COMPLETE
249,249,0.8694444444444445,2023-03-02 00:30:26.729178,2023-03-02 00:30:26.912660,0 days 00:00:00.183482,0.13500123366038183,0.09200550150048477,,,,,,,,,,,,,,Bayes,,,,,,,,,,,,,,,,,,,,,,COMPLETE
250,250,0.8688888888888889,2023-03-02 00:30:26.739749,2023-03-02 00:30:26.910561,0 days 00:00:00.170812,0.13264127379054322,0.08179717545276557,,,,,,,,,,,,,,Bayes,,,,,,,,,,,,,,,,,,,,,,COMPLETE
251,251,0.8688888888888888,2023-03-02 00:30:26.752749,2023-03-02 00:30:26.934291,0 days 00:00:00.181542,0.12822046204488485,0.08471999110618637,,,,,,,,,,,,,,Bayes,,,,,,,,,,,,,,,,,,,,,,COMPLETE
252,252,0.8688888888888888,2023-03-02 00:30:26.771751,2023-03-02 00:30:26.945289,0 days 00:00:00.173538,0.13410572915258556,0.08560000318877452,,,,,,,,,,,,,,Bayes,,,,,,,,,,,,,,,,,,,,,,COMPLETE
253,253,0.8638888888888889,2023-03-02 00:30:26.796749,2023-03-02 00:30:26.972290,0 days 00:00:00.175541,0.1329728028029613,0.4484606664550275,,,,,,,,,,,,,,Bayes,,,,,,,,,,,,,,,,,,,,,,COMPLETE
254,254,0.8688888888888888,2023-03-02 00:30:26.800750,2023-03-02 00:30:26.970289,0 days 00:00:00.169539,0.13077125458677064,0.08358859723384152,,,,,,,,,,,,,,Bayes,,,,,,,,,,,,,,,,,,,,,,COMPLETE
255,255,0.8677777777777778,2023-03-02 00:30:26.864750,2023-03-02 00:30:27.014487,0 days 00:00:00.149737,0.13182759859489332,0.1604402188139175,,,,,,,,,,,,,,Bayes,,,,,,,,,,,,,,,,,,,,,,COMPLETE
256,256,0.8690740740740741,2023-03-02 00:30:26.886752,2023-03-02 00:30:27.041486,0 days 00:00:00.154734,0.13202796428875657,0.15197898575313148,,,,,,,,,,,,,,Bayes,,,,,,,,,,,,,,,,,,,,,,COMPLETE
257,257,0.8677777777777778,2023-03-02 00:30:26.914774,2023-03-02 00:30:27.066720,0 days 00:00:00.151946,0.13884102308842966,0.1615528963819381,,,,,,,,,,,,,,Bayes,,,,,,,,,,,,,,,,,,,,,,COMPLETE
258,258,0.8690740740740741,2023-03-02 00:30:26.918289,2023-03-02 00:30:27.068647,0 days 00:00:00.150358,0.14068840199636692,0.10500141089318993,,,,,,,,,,,,,,Bayes,,,,,,,,,,,,,,,,,,,,,,COMPLETE
259,259,0.8690740740740741,2023-03-02 00:30:26.940287,2023-03-02 00:30:27.176645,0 days 00:00:00.236358,0.10068285155700149,0.15164830071416277,,,,,,,,,,,,,,Bayes,,,,,,,,,,,,,,,,,,,,,,COMPLETE
260,260,0.8690740740740741,2023-03-02 00:30:26.950293,2023-03-02 00:30:27.178643,0 days 00:00:00.228350,0.09453711212104259,0.15154822065591853,,,,,,,,,,,,,,Bayes,,,,,,,,,,,,,,,,,,,,,,COMPLETE
261,261,0.8690740740740741,2023-03-02 00:30:26.972290,2023-03-02 00:30:27.201643,0 days 00:00:00.229353,0.09570215468783112,0.10459296053362127,,,,,,,,,,,,,,Bayes,,,,,,,,,,,,,,,,,,,,,,COMPLETE
262,262,0.8690740740740741,2023-03-02 00:30:26.975291,2023-03-02 00:30:27.222643,0 days 00:00:00.247352,0.09262598247500274,0.10387374752495043,,,,,,,,,,,,,,Bayes,,,,,,,,,,,,,,,,,,,,,,COMPLETE
263,263,0.8681481481481481,2023-03-02 00:30:27.016488,2023-03-02 00:30:27.241644,0 days 00:00:00.225156,0.0894604276487464,0.051827891421510355,,,,,,,,,,,,,,Bayes,,,,,,,,,,,,,,,,,,,,,,COMPLETE
264,264,0.8685185185185186,2023-03-02 00:30:27.043486,2023-03-02 00:30:27.277645,0 days 00:00:00.234159,0.10151141493883224,0.04683077916047174,,,,,,,,,,,,,,Bayes,,,,,,,,,,,,,,,,,,,,,,COMPLETE
265,265,0.8681481481481481,2023-03-02 00:30:27.072643,2023-03-02 00:30:27.312645,0 days 00:00:00.240002,0.09786260989453349,0.05510300398610357,,,,,,,,,,,,,,Bayes,,,,,,,,,,,,,,,,,,,,,,COMPLETE
266,266,0.8681481481481481,2023-03-02 00:30:27.080643,2023-03-02 00:30:27.310644,0 days 00:00:00.230001,0.0917588517433554,0.05199213477528101,,,,,,,,,,,,,,Bayes,,,,,,,,,,,,,,,,,,,,,,COMPLETE
267,267,0.8685185185185185,2023-03-02 00:30:27.179644,2023-03-02 00:30:27.369642,0 days 00:00:00.189998,0.17900359764159862,0.06903276278918852,,,,,,,,,,,,,,Bayes,,,,,,,,,,,,,,,,,,,,,,COMPLETE
268,268,0.8685185185185185,2023-03-02 00:30:27.185646,2023-03-02 00:30:27.402946,0 days 00:00:00.217300,0.2798727882519057,0.06706672129519939,,,,,,,,,,,,,,Bayes,,,,,,,,,,,,,,,,,,,,,,COMPLETE
269,269,0.867037037037037,2023-03-02 00:30:27.206643,2023-03-02 00:30:27.419621,0 days 00:00:00.212978,0.2721214181149886,0.22444108071870889,,,,,,,,,,,,,,Bayes,,,,,,,,,,,,,,,,,,,,,,COMPLETE
270,270,0.8685185185185185,2023-03-02 00:30:27.227646,2023-03-02 00:30:27.436359,0 days 00:00:00.208713,0.2774560275367485,0.06857664436574042,,,,,,,,,,,,,,Bayes,,,,,,,,,,,,,,,,,,,,,,COMPLETE
271,271,0.8690740740740741,2023-03-02 00:30:27.244646,2023-03-02 00:30:27.453361,0 days 00:00:00.208715,0.03893199416339645,0.030042775303961225,,,,,,,,,,,,,,Bayes,,,,,,,,,,,,,,,,,,,,,,COMPLETE
272,272,0.5,2023-03-02 00:30:27.284643,2023-03-02 00:30:27.356643,0 days 00:00:00.072000,,,,,,,,,,,,,,,,Tree,,,,,,,,,805.1602215100911,entropy,0.20699697040630882,837.6063264362978,0.14090648923029298,0.3233253413806887,0.39355534737906467,best,,,,,,COMPLETE
273,273,0.8690740740740741,2023-03-02 00:30:27.322644,2023-03-02 00:30:27.515358,0 days 00:00:00.192714,0.16740543691817564,0.1321754550403803,,,,,,,,,,,,,,Bayes,,,,,,,,,,,,,,,,,,,,,,COMPLETE
274,274,0.5,2023-03-02 00:30:27.325647,2023-03-02 00:30:27.394644,0 days 00:00:00.068997,,,,,,,,,,,,,,,,Tree,,,,,,,,,536.9512843270752,entropy,0.7567411536947435,475.79412871941895,0.12896338386150236,0.2643260807753559,0.4055902678707857,best,,,,,,COMPLETE
275,275,0.8688888888888889,2023-03-02 00:30:27.362646,2023-03-02 00:30:27.514358,0 days 00:00:00.151712,0.2816509245327714,0.02185121019280442,,,,,,,,,,,,,,Bayes,,,,,,,,,,,,,,,,,,,,,,COMPLETE
276,276,0.8690740740740741,2023-03-02 00:30:27.384645,2023-03-02 00:30:27.531358,0 days 00:00:00.146713,0.2827022035800772,0.022785496603384373,,,,,,,,,,,,,,Bayes,,,,,,,,,,,,,,,,,,,,,,COMPLETE
277,277,0.8688888888888889,2023-03-02 00:30:27.400836,2023-03-02 00:30:27.550358,0 days 00:00:00.149522,0.037633721651263954,0.021836924101484356,,,,,,,,,,,,,,Bayes,,,,,,,,,,,,,,,,,,,,,,COMPLETE
278,278,0.8692592592592593,2023-03-02 00:30:27.407644,2023-03-02 00:30:27.556358,0 days 00:00:00.148714,0.04529400590133412,0.004359250501193859,,,,,,,,,,,,,,Bayes,,,,,,,,,,,,,,,,,,,,,,COMPLETE
279,279,0.8692592592592593,2023-03-02 00:30:27.421200,2023-03-02 00:30:27.571358,0 days 00:00:00.150158,0.036949632913812064,0.002599966410565457,,,,,,,,,,,,,,Bayes,,,,,,,,,,,,,,,,,,,,,,COMPLETE
280,280,0.8690740740740741,2023-03-02 00:30:27.438359,2023-03-02 00:30:27.599360,0 days 00:00:00.161001,0.20278536890057713,0.0054787536786008,,,,,,,,,,,,,,Bayes,,,,,,,,,,,,,,,,,,,,,,COMPLETE
281,281,0.8688888888888889,2023-03-02 00:30:27.457361,2023-03-02 00:30:27.592358,0 days 00:00:00.134997,0.20410374645088036,0.13428912816000432,,,,,,,,,,,,,,Bayes,,,,,,,,,,,,,,,,,,,,,,COMPLETE
282,282,0.8690740740740741,2023-03-02 00:30:27.516358,2023-03-02 00:30:27.690359,0 days 00:00:00.174001,0.2050266894438102,0.11117062143659823,,,,,,,,,,,,,,Bayes,,,,,,,,,,,,,,,,,,,,,,COMPLETE
283,283,0.8690740740740741,2023-03-02 00:30:27.524358,2023-03-02 00:30:27.693359,0 days 00:00:00.169001,0.20201191198237306,0.1002917439177841,,,,,,,,,,,,,,Bayes,,,,,,,,,,,,,,,,,,,,,,COMPLETE
284,284,0.8692592592592593,2023-03-02 00:30:27.535362,2023-03-02 00:30:27.689358,0 days 00:00:00.153996,0.20284989734465564,0.09923405115193712,,,,,,,,,,,,,,Bayes,,,,,,,,,,,,,,,,,,,,,,COMPLETE
285,285,0.8690740740740741,2023-03-02 00:30:27.552359,2023-03-02 00:30:27.758360,0 days 00:00:00.206001,0.3422452582790083,0.10125334831126702,,,,,,,,,,,,,,Bayes,,,,,,,,,,,,,,,,,,,,,,COMPLETE
286,286,0.8690740740740741,2023-03-02 00:30:27.560359,2023-03-02 00:30:27.760358,0 days 00:00:00.199999,0.2045611666820987,0.10149997014113471,,,,,,,,,,,,,,Bayes,,,,,,,,,,,,,,,,,,,,,,COMPLETE
287,287,0.8690740740740741,2023-03-02 00:30:27.574358,2023-03-02 00:30:27.769360,0 days 00:00:00.195002,0.0005631914220400672,0.10121834326431539,,,,,,,,,,,,,,Bayes,,,,,,,,,,,,,,,,,,,,,,COMPLETE
288,288,0.8690740740740741,2023-03-02 00:30:27.596360,2023-03-02 00:30:27.820359,0 days 00:00:00.223999,0.14972397588367098,0.1030745473236713,,,,,,,,,,,,,,Bayes,,,,,,,,,,,,,,,,,,,,,,COMPLETE
289,289,0.8429629629629629,2023-03-02 00:30:27.606358,2023-03-02 00:30:27.910358,0 days 00:00:00.304000,,,,,,,,,,,,,,,,kNN,,,,,,,,,,,,,,,,,ball_tree,7.0,320.0,10.0,distance,COMPLETE
290,290,0.8427777777777778,2023-03-02 00:30:27.692358,2023-03-02 00:30:27.989104,0 days 00:00:00.296746,,,,,,,,,,,,,,,,kNN,,,,,,,,,,,,,,,,,brute,20.0,322.0,8.0,distance,COMPLETE
291,291,0.8446296296296296,2023-03-02 00:30:27.698359,2023-03-02 00:30:27.999101,0 days 00:00:00.300742,,,,,,,,,,,,,,,,kNN,,,,,,,,,,,,,,,,,brute,5.0,328.0,10.0,distance,COMPLETE
292,292,0.8690740740740741,2023-03-02 00:30:27.705359,2023-03-02 00:30:27.878358,0 days 00:00:00.172999,0.0014402233122022476,0.08090094774090463,,,,,,,,,,,,,,Bayes,,,,,,,,,,,,,,,,,,,,,,COMPLETE
293,293,0.8688888888888888,2023-03-02 00:30:27.762359,2023-03-02 00:30:27.937102,0 days 00:00:00.174743,0.15231419604293744,0.07545402048382133,,,,,,,,,,,,,,Bayes,,,,,,,,,,,,,,,,,,,,,,COMPLETE
294,294,0.8446296296296296,2023-03-02 00:30:27.765358,2023-03-02 00:30:28.033102,0 days 00:00:00.267744,,,,,,,,,,,,,,,,kNN,,,,,,,,,,,,,,,,,ball_tree,1.0,328.0,38.0,distance,COMPLETE
295,295,0.8690740740740741,2023-03-02 00:30:27.784358,2023-03-02 00:30:27.911358,0 days 00:00:00.127000,0.15289438554488632,0.07986794656313816,,,,,,,,,,,,,,Bayes,,,,,,,,,,,,,,,,,,,,,,COMPLETE
296,296,0.8688888888888888,2023-03-02 00:30:27.823358,2023-03-02 00:30:27.961101,0 days 00:00:00.137743,0.25002549588445405,0.07615340584157992,,,,,,,,,,,,,,Bayes,,,,,,,,,,,,,,,,,,,,,,COMPLETE
297,297,0.8446296296296296,2023-03-02 00:30:27.881359,2023-03-02 00:30:28.143101,0 days 00:00:00.261742,,,,,,,,,,,,,,,,kNN,,,,,,,,,,,,,,,,,brute,13.0,334.0,47.0,distance,COMPLETE
298,298,0.8664814814814814,2023-03-02 00:30:27.912359,2023-03-02 00:30:28.057101,0 days 00:00:00.144742,0.11660308393745408,0.2692243159724966,,,,,,,,,,,,,,Bayes,,,,,,,,,,,,,,,,,,,,,,COMPLETE
299,299,0.8690740740740741,2023-03-02 00:30:27.917358,2023-03-02 00:30:28.071102,0 days 00:00:00.153744,0.25684945136633386,0.12830639068042032,,,,,,,,,,,,,,Bayes,,,,,,,,,,,,,,,,,,,,,,COMPLETE
300,300,0.8692592592592592,2023-03-02 00:30:27.941101,2023-03-02 00:30:28.087102,0 days 00:00:00.146001,0.2497952535887578,0.12437493288101369,,,,,,,,,,,,,,Bayes,,,,,,,,,,,,,,,,,,,,,,COMPLETE
