,number,value,datetime_start,datetime_complete,duration,params_Bayes_prior_positive,params_Bayes_var_smoothing,params_GB_ccp_alpha,params_GB_criterion,params_GB_learning_rate,params_GB_loss,params_GB_max_depth,params_GB_max_features,params_GB_min_impurity_decrease,params_GB_min_samples_leaf,params_GB_min_samples_split,params_GB_n_estimators,params_GB_subsample,params_GB_tol,params_GB_validation_fraction,params_Method,params_SVM_C,params_SVM_coef0,params_SVM_decision_function_shape,params_SVM_degree,params_SVM_gamma,params_SVM_kernel,params_SVM_shrinking,params_SVM_tol,params_Tree_ccp_alpha,params_Tree_criterion,params_Tree_max_features,params_Tree_min_impurity_decrease,params_Tree_min_samples_leaf,params_Tree_min_samples_split,params_Tree_min_weight_fraction_leaf,params_Tree_splitter,params_kNN_algorithm,params_kNN_leaf_size,params_kNN_n_neighbors,params_kNN_p,params_kNN_weights,state
1547,1547,0.8688888888888889,2023-03-02 00:31:28.606714,2023-03-02 00:31:29.020392,0 days 00:00:00.413678,0.33611704018181365,0.03762356191055791,,,,,,,,,,,,,,Bayes,,,,,,,,,,,,,,,,,,,,,,COMPLETE
1548,1548,0.864074074074074,2023-03-02 00:31:28.669235,2023-03-02 00:31:29.105405,0 days 00:00:00.436170,0.9172182299050371,0.44107220180798834,,,,,,,,,,,,,,Bayes,,,,,,,,,,,,,,,,,,,,,,COMPLETE
1549,1549,0.8629629629629629,2023-03-02 00:31:28.714235,2023-03-02 00:31:29.143404,0 days 00:00:00.429169,0.5574265276806103,0.6513024641072755,,,,,,,,,,,,,,Bayes,,,,,,,,,,,,,,,,,,,,,,COMPLETE
1550,1550,0.8624074074074074,2023-03-02 00:31:28.911392,2023-03-02 00:31:29.224406,0 days 00:00:00.313014,0.9423172524197422,0.8144055708083582,,,,,,,,,,,,,,Bayes,,,,,,,,,,,,,,,,,,,,,,COMPLETE
1551,1551,0.8692592592592593,2023-03-02 00:31:28.965393,2023-03-02 00:31:29.273404,0 days 00:00:00.308011,0.33764015503399425,0.01140425030443766,,,,,,,,,,,,,,Bayes,,,,,,,,,,,,,,,,,,,,,,COMPLETE
1552,1552,0.8688888888888889,2023-03-02 00:31:29.023392,2023-03-02 00:31:29.329190,0 days 00:00:00.305798,0.04583303744924862,0.13878944659922024,,,,,,,,,,,,,,Bayes,,,,,,,,,,,,,,,,,,,,,,COMPLETE
1553,1553,0.8690740740740741,2023-03-02 00:31:29.050393,2023-03-02 00:31:29.376189,0 days 00:00:00.325796,0.771146247740331,0.13196456157985992,,,,,,,,,,,,,,Bayes,,,,,,,,,,,,,,,,,,,,,,COMPLETE
1554,1554,0.8690740740740741,2023-03-02 00:31:29.109406,2023-03-02 00:31:29.455494,0 days 00:00:00.346088,0.049704774365580434,0.12211264428507472,,,,,,,,,,,,,,Bayes,,,,,,,,,,,,,,,,,,,,,,COMPLETE
1555,1555,0.8625925925925927,2023-03-02 00:31:29.148406,2023-03-02 00:31:29.442491,0 days 00:00:00.294085,0.04874694896831398,0.7837146669790516,,,,,,,,,,,,,,Bayes,,,,,,,,,,,,,,,,,,,,,,COMPLETE
1556,1556,0.8631481481481482,2023-03-02 00:31:29.227405,2023-03-02 00:31:29.633506,0 days 00:00:00.406101,0.04352253651711273,0.743239969202282,,,,,,,,,,,,,,Bayes,,,,,,,,,,,,,,,,,,,,,,COMPLETE
1557,1557,0.8690740740740741,2023-03-02 00:31:29.276405,2023-03-02 00:31:29.668507,0 days 00:00:00.392102,0.04943486503552484,0.0009206727609859938,,,,,,,,,,,,,,Bayes,,,,,,,,,,,,,,,,,,,,,,COMPLETE
1558,1558,0.8624074074074074,2023-03-02 00:31:29.324677,2023-03-02 00:31:29.733047,0 days 00:00:00.408370,0.2442570754858903,0.8253855425362928,,,,,,,,,,,,,,Bayes,,,,,,,,,,,,,,,,,,,,,,COMPLETE
1559,1559,0.8664814814814815,2023-03-02 00:31:29.336189,2023-03-02 00:31:29.731048,0 days 00:00:00.394859,0.24989478494733608,0.2595941404821991,,,,,,,,,,,,,,Bayes,,,,,,,,,,,,,,,,,,,,,,COMPLETE
1560,1560,0.8646296296296296,2023-03-02 00:31:29.378193,2023-03-02 00:31:29.788047,0 days 00:00:00.409854,0.2650335004790603,0.3882984499071218,,,,,,,,,,,,,,Bayes,,,,,,,,,,,,,,,,,,,,,,COMPLETE
1561,1561,0.8635185185185185,2023-03-02 00:31:29.446492,2023-03-02 00:31:29.856203,0 days 00:00:00.409711,0.39026996234652617,0.5381485491652885,,,,,,,,,,,,,,Bayes,,,,,,,,,,,,,,,,,,,,,,COMPLETE
1562,1562,0.8690740740740741,2023-03-02 00:31:29.459493,2023-03-02 00:31:29.856203,0 days 00:00:00.396710,0.29194539747677095,0.0787015924769538,,,,,,,,,,,,,,Bayes,,,,,,,,,,,,,,,,,,,,,,COMPLETE
1563,1563,0.8688888888888888,2023-03-02 00:31:29.636506,2023-03-02 00:31:29.962720,0 days 00:00:00.326214,0.24701396576645254,0.0852917226941769,,,,,,,,,,,,,,Bayes,,,,,,,,,,,,,,,,,,,,,,COMPLETE
1564,1564,0.8690740740740741,2023-03-02 00:31:29.670505,2023-03-02 00:31:29.996719,0 days 00:00:00.326214,0.24556903007814948,0.0867273366267378,,,,,,,,,,,,,,Bayes,,,,,,,,,,,,,,,,,,,,,,COMPLETE
1565,1565,0.8605555555555556,2023-03-02 00:31:29.735051,2023-03-02 00:31:30.073738,0 days 00:00:00.338687,0.2941631296907353,0.9792090627141826,,,,,,,,,,,,,,Bayes,,,,,,,,,,,,,,,,,,,,,,COMPLETE
1566,1566,0.8648148148148148,2023-03-02 00:31:29.747048,2023-03-02 00:31:30.057735,0 days 00:00:00.310687,0.28812988224046276,0.35254448976157504,,,,,,,,,,,,,,Bayes,,,,,,,,,,,,,,,,,,,,,,COMPLETE
1567,1567,0.8614814814814814,2023-03-02 00:31:29.791047,2023-03-02 00:31:30.118735,0 days 00:00:00.327688,0.2851597496783211,0.9002589193270727,,,,,,,,,,,,,,Bayes,,,,,,,,,,,,,,,,,,,,,,COMPLETE
1568,1568,0.8690740740740741,2023-03-02 00:31:29.859202,2023-03-02 00:31:30.215748,0 days 00:00:00.356546,0.2979226323901786,0.11297844694315783,,,,,,,,,,,,,,Bayes,,,,,,,,,,,,,,,,,,,,,,COMPLETE
1569,1569,0.8681481481481481,2023-03-02 00:31:29.871203,2023-03-02 00:31:30.184749,0 days 00:00:00.313546,0.07395884060053355,0.051845112557174,,,,,,,,,,,,,,Bayes,,,,,,,,,,,,,,,,,,,,,,COMPLETE
1570,1570,0.8681481481481481,2023-03-02 00:31:29.964720,2023-03-02 00:31:30.374355,0 days 00:00:00.409635,0.30447037619074263,0.05085440119818915,,,,,,,,,,,,,,Bayes,,,,,,,,,,,,,,,,,,,,,,COMPLETE
1571,1571,0.8635185185185186,2023-03-02 00:31:29.999721,2023-03-02 00:31:30.437239,0 days 00:00:00.437518,0.3061633009507564,0.4760874779057345,,,,,,,,,,,,,,Bayes,,,,,,,,,,,,,,,,,,,,,,COMPLETE
1572,1572,0.8677777777777778,2023-03-02 00:31:30.060735,2023-03-02 00:31:30.457241,0 days 00:00:00.396506,0.07431377279254697,0.175494799501372,,,,,,,,,,,,,,Bayes,,,,,,,,,,,,,,,,,,,,,,COMPLETE
1573,1573,0.867962962962963,2023-03-02 00:31:30.084735,2023-03-02 00:31:30.493241,0 days 00:00:00.408506,0.07663554039170548,0.20481018862393024,,,,,,,,,,,,,,Bayes,,,,,,,,,,,,,,,,,,,,,,COMPLETE
1574,1574,0.8675925925925927,2023-03-02 00:31:30.121735,2023-03-02 00:31:30.528004,0 days 00:00:00.406269,0.1292563695896984,0.1804423620884043,,,,,,,,,,,,,,Bayes,,,,,,,,,,,,,,,,,,,,,,COMPLETE
1575,1575,0.8690740740740741,2023-03-02 00:31:30.188749,2023-03-02 00:31:30.584004,0 days 00:00:00.395255,0.1578679680663755,0.14607894262291687,,,,,,,,,,,,,,Bayes,,,,,,,,,,,,,,,,,,,,,,COMPLETE
1576,1576,0.8644444444444445,2023-03-02 00:31:30.217750,2023-03-02 00:31:30.620372,0 days 00:00:00.402622,0.6288903529259899,0.39535119818715175,,,,,,,,,,,,,,Bayes,,,,,,,,,,,,,,,,,,,,,,COMPLETE
1577,1577,0.8642592592592593,2023-03-02 00:31:30.377360,2023-03-02 00:31:30.702387,0 days 00:00:00.325027,0.15676667864123375,0.406462790187761,,,,,,,,,,,,,,Bayes,,,,,,,,,,,,,,,,,,,,,,COMPLETE
1578,1578,0.8692592592592593,2023-03-02 00:31:30.444239,2023-03-02 00:31:30.776395,0 days 00:00:00.332156,0.15725839515365475,0.09913649022416153,,,,,,,,,,,,,,Bayes,,,,,,,,,,,,,,,,,,,,,,COMPLETE
1579,1579,0.8692592592592593,2023-03-02 00:31:30.469240,2023-03-02 00:31:30.777395,0 days 00:00:00.308155,0.1310870316355196,0.09792466284893428,,,,,,,,,,,,,,Bayes,,,,,,,,,,,,,,,,,,,,,,COMPLETE
1580,1580,0.8627777777777778,2023-03-02 00:31:30.496242,2023-03-02 00:31:30.805950,0 days 00:00:00.309708,0.12486535636449198,0.6015389181438905,,,,,,,,,,,,,,Bayes,,,,,,,,,,,,,,,,,,,,,,COMPLETE
1581,1581,0.8690740740740741,2023-03-02 00:31:30.532006,2023-03-02 00:31:30.864876,0 days 00:00:00.332870,0.09472299600326517,0.10005074310780548,,,,,,,,,,,,,,Bayes,,,,,,,,,,,,,,,,,,,,,,COMPLETE
1582,1582,0.8692592592592593,2023-03-02 00:31:30.587008,2023-03-02 00:31:30.928751,0 days 00:00:00.341743,0.46566649097574303,0.09837268126955218,,,,,,,,,,,,,,Bayes,,,,,,,,,,,,,,,,,,,,,,COMPLETE
1583,1583,0.8692592592592593,2023-03-02 00:31:30.626386,2023-03-02 00:31:30.993704,0 days 00:00:00.367318,0.39992703211263464,0.0972530604381713,,,,,,,,,,,,,,Bayes,,,,,,,,,,,,,,,,,,,,,,COMPLETE
1584,1584,0.8614814814814814,2023-03-02 00:31:30.704387,2023-03-02 00:31:31.137707,0 days 00:00:00.433320,0.22058354490607762,0.9073954561200569,,,,,,,,,,,,,,Bayes,,,,,,,,,,,,,,,,,,,,,,COMPLETE
1585,1585,0.8681481481481481,2023-03-02 00:31:30.783396,2023-03-02 00:31:31.194707,0 days 00:00:00.411311,0.09269724884906227,0.06379542087857724,,,,,,,,,,,,,,Bayes,,,,,,,,,,,,,,,,,,,,,,COMPLETE
1586,1586,0.8683333333333333,2023-03-02 00:31:30.793950,2023-03-02 00:31:31.212707,0 days 00:00:00.418757,0.4660747850520514,0.06547662457691975,,,,,,,,,,,,,,Bayes,,,,,,,,,,,,,,,,,,,,,,COMPLETE
1587,1587,0.8679629629629629,2023-03-02 00:31:30.828100,2023-03-02 00:31:31.249707,0 days 00:00:00.421607,0.48721848480499025,0.0610008705571449,,,,,,,,,,,,,,Bayes,,,,,,,,,,,,,,,,,,,,,,COMPLETE
1588,1588,0.8683333333333333,2023-03-02 00:31:30.867875,2023-03-02 00:31:31.296707,0 days 00:00:00.428832,0.22687016421441566,0.06576706316284762,,,,,,,,,,,,,,Bayes,,,,,,,,,,,,,,,,,,,,,,COMPLETE
1589,1589,0.8681481481481481,2023-03-02 00:31:30.931751,2023-03-02 00:31:31.372413,0 days 00:00:00.440662,0.0011812448118671132,0.05982914468859847,,,,,,,,,,,,,,Bayes,,,,,,,,,,,,,,,,,,,,,,COMPLETE
1590,1590,0.8633333333333333,2023-03-02 00:31:31.092694,2023-03-02 00:31:31.472367,0 days 00:00:00.379673,0.0016432286087549562,0.486247353589722,,,,,,,,,,,,,,Bayes,,,,,,,,,,,,,,,,,,,,,,COMPLETE
1591,1591,0.8633333333333334,2023-03-02 00:31:31.140708,2023-03-02 00:31:31.524367,0 days 00:00:00.383659,0.020270554624966255,0.5299533030540804,,,,,,,,,,,,,,Bayes,,,,,,,,,,,,,,,,,,,,,,COMPLETE
1592,1592,0.8690740740740741,2023-03-02 00:31:31.199708,2023-03-02 00:31:31.640367,0 days 00:00:00.440659,0.020874754111141113,0.11906397247299666,,,,,,,,,,,,,,Bayes,,,,,,,,,,,,,,,,,,,,,,COMPLETE
1593,1593,0.8633333333333333,2023-03-02 00:31:31.225709,2023-03-02 00:31:31.639367,0 days 00:00:00.413658,0.2684354953880824,0.4932650192778958,,,,,,,,,,,,,,Bayes,,,,,,,,,,,,,,,,,,,,,,COMPLETE
1594,1594,0.8638888888888889,2023-03-02 00:31:31.253710,2023-03-02 00:31:31.783377,0 days 00:00:00.529667,0.2684818545077908,0.45965244334793964,,,,,,,,,,,,,,Bayes,,,,,,,,,,,,,,,,,,,,,,COMPLETE
1595,1595,0.5,2023-03-02 00:31:31.300707,2023-03-02 00:31:31.557367,0 days 00:00:00.256660,,,,,,,,,,,,,,,,SVM,57.48628830725689,-71.53807078177674,ovo,42.0,auto,poly,True,0.04988861251913923,,,,,,,,,,,,,,COMPLETE
1596,1596,0.5,2023-03-02 00:31:31.381410,2023-03-02 00:31:31.624367,0 days 00:00:00.242957,,,,,,,,,,,,,,,,SVM,56.350802507831524,43.56218042169297,ovo,42.0,auto,poly,True,0.39106444147938196,,,,,,,,,,,,,,COMPLETE
1597,1597,0.8690740740740741,2023-03-02 00:31:31.486368,2023-03-02 00:31:31.934640,0 days 00:00:00.448272,0.8225699293129587,0.026554619689844808,,,,,,,,,,,,,,Bayes,,,,,,,,,,,,,,,,,,,,,,COMPLETE
1598,1598,0.8690740740740741,2023-03-02 00:31:31.527367,2023-03-02 00:31:31.967640,0 days 00:00:00.440273,0.18502169209862807,0.02002397020446252,,,,,,,,,,,,,,Bayes,,,,,,,,,,,,,,,,,,,,,,COMPLETE
1599,1599,0.8631481481481481,2023-03-02 00:31:31.562369,2023-03-02 00:31:31.988640,0 days 00:00:00.426271,0.7317216305981948,0.6793085442240574,,,,,,,,,,,,,,Bayes,,,,,,,,,,,,,,,,,,,,,,COMPLETE
1600,1600,0.866111111111111,2023-03-02 00:31:31.627367,2023-03-02 00:31:32.061237,0 days 00:00:00.433870,0.5898600689277181,0.32868143075209333,,,,,,,,,,,,,,Bayes,,,,,,,,,,,,,,,,,,,,,,COMPLETE
1601,1601,0.8690740740740741,2023-03-02 00:31:31.643367,2023-03-02 00:31:32.064239,0 days 00:00:00.420872,0.4185028905355467,0.14252685467642662,,,,,,,,,,,,,,Bayes,,,,,,,,,,,,,,,,,,,,,,COMPLETE
1602,1602,0.867037037037037,2023-03-02 00:31:31.654369,2023-03-02 00:31:32.103215,0 days 00:00:00.448846,0.3248911566271931,0.22835334546763847,,,,,,,,,,,,,,Bayes,,,,,,,,,,,,,,,,,,,,,,COMPLETE
1603,1603,0.8690740740740741,2023-03-02 00:31:31.789377,2023-03-02 00:31:32.172379,0 days 00:00:00.383002,0.6958532956383174,0.14315312133400782,,,,,,,,,,,,,,Bayes,,,,,,,,,,,,,,,,,,,,,,COMPLETE
1604,1604,0.8688888888888888,2023-03-02 00:31:31.939640,2023-03-02 00:31:32.302379,0 days 00:00:00.362739,0.18745332600818562,0.08482732346440358,,,,,,,,,,,,,,Bayes,,,,,,,,,,,,,,,,,,,,,,COMPLETE
1605,1605,0.8690740740740741,2023-03-02 00:31:31.975640,2023-03-02 00:31:32.419862,0 days 00:00:00.444222,0.3183987234646466,0.11815684163466739,,,,,,,,,,,,,,Bayes,,,,,,,,,,,,,,,,,,,,,,COMPLETE
1606,1606,0.8629629629629629,2023-03-02 00:31:32.000764,2023-03-02 00:31:32.436865,0 days 00:00:00.436101,0.32508065630962346,0.5824369150234678,,,,,,,,,,,,,,Bayes,,,,,,,,,,,,,,,,,,,,,,COMPLETE
1607,1607,0.8690740740740741,2023-03-02 00:31:32.066238,2023-03-02 00:31:32.489861,0 days 00:00:00.423623,0.35839692385460203,0.12136914112607454,,,,,,,,,,,,,,Bayes,,,,,,,,,,,,,,,,,,,,,,COMPLETE
1608,1608,0.8633333333333334,2023-03-02 00:31:32.076241,2023-03-02 00:31:32.522893,0 days 00:00:00.446652,0.34015469900897255,0.5732207783585386,,,,,,,,,,,,,,Bayes,,,,,,,,,,,,,,,,,,,,,,COMPLETE
1609,1609,0.8624074074074074,2023-03-02 00:31:32.089216,2023-03-02 00:31:32.530892,0 days 00:00:00.441676,0.6701509777146989,0.7925561105010076,,,,,,,,,,,,,,Bayes,,,,,,,,,,,,,,,,,,,,,,COMPLETE
1610,1610,0.8664814814814814,2023-03-02 00:31:32.119214,2023-03-02 00:31:32.577892,0 days 00:00:00.458678,0.35618556325455253,0.27363059297116127,,,,,,,,,,,,,,Bayes,,,,,,,,,,,,,,,,,,,,,,COMPLETE
1611,1611,0.8688888888888889,2023-03-02 00:31:32.175380,2023-03-02 00:31:32.614895,0 days 00:00:00.439515,0.35455633246077334,0.08235453155586181,,,,,,,,,,,,,,Bayes,,,,,,,,,,,,,,,,,,,,,,COMPLETE
1612,1612,0.8690740740740741,2023-03-02 00:31:32.306381,2023-03-02 00:31:32.938566,0 days 00:00:00.632185,0.3271193145847697,0.07982248777009765,,,,,,,,,,,,,,Bayes,,,,,,,,,,,,,,,,,,,,,,COMPLETE
1613,1613,0.8688888888888888,2023-03-02 00:31:32.425862,2023-03-02 00:31:32.919561,0 days 00:00:00.493699,0.10298342651792332,0.15886593466019033,,,,,,,,,,,,,,Bayes,,,,,,,,,,,,,,,,,,,,,,COMPLETE
1614,1614,0.8633333333333333,2023-03-02 00:31:32.449864,2023-03-02 00:31:33.018565,0 days 00:00:00.568701,0.846738977604582,0.6887935706102798,,,,,,,,,,,,,,Bayes,,,,,,,,,,,,,,,,,,,,,,COMPLETE
1615,1615,0.5,2023-03-02 00:31:32.492861,2023-03-02 00:31:33.093578,0 days 00:00:00.600717,,,,,,,,,,,,,,,,Tree,,,,,,,,,598.4308307120097,entropy,0.30232124073016725,815.7739316001755,0.3612691902085169,0.9870844956729558,0.4357942292174129,best,,,,,,COMPLETE
1616,1616,0.8688888888888889,2023-03-02 00:31:32.533894,2023-03-02 00:31:33.140579,0 days 00:00:00.606685,0.1168722561388923,0.08130458672326946,,,,,,,,,,,,,,Bayes,,,,,,,,,,,,,,,,,,,,,,COMPLETE
1617,1617,0.5,2023-03-02 00:31:32.549894,2023-03-02 00:31:33.157578,0 days 00:00:00.607684,,,,,,,,,,,,,,,,Tree,,,,,,,,,649.445485132941,entropy,0.49778469479171605,446.822699345195,0.35547379893731834,0.8179166620358562,0.44039232000328865,best,,,,,,COMPLETE
1618,1618,0.5,2023-03-02 00:31:32.603893,2023-03-02 00:31:33.141579,0 days 00:00:00.537686,,,,,,,,,,,,,,,,Tree,,,,,,,,,653.0875076878467,entropy,0.5032766277487482,620.5510047290375,0.43874084404781355,0.48175008541295244,0.001343514252236444,best,,,,,,COMPLETE
1619,1619,0.5,2023-03-02 00:31:32.627894,2023-03-02 00:31:33.184578,0 days 00:00:00.556684,,,,,,,,,,,,,,,,Tree,,,,,,,,,900.4314246803663,entropy,0.49428760357778195,626.5045656737317,0.43376502467033284,0.4255123058147774,0.4409786724960997,best,,,,,,COMPLETE
1620,1620,0.5,2023-03-02 00:31:32.927562,2023-03-02 00:31:33.455733,0 days 00:00:00.528171,,,,,,,,,,,,,,,,Tree,,,,,,,,,1.1913059035944116,entropy,0.4453624883110861,389.46347380590964,0.06579981326419004,0.07762355679386335,0.11052536654564832,best,,,,,,COMPLETE
1621,1621,0.8646296296296296,2023-03-02 00:31:32.941561,2023-03-02 00:31:33.503250,0 days 00:00:00.561689,0.7429988470549478,0.37570893104585845,,,,,,,,,,,,,,Bayes,,,,,,,,,,,,,,,,,,,,,,COMPLETE
1622,1622,0.8614814814814815,2023-03-02 00:31:33.023660,2023-03-02 00:31:33.535250,0 days 00:00:00.511590,0.11286089442186509,0.9196893796316941,,,,,,,,,,,,,,Bayes,,,,,,,,,,,,,,,,,,,,,,COMPLETE
1623,1623,0.8688888888888889,2023-03-02 00:31:33.095578,2023-03-02 00:31:33.573251,0 days 00:00:00.477673,0.11648344711666106,0.03796380619545389,,,,,,,,,,,,,,Bayes,,,,,,,,,,,,,,,,,,,,,,COMPLETE
1624,1624,0.8690740740740741,2023-03-02 00:31:33.144578,2023-03-02 00:31:33.627250,0 days 00:00:00.482672,0.06737205638001009,0.11742940262277893,,,,,,,,,,,,,,Bayes,,,,,,,,,,,,,,,,,,,,,,COMPLETE
1625,1625,0.8688888888888889,2023-03-02 00:31:33.159578,2023-03-02 00:31:33.658250,0 days 00:00:00.498672,0.4504307281382235,0.03953826880320057,,,,,,,,,,,,,,Bayes,,,,,,,,,,,,,,,,,,,,,,COMPLETE
1626,1626,0.8685185185185185,2023-03-02 00:31:33.172579,2023-03-02 00:31:33.604251,0 days 00:00:00.431672,0.03129500057916794,0.04396989598051997,,,,,,,,,,,,,,Bayes,,,,,,,,,,,,,,,,,,,,,,COMPLETE
1627,1627,0.8635185185185185,2023-03-02 00:31:33.212581,2023-03-02 00:31:33.740769,0 days 00:00:00.528188,0.21950232837656986,0.5527832091656851,,,,,,,,,,,,,,Bayes,,,,,,,,,,,,,,,,,,,,,,COMPLETE
1628,1628,0.8694444444444445,2023-03-02 00:31:33.462733,2023-03-02 00:31:34.115883,0 days 00:00:00.653150,0.0658344326088321,0.10702248367542146,,,,,,,,,,,,,,Bayes,,,,,,,,,,,,,,,,,,,,,,COMPLETE
1629,1629,0.8690740740740741,2023-03-02 00:31:33.507251,2023-03-02 00:31:34.138883,0 days 00:00:00.631632,0.21851621501662552,0.11256633418389743,,,,,,,,,,,,,,Bayes,,,,,,,,,,,,,,,,,,,,,,COMPLETE
1630,1630,0.8690740740740741,2023-03-02 00:31:33.538253,2023-03-02 00:31:34.165884,0 days 00:00:00.627631,0.20770742906709277,0.11264779930209386,,,,,,,,,,,,,,Bayes,,,,,,,,,,,,,,,,,,,,,,COMPLETE
1631,1631,0.8468518518518519,2023-03-02 00:31:33.577251,2023-03-02 00:31:34.053884,0 days 00:00:00.476633,,,,,,,,,,,,,,,,kNN,,,,,,,,,,,,,,,,,kd_tree,289.0,46.0,284.0,distance,COMPLETE
1632,1632,0.8533333333333334,2023-03-02 00:31:33.610252,2023-03-02 00:31:34.211886,0 days 00:00:00.601634,,,,,,,,,,,,,,,,kNN,,,,,,,,,,,,,,,,,kd_tree,299.0,151.0,89.0,distance,COMPLETE
1633,1633,0.8485185185185186,2023-03-02 00:31:33.642251,2023-03-02 00:31:34.236884,0 days 00:00:00.594633,,,,,,,,,,,,,,,,kNN,,,,,,,,,,,,,,,,,kd_tree,288.0,142.0,60.0,distance,COMPLETE
1634,1634,0.8414814814814815,2023-03-02 00:31:33.672250,2023-03-02 00:31:34.068886,0 days 00:00:00.396636,,,,,,,,,,,,,,,,kNN,,,,,,,,,,,,,,,,,kd_tree,303.0,28.0,64.0,distance,COMPLETE
1635,1635,0.8692592592592592,2023-03-02 00:31:33.768770,2023-03-02 00:31:34.323885,0 days 00:00:00.555115,0.5426210314995117,0.12390417801211266,,,,,,,,,,,,,,Bayes,,,,,,,,,,,,,,,,,,,,,,COMPLETE
1636,1636,0.8688888888888889,2023-03-02 00:31:34.056884,2023-03-02 00:31:34.405998,0 days 00:00:00.349114,0.8715476512158715,0.1342885448022717,,,,,,,,,,,,,,Bayes,,,,,,,,,,,,,,,,,,,,,,COMPLETE
1637,1637,0.8635185185185186,2023-03-02 00:31:34.070884,2023-03-02 00:31:34.420559,0 days 00:00:00.349675,0.256694915838898,0.7187383839192854,,,,,,,,,,,,,,Bayes,,,,,,,,,,,,,,,,,,,,,,COMPLETE
1638,1638,0.8664814814814814,2023-03-02 00:31:34.128885,2023-03-02 00:31:34.465558,0 days 00:00:00.336673,0.39105165009534626,0.2478483242984829,,,,,,,,,,,,,,Bayes,,,,,,,,,,,,,,,,,,,,,,COMPLETE
1639,1639,0.8653703703703703,2023-03-02 00:31:34.142884,2023-03-02 00:31:34.501558,0 days 00:00:00.358674,0.38372009784522754,0.33871642899719057,,,,,,,,,,,,,,Bayes,,,,,,,,,,,,,,,,,,,,,,COMPLETE
1640,1640,0.8614814814814815,2023-03-02 00:31:34.179886,2023-03-02 00:31:34.505869,0 days 00:00:00.325983,0.5130904679737115,0.9384043478276198,,,,,,,,,,,,,,Bayes,,,,,,,,,,,,,,,,,,,,,,COMPLETE
1641,1641,0.8629629629629629,2023-03-02 00:31:34.214886,2023-03-02 00:31:34.564871,0 days 00:00:00.349985,0.7168417397608959,0.6140336581143623,,,,,,,,,,,,,,Bayes,,,,,,,,,,,,,,,,,,,,,,COMPLETE
1642,1642,0.8688888888888889,2023-03-02 00:31:34.242884,2023-03-02 00:31:34.692881,0 days 00:00:00.449997,0.270032717700625,0.08166406138617942,,,,,,,,,,,,,,Bayes,,,,,,,,,,,,,,,,,,,,,,COMPLETE
1643,1643,0.867962962962963,2023-03-02 00:31:34.333884,2023-03-02 00:31:34.801900,0 days 00:00:00.468016,0.2783247115890598,0.2018658110290055,,,,,,,,,,,,,,Bayes,,,,,,,,,,,,,,,,,,,,,,COMPLETE
1644,1644,0.8688888888888888,2023-03-02 00:31:34.409559,2023-03-02 00:31:34.868911,0 days 00:00:00.459352,0.2773047500804023,0.08534041312951861,,,,,,,,,,,,,,Bayes,,,,,,,,,,,,,,,,,,,,,,COMPLETE
1645,1645,0.8690740740740741,2023-03-02 00:31:34.423559,2023-03-02 00:31:34.930640,0 days 00:00:00.507081,0.8017156990663437,0.08089494686997338,,,,,,,,,,,,,,Bayes,,,,,,,,,,,,,,,,,,,,,,COMPLETE
1646,1646,0.8688888888888888,2023-03-02 00:31:34.468560,2023-03-02 00:31:34.984639,0 days 00:00:00.516079,0.436631770734088,0.08474976350235955,,,,,,,,,,,,,,Bayes,,,,,,,,,,,,,,,,,,,,,,COMPLETE
1647,1647,0.8611111111111112,2023-03-02 00:31:34.507868,2023-03-02 00:31:35.013641,0 days 00:00:00.505773,0.2716857774157784,0.9593587915363808,,,,,,,,,,,,,,Bayes,,,,,,,,,,,,,,,,,,,,,,COMPLETE
1648,1648,0.8694444444444445,2023-03-02 00:31:34.518868,2023-03-02 00:31:35.017641,0 days 00:00:00.498773,0.9008077863938546,0.08789127095567903,,,,,,,,,,,,,,Bayes,,,,,,,,,,,,,,,,,,,,,,COMPLETE
1649,1649,0.8677777777777778,2023-03-02 00:31:34.567869,2023-03-02 00:31:35.098639,0 days 00:00:00.530770,0.28050469021290175,0.16762399063828454,,,,,,,,,,,,,,Bayes,,,,,,,,,,,,,,,,,,,,,,COMPLETE
1650,1650,0.7240740740740741,2023-03-02 00:31:34.697882,2023-03-02 00:31:34.912909,0 days 00:00:00.215027,,,,,,,,,,,,,,,,SVM,73.84035945005212,,ovo,,auto,rbf,True,0.21232921592079557,,,,,,,,,,,,,,COMPLETE
1651,1651,0.7194444444444444,2023-03-02 00:31:34.807912,2023-03-02 00:31:35.030641,0 days 00:00:00.222729,,,,,,,,,,,,,,,,SVM,74.40747542008259,,ovo,,auto,rbf,True,0.8494404706766732,,,,,,,,,,,,,,COMPLETE
1652,1652,0.8638888888888889,2023-03-02 00:31:34.871911,2023-03-02 00:31:35.335640,0 days 00:00:00.463729,0.14542906917143256,0.45266255457848503,,,,,,,,,,,,,,Bayes,,,,,,,,,,,,,,,,,,,,,,COMPLETE
