,number,value,datetime_start,datetime_complete,duration,params_Bayes_prior_positive,params_Bayes_var_smoothing,params_GB_ccp_alpha,params_GB_criterion,params_GB_learning_rate,params_GB_loss,params_GB_max_depth,params_GB_max_features,params_GB_min_impurity_decrease,params_GB_min_samples_leaf,params_GB_min_samples_split,params_GB_n_estimators,params_GB_subsample,params_GB_tol,params_GB_validation_fraction,params_Method,params_SVM_C,params_SVM_coef0,params_SVM_decision_function_shape,params_SVM_degree,params_SVM_gamma,params_SVM_kernel,params_SVM_shrinking,params_SVM_tol,params_Tree_ccp_alpha,params_Tree_criterion,params_Tree_max_features,params_Tree_min_impurity_decrease,params_Tree_min_samples_leaf,params_Tree_min_samples_split,params_Tree_min_weight_fraction_leaf,params_Tree_splitter,params_kNN_algorithm,params_kNN_leaf_size,params_kNN_n_neighbors,params_kNN_p,params_kNN_weights,state
820,820,0.8692592592592592,2023-03-02 00:30:48.980593,2023-03-02 00:30:49.346334,0 days 00:00:00.365741,0.3137861645642499,0.12495729557546637,,,,,,,,,,,,,,Bayes,,,,,,,,,,,,,,,,,,,,,,COMPLETE
821,821,0.867962962962963,2023-03-02 00:30:49.080109,2023-03-02 00:30:49.366334,0 days 00:00:00.286225,0.5130459865451779,0.18938510953452736,,,,,,,,,,,,,,Bayes,,,,,,,,,,,,,,,,,,,,,,COMPLETE
822,822,0.8692592592592592,2023-03-02 00:30:49.085111,2023-03-02 00:30:49.401333,0 days 00:00:00.316222,0.29907684070653223,0.1235329934808157,,,,,,,,,,,,,,Bayes,,,,,,,,,,,,,,,,,,,,,,COMPLETE
823,823,0.7681481481481481,2023-03-02 00:30:49.144109,2023-03-02 00:30:59.885905,0 days 00:00:10.741796,,,,,,,,,,,,,,,,SVM,17.975013236311547,33.75964537080341,ovr,3.0,scale,poly,False,0.5296797617125081,,,,,,,,,,,,,,COMPLETE
824,824,0.5,2023-03-02 00:30:49.226038,2023-03-02 00:30:49.381333,0 days 00:00:00.155295,,,,,,,,,,,,,,,,SVM,18.446177609045453,-99.43120834449665,ovr,33.0,scale,poly,False,0.5209822585389549,,,,,,,,,,,,,,COMPLETE
825,825,0.8633333333333333,2023-03-02 00:30:49.249333,2023-03-02 00:30:49.524335,0 days 00:00:00.275002,0.22294647138987955,0.5114056083554475,,,,,,,,,,,,,,Bayes,,,,,,,,,,,,,,,,,,,,,,COMPLETE
826,826,0.8694444444444445,2023-03-02 00:30:49.287332,2023-03-02 00:30:49.526333,0 days 00:00:00.239001,0.7649104826265948,0.09036880921898782,,,,,,,,,,,,,,Bayes,,,,,,,,,,,,,,,,,,,,,,COMPLETE
827,827,0.8635185185185186,2023-03-02 00:30:49.317334,2023-03-02 00:30:50.677501,0 days 00:00:01.360167,,,,,,,,,,,,,,,,SVM,16.633957505199042,98.00465520558942,ovo,2.0,scale,poly,True,0.08670534486427817,,,,,,,,,,,,,,COMPLETE
828,828,0.8488888888888888,2023-03-02 00:30:49.358337,2023-03-02 00:30:49.547333,0 days 00:00:00.188996,,,,,,,,,,,,,,,,SVM,38.4223272804752,33.84291618334577,ovo,1.0,scale,poly,True,0.09265794068137367,,,,,,,,,,,,,,COMPLETE
829,829,0.8472222222222222,2023-03-02 00:30:49.370334,2023-03-02 00:30:49.701334,0 days 00:00:00.331000,,,,,,,,,,,,,,,,SVM,38.13628171543427,,ovo,,,linear,True,0.13762168027692978,,,,,,,,,,,,,,COMPLETE
830,830,0.8631481481481482,2023-03-02 00:30:49.392334,2023-03-02 00:30:49.581334,0 days 00:00:00.189000,0.16657507734860189,0.7326220920852107,,,,,,,,,,,,,,Bayes,,,,,,,,,,,,,,,,,,,,,,COMPLETE
831,831,0.8690740740740741,2023-03-02 00:30:49.413334,2023-03-02 00:30:49.581334,0 days 00:00:00.168000,0.49031350971438437,0.0018962523073653426,,,,,,,,,,,,,,Bayes,,,,,,,,,,,,,,,,,,,,,,COMPLETE
832,832,0.8692592592592594,2023-03-02 00:30:49.526333,2023-03-02 00:30:49.677334,0 days 00:00:00.151001,0.3744803049127589,0.10950903941527666,,,,,,,,,,,,,,Bayes,,,,,,,,,,,,,,,,,,,,,,COMPLETE
833,833,0.8688888888888888,2023-03-02 00:30:49.533335,2023-03-02 00:30:49.669332,0 days 00:00:00.135997,0.974321441923637,0.15762975553177144,,,,,,,,,,,,,,Bayes,,,,,,,,,,,,,,,,,,,,,,COMPLETE
834,834,0.8633333333333334,2023-03-02 00:30:49.553333,2023-03-02 00:30:49.667334,0 days 00:00:00.114001,0.5327358628313743,0.5704088521105269,,,,,,,,,,,,,,Bayes,,,,,,,,,,,,,,,,,,,,,,COMPLETE
835,835,0.8690740740740741,2023-03-02 00:30:49.584336,2023-03-02 00:30:49.739129,0 days 00:00:00.154793,0.3790312547116255,0.10370073182331815,,,,,,,,,,,,,,Bayes,,,,,,,,,,,,,,,,,,,,,,COMPLETE
836,836,0.8622222222222222,2023-03-02 00:30:49.589334,2023-03-02 00:30:49.737127,0 days 00:00:00.147793,0.2596155277380617,0.8086207609347854,,,,,,,,,,,,,,Bayes,,,,,,,,,,,,,,,,,,,,,,COMPLETE
837,837,0.8688888888888889,2023-03-02 00:30:49.671333,2023-03-02 00:30:49.839130,0 days 00:00:00.167797,0.6812988585162763,0.08207794082713614,,,,,,,,,,,,,,Bayes,,,,,,,,,,,,,,,,,,,,,,COMPLETE
838,838,0.8666666666666666,2023-03-02 00:30:49.678333,2023-03-02 00:30:49.842129,0 days 00:00:00.163796,0.2598005811320598,0.28324923467291707,,,,,,,,,,,,,,Bayes,,,,,,,,,,,,,,,,,,,,,,COMPLETE
839,839,0.8635185185185185,2023-03-02 00:30:49.691335,2023-03-02 00:30:49.849129,0 days 00:00:00.157794,0.2539953476735657,0.5552328882509512,,,,,,,,,,,,,,Bayes,,,,,,,,,,,,,,,,,,,,,,COMPLETE
840,840,0.8688888888888888,2023-03-02 00:30:49.712332,2023-03-02 00:30:49.882127,0 days 00:00:00.169795,0.24299341395488092,0.0841690007370861,,,,,,,,,,,,,,Bayes,,,,,,,,,,,,,,,,,,,,,,COMPLETE
841,841,0.8637037037037036,2023-03-02 00:30:49.740130,2023-03-02 00:30:49.906129,0 days 00:00:00.165999,0.04119181992949777,0.5550350889664133,,,,,,,,,,,,,,Bayes,,,,,,,,,,,,,,,,,,,,,,COMPLETE
842,842,0.8618518518518519,2023-03-02 00:30:49.747130,2023-03-02 00:30:49.920130,0 days 00:00:00.173000,0.04499383784401918,0.8711650078877444,,,,,,,,,,,,,,Bayes,,,,,,,,,,,,,,,,,,,,,,COMPLETE
843,843,0.8653703703703703,2023-03-02 00:30:49.843129,2023-03-02 00:30:50.015127,0 days 00:00:00.171998,0.551123566251643,0.33830887910813834,,,,,,,,,,,,,,Bayes,,,,,,,,,,,,,,,,,,,,,,COMPLETE
844,844,0.8681481481481481,2023-03-02 00:30:49.852127,2023-03-02 00:30:50.116129,0 days 00:00:00.264002,0.03504341068452985,0.05374659430069536,,,,,,,,,,,,,,Bayes,,,,,,,,,,,,,,,,,,,,,,COMPLETE
845,845,0.8681481481481481,2023-03-02 00:30:49.862129,2023-03-02 00:30:50.026129,0 days 00:00:00.164000,0.04118914816842758,0.05265993638354487,,,,,,,,,,,,,,Bayes,,,,,,,,,,,,,,,,,,,,,,COMPLETE
846,846,0.8681481481481481,2023-03-02 00:30:49.885127,2023-03-02 00:30:50.123127,0 days 00:00:00.238000,0.045489676992645195,0.06334920406431424,,,,,,,,,,,,,,Bayes,,,,,,,,,,,,,,,,,,,,,,COMPLETE
847,847,0.8627777777777779,2023-03-02 00:30:49.910130,2023-03-02 00:30:50.169128,0 days 00:00:00.258998,0.2878553870763575,0.656442104222295,,,,,,,,,,,,,,Bayes,,,,,,,,,,,,,,,,,,,,,,COMPLETE
848,848,0.8627777777777779,2023-03-02 00:30:49.926134,2023-03-02 00:30:50.177127,0 days 00:00:00.250993,0.7163849611343905,0.6653375379515891,,,,,,,,,,,,,,Bayes,,,,,,,,,,,,,,,,,,,,,,COMPLETE
849,849,0.8688888888888889,2023-03-02 00:30:50.021129,2023-03-02 00:30:50.281841,0 days 00:00:00.260712,0.1836771366182217,0.13641185572773684,,,,,,,,,,,,,,Bayes,,,,,,,,,,,,,,,,,,,,,,COMPLETE
850,850,0.8633333333333334,2023-03-02 00:30:50.031131,2023-03-02 00:30:50.272841,0 days 00:00:00.241710,0.15729995648587383,0.5292829615061007,,,,,,,,,,,,,,Bayes,,,,,,,,,,,,,,,,,,,,,,COMPLETE
851,851,0.8629629629629629,2023-03-02 00:30:50.119128,2023-03-02 00:30:50.291843,0 days 00:00:00.172715,0.18929555638354997,0.6059177940321518,,,,,,,,,,,,,,Bayes,,,,,,,,,,,,,,,,,,,,,,COMPLETE
852,852,0.8688888888888889,2023-03-02 00:30:50.130129,2023-03-02 00:30:50.311842,0 days 00:00:00.181713,0.28193270945471555,0.13781597705198106,,,,,,,,,,,,,,Bayes,,,,,,,,,,,,,,,,,,,,,,COMPLETE
853,853,0.8688888888888889,2023-03-02 00:30:50.172128,2023-03-02 00:30:50.344842,0 days 00:00:00.172714,0.18952965204075284,0.13759755720857428,,,,,,,,,,,,,,Bayes,,,,,,,,,,,,,,,,,,,,,,COMPLETE
854,854,0.8635185185185186,2023-03-02 00:30:50.180129,2023-03-02 00:30:50.365843,0 days 00:00:00.185714,0.18786244311726535,0.47606231791172615,,,,,,,,,,,,,,Bayes,,,,,,,,,,,,,,,,,,,,,,COMPLETE
855,855,0.8692592592592593,2023-03-02 00:30:50.275843,2023-03-02 00:30:50.451842,0 days 00:00:00.175999,0.21730155158996434,0.09909312533179686,,,,,,,,,,,,,,Bayes,,,,,,,,,,,,,,,,,,,,,,COMPLETE
856,856,0.8692592592592593,2023-03-02 00:30:50.285843,2023-03-02 00:30:50.462841,0 days 00:00:00.176998,0.223845922430894,0.09716857101773801,,,,,,,,,,,,,,Bayes,,,,,,,,,,,,,,,,,,,,,,COMPLETE
857,857,0.8692592592592593,2023-03-02 00:30:50.300842,2023-03-02 00:30:50.462841,0 days 00:00:00.161999,0.9763177240970187,0.1056884326242773,,,,,,,,,,,,,,Bayes,,,,,,,,,,,,,,,,,,,,,,COMPLETE
858,858,0.8690740740740741,2023-03-02 00:30:50.321842,2023-03-02 00:30:50.504501,0 days 00:00:00.182659,0.44728969306037064,0.10315432081491428,,,,,,,,,,,,,,Bayes,,,,,,,,,,,,,,,,,,,,,,COMPLETE
859,859,0.8690740740740741,2023-03-02 00:30:50.347843,2023-03-02 00:30:50.530503,0 days 00:00:00.182660,0.01891408629085073,0.10052188425237778,,,,,,,,,,,,,,Bayes,,,,,,,,,,,,,,,,,,,,,,COMPLETE
860,860,0.8629629629629629,2023-03-02 00:30:50.367843,2023-03-02 00:30:50.539501,0 days 00:00:00.171658,0.2232170253927776,0.6438273182078985,,,,,,,,,,,,,,Bayes,,,,,,,,,,,,,,,,,,,,,,COMPLETE
861,861,0.8688888888888888,2023-03-02 00:30:50.456843,2023-03-02 00:30:50.641502,0 days 00:00:00.184659,0.10291723290408351,0.07621638628416658,,,,,,,,,,,,,,Bayes,,,,,,,,,,,,,,,,,,,,,,COMPLETE
862,862,0.8633333333333333,2023-03-02 00:30:50.464844,2023-03-02 00:30:50.631502,0 days 00:00:00.166658,0.4280028503899027,0.5015308711969237,,,,,,,,,,,,,,Bayes,,,,,,,,,,,,,,,,,,,,,,COMPLETE
863,863,0.8690740740740741,2023-03-02 00:30:50.472842,2023-03-02 00:30:50.634503,0 days 00:00:00.161661,0.10747134871118946,0.07857965279244761,,,,,,,,,,,,,,Bayes,,,,,,,,,,,,,,,,,,,,,,COMPLETE
864,864,0.8611111111111112,2023-03-02 00:30:50.506502,2023-03-02 00:30:50.698501,0 days 00:00:00.191999,0.014562598561154608,0.9573082769798353,,,,,,,,,,,,,,Bayes,,,,,,,,,,,,,,,,,,,,,,COMPLETE
865,865,0.8688888888888888,2023-03-02 00:30:50.534502,2023-03-02 00:30:50.722501,0 days 00:00:00.187999,0.6377396701377396,0.0761563927456766,,,,,,,,,,,,,,Bayes,,,,,,,,,,,,,,,,,,,,,,COMPLETE
866,866,0.8690740740740741,2023-03-02 00:30:50.542502,2023-03-02 00:30:50.733501,0 days 00:00:00.190999,0.34928484441632257,0.022869958910010327,,,,,,,,,,,,,,Bayes,,,,,,,,,,,,,,,,,,,,,,COMPLETE
867,867,0.8624074074074074,2023-03-02 00:30:50.635501,2023-03-02 00:30:50.837821,0 days 00:00:00.202320,0.34943568479577175,0.8297222155438837,,,,,,,,,,,,,,Bayes,,,,,,,,,,,,,,,,,,,,,,COMPLETE
868,868,0.8690740740740741,2023-03-02 00:30:50.642501,2023-03-02 00:30:50.838819,0 days 00:00:00.196318,0.0019092439986334309,0.12092881208825842,,,,,,,,,,,,,,Bayes,,,,,,,,,,,,,,,,,,,,,,COMPLETE
869,869,0.8690740740740741,2023-03-02 00:30:50.649503,2023-03-02 00:30:50.876819,0 days 00:00:00.227316,0.00023865838108739698,0.12058293998861219,,,,,,,,,,,,,,Bayes,,,,,,,,,,,,,,,,,,,,,,COMPLETE
870,870,0.8631481481481481,2023-03-02 00:30:50.680501,2023-03-02 00:30:50.894623,0 days 00:00:00.214122,0.3256758170751223,0.6778075547940101,,,,,,,,,,,,,,Bayes,,,,,,,,,,,,,,,,,,,,,,COMPLETE
871,871,0.8690740740740741,2023-03-02 00:30:50.700504,2023-03-02 00:30:50.923773,0 days 00:00:00.223269,0.3474586244103745,0.11935374993031235,,,,,,,,,,,,,,Bayes,,,,,,,,,,,,,,,,,,,,,,COMPLETE
872,872,0.8688888888888888,2023-03-02 00:30:50.725504,2023-03-02 00:30:50.948771,0 days 00:00:00.223267,0.31519765851214676,0.1585250668731099,,,,,,,,,,,,,,Bayes,,,,,,,,,,,,,,,,,,,,,,COMPLETE
873,873,0.8690740740740741,2023-03-02 00:30:50.739408,2023-03-02 00:30:50.962771,0 days 00:00:00.223363,0.3154739383869185,0.1224081408661953,,,,,,,,,,,,,,Bayes,,,,,,,,,,,,,,,,,,,,,,COMPLETE
874,874,0.8690740740740741,2023-03-02 00:30:50.840821,2023-03-02 00:30:51.083018,0 days 00:00:00.242197,0.1492446045871191,0.03250846050815847,,,,,,,,,,,,,,Bayes,,,,,,,,,,,,,,,,,,,,,,COMPLETE
875,875,0.862962962962963,2023-03-02 00:30:50.847822,2023-03-02 00:30:51.057019,0 days 00:00:00.209197,0.07190948936317568,0.7476017269755708,,,,,,,,,,,,,,Bayes,,,,,,,,,,,,,,,,,,,,,,COMPLETE
876,876,0.8690740740740741,2023-03-02 00:30:50.879818,2023-03-02 00:30:51.085018,0 days 00:00:00.205200,0.8794208091732332,0.0296709220492912,,,,,,,,,,,,,,Bayes,,,,,,,,,,,,,,,,,,,,,,COMPLETE
877,877,0.8685185185185185,2023-03-02 00:30:50.899143,2023-03-02 00:30:51.143021,0 days 00:00:00.243878,0.06546454381628801,0.04214166701545451,,,,,,,,,,,,,,Bayes,,,,,,,,,,,,,,,,,,,,,,COMPLETE
878,878,0.8614814814814814,2023-03-02 00:30:50.926772,2023-03-02 00:30:51.280918,0 days 00:00:00.354146,0.757185546631589,0.906689531138511,,,,,,,,,,,,,,Bayes,,,,,,,,,,,,,,,,,,,,,,COMPLETE
879,879,0.8644444444444445,2023-03-02 00:30:50.953771,2023-03-02 00:30:51.309921,0 days 00:00:00.356150,0.14314808494787354,0.40528239616029993,,,,,,,,,,,,,,Bayes,,,,,,,,,,,,,,,,,,,,,,COMPLETE
880,880,0.867037037037037,2023-03-02 00:30:50.969773,2023-03-02 00:30:51.349918,0 days 00:00:00.380145,0.14346780717026708,0.22141559988064002,,,,,,,,,,,,,,Bayes,,,,,,,,,,,,,,,,,,,,,,COMPLETE
881,881,0.8679629629629629,2023-03-02 00:30:51.062019,2023-03-02 00:30:51.497919,0 days 00:00:00.435900,0.13516656439328217,0.061483918350460326,,,,,,,,,,,,,,Bayes,,,,,,,,,,,,,,,,,,,,,,COMPLETE
882,882,0.8371296296296297,2023-03-02 00:30:51.086020,2023-03-02 00:30:51.414919,0 days 00:00:00.328899,,,,,,,,,,,,,,,,kNN,,,,,,,,,,,,,,,,,kd_tree,214.0,33.0,476.0,uniform,COMPLETE
883,883,0.7424999999999999,2023-03-02 00:30:51.094018,2023-03-02 00:30:51.699436,0 days 00:00:00.605418,,,,,,,,,,,,,,,,kNN,,,,,,,,,,,,,,,,,kd_tree,202.0,387.0,470.0,uniform,COMPLETE
884,884,0.5,2023-03-02 00:30:51.151017,2023-03-02 00:30:51.559918,0 days 00:00:00.408901,,,,,,,,,,,,,,,,Tree,,,,,,,,,992.4946476712913,entropy,0.6810337253571902,964.3715330209947,0.4810895901128377,0.028309956539763204,0.06726628866250078,best,,,,,,COMPLETE
885,885,0.8603703703703703,2023-03-02 00:30:51.287919,2023-03-02 00:30:51.583921,0 days 00:00:00.296002,0.27686377455272543,0.9813597215293153,,,,,,,,,,,,,,Bayes,,,,,,,,,,,,,,,,,,,,,,COMPLETE
886,886,0.7308333333333333,2023-03-02 00:30:51.316919,2023-03-02 00:30:51.755087,0 days 00:00:00.438168,,,,,,,,,,,,,,,,kNN,,,,,,,,,,,,,,,,,kd_tree,212.0,380.0,489.0,uniform,COMPLETE
887,887,0.5,2023-03-02 00:30:51.362921,2023-03-02 00:30:51.606437,0 days 00:00:00.243516,,,,,,,,,,,,,,,,Tree,,,,,,,,,987.6643658765659,entropy,0.657672585147605,937.7867164104262,0.49067342469200637,0.7444821461297675,0.006065064482870031,best,,,,,,COMPLETE
888,888,0.8688888888888888,2023-03-02 00:30:51.419920,2023-03-02 00:30:51.643437,0 days 00:00:00.223517,0.3959948925807584,0.0860346751576282,,,,,,,,,,,,,,Bayes,,,,,,,,,,,,,,,,,,,,,,COMPLETE
889,889,0.5,2023-03-02 00:30:51.499921,2023-03-02 00:30:51.725438,0 days 00:00:00.225517,,,,,,,,,,,,,,,,Tree,,,,,,,,,397.109975168226,entropy,0.46777167669079234,226.60733652348017,0.11057307763989402,0.7448846295839529,0.014809144104160843,best,,,,,,COMPLETE
890,890,0.862962962962963,2023-03-02 00:30:51.562919,2023-03-02 00:30:51.769408,0 days 00:00:00.206489,0.27623839819430657,0.7550747409027903,,,,,,,,,,,,,,Bayes,,,,,,,,,,,,,,,,,,,,,,COMPLETE
891,891,0.8631481481481481,2023-03-02 00:30:51.585919,2023-03-02 00:30:51.809407,0 days 00:00:00.223488,0.29297522499832235,0.6816167325555198,,,,,,,,,,,,,,Bayes,,,,,,,,,,,,,,,,,,,,,,COMPLETE
892,892,0.8688888888888888,2023-03-02 00:30:51.609436,2023-03-02 00:30:51.827927,0 days 00:00:00.218491,0.37106639281526616,0.08553435302816757,,,,,,,,,,,,,,Bayes,,,,,,,,,,,,,,,,,,,,,,COMPLETE
893,893,0.8633333333333334,2023-03-02 00:30:51.645436,2023-03-02 00:30:51.871255,0 days 00:00:00.225819,0.09577218301695078,0.5747463288082335,,,,,,,,,,,,,,Bayes,,,,,,,,,,,,,,,,,,,,,,COMPLETE
894,894,0.8688888888888889,2023-03-02 00:30:51.703439,2023-03-02 00:30:51.911251,0 days 00:00:00.207812,0.796968376852871,0.08234960208796051,,,,,,,,,,,,,,Bayes,,,,,,,,,,,,,,,,,,,,,,COMPLETE
895,895,0.8646296296296296,2023-03-02 00:30:51.729436,2023-03-02 00:30:51.946253,0 days 00:00:00.216817,0.09300784330775136,0.3771768344672281,,,,,,,,,,,,,,Bayes,,,,,,,,,,,,,,,,,,,,,,COMPLETE
896,896,0.8664814814814815,2023-03-02 00:30:51.757761,2023-03-02 00:30:51.977252,0 days 00:00:00.219491,0.737809479675644,0.2417000705656295,,,,,,,,,,,,,,Bayes,,,,,,,,,,,,,,,,,,,,,,COMPLETE
897,897,0.8635185185185185,2023-03-02 00:30:51.775408,2023-03-02 00:30:51.981251,0 days 00:00:00.205843,0.09020645201928397,0.5397319661739877,,,,,,,,,,,,,,Bayes,,,,,,,,,,,,,,,,,,,,,,COMPLETE
898,898,0.8681481481481481,2023-03-02 00:30:51.813409,2023-03-02 00:30:52.035007,0 days 00:00:00.221598,0.24466868104796977,0.05645466048916437,,,,,,,,,,,,,,Bayes,,,,,,,,,,,,,,,,,,,,,,COMPLETE
899,899,0.8648148148148147,2023-03-02 00:30:51.830928,2023-03-02 00:30:52.036951,0 days 00:00:00.206023,0.09748513966671782,0.3822391768455525,,,,,,,,,,,,,,Bayes,,,,,,,,,,,,,,,,,,,,,,COMPLETE
900,900,0.8677777777777778,2023-03-02 00:30:51.875252,2023-03-02 00:30:52.100827,0 days 00:00:00.225575,0.2398193491929042,0.16012787775627974,,,,,,,,,,,,,,Bayes,,,,,,,,,,,,,,,,,,,,,,COMPLETE
901,901,0.8614814814814815,2023-03-02 00:30:51.913252,2023-03-02 00:30:52.128828,0 days 00:00:00.215576,0.23934305638517575,0.9411370783696735,,,,,,,,,,,,,,Bayes,,,,,,,,,,,,,,,,,,,,,,COMPLETE
902,902,0.864074074074074,2023-03-02 00:30:51.948251,2023-03-02 00:30:52.172394,0 days 00:00:00.224143,0.6261991785641549,0.4408360514217314,,,,,,,,,,,,,,Bayes,,,,,,,,,,,,,,,,,,,,,,COMPLETE
903,903,0.8633333333333333,2023-03-02 00:30:51.982252,2023-03-02 00:30:52.211395,0 days 00:00:00.229143,0.11632418902463346,0.7272947984620111,,,,,,,,,,,,,,Bayes,,,,,,,,,,,,,,,,,,,,,,COMPLETE
904,904,0.8635185185185186,2023-03-02 00:30:51.988387,2023-03-02 00:30:52.194395,0 days 00:00:00.206008,0.8334678960297852,0.7141125887888283,,,,,,,,,,,,,,Bayes,,,,,,,,,,,,,,,,,,,,,,COMPLETE
905,905,0.8692592592592594,2023-03-02 00:30:52.038952,2023-03-02 00:30:52.275043,0 days 00:00:00.236091,0.6334613880484079,0.11096158458514378,,,,,,,,,,,,,,Bayes,,,,,,,,,,,,,,,,,,,,,,COMPLETE
906,906,0.8624074074074074,2023-03-02 00:30:52.045952,2023-03-02 00:30:52.253029,0 days 00:00:00.207077,0.46081325947914537,0.8164644647696577,,,,,,,,,,,,,,Bayes,,,,,,,,,,,,,,,,,,,,,,COMPLETE
907,907,0.8664814814814815,2023-03-02 00:30:52.106829,2023-03-02 00:30:52.329044,0 days 00:00:00.222215,0.1146165202352332,0.2587602435959414,,,,,,,,,,,,,,Bayes,,,,,,,,,,,,,,,,,,,,,,COMPLETE
908,908,0.8635185185185185,2023-03-02 00:30:52.131827,2023-03-02 00:30:52.341044,0 days 00:00:00.209217,0.11633408208840679,0.5487122085374256,,,,,,,,,,,,,,Bayes,,,,,,,,,,,,,,,,,,,,,,COMPLETE
909,909,0.8666666666666666,2023-03-02 00:30:52.175396,2023-03-02 00:30:52.475564,0 days 00:00:00.300168,0.12345628994369495,0.30128877598000825,,,,,,,,,,,,,,Bayes,,,,,,,,,,,,,,,,,,,,,,COMPLETE
910,910,0.8681481481481481,2023-03-02 00:30:52.196395,2023-03-02 00:30:52.498565,0 days 00:00:00.302170,0.11630568312898888,0.06356544511802625,,,,,,,,,,,,,,Bayes,,,,,,,,,,,,,,,,,,,,,,COMPLETE
911,911,0.8627777777777778,2023-03-02 00:30:52.215394,2023-03-02 00:30:52.514564,0 days 00:00:00.299170,0.20577312956124946,0.6028299933953638,,,,,,,,,,,,,,Bayes,,,,,,,,,,,,,,,,,,,,,,COMPLETE
912,912,0.8679629629629629,2023-03-02 00:30:52.255674,2023-03-02 00:30:52.554564,0 days 00:00:00.298890,0.05756022454712516,0.06275517767994283,,,,,,,,,,,,,,Bayes,,,,,,,,,,,,,,,,,,,,,,COMPLETE
913,913,0.8685185185185185,2023-03-02 00:30:52.277043,2023-03-02 00:30:52.584565,0 days 00:00:00.307522,0.16487757727845417,0.06712521192940218,,,,,,,,,,,,,,Bayes,,,,,,,,,,,,,,,,,,,,,,COMPLETE
914,914,0.8635185185185186,2023-03-02 00:30:52.333043,2023-03-02 00:30:52.658565,0 days 00:00:00.325522,0.021363699712557326,0.7091549156516677,,,,,,,,,,,,,,Bayes,,,,,,,,,,,,,,,,,,,,,,COMPLETE
915,915,0.8694444444444445,2023-03-02 00:30:52.348043,2023-03-02 00:30:52.682564,0 days 00:00:00.334521,0.527124973811073,0.09515681685850022,,,,,,,,,,,,,,Bayes,,,,,,,,,,,,,,,,,,,,,,COMPLETE
916,916,0.8692592592592593,2023-03-02 00:30:52.478566,2023-03-02 00:30:52.718564,0 days 00:00:00.239998,0.020519206958597616,0.09633914151962591,,,,,,,,,,,,,,Bayes,,,,,,,,,,,,,,,,,,,,,,COMPLETE
917,917,0.8614814814814814,2023-03-02 00:30:52.501565,2023-03-02 00:30:52.763547,0 days 00:00:00.261982,0.5811697230344006,0.8965912027794536,,,,,,,,,,,,,,Bayes,,,,,,,,,,,,,,,,,,,,,,COMPLETE
918,918,0.8692592592592593,2023-03-02 00:30:52.516565,2023-03-02 00:30:52.781317,0 days 00:00:00.264752,0.16637243212749014,0.09734239527246463,,,,,,,,,,,,,,Bayes,,,,,,,,,,,,,,,,,,,,,,COMPLETE
919,919,0.7525,2023-03-02 00:30:52.556566,2023-03-02 00:30:52.728565,0 days 00:00:00.171999,,,,,,,,,,,,,,,,SVM,30.11780825978868,,ovr,,auto,rbf,False,0.020351267869294032,,,,,,,,,,,,,,COMPLETE
920,920,0.7596296296296295,2023-03-02 00:30:52.586563,2023-03-02 00:30:52.753565,0 days 00:00:00.167002,,,,,,,,,,,,,,,,SVM,25.527433412002328,,ovr,,auto,rbf,False,0.8869976630786127,,,,,,,,,,,,,,COMPLETE
921,921,0.8692592592592592,2023-03-02 00:30:52.663566,2023-03-02 00:30:52.883317,0 days 00:00:00.219751,0.5021217138185217,0.12319060797611868,,,,,,,,,,,,,,Bayes,,,,,,,,,,,,,,,,,,,,,,COMPLETE
922,922,0.8633333333333333,2023-03-02 00:30:52.687564,2023-03-02 00:30:52.893319,0 days 00:00:00.205755,0.3233961839125191,0.4819715471430563,,,,,,,,,,,,,,Bayes,,,,,,,,,,,,,,,,,,,,,,COMPLETE
923,923,0.8651851851851852,2023-03-02 00:30:52.720565,2023-03-02 00:30:52.936317,0 days 00:00:00.215752,0.329754012891092,0.34428078864793565,,,,,,,,,,,,,,Bayes,,,,,,,,,,,,,,,,,,,,,,COMPLETE
924,924,0.8640740740740741,2023-03-02 00:30:52.735567,2023-03-02 00:30:52.935316,0 days 00:00:00.199749,0.3344477919582236,0.41331968266200514,,,,,,,,,,,,,,Bayes,,,,,,,,,,,,,,,,,,,,,,COMPLETE
925,925,0.8688888888888889,2023-03-02 00:30:52.758295,2023-03-02 00:30:52.965317,0 days 00:00:00.207022,0.3005927775420427,0.1372171044990589,,,,,,,,,,,,,,Bayes,,,,,,,,,,,,,,,,,,,,,,COMPLETE
926,926,0.8690740740740741,2023-03-02 00:30:52.775318,2023-03-02 00:30:52.959317,0 days 00:00:00.183999,0.3311844502474616,0.14139218883167656,,,,,,,,,,,,,,Bayes,,,,,,,,,,,,,,,,,,,,,,COMPLETE
927,927,0.8644444444444443,2023-03-02 00:30:52.792316,2023-03-02 00:30:52.983318,0 days 00:00:00.191002,0.7750074914391828,0.4175609135723057,,,,,,,,,,,,,,Bayes,,,,,,,,,,,,,,,,,,,,,,COMPLETE
