,number,value,datetime_start,datetime_complete,duration,params_Bayes_prior_positive,params_Bayes_var_smoothing,params_GB_ccp_alpha,params_GB_criterion,params_GB_learning_rate,params_GB_loss,params_GB_max_depth,params_GB_max_features,params_GB_min_impurity_decrease,params_GB_min_samples_leaf,params_GB_min_samples_split,params_GB_n_estimators,params_GB_subsample,params_GB_tol,params_GB_validation_fraction,params_Method,params_SVM_C,params_SVM_coef0,params_SVM_decision_function_shape,params_SVM_degree,params_SVM_gamma,params_SVM_kernel,params_SVM_shrinking,params_SVM_tol,params_Tree_ccp_alpha,params_Tree_criterion,params_Tree_max_features,params_Tree_min_impurity_decrease,params_Tree_min_samples_leaf,params_Tree_min_samples_split,params_Tree_min_weight_fraction_leaf,params_Tree_splitter,params_kNN_algorithm,params_kNN_leaf_size,params_kNN_n_neighbors,params_kNN_p,params_kNN_weights,state
1754,1754,0.755,2023-03-02 00:31:43.075731,2023-03-02 00:31:43.293731,0 days 00:00:00.218000,,,,,,,,,,,,,,,,SVM,22.711132739883006,,ovo,,scale,rbf,True,0.5600021180059536,,,,,,,,,,,,,,COMPLETE
1755,1755,0.7527777777777778,2023-03-02 00:31:43.091731,2023-03-02 00:31:43.345731,0 days 00:00:00.254000,,,,,,,,,,,,,,,,SVM,23.967314891662625,,ovo,,scale,rbf,True,0.24131487225755904,,,,,,,,,,,,,,COMPLETE
1756,1756,0.8618518518518519,2023-03-02 00:31:43.253731,2023-03-02 00:31:43.681614,0 days 00:00:00.427883,0.21545885625453828,0.8339316965217414,,,,,,,,,,,,,,Bayes,,,,,,,,,,,,,,,,,,,,,,COMPLETE
1757,1757,0.5,2023-03-02 00:31:43.278729,2023-03-02 00:31:43.587614,0 days 00:00:00.308885,,,,,,,,,,,,,,,,SVM,71.4179752896955,84.50312112568842,ovr,67.0,auto,poly,False,0.5156675868072247,,,,,,,,,,,,,,COMPLETE
1758,1758,0.8607407407407407,2023-03-02 00:31:43.298730,2023-03-02 00:31:43.682616,0 days 00:00:00.383886,0.18666435708106804,0.9784478387994826,,,,,,,,,,,,,,Bayes,,,,,,,,,,,,,,,,,,,,,,COMPLETE
1759,1759,0.8688888888888888,2023-03-02 00:31:43.347729,2023-03-02 00:31:43.741614,0 days 00:00:00.393885,0.568962740773022,0.07435811775942601,,,,,,,,,,,,,,Bayes,,,,,,,,,,,,,,,,,,,,,,COMPLETE
1760,1760,0.862962962962963,2023-03-02 00:31:43.367728,2023-03-02 00:31:43.742614,0 days 00:00:00.374886,0.235801999655052,0.7699069012029189,,,,,,,,,,,,,,Bayes,,,,,,,,,,,,,,,,,,,,,,COMPLETE
1761,1761,0.8601851851851852,2023-03-02 00:31:43.508729,2023-03-02 00:31:43.800617,0 days 00:00:00.291888,0.21736018402969343,0.9853140454395275,,,,,,,,,,,,,,Bayes,,,,,,,,,,,,,,,,,,,,,,COMPLETE
1762,1762,0.8688888888888888,2023-03-02 00:31:43.590614,2023-03-02 00:31:43.857613,0 days 00:00:00.266999,0.1816538971546292,0.0732945771175166,,,,,,,,,,,,,,Bayes,,,,,,,,,,,,,,,,,,,,,,COMPLETE
1763,1763,0.8683333333333333,2023-03-02 00:31:43.684615,2023-03-02 00:31:43.950616,0 days 00:00:00.266001,0.11653752805257594,0.06450879458158773,,,,,,,,,,,,,,Bayes,,,,,,,,,,,,,,,,,,,,,,COMPLETE
1764,1764,0.8601851851851852,2023-03-02 00:31:43.699617,2023-03-02 00:31:43.964614,0 days 00:00:00.264997,0.5661062603489841,0.9987165272985408,,,,,,,,,,,,,,Bayes,,,,,,,,,,,,,,,,,,,,,,COMPLETE
1765,1765,0.8644444444444445,2023-03-02 00:31:43.746615,2023-03-02 00:31:44.105421,0 days 00:00:00.358806,0.6268824628351997,0.3896368029688793,,,,,,,,,,,,,,Bayes,,,,,,,,,,,,,,,,,,,,,,COMPLETE
1766,1766,0.8648148148148149,2023-03-02 00:31:43.759615,2023-03-02 00:31:44.135421,0 days 00:00:00.375806,0.10587689517473584,0.36841559859529927,,,,,,,,,,,,,,Bayes,,,,,,,,,,,,,,,,,,,,,,COMPLETE
1767,1767,0.8633333333333334,2023-03-02 00:31:43.802614,2023-03-02 00:31:44.171422,0 days 00:00:00.368808,0.6322753721270573,0.568979782884139,,,,,,,,,,,,,,Bayes,,,,,,,,,,,,,,,,,,,,,,COMPLETE
1768,1768,0.8631481481481482,2023-03-02 00:31:43.862614,2023-03-02 00:31:44.229421,0 days 00:00:00.366807,0.8018031980063792,0.5787722057228306,,,,,,,,,,,,,,Bayes,,,,,,,,,,,,,,,,,,,,,,COMPLETE
1769,1769,0.8692592592592593,2023-03-02 00:31:43.954615,2023-03-02 00:31:44.314422,0 days 00:00:00.359807,0.4324871314038207,0.09404555200400237,,,,,,,,,,,,,,Bayes,,,,,,,,,,,,,,,,,,,,,,COMPLETE
1770,1770,0.8681481481481481,2023-03-02 00:31:44.063423,2023-03-02 00:31:44.313421,0 days 00:00:00.249998,0.32678890757411433,0.19913577577871272,,,,,,,,,,,,,,Bayes,,,,,,,,,,,,,,,,,,,,,,COMPLETE
1771,1771,0.8631481481481481,2023-03-02 00:31:44.107421,2023-03-02 00:31:44.385937,0 days 00:00:00.278516,0.42987659339755424,0.675007663782871,,,,,,,,,,,,,,Bayes,,,,,,,,,,,,,,,,,,,,,,COMPLETE
1772,1772,0.8638888888888889,2023-03-02 00:31:44.140424,2023-03-02 00:31:44.416936,0 days 00:00:00.276512,0.28283076154467823,0.4528715127981909,,,,,,,,,,,,,,Bayes,,,,,,,,,,,,,,,,,,,,,,COMPLETE
1773,1773,0.866111111111111,2023-03-02 00:31:44.174423,2023-03-02 00:31:44.448504,0 days 00:00:00.274081,0.9576152718364584,0.32940972434819804,,,,,,,,,,,,,,Bayes,,,,,,,,,,,,,,,,,,,,,,COMPLETE
1774,1774,0.8664814814814815,2023-03-02 00:31:44.231422,2023-03-02 00:31:44.512504,0 days 00:00:00.281082,0.3231262025310476,0.3213391456347385,,,,,,,,,,,,,,Bayes,,,,,,,,,,,,,,,,,,,,,,COMPLETE
1775,1775,0.8648148148148148,2023-03-02 00:31:44.316422,2023-03-02 00:31:44.708223,0 days 00:00:00.391801,0.9995019922499954,0.35385974077655963,,,,,,,,,,,,,,Bayes,,,,,,,,,,,,,,,,,,,,,,COMPLETE
1776,1776,0.8688888888888889,2023-03-02 00:31:44.328422,2023-03-02 00:31:44.724237,0 days 00:00:00.395815,0.7698323511763493,0.1404870618674225,,,,,,,,,,,,,,Bayes,,,,,,,,,,,,,,,,,,,,,,COMPLETE
1777,1777,0.8688888888888889,2023-03-02 00:31:44.387936,2023-03-02 00:31:44.780237,0 days 00:00:00.392301,0.6810868840106874,0.13613303507214586,,,,,,,,,,,,,,Bayes,,,,,,,,,,,,,,,,,,,,,,COMPLETE
1778,1778,0.8688888888888889,2023-03-02 00:31:44.420511,2023-03-02 00:31:44.821238,0 days 00:00:00.400727,0.0005225343712662693,0.14082562164412382,,,,,,,,,,,,,,Bayes,,,,,,,,,,,,,,,,,,,,,,COMPLETE
1779,1779,0.8629629629629629,2023-03-02 00:31:44.451506,2023-03-02 00:31:44.820238,0 days 00:00:00.368732,0.15765437661848586,0.6361976176250594,,,,,,,,,,,,,,Bayes,,,,,,,,,,,,,,,,,,,,,,COMPLETE
1780,1780,0.8618518518518519,2023-03-02 00:31:44.515505,2023-03-02 00:31:44.926237,0 days 00:00:00.410732,0.35752810598059975,0.8392880915794385,,,,,,,,,,,,,,Bayes,,,,,,,,,,,,,,,,,,,,,,COMPLETE
1781,1781,0.862962962962963,2023-03-02 00:31:44.574199,2023-03-02 00:31:45.003237,0 days 00:00:00.429038,0.4540114049168563,0.7602881619229995,,,,,,,,,,,,,,Bayes,,,,,,,,,,,,,,,,,,,,,,COMPLETE
1782,1782,0.8635185185185185,2023-03-02 00:31:44.712222,2023-03-02 00:31:45.043253,0 days 00:00:00.331031,0.025915722027954405,0.5423323997306366,,,,,,,,,,,,,,Bayes,,,,,,,,,,,,,,,,,,,,,,COMPLETE
1783,1783,0.8692592592592593,2023-03-02 00:31:44.732238,2023-03-02 00:31:45.044251,0 days 00:00:00.312013,0.36557960804177875,0.09615147793246101,,,,,,,,,,,,,,Bayes,,,,,,,,,,,,,,,,,,,,,,COMPLETE
1784,1784,0.8690740740740741,2023-03-02 00:31:44.783236,2023-03-02 00:31:45.115325,0 days 00:00:00.332089,0.5980271086499237,0.02881071698404894,,,,,,,,,,,,,,Bayes,,,,,,,,,,,,,,,,,,,,,,COMPLETE
1785,1785,0.8629629629629629,2023-03-02 00:31:44.823237,2023-03-02 00:31:45.293846,0 days 00:00:00.470609,0.4496267892739485,0.5960973977547263,,,,,,,,,,,,,,Bayes,,,,,,,,,,,,,,,,,,,,,,COMPLETE
1786,1786,0.8666666666666666,2023-03-02 00:31:44.836238,2023-03-02 00:31:45.425845,0 days 00:00:00.589607,0.44788795736789644,0.28243183653025905,,,,,,,,,,,,,,Bayes,,,,,,,,,,,,,,,,,,,,,,COMPLETE
1787,1787,0.8677777777777778,2023-03-02 00:31:44.928237,2023-03-02 00:31:45.599554,0 days 00:00:00.671317,0.02641833201739727,0.1670879648058397,,,,,,,,,,,,,,Bayes,,,,,,,,,,,,,,,,,,,,,,COMPLETE
1788,1788,0.8685185185185185,2023-03-02 00:31:45.006239,2023-03-02 00:31:45.637556,0 days 00:00:00.631317,0.02861057272282754,0.069384205165019,,,,,,,,,,,,,,Bayes,,,,,,,,,,,,,,,,,,,,,,COMPLETE
1789,1789,0.8342592592592593,2023-03-02 00:31:45.047252,2023-03-02 00:31:45.696556,0 days 00:00:00.649304,,,,,,,,,,,,,,,,kNN,,,,,,,,,,,,,,,,,brute,70.0,178.0,457.0,uniform,COMPLETE
1790,1790,0.6287962962962964,2023-03-02 00:31:45.060877,2023-03-02 00:31:45.987577,0 days 00:00:00.926700,,,,,,,,,,,,,,,,kNN,,,,,,,,,,,,,,,,,brute,442.0,430.0,457.0,uniform,COMPLETE
1791,1791,0.8375925925925926,2023-03-02 00:31:45.137318,2023-03-02 00:31:45.637556,0 days 00:00:00.500238,,,,,,,,,,,,,,,,kNN,,,,,,,,,,,,,,,,,brute,447.0,179.0,751.0,uniform,COMPLETE
1792,1792,0.8228703703703704,2023-03-02 00:31:45.304844,2023-03-02 00:31:45.924935,0 days 00:00:00.620091,,,,,,,,,,,,,,,,kNN,,,,,,,,,,,,,,,,,brute,441.0,269.0,586.0,uniform,COMPLETE
1793,1793,0.8383333333333334,2023-03-02 00:31:45.434845,2023-03-02 00:31:45.765555,0 days 00:00:00.330710,,,,,,,,,,,,,,,,kNN,,,,,,,,,,,,,,,,,brute,439.0,175.0,873.0,uniform,COMPLETE
1794,1794,0.8690740740740741,2023-03-02 00:31:45.602555,2023-03-02 00:31:45.969936,0 days 00:00:00.367381,0.3007550078643829,0.1012529074993217,,,,,,,,,,,,,,Bayes,,,,,,,,,,,,,,,,,,,,,,COMPLETE
1795,1795,0.8631481481481482,2023-03-02 00:31:45.640556,2023-03-02 00:31:46.032575,0 days 00:00:00.392019,0.8693281601679199,0.7444126506665429,,,,,,,,,,,,,,Bayes,,,,,,,,,,,,,,,,,,,,,,COMPLETE
1796,1796,0.8690740740740741,2023-03-02 00:31:45.652556,2023-03-02 00:31:46.039573,0 days 00:00:00.387017,0.30113056871387367,0.10145241583821331,,,,,,,,,,,,,,Bayes,,,,,,,,,,,,,,,,,,,,,,COMPLETE
1797,1797,0.8614814814814815,2023-03-02 00:31:45.698557,2023-03-02 00:31:46.138289,0 days 00:00:00.439732,0.3961240726454156,0.9422428373011725,,,,,,,,,,,,,,Bayes,,,,,,,,,,,,,,,,,,,,,,COMPLETE
1798,1798,0.8685185185185185,2023-03-02 00:31:45.780119,2023-03-02 00:31:46.277292,0 days 00:00:00.497173,0.4000810740467273,0.04203234338926541,,,,,,,,,,,,,,Bayes,,,,,,,,,,,,,,,,,,,,,,COMPLETE
1799,1799,0.867037037037037,2023-03-02 00:31:45.927935,2023-03-02 00:31:46.471289,0 days 00:00:00.543354,0.30941201295913445,0.22797206631927935,,,,,,,,,,,,,,Bayes,,,,,,,,,,,,,,,,,,,,,,COMPLETE
1800,1800,0.8683333333333334,2023-03-02 00:31:45.972936,2023-03-02 00:31:46.542289,0 days 00:00:00.569353,0.40707647976350114,0.047955151586502674,,,,,,,,,,,,,,Bayes,,,,,,,,,,,,,,,,,,,,,,COMPLETE
1801,1801,0.5,2023-03-02 00:31:46.013574,2023-03-02 00:31:46.575288,0 days 00:00:00.561714,,,,,,,,,,,,,,,,Tree,,,,,,,,,695.2735631434841,gini,0.09321897631110487,347.69584989103953,0.12667344174087353,0.8900343729265302,0.05686687020477471,random,,,,,,COMPLETE
1802,1802,0.5,2023-03-02 00:31:46.047574,2023-03-02 00:31:46.633493,0 days 00:00:00.585919,,,,,,,,,,,,,,,,Tree,,,,,,,,,34.01241585367808,gini,0.10393998245210523,74.8944160961085,0.34309091222579446,0.5799072525410097,0.05586479651143189,random,,,,,,COMPLETE
1803,1803,0.8690740740740741,2023-03-02 00:31:46.070574,2023-03-02 00:31:46.648491,0 days 00:00:00.577917,0.05475775931801848,0.08706910543007726,,,,,,,,,,,,,,Bayes,,,,,,,,,,,,,,,,,,,,,,COMPLETE
1804,1804,0.8688888888888889,2023-03-02 00:31:46.126287,2023-03-02 00:31:46.708494,0 days 00:00:00.582207,0.056591510143447946,0.08214500176399238,,,,,,,,,,,,,,Bayes,,,,,,,,,,,,,,,,,,,,,,COMPLETE
1805,1805,0.5,2023-03-02 00:31:46.140288,2023-03-02 00:31:46.690491,0 days 00:00:00.550203,,,,,,,,,,,,,,,,Tree,,,,,,,,,545.7269337212928,gini,0.24592636077867314,73.23914841092284,0.21083659806184393,0.13988398703377036,0.2726905867143555,random,,,,,,COMPLETE
1806,1806,0.8635185185185185,2023-03-02 00:31:46.283288,2023-03-02 00:31:46.803492,0 days 00:00:00.520204,0.13140432604755595,0.5429549097586185,,,,,,,,,,,,,,Bayes,,,,,,,,,,,,,,,,,,,,,,COMPLETE
1807,1807,0.864074074074074,2023-03-02 00:31:46.474289,2023-03-02 00:31:46.980491,0 days 00:00:00.506202,0.04976087171932658,0.468342537233892,,,,,,,,,,,,,,Bayes,,,,,,,,,,,,,,,,,,,,,,COMPLETE
1808,1808,0.862962962962963,2023-03-02 00:31:46.547291,2023-03-02 00:31:47.031102,0 days 00:00:00.483811,0.05640727605630277,0.7725306322210356,,,,,,,,,,,,,,Bayes,,,,,,,,,,,,,,,,,,,,,,COMPLETE
1809,1809,0.8690740740740741,2023-03-02 00:31:46.585289,2023-03-02 00:31:47.028102,0 days 00:00:00.442813,0.5036906084943203,0.11449473250911855,,,,,,,,,,,,,,Bayes,,,,,,,,,,,,,,,,,,,,,,COMPLETE
1810,1810,0.8692592592592594,2023-03-02 00:31:46.635620,2023-03-02 00:31:47.102910,0 days 00:00:00.467290,0.2433903493521171,0.1102344626703567,,,,,,,,,,,,,,Bayes,,,,,,,,,,,,,,,,,,,,,,COMPLETE
1811,1811,0.8692592592592594,2023-03-02 00:31:46.650491,2023-03-02 00:31:47.170620,0 days 00:00:00.520129,0.33658716969814717,0.11042047676330553,,,,,,,,,,,,,,Bayes,,,,,,,,,,,,,,,,,,,,,,COMPLETE
1812,1812,0.8644444444444443,2023-03-02 00:31:46.696494,2023-03-02 00:31:47.173620,0 days 00:00:00.477126,0.5251210400666942,0.4189275388987764,,,,,,,,,,,,,,Bayes,,,,,,,,,,,,,,,,,,,,,,COMPLETE
1813,1813,0.8635185185185186,2023-03-02 00:31:46.711491,2023-03-02 00:31:47.146621,0 days 00:00:00.435130,0.13792916130780625,0.7125506476774506,,,,,,,,,,,,,,Bayes,,,,,,,,,,,,,,,,,,,,,,COMPLETE
1814,1814,0.865,2023-03-02 00:31:46.806491,2023-03-02 00:31:47.292620,0 days 00:00:00.486129,0.19452978146738986,0.3607864223959374,,,,,,,,,,,,,,Bayes,,,,,,,,,,,,,,,,,,,,,,COMPLETE
1815,1815,0.8683333333333333,2023-03-02 00:31:46.983491,2023-03-02 00:31:47.334620,0 days 00:00:00.351129,0.23880366481368634,0.06514162879689347,,,,,,,,,,,,,,Bayes,,,,,,,,,,,,,,,,,,,,,,COMPLETE
1816,1816,0.8646296296296296,2023-03-02 00:31:47.032102,2023-03-02 00:31:47.500226,0 days 00:00:00.468124,0.27975925059851203,0.3764308754934148,,,,,,,,,,,,,,Bayes,,,,,,,,,,,,,,,,,,,,,,COMPLETE
1817,1817,0.8685185185185185,2023-03-02 00:31:47.045104,2023-03-02 00:31:47.502225,0 days 00:00:00.457121,0.24333369956376272,0.07059771375639051,,,,,,,,,,,,,,Bayes,,,,,,,,,,,,,,,,,,,,,,COMPLETE
1818,1818,0.867962962962963,2023-03-02 00:31:47.105910,2023-03-02 00:31:47.543225,0 days 00:00:00.437315,0.2833991294100861,0.21028041602526892,,,,,,,,,,,,,,Bayes,,,,,,,,,,,,,,,,,,,,,,COMPLETE
1819,1819,0.8668518518518519,2023-03-02 00:31:47.159621,2023-03-02 00:31:47.662607,0 days 00:00:00.502986,0.2838210292092477,0.2932017535105318,,,,,,,,,,,,,,Bayes,,,,,,,,,,,,,,,,,,,,,,COMPLETE
1820,1820,0.8690740740740741,2023-03-02 00:31:47.176620,2023-03-02 00:31:47.608930,0 days 00:00:00.432310,0.10810649584538534,0.0202510362647573,,,,,,,,,,,,,,Bayes,,,,,,,,,,,,,,,,,,,,,,COMPLETE
1821,1821,0.867962962962963,2023-03-02 00:31:47.191622,2023-03-02 00:31:47.625080,0 days 00:00:00.433458,0.10877892557164724,0.20279090562239077,,,,,,,,,,,,,,Bayes,,,,,,,,,,,,,,,,,,,,,,COMPLETE
1822,1822,0.8690740740740741,2023-03-02 00:31:47.298620,2023-03-02 00:31:47.748610,0 days 00:00:00.449990,0.279714278032919,0.01829832605203957,,,,,,,,,,,,,,Bayes,,,,,,,,,,,,,,,,,,,,,,COMPLETE
1823,1823,0.8694444444444445,2023-03-02 00:31:47.365621,2023-03-02 00:31:47.824608,0 days 00:00:00.458987,0.10676645133799459,0.08913928837882626,,,,,,,,,,,,,,Bayes,,,,,,,,,,,,,,,,,,,,,,COMPLETE
1824,1824,0.8694444444444445,2023-03-02 00:31:47.504224,2023-03-02 00:31:47.884608,0 days 00:00:00.380384,0.096695431788167,0.0895101637331362,,,,,,,,,,,,,,Bayes,,,,,,,,,,,,,,,,,,,,,,COMPLETE
1825,1825,0.8688888888888888,2023-03-02 00:31:47.520226,2023-03-02 00:31:47.915610,0 days 00:00:00.395384,0.1674956007667593,0.15571561105052456,,,,,,,,,,,,,,Bayes,,,,,,,,,,,,,,,,,,,,,,COMPLETE
1826,1826,0.8677777777777778,2023-03-02 00:31:47.564224,2023-03-02 00:31:47.959607,0 days 00:00:00.395383,0.10920000067033915,0.16210790931436064,,,,,,,,,,,,,,Bayes,,,,,,,,,,,,,,,,,,,,,,COMPLETE
1827,1827,0.8618518518518519,2023-03-02 00:31:47.611931,2023-03-02 00:31:48.085621,0 days 00:00:00.473690,0.9901965110496078,0.8743661802670979,,,,,,,,,,,,,,Bayes,,,,,,,,,,,,,,,,,,,,,,COMPLETE
1828,1828,0.8631481481481482,2023-03-02 00:31:47.628801,2023-03-02 00:31:48.141308,0 days 00:00:00.512507,0.1570821682624235,0.5233913131384573,,,,,,,,,,,,,,Bayes,,,,,,,,,,,,,,,,,,,,,,COMPLETE
1829,1829,0.8690740740740741,2023-03-02 00:31:47.679610,2023-03-02 00:31:48.115618,0 days 00:00:00.436008,0.16371777553881126,0.1295189005397434,,,,,,,,,,,,,,Bayes,,,,,,,,,,,,,,,,,,,,,,COMPLETE
1830,1830,0.8688888888888889,2023-03-02 00:31:47.761608,2023-03-02 00:31:48.224781,0 days 00:00:00.463173,0.16300880091606734,0.13403848717056863,,,,,,,,,,,,,,Bayes,,,,,,,,,,,,,,,,,,,,,,COMPLETE
1831,1831,0.8690740740740741,2023-03-02 00:31:47.837608,2023-03-02 00:31:48.300778,0 days 00:00:00.463170,0.17557341454235825,0.0006631386251244181,,,,,,,,,,,,,,Bayes,,,,,,,,,,,,,,,,,,,,,,COMPLETE
1832,1832,0.8681481481481481,2023-03-02 00:31:47.886608,2023-03-02 00:31:48.357778,0 days 00:00:00.471170,0.2188119186600398,0.05568942571344333,,,,,,,,,,,,,,Bayes,,,,,,,,,,,,,,,,,,,,,,COMPLETE
1833,1833,0.8681481481481481,2023-03-02 00:31:47.920609,2023-03-02 00:31:48.399778,0 days 00:00:00.479169,0.9650983595703077,0.055977903960247925,,,,,,,,,,,,,,Bayes,,,,,,,,,,,,,,,,,,,,,,COMPLETE
1834,1834,0.8681481481481481,2023-03-02 00:31:47.963607,2023-03-02 00:31:48.436779,0 days 00:00:00.473172,0.2113615074741223,0.05556297698831888,,,,,,,,,,,,,,Bayes,,,,,,,,,,,,,,,,,,,,,,COMPLETE
1835,1835,0.8685185185185185,2023-03-02 00:31:48.090621,2023-03-02 00:31:48.473778,0 days 00:00:00.383157,0.5852549694698036,0.06988338662289564,,,,,,,,,,,,,,Bayes,,,,,,,,,,,,,,,,,,,,,,COMPLETE
1836,1836,0.8681481481481481,2023-03-02 00:31:48.128619,2023-03-02 00:31:48.520778,0 days 00:00:00.392159,0.8370008023772121,0.055250707087342414,,,,,,,,,,,,,,Bayes,,,,,,,,,,,,,,,,,,,,,,COMPLETE
1837,1837,0.8681481481481481,2023-03-02 00:31:48.149206,2023-03-02 00:31:48.515777,0 days 00:00:00.366571,0.8386891000045275,0.05481544298270932,,,,,,,,,,,,,,Bayes,,,,,,,,,,,,,,,,,,,,,,COMPLETE
1838,1838,0.8685185185185185,2023-03-02 00:31:48.226780,2023-03-02 00:31:48.691706,0 days 00:00:00.464926,0.07857106368582595,0.07025658645379859,,,,,,,,,,,,,,Bayes,,,,,,,,,,,,,,,,,,,,,,COMPLETE
1839,1839,0.862962962962963,2023-03-02 00:31:48.303778,2023-03-02 00:31:48.767733,0 days 00:00:00.463955,0.22081766289694588,0.7597878203291042,,,,,,,,,,,,,,Bayes,,,,,,,,,,,,,,,,,,,,,,COMPLETE
1840,1840,0.8629629629629629,2023-03-02 00:31:48.371777,2023-03-02 00:31:48.859732,0 days 00:00:00.487955,0.3397060865685137,0.629357409995747,,,,,,,,,,,,,,Bayes,,,,,,,,,,,,,,,,,,,,,,COMPLETE
1841,1841,0.8692592592592593,2023-03-02 00:31:48.402778,2023-03-02 00:31:48.874732,0 days 00:00:00.471954,0.5382518713965732,0.10622647818761108,,,,,,,,,,,,,,Bayes,,,,,,,,,,,,,,,,,,,,,,COMPLETE
1842,1842,0.8694444444444445,2023-03-02 00:31:48.441778,2023-03-02 00:31:48.890732,0 days 00:00:00.448954,0.07873098750488036,0.0953956742844272,,,,,,,,,,,,,,Bayes,,,,,,,,,,,,,,,,,,,,,,COMPLETE
1843,1843,0.8690740740740741,2023-03-02 00:31:48.476780,2023-03-02 00:31:48.968734,0 days 00:00:00.491954,0.8298483017587289,0.10455932599407983,,,,,,,,,,,,,,Bayes,,,,,,,,,,,,,,,,,,,,,,COMPLETE
1844,1844,0.8690740740740741,2023-03-02 00:31:48.523778,2023-03-02 00:31:48.986733,0 days 00:00:00.462955,0.769849443894287,0.10301838150647792,,,,,,,,,,,,,,Bayes,,,,,,,,,,,,,,,,,,,,,,COMPLETE
1845,1845,0.8694444444444445,2023-03-02 00:31:48.623779,2023-03-02 00:31:49.015732,0 days 00:00:00.391953,0.07436173601345689,0.10742407307496937,,,,,,,,,,,,,,Bayes,,,,,,,,,,,,,,,,,,,,,,COMPLETE
1846,1846,0.8664814814814815,2023-03-02 00:31:48.694707,2023-03-02 00:31:49.084255,0 days 00:00:00.389548,0.3235623200323032,0.25726254110455143,,,,,,,,,,,,,,Bayes,,,,,,,,,,,,,,,,,,,,,,COMPLETE
1847,1847,0.8662962962962963,2023-03-02 00:31:48.772735,2023-03-02 00:31:49.234835,0 days 00:00:00.462100,0.35818425888463995,0.2652876726602026,,,,,,,,,,,,,,Bayes,,,,,,,,,,,,,,,,,,,,,,COMPLETE
1848,1848,0.8675925925925927,2023-03-02 00:31:48.863734,2023-03-02 00:31:49.336836,0 days 00:00:00.473102,0.2616038081129344,0.1829446720522528,,,,,,,,,,,,,,Bayes,,,,,,,,,,,,,,,,,,,,,,COMPLETE
1849,1849,0.8644444444444443,2023-03-02 00:31:48.877732,2023-03-02 00:31:49.392835,0 days 00:00:00.515103,0.3795412035700535,0.43090878344801786,,,,,,,,,,,,,,Bayes,,,,,,,,,,,,,,,,,,,,,,COMPLETE
1850,1850,0.8642592592592593,2023-03-02 00:31:48.903733,2023-03-02 00:31:49.321838,0 days 00:00:00.418105,0.3620024593068861,0.4361961644585573,,,,,,,,,,,,,,Bayes,,,,,,,,,,,,,,,,,,,,,,COMPLETE
1851,1851,0.8635185185185185,2023-03-02 00:31:48.973734,2023-03-02 00:31:49.453848,0 days 00:00:00.480114,0.35810998402745076,0.5521149561231447,,,,,,,,,,,,,,Bayes,,,,,,,,,,,,,,,,,,,,,,COMPLETE
1852,1852,0.8688888888888889,2023-03-02 00:31:48.992735,2023-03-02 00:31:49.451845,0 days 00:00:00.459110,0.3564046665848448,0.13272476732944194,,,,,,,,,,,,,,Bayes,,,,,,,,,,,,,,,,,,,,,,COMPLETE
1853,1853,0.8631481481481482,2023-03-02 00:31:49.018733,2023-03-02 00:31:49.454848,0 days 00:00:00.436115,0.3548185478959246,0.5179226667821623,,,,,,,,,,,,,,Bayes,,,,,,,,,,,,,,,,,,,,,,COMPLETE
1854,1854,0.8618518518518519,2023-03-02 00:31:49.088254,2023-03-02 00:31:49.700894,0 days 00:00:00.612640,0.372698316419963,0.8554666775426736,,,,,,,,,,,,,,Bayes,,,,,,,,,,,,,,,,,,,,,,COMPLETE
1855,1855,0.8688888888888889,2023-03-02 00:31:49.236837,2023-03-02 00:31:49.739893,0 days 00:00:00.503056,0.6401968222704456,0.1328692729654351,,,,,,,,,,,,,,Bayes,,,,,,,,,,,,,,,,,,,,,,COMPLETE
1856,1856,0.8611111111111112,2023-03-02 00:31:49.325837,2023-03-02 00:31:49.860900,0 days 00:00:00.535063,0.0008966784602859393,0.959463816407551,,,,,,,,,,,,,,Bayes,,,,,,,,,,,,,,,,,,,,,,COMPLETE
1857,1857,0.8688888888888888,2023-03-02 00:31:49.339836,2023-03-02 00:31:49.933918,0 days 00:00:00.594082,0.7257993666131402,0.08316850841985719,,,,,,,,,,,,,,Bayes,,,,,,,,,,,,,,,,,,,,,,COMPLETE
1858,1858,0.8618518518518519,2023-03-02 00:31:49.397835,2023-03-02 00:31:49.960919,0 days 00:00:00.563084,0.1247725326982122,0.8682871175732869,,,,,,,,,,,,,,Bayes,,,,,,,,,,,,,,,,,,,,,,COMPLETE
1859,1859,0.8688888888888888,2023-03-02 00:31:49.456845,2023-03-02 00:31:50.148942,0 days 00:00:00.692097,0.13055095733125507,0.08521171798328726,,,,,,,,,,,,,,Bayes,,,,,,,,,,,,,,,,,,,,,,COMPLETE
1860,1860,0.5,2023-03-02 00:31:49.470845,2023-03-02 00:31:52.920140,0 days 00:00:03.449295,,,192.6830892228166,friedman_mse,3.3772674972284973,exponential,32.0,0.004761153820633579,237.6972477004809,0.22950744099915094,0.7866232193034209,723.0,0.6225315233221558,0.36837613336935365,0.9102045423927099,Gradient Boosting,,,,,,,,,,,,,,,,,,,,,,COMPLETE
