,number,value,datetime_start,datetime_complete,duration,params_Bayes_prior_positive,params_Bayes_var_smoothing,params_GB_ccp_alpha,params_GB_criterion,params_GB_learning_rate,params_GB_loss,params_GB_max_depth,params_GB_max_features,params_GB_min_impurity_decrease,params_GB_min_samples_leaf,params_GB_min_samples_split,params_GB_n_estimators,params_GB_subsample,params_GB_tol,params_GB_validation_fraction,params_Method,params_SVM_C,params_SVM_coef0,params_SVM_decision_function_shape,params_SVM_degree,params_SVM_gamma,params_SVM_kernel,params_SVM_shrinking,params_SVM_tol,params_Tree_ccp_alpha,params_Tree_criterion,params_Tree_max_features,params_Tree_min_impurity_decrease,params_Tree_min_samples_leaf,params_Tree_min_samples_split,params_Tree_min_weight_fraction_leaf,params_Tree_splitter,params_kNN_algorithm,params_kNN_leaf_size,params_kNN_n_neighbors,params_kNN_p,params_kNN_weights,state
719,719,0.8690740740740741,2023-03-02 00:30:42.561741,2023-03-02 00:30:42.768830,0 days 00:00:00.207089,0.3567044423304337,0.11643546297827595,,,,,,,,,,,,,,Bayes,,,,,,,,,,,,,,,,,,,,,,COMPLETE
720,720,0.8690740740740741,2023-03-02 00:30:42.566741,2023-03-02 00:30:42.770832,0 days 00:00:00.204091,0.3634677482567159,0.1209371572237305,,,,,,,,,,,,,,Bayes,,,,,,,,,,,,,,,,,,,,,,COMPLETE
721,721,0.8690740740740741,2023-03-02 00:30:42.593743,2023-03-02 00:30:42.809830,0 days 00:00:00.216087,0.361593732084835,0.11845017908843031,,,,,,,,,,,,,,Bayes,,,,,,,,,,,,,,,,,,,,,,COMPLETE
722,722,0.862962962962963,2023-03-02 00:30:42.622741,2023-03-02 00:30:42.864835,0 days 00:00:00.242094,0.3572628403508701,0.7607289581013852,,,,,,,,,,,,,,Bayes,,,,,,,,,,,,,,,,,,,,,,COMPLETE
723,723,0.8692592592592593,2023-03-02 00:30:42.634571,2023-03-02 00:30:42.914829,0 days 00:00:00.280258,0.5521753975404954,0.014510520345630343,,,,,,,,,,,,,,Bayes,,,,,,,,,,,,,,,,,,,,,,COMPLETE
724,724,0.8688888888888888,2023-03-02 00:30:42.716831,2023-03-02 00:30:43.020284,0 days 00:00:00.303453,0.2432779938307309,0.08498463900472002,,,,,,,,,,,,,,Bayes,,,,,,,,,,,,,,,,,,,,,,COMPLETE
725,725,0.8694444444444445,2023-03-02 00:30:42.730829,2023-03-02 00:30:43.045398,0 days 00:00:00.314569,0.24044925714186288,0.08794724213323911,,,,,,,,,,,,,,Bayes,,,,,,,,,,,,,,,,,,,,,,COMPLETE
726,726,0.8646296296296296,2023-03-02 00:30:42.762829,2023-03-02 00:30:43.080383,0 days 00:00:00.317554,0.24783182831577746,0.4208631359265067,,,,,,,,,,,,,,Bayes,,,,,,,,,,,,,,,,,,,,,,COMPLETE
727,727,0.852037037037037,2023-03-02 00:30:42.771832,2023-03-02 00:30:42.954283,0 days 00:00:00.182451,,,,,,,,,,,,,,,,kNN,,,,,,,,,,,,,,,,,kd_tree,139.0,53.0,592.0,distance,COMPLETE
728,728,0.8666666666666667,2023-03-02 00:30:42.781829,2023-03-02 00:30:43.061380,0 days 00:00:00.279551,0.247920114309885,0.23828530193973202,,,,,,,,,,,,,,Bayes,,,,,,,,,,,,,,,,,,,,,,COMPLETE
729,729,0.8694444444444445,2023-03-02 00:30:42.815831,2023-03-02 00:30:43.114383,0 days 00:00:00.298552,0.2374994199774599,0.09220475571587627,,,,,,,,,,,,,,Bayes,,,,,,,,,,,,,,,,,,,,,,COMPLETE
730,730,0.801111111111111,2023-03-02 00:30:42.870830,2023-03-02 00:30:43.364148,0 days 00:00:00.493318,,,,,,,,,,,,,,,,kNN,,,,,,,,,,,,,,,,,kd_tree,135.0,408.0,616.0,distance,COMPLETE
731,731,0.8505555555555555,2023-03-02 00:30:42.924832,2023-03-02 00:30:43.144271,0 days 00:00:00.219439,,,,,,,,,,,,,,,,kNN,,,,,,,,,,,,,,,,,kd_tree,51.0,72.0,151.0,distance,COMPLETE
732,732,0.8692592592592593,2023-03-02 00:30:42.963282,2023-03-02 00:30:43.221133,0 days 00:00:00.257851,0.9426932944893649,0.09891583648888051,,,,,,,,,,,,,,Bayes,,,,,,,,,,,,,,,,,,,,,,COMPLETE
733,733,0.8685185185185185,2023-03-02 00:30:43.023282,2023-03-02 00:30:43.283133,0 days 00:00:00.259851,0.13077866240096275,0.06977067481540443,,,,,,,,,,,,,,Bayes,,,,,,,,,,,,,,,,,,,,,,COMPLETE
734,734,0.8685185185185185,2023-03-02 00:30:43.047382,2023-03-02 00:30:43.298135,0 days 00:00:00.250753,0.1265280957915353,0.06939536054664393,,,,,,,,,,,,,,Bayes,,,,,,,,,,,,,,,,,,,,,,COMPLETE
735,735,0.8635185185185185,2023-03-02 00:30:43.063383,2023-03-02 00:30:43.310134,0 days 00:00:00.246751,0.6029089734634681,0.5406091270248515,,,,,,,,,,,,,,Bayes,,,,,,,,,,,,,,,,,,,,,,COMPLETE
736,736,0.5,2023-03-02 00:30:43.083381,2023-03-02 00:30:43.359149,0 days 00:00:00.275768,,,,,,,,,,,,,,,,Tree,,,,,,,,,330.7197342995104,gini,0.2952910624978934,657.2324543193257,0.0354812807750009,0.10977615609220359,0.32185262537786263,random,,,,,,COMPLETE
737,737,0.5,2023-03-02 00:30:43.117381,2023-03-02 00:30:43.411148,0 days 00:00:00.293767,,,,,,,,,,,,,,,,Tree,,,,,,,,,305.50508326053,gini,0.2592305662526487,646.6209316009686,0.04704675683470044,0.9291206797405505,0.3182432992463563,random,,,,,,COMPLETE
738,738,0.8675925925925927,2023-03-02 00:30:43.149557,2023-03-02 00:30:43.449182,0 days 00:00:00.299625,0.4374522215087662,0.17843928745996618,,,,,,,,,,,,,,Bayes,,,,,,,,,,,,,,,,,,,,,,COMPLETE
739,739,0.5,2023-03-02 00:30:43.224137,2023-03-02 00:30:43.543183,0 days 00:00:00.319046,,,,,,,,,,,,,,,,Tree,,,,,,,,,934.8428229579579,gini,0.20126327894984497,569.7473265934101,0.05356527278197565,0.11849616512863093,0.457087742380267,random,,,,,,COMPLETE
740,740,0.5,2023-03-02 00:30:43.291136,2023-03-02 00:30:43.599632,0 days 00:00:00.308496,,,,,,,,,,,,,,,,Tree,,,,,,,,,529.0143958340244,gini,0.8960385817292852,98.04119016484088,0.18441618216163624,0.11540247598482722,0.28282209570324746,random,,,,,,COMPLETE
741,741,0.5,2023-03-02 00:30:43.305138,2023-03-02 00:30:43.622632,0 days 00:00:00.317494,,,,,,,,,,,,,,,,Tree,,,,,,,,,476.38538976273645,gini,0.9026191243812727,46.875705582827834,0.18524560053306233,0.11875168141750869,0.4577883877844749,random,,,,,,COMPLETE
742,742,0.5,2023-03-02 00:30:43.316133,2023-03-02 00:30:43.598632,0 days 00:00:00.282499,,,,,,,,,,,,,,,,Tree,,,,,,,,,446.06093625481014,gini,0.8938813042594446,59.94331190468142,0.18304521335234156,0.9059090410308124,0.2763632036145389,random,,,,,,COMPLETE
743,743,0.8690740740740741,2023-03-02 00:30:43.366147,2023-03-02 00:30:43.650142,0 days 00:00:00.283995,0.4788002459588958,0.10087998397839502,,,,,,,,,,,,,,Bayes,,,,,,,,,,,,,,,,,,,,,,COMPLETE
744,744,0.8677777777777778,2023-03-02 00:30:43.374146,2023-03-02 00:30:43.640635,0 days 00:00:00.266489,0.40547954105277023,0.16085664785990306,,,,,,,,,,,,,,Bayes,,,,,,,,,,,,,,,,,,,,,,COMPLETE
745,745,0.860925925925926,2023-03-02 00:30:43.417147,2023-03-02 00:30:43.681829,0 days 00:00:00.264682,0.08154317980618864,0.9644787389984435,,,,,,,,,,,,,,Bayes,,,,,,,,,,,,,,,,,,,,,,COMPLETE
746,746,0.8666666666666667,2023-03-02 00:30:43.457183,2023-03-02 00:30:43.710829,0 days 00:00:00.253646,0.40968600424059437,0.30742524231541984,,,,,,,,,,,,,,Bayes,,,,,,,,,,,,,,,,,,,,,,COMPLETE
747,747,0.8653703703703703,2023-03-02 00:30:43.548632,2023-03-02 00:30:43.794828,0 days 00:00:00.246196,0.28008478442872936,0.33799826080860496,,,,,,,,,,,,,,Bayes,,,,,,,,,,,,,,,,,,,,,,COMPLETE
748,748,0.8664814814814814,2023-03-02 00:30:43.601635,2023-03-02 00:30:43.820828,0 days 00:00:00.219193,0.4175103832265301,0.2693247592985407,,,,,,,,,,,,,,Bayes,,,,,,,,,,,,,,,,,,,,,,COMPLETE
749,749,0.8690740740740741,2023-03-02 00:30:43.608635,2023-03-02 00:30:43.828828,0 days 00:00:00.220193,0.08041295563962636,0.019767649796076356,,,,,,,,,,,,,,Bayes,,,,,,,,,,,,,,,,,,,,,,COMPLETE
750,750,0.8633333333333333,2023-03-02 00:30:43.634633,2023-03-02 00:30:43.858828,0 days 00:00:00.224195,0.07993883568034446,0.6967981978295357,,,,,,,,,,,,,,Bayes,,,,,,,,,,,,,,,,,,,,,,COMPLETE
751,751,0.8690740740740741,2023-03-02 00:30:43.643815,2023-03-02 00:30:43.859828,0 days 00:00:00.216013,0.03741458255557451,0.07906475933749293,,,,,,,,,,,,,,Bayes,,,,,,,,,,,,,,,,,,,,,,COMPLETE
752,752,0.8688888888888888,2023-03-02 00:30:43.655831,2023-03-02 00:30:43.874830,0 days 00:00:00.218999,0.2831948981315578,0.07255299570246906,,,,,,,,,,,,,,Bayes,,,,,,,,,,,,,,,,,,,,,,COMPLETE
753,753,0.8633333333333333,2023-03-02 00:30:43.683831,2023-03-02 00:30:43.984830,0 days 00:00:00.300999,0.30053262409180825,0.49080376543002213,,,,,,,,,,,,,,Bayes,,,,,,,,,,,,,,,,,,,,,,COMPLETE
754,754,0.8690740740740741,2023-03-02 00:30:43.712829,2023-03-02 00:30:44.013827,0 days 00:00:00.300998,0.02209134656260031,0.019631454049221772,,,,,,,,,,,,,,Bayes,,,,,,,,,,,,,,,,,,,,,,COMPLETE
755,755,0.8625925925925927,2023-03-02 00:30:43.797394,2023-03-02 00:30:44.096829,0 days 00:00:00.299435,0.29513416977256496,0.7855059305646263,,,,,,,,,,,,,,Bayes,,,,,,,,,,,,,,,,,,,,,,COMPLETE
756,756,0.8690740740740741,2023-03-02 00:30:43.822829,2023-03-02 00:30:44.129831,0 days 00:00:00.307002,0.0365841763240356,0.1311853835439849,,,,,,,,,,,,,,Bayes,,,,,,,,,,,,,,,,,,,,,,COMPLETE
757,757,0.8690740740740741,2023-03-02 00:30:43.830831,2023-03-02 00:30:44.128405,0 days 00:00:00.297574,0.030927863485871055,0.13167105239821006,,,,,,,,,,,,,,Bayes,,,,,,,,,,,,,,,,,,,,,,COMPLETE
758,758,0.8690740740740741,2023-03-02 00:30:43.863828,2023-03-02 00:30:44.173258,0 days 00:00:00.309430,0.19148776014881355,0.12985901709407704,,,,,,,,,,,,,,Bayes,,,,,,,,,,,,,,,,,,,,,,COMPLETE
759,759,0.8631481481481482,2023-03-02 00:30:43.870832,2023-03-02 00:30:44.165256,0 days 00:00:00.294424,0.10395552779689576,0.736311586655459,,,,,,,,,,,,,,Bayes,,,,,,,,,,,,,,,,,,,,,,COMPLETE
760,760,0.8690740740740741,2023-03-02 00:30:43.882828,2023-03-02 00:30:44.189254,0 days 00:00:00.306426,0.10665912836827274,0.12878941695448043,,,,,,,,,,,,,,Bayes,,,,,,,,,,,,,,,,,,,,,,COMPLETE
761,761,0.8629629629629629,2023-03-02 00:30:43.987828,2023-03-02 00:30:44.201255,0 days 00:00:00.213427,0.5715653534227856,0.6348928149670099,,,,,,,,,,,,,,Bayes,,,,,,,,,,,,,,,,,,,,,,COMPLETE
762,762,0.8690740740740741,2023-03-02 00:30:44.018828,2023-03-02 00:30:44.241255,0 days 00:00:00.222427,0.11153795311201438,0.13175555401085032,,,,,,,,,,,,,,Bayes,,,,,,,,,,,,,,,,,,,,,,COMPLETE
763,763,0.8690740740740741,2023-03-02 00:30:44.099828,2023-03-02 00:30:44.317255,0 days 00:00:00.217427,0.10101834094206674,0.10280692696138224,,,,,,,,,,,,,,Bayes,,,,,,,,,,,,,,,,,,,,,,COMPLETE
764,764,0.8692592592592593,2023-03-02 00:30:44.131831,2023-03-02 00:30:44.345258,0 days 00:00:00.213427,0.1998613901584368,0.09946004059361951,,,,,,,,,,,,,,Bayes,,,,,,,,,,,,,,,,,,,,,,COMPLETE
765,765,0.8616666666666667,2023-03-02 00:30:44.138828,2023-03-02 00:30:44.360819,0 days 00:00:00.221991,0.46342496162355495,0.8809354713451831,,,,,,,,,,,,,,Bayes,,,,,,,,,,,,,,,,,,,,,,COMPLETE
766,766,0.8690740740740741,2023-03-02 00:30:44.168254,2023-03-02 00:30:44.386819,0 days 00:00:00.218565,0.26555554394961023,0.10464169343098763,,,,,,,,,,,,,,Bayes,,,,,,,,,,,,,,,,,,,,,,COMPLETE
767,767,0.8633333333333333,2023-03-02 00:30:44.176259,2023-03-02 00:30:44.395821,0 days 00:00:00.219562,0.45991527646124036,0.6206248052010035,,,,,,,,,,,,,,Bayes,,,,,,,,,,,,,,,,,,,,,,COMPLETE
768,768,0.8631481481481482,2023-03-02 00:30:44.196255,2023-03-02 00:30:44.427822,0 days 00:00:00.231567,0.1374523267992636,0.5179609121461242,,,,,,,,,,,,,,Bayes,,,,,,,,,,,,,,,,,,,,,,COMPLETE
769,769,0.865,2023-03-02 00:30:44.205255,2023-03-02 00:30:44.419818,0 days 00:00:00.214563,0.3896121364449937,0.35971830052481973,,,,,,,,,,,,,,Bayes,,,,,,,,,,,,,,,,,,,,,,COMPLETE
770,770,0.8679629629629629,2023-03-02 00:30:44.245255,2023-03-02 00:30:44.465819,0 days 00:00:00.220564,0.8736052410156339,0.06255384009801775,,,,,,,,,,,,,,Bayes,,,,,,,,,,,,,,,,,,,,,,COMPLETE
771,771,0.8688888888888888,2023-03-02 00:30:44.319255,2023-03-02 00:30:44.546819,0 days 00:00:00.227564,0.9057852579031967,0.07478544071105811,,,,,,,,,,,,,,Bayes,,,,,,,,,,,,,,,,,,,,,,COMPLETE
772,772,0.867962962962963,2023-03-02 00:30:44.348820,2023-03-02 00:30:44.569820,0 days 00:00:00.221000,0.5250748257580706,0.2038864944732899,,,,,,,,,,,,,,Bayes,,,,,,,,,,,,,,,,,,,,,,COMPLETE
773,773,0.8633333333333334,2023-03-02 00:30:44.363819,2023-03-02 00:30:44.596822,0 days 00:00:00.233003,0.3872705239617171,0.5664041943767328,,,,,,,,,,,,,,Bayes,,,,,,,,,,,,,,,,,,,,,,COMPLETE
774,774,0.8638888888888889,2023-03-02 00:30:44.389819,2023-03-02 00:30:44.597819,0 days 00:00:00.208000,0.14096741141137897,0.45712579580764046,,,,,,,,,,,,,,Bayes,,,,,,,,,,,,,,,,,,,,,,COMPLETE
775,775,0.867962962962963,2023-03-02 00:30:44.399820,2023-03-02 00:30:44.619819,0 days 00:00:00.219999,0.9332318533351726,0.20852624421232158,,,,,,,,,,,,,,Bayes,,,,,,,,,,,,,,,,,,,,,,COMPLETE
776,776,0.8644444444444443,2023-03-02 00:30:44.422820,2023-03-02 00:30:44.662429,0 days 00:00:00.239609,0.156004038077927,0.41984385523197376,,,,,,,,,,,,,,Bayes,,,,,,,,,,,,,,,,,,,,,,COMPLETE
777,777,0.8688888888888889,2023-03-02 00:30:44.432822,2023-03-02 00:30:44.644822,0 days 00:00:00.212000,0.9143161158123474,0.08203171489137928,,,,,,,,,,,,,,Bayes,,,,,,,,,,,,,,,,,,,,,,COMPLETE
778,778,0.864074074074074,2023-03-02 00:30:44.468819,2023-03-02 00:30:44.708427,0 days 00:00:00.239608,0.1647647876309995,0.4645386175350873,,,,,,,,,,,,,,Bayes,,,,,,,,,,,,,,,,,,,,,,COMPLETE
779,779,0.8631481481481481,2023-03-02 00:30:44.548820,2023-03-02 00:30:44.890427,0 days 00:00:00.341607,0.052933192764935626,0.5869084890569238,,,,,,,,,,,,,,Bayes,,,,,,,,,,,,,,,,,,,,,,COMPLETE
780,780,0.5,2023-03-02 00:30:44.571820,2023-03-02 00:30:47.836134,0 days 00:00:03.264314,,,107.12389904623603,squared_error,5.832450972276541,exponential,12.0,0.993440713670634,984.0061371075442,0.2992933254916957,0.08903417593673901,869.0,0.46198165833852733,0.10980430557492987,0.6773771342522608,Gradient Boosting,,,,,,,,,,,,,,,,,,,,,,COMPLETE
781,781,0.8681481481481481,2023-03-02 00:30:44.600819,2023-03-02 00:30:44.968428,0 days 00:00:00.367609,0.055562271527832545,0.05626193040758419,,,,,,,,,,,,,,Bayes,,,,,,,,,,,,,,,,,,,,,,COMPLETE
782,782,0.8677777777777778,2023-03-02 00:30:44.607820,2023-03-02 00:30:44.972427,0 days 00:00:00.364607,0.05424487858449125,0.17146471912015632,,,,,,,,,,,,,,Bayes,,,,,,,,,,,,,,,,,,,,,,COMPLETE
783,783,0.5,2023-03-02 00:30:44.629819,2023-03-02 00:30:47.965134,0 days 00:00:03.335315,,,73.13697616696334,squared_error,5.811457784267433,exponential,12.0,0.9498173045851174,977.1980259993402,0.30064726198269187,0.061226826514447885,841.0,0.4629609684093082,0.08003984709775941,0.6539770298593685,Gradient Boosting,,,,,,,,,,,,,,,,,,,,,,COMPLETE
784,784,0.5,2023-03-02 00:30:44.652704,2023-03-02 00:30:47.658917,0 days 00:00:03.006213,,,75.85618131598636,squared_error,6.0193954011715265,exponential,13.0,0.9866571267010738,982.3470009443829,0.31511367160701265,0.08915024872649313,828.0,0.10461077493750937,0.12067572446087699,0.6453711885413977,Gradient Boosting,,,,,,,,,,,,,,,,,,,,,,COMPLETE
785,785,0.5,2023-03-02 00:30:44.668430,2023-03-02 00:30:47.914134,0 days 00:00:03.245704,,,273.8147894678109,squared_error,6.012219699054936,exponential,13.0,0.4450186556335983,995.6992307641967,0.3050878536575566,0.09472107827628484,834.0,0.4379354269487805,0.15027380710817223,0.6129503870770407,Gradient Boosting,,,,,,,,,,,,,,,,,,,,,,COMPLETE
786,786,0.5,2023-03-02 00:30:44.714428,2023-03-02 00:30:48.185147,0 days 00:00:03.470719,,,117.1999441924745,squared_error,6.259788116603703,exponential,12.0,0.970767790737551,985.3878199595856,0.3089502379432776,0.8175188052027522,885.0,0.47860568253689006,0.11267341631501931,0.6456859870866044,Gradient Boosting,,,,,,,,,,,,,,,,,,,,,,COMPLETE
787,787,0.8692592592592593,2023-03-02 00:30:44.892430,2023-03-02 00:30:45.327306,0 days 00:00:00.434876,0.21702839899141282,0.10637173860770395,,,,,,,,,,,,,,Bayes,,,,,,,,,,,,,,,,,,,,,,COMPLETE
788,788,0.5,2023-03-02 00:30:44.974427,2023-03-02 00:30:46.301990,0 days 00:00:01.327563,,,91.3435400552737,squared_error,6.038341118233484,exponential,12.0,0.9492246963757153,972.708946320442,0.28765011542351027,0.07714050649582926,221.0,0.11890598667665919,0.13017843429864523,0.6603381581922789,Gradient Boosting,,,,,,,,,,,,,,,,,,,,,,COMPLETE
789,789,0.8668518518518519,2023-03-02 00:30:44.981431,2023-03-02 00:30:45.411302,0 days 00:00:00.429871,0.2238266100715633,0.23498029693074673,,,,,,,,,,,,,,Bayes,,,,,,,,,,,,,,,,,,,,,,COMPLETE
790,790,0.8690740740740741,2023-03-02 00:30:45.334303,2023-03-02 00:30:45.722542,0 days 00:00:00.388239,0.3343094937895407,0.08640617693175011,,,,,,,,,,,,,,Bayes,,,,,,,,,,,,,,,,,,,,,,COMPLETE
791,791,0.8692592592592593,2023-03-02 00:30:45.418302,2023-03-02 00:30:45.802112,0 days 00:00:00.383810,0.8093450217142413,0.08723786713672628,,,,,,,,,,,,,,Bayes,,,,,,,,,,,,,,,,,,,,,,COMPLETE
792,792,0.5,2023-03-02 00:30:45.726542,2023-03-02 00:30:48.977592,0 days 00:00:03.251050,,,277.13264417268164,squared_error,6.171129193617324,exponential,13.0,0.13208494329569698,990.2138107283021,0.29972842529739,0.06424619529526776,883.0,0.4873269207409885,0.8775578735673149,0.6134252004966838,Gradient Boosting,,,,,,,,,,,,,,,,,,,,,,COMPLETE
793,793,0.5,2023-03-02 00:30:45.810110,2023-03-02 00:30:48.865594,0 days 00:00:03.055484,,,69.8781627585866,squared_error,5.96949958235019,exponential,13.0,0.9977456512583139,991.4389668709439,0.28889677829219407,0.05730156183142654,892.0,0.4775607495383551,0.8880591672403176,0.8435830971127294,Gradient Boosting,,,,,,,,,,,,,,,,,,,,,,COMPLETE
794,794,0.8690740740740741,2023-03-02 00:30:46.309991,2023-03-02 00:30:46.687773,0 days 00:00:00.377782,0.30521890313793765,0.15285635036379644,,,,,,,,,,,,,,Bayes,,,,,,,,,,,,,,,,,,,,,,COMPLETE
795,795,0.8688888888888889,2023-03-02 00:30:46.698660,2023-03-02 00:30:47.129627,0 days 00:00:00.430967,0.02493547589476386,0.037401529238069976,,,,,,,,,,,,,,Bayes,,,,,,,,,,,,,,,,,,,,,,COMPLETE
796,796,0.8681481481481481,2023-03-02 00:30:47.140628,2023-03-02 00:30:47.561916,0 days 00:00:00.421288,0.2661154852151098,0.05948673394840734,,,,,,,,,,,,,,Bayes,,,,,,,,,,,,,,,,,,,,,,COMPLETE
797,797,0.8694444444444445,2023-03-02 00:30:47.569918,2023-03-02 00:30:47.978135,0 days 00:00:00.408217,0.4312458971494459,0.10679388136010631,,,,,,,,,,,,,,Bayes,,,,,,,,,,,,,,,,,,,,,,COMPLETE
798,798,0.8694444444444445,2023-03-02 00:30:47.672916,2023-03-02 00:30:48.036149,0 days 00:00:00.363233,0.33571027967058853,0.10695632049417837,,,,,,,,,,,,,,Bayes,,,,,,,,,,,,,,,,,,,,,,COMPLETE
799,799,0.8683333333333333,2023-03-02 00:30:47.840134,2023-03-02 00:30:48.201149,0 days 00:00:00.361015,0.5812661816022597,0.06562344316753084,,,,,,,,,,,,,,Bayes,,,,,,,,,,,,,,,,,,,,,,COMPLETE
800,800,0.8685185185185185,2023-03-02 00:30:47.919136,2023-03-02 00:30:48.253359,0 days 00:00:00.334223,0.3424657662701951,0.06904480942639966,,,,,,,,,,,,,,Bayes,,,,,,,,,,,,,,,,,,,,,,COMPLETE
801,801,0.8688888888888888,2023-03-02 00:30:47.973136,2023-03-02 00:30:48.288482,0 days 00:00:00.315346,0.6299928394119112,0.07158440496357127,,,,,,,,,,,,,,Bayes,,,,,,,,,,,,,,,,,,,,,,COMPLETE
802,802,0.8679629629629629,2023-03-02 00:30:47.984133,2023-03-02 00:30:48.305358,0 days 00:00:00.321225,0.33780030435405267,0.06177901938613343,,,,,,,,,,,,,,Bayes,,,,,,,,,,,,,,,,,,,,,,COMPLETE
803,803,0.8688888888888888,2023-03-02 00:30:48.044146,2023-03-02 00:30:48.396360,0 days 00:00:00.352214,0.2839619921804025,0.085719511315456,,,,,,,,,,,,,,Bayes,,,,,,,,,,,,,,,,,,,,,,COMPLETE
804,804,0.8664814814814815,2023-03-02 00:30:48.193146,2023-03-02 00:30:48.540456,0 days 00:00:00.347310,0.01645787635813767,0.31751249427480016,,,,,,,,,,,,,,Bayes,,,,,,,,,,,,,,,,,,,,,,COMPLETE
805,805,0.8688888888888889,2023-03-02 00:30:48.209147,2023-03-02 00:30:48.501889,0 days 00:00:00.292742,0.8188559842915141,0.006299246767534503,,,,,,,,,,,,,,Bayes,,,,,,,,,,,,,,,,,,,,,,COMPLETE
806,806,0.8668518518518519,2023-03-02 00:30:48.258360,2023-03-02 00:30:48.644458,0 days 00:00:00.386098,0.19275498198629096,0.30298775524830784,,,,,,,,,,,,,,Bayes,,,,,,,,,,,,,,,,,,,,,,COMPLETE
807,807,0.8300000000000001,2023-03-02 00:30:48.294360,2023-03-02 00:30:48.672458,0 days 00:00:00.378098,,,,,,,,,,,,,,,,kNN,,,,,,,,,,,,,,,,,brute,358.0,208.0,832.0,distance,COMPLETE
808,808,0.8692592592592594,2023-03-02 00:30:48.311361,2023-03-02 00:30:48.717560,0 days 00:00:00.406199,0.2701103554011639,0.10860167976368042,,,,,,,,,,,,,,Bayes,,,,,,,,,,,,,,,,,,,,,,COMPLETE
809,809,0.8690740740740741,2023-03-02 00:30:48.407890,2023-03-02 00:30:48.759580,0 days 00:00:00.351690,0.1234223007074214,0.15053132122047094,,,,,,,,,,,,,,Bayes,,,,,,,,,,,,,,,,,,,,,,COMPLETE
810,810,0.8390740740740741,2023-03-02 00:30:48.507889,2023-03-02 00:30:48.877593,0 days 00:00:00.369704,,,,,,,,,,,,,,,,kNN,,,,,,,,,,,,,,,,,brute,423.0,212.0,123.0,distance,COMPLETE
811,811,0.8422222222222222,2023-03-02 00:30:48.551456,2023-03-02 00:30:48.909594,0 days 00:00:00.358138,,,,,,,,,,,,,,,,kNN,,,,,,,,,,,,,,,,,brute,426.0,202.0,114.0,distance,COMPLETE
812,812,0.8694444444444445,2023-03-02 00:30:48.651457,2023-03-02 00:30:48.950593,0 days 00:00:00.299136,0.13156360284829247,0.09529018314961286,,,,,,,,,,,,,,Bayes,,,,,,,,,,,,,,,,,,,,,,COMPLETE
813,813,0.8687037037037038,2023-03-02 00:30:48.678459,2023-03-02 00:30:48.989594,0 days 00:00:00.311135,0.12502564940689265,0.035956207009435824,,,,,,,,,,,,,,Bayes,,,,,,,,,,,,,,,,,,,,,,COMPLETE
814,814,0.8688888888888889,2023-03-02 00:30:48.721236,2023-03-02 00:30:48.990593,0 days 00:00:00.269357,0.07496662443977863,0.03755415761388249,,,,,,,,,,,,,,Bayes,,,,,,,,,,,,,,,,,,,,,,COMPLETE
815,815,0.8648148148148149,2023-03-02 00:30:48.764579,2023-03-02 00:30:49.141108,0 days 00:00:00.376529,0.3114406038638203,0.3665635849125255,,,,,,,,,,,,,,Bayes,,,,,,,,,,,,,,,,,,,,,,COMPLETE
816,816,0.8642592592592593,2023-03-02 00:30:48.869592,2023-03-02 00:30:49.223417,0 days 00:00:00.353825,0.0700915801798187,0.4350506702656658,,,,,,,,,,,,,,Bayes,,,,,,,,,,,,,,,,,,,,,,COMPLETE
817,817,0.867962962962963,2023-03-02 00:30:48.880592,2023-03-02 00:30:49.239332,0 days 00:00:00.358740,0.09079466217849064,0.18613493009412815,,,,,,,,,,,,,,Bayes,,,,,,,,,,,,,,,,,,,,,,COMPLETE
818,818,0.8675925925925927,2023-03-02 00:30:48.917591,2023-03-02 00:30:49.285332,0 days 00:00:00.367741,0.08374821423462839,0.18133728817086406,,,,,,,,,,,,,,Bayes,,,,,,,,,,,,,,,,,,,,,,COMPLETE
819,819,0.8622222222222222,2023-03-02 00:30:48.953591,2023-03-02 00:30:49.315335,0 days 00:00:00.361744,0.47716736812561805,0.7958658745597438,,,,,,,,,,,,,,Bayes,,,,,,,,,,,,,,,,,,,,,,COMPLETE
