,number,value,datetime_start,datetime_complete,duration,params_Bayes_prior_positive,params_Bayes_var_smoothing,params_GB_ccp_alpha,params_GB_criterion,params_GB_learning_rate,params_GB_loss,params_GB_max_depth,params_GB_max_features,params_GB_min_impurity_decrease,params_GB_min_samples_leaf,params_GB_min_samples_split,params_GB_n_estimators,params_GB_subsample,params_GB_tol,params_GB_validation_fraction,params_Method,params_SVM_C,params_SVM_coef0,params_SVM_decision_function_shape,params_SVM_degree,params_SVM_gamma,params_SVM_kernel,params_SVM_shrinking,params_SVM_tol,params_Tree_ccp_alpha,params_Tree_criterion,params_Tree_max_features,params_Tree_min_impurity_decrease,params_Tree_min_samples_leaf,params_Tree_min_samples_split,params_Tree_min_weight_fraction_leaf,params_Tree_splitter,params_kNN_algorithm,params_kNN_leaf_size,params_kNN_n_neighbors,params_kNN_p,params_kNN_weights,state
1446,1446,0.8618518518518519,2023-03-02 00:31:19.766936,2023-03-02 00:31:20.163102,0 days 00:00:00.396166,0.8184079610961355,0.8503015974767341,,,,,,,,,,,,,,Bayes,,,,,,,,,,,,,,,,,,,,,,COMPLETE
1447,1447,0.867962962962963,2023-03-02 00:31:19.801938,2023-03-02 00:31:20.216783,0 days 00:00:00.414845,0.7994676771056052,0.19549823783709372,,,,,,,,,,,,,,Bayes,,,,,,,,,,,,,,,,,,,,,,COMPLETE
1448,1448,0.8692592592592592,2023-03-02 00:31:19.825936,2023-03-02 00:31:20.234784,0 days 00:00:00.408848,0.6092651609823502,0.1270538106664333,,,,,,,,,,,,,,Bayes,,,,,,,,,,,,,,,,,,,,,,COMPLETE
1449,1449,0.867962962962963,2023-03-02 00:31:19.903936,2023-03-02 00:31:20.329781,0 days 00:00:00.425845,0.21028953596311137,0.21091604986027324,,,,,,,,,,,,,,Bayes,,,,,,,,,,,,,,,,,,,,,,COMPLETE
1450,1450,0.8692592592592592,2023-03-02 00:31:19.918935,2023-03-02 00:31:20.342782,0 days 00:00:00.423847,0.5838585294099069,0.12701728067975204,,,,,,,,,,,,,,Bayes,,,,,,,,,,,,,,,,,,,,,,COMPLETE
1451,1451,0.8690740740740741,2023-03-02 00:31:20.011936,2023-03-02 00:31:20.422782,0 days 00:00:00.410846,0.28158174360801264,0.000746381080897196,,,,,,,,,,,,,,Bayes,,,,,,,,,,,,,,,,,,,,,,COMPLETE
1452,1452,0.8681481481481481,2023-03-02 00:31:20.032937,2023-03-02 00:31:20.446781,0 days 00:00:00.413844,0.5581289826224176,0.055606778690137956,,,,,,,,,,,,,,Bayes,,,,,,,,,,,,,,,,,,,,,,COMPLETE
1453,1453,0.8681481481481481,2023-03-02 00:31:20.169103,2023-03-02 00:31:20.473781,0 days 00:00:00.304678,0.7643568451133096,0.057559955571966075,,,,,,,,,,,,,,Bayes,,,,,,,,,,,,,,,,,,,,,,COMPLETE
1454,1454,0.8681481481481481,2023-03-02 00:31:20.180103,2023-03-02 00:31:20.501781,0 days 00:00:00.321678,0.8990427843082377,0.05789964570022225,,,,,,,,,,,,,,Bayes,,,,,,,,,,,,,,,,,,,,,,COMPLETE
1455,1455,0.8681481481481481,2023-03-02 00:31:20.222781,2023-03-02 00:31:20.600105,0 days 00:00:00.377324,0.23067250224844035,0.058265991966352584,,,,,,,,,,,,,,Bayes,,,,,,,,,,,,,,,,,,,,,,COMPLETE
1456,1456,0.8664814814814815,2023-03-02 00:31:20.245782,2023-03-02 00:31:20.782240,0 days 00:00:00.536458,0.9992789708704355,0.2591579391908626,,,,,,,,,,,,,,Bayes,,,,,,,,,,,,,,,,,,,,,,COMPLETE
1457,1457,0.8648148148148147,2023-03-02 00:31:20.331782,2023-03-02 00:31:20.953793,0 days 00:00:00.622011,0.2551592715600483,0.3840514312625832,,,,,,,,,,,,,,Bayes,,,,,,,,,,,,,,,,,,,,,,COMPLETE
1458,1458,0.8666666666666667,2023-03-02 00:31:20.346782,2023-03-02 00:31:20.996238,0 days 00:00:00.649456,0.37359764281016633,0.3138892906631938,,,,,,,,,,,,,,Bayes,,,,,,,,,,,,,,,,,,,,,,COMPLETE
1459,1459,0.6047222222222223,2023-03-02 00:31:20.426782,2023-03-02 00:31:21.332980,0 days 00:00:00.906198,,,,,,,,,,,,,,,,kNN,,,,,,,,,,,,,,,,,ball_tree,378.0,353.0,693.0,uniform,COMPLETE
1460,1460,0.722962962962963,2023-03-02 00:31:20.456781,2023-03-02 00:31:21.184981,0 days 00:00:00.728200,,,,,,,,,,,,,,,,kNN,,,,,,,,,,,,,,,,,ball_tree,377.0,269.0,685.0,uniform,COMPLETE
1461,1461,0.4719444444444445,2023-03-02 00:31:20.480783,2023-03-02 00:31:21.257980,0 days 00:00:00.777197,,,,,,,,,,,,,,,,kNN,,,,,,,,,,,,,,,,,ball_tree,188.0,351.0,950.0,uniform,COMPLETE
1462,1462,0.4712962962962963,2023-03-02 00:31:20.516107,2023-03-02 00:31:21.287980,0 days 00:00:00.771873,,,,,,,,,,,,,,,,kNN,,,,,,,,,,,,,,,,,ball_tree,185.0,350.0,963.0,uniform,COMPLETE
1463,1463,0.8692592592592593,2023-03-02 00:31:20.624103,2023-03-02 00:31:21.163980,0 days 00:00:00.539877,0.3742916664886764,0.09856962298553264,,,,,,,,,,,,,,Bayes,,,,,,,,,,,,,,,,,,,,,,COMPLETE
1464,1464,0.5743518518518519,2023-03-02 00:31:20.796756,2023-03-02 00:31:21.395979,0 days 00:00:00.599223,,,,,,,,,,,,,,,,kNN,,,,,,,,,,,,,,,,,ball_tree,184.0,357.0,701.0,uniform,COMPLETE
1465,1465,0.6497222222222223,2023-03-02 00:31:20.957794,2023-03-02 00:31:21.610266,0 days 00:00:00.652472,,,,,,,,,,,,,,,,kNN,,,,,,,,,,,,,,,,,ball_tree,189.0,355.0,670.0,uniform,COMPLETE
1466,1466,0.798425925925926,2023-03-02 00:31:20.999238,2023-03-02 00:31:21.609272,0 days 00:00:00.610034,,,,,,,,,,,,,,,,kNN,,,,,,,,,,,,,,,,,ball_tree,184.0,352.0,183.0,uniform,COMPLETE
1467,1467,0.8633333333333334,2023-03-02 00:31:21.166981,2023-03-02 00:31:21.659737,0 days 00:00:00.492756,0.11963946138184377,0.5309595645820054,,,,,,,,,,,,,,Bayes,,,,,,,,,,,,,,,,,,,,,,COMPLETE
1468,1468,0.5,2023-03-02 00:31:21.186981,2023-03-02 00:31:24.301830,0 days 00:00:03.114849,,,145.43449160527814,friedman_mse,0.08714744510454953,exponential,20.0,0.7280941163068062,315.5892186381324,0.4874659311680356,0.2468598529632242,934.0,0.40245796624066515,0.1692540017077473,0.3196135170141064,Gradient Boosting,,,,,,,,,,,,,,,,,,,,,,COMPLETE
1469,1469,0.5,2023-03-02 00:31:21.266983,2023-03-02 00:31:25.795671,0 days 00:00:04.528688,,,454.50875794983136,friedman_mse,7.00515103197454,exponential,20.0,0.7284150376044904,307.22718613881494,0.42769334247470553,0.2426548487625344,479.0,0.9574099034668047,0.7342245582839759,0.2906817254932988,Gradient Boosting,,,,,,,,,,,,,,,,,,,,,,COMPLETE
1470,1470,0.5,2023-03-02 00:31:21.299982,2023-03-02 00:31:32.055240,0 days 00:00:10.755258,,,445.40454374165506,friedman_mse,6.994628131487208,exponential,21.0,0.6298783418954903,287.90092806320916,0.1731032705565242,0.2579436974963135,990.0,0.9586087563329391,0.692693058165319,0.0006283299532653386,Gradient Boosting,,,,,,,,,,,,,,,,,,,,,,COMPLETE
1471,1471,0.5,2023-03-02 00:31:21.338981,2023-03-02 00:31:24.723244,0 days 00:00:03.384263,,,444.3248875721686,friedman_mse,7.100298520616098,exponential,20.0,0.7288802592719499,608.3971144944121,0.48080365722500557,0.23651034149393424,939.0,0.8361096946162636,0.7203840290256269,0.30461492697471976,Gradient Boosting,,,,,,,,,,,,,,,,,,,,,,COMPLETE
1472,1472,0.5,2023-03-02 00:31:21.408980,2023-03-02 00:31:29.319372,0 days 00:00:07.910392,,,459.2748064429299,friedman_mse,6.650618695883357,exponential,33.0,0.47986144371346046,610.0458174181189,0.18737543440816568,0.8418044629241922,949.0,0.9633187771732352,0.8382511430577533,0.27966324541413823,Gradient Boosting,,,,,,,,,,,,,,,,,,,,,,COMPLETE
1473,1473,0.8627777777777779,2023-03-02 00:31:21.612265,2023-03-02 00:31:22.179755,0 days 00:00:00.567490,0.11618125344302532,0.6656547076657866,,,,,,,,,,,,,,Bayes,,,,,,,,,,,,,,,,,,,,,,COMPLETE
1474,1474,0.5,2023-03-02 00:31:21.627267,2023-03-02 00:31:24.833928,0 days 00:00:03.206661,,,137.19197370051756,friedman_mse,6.964489510351495,exponential,20.0,0.7212452697829533,608.314138094245,0.17879812120047722,0.2411162329381501,997.0,0.2275700148776364,0.6820114966676009,0.3043645061481801,Gradient Boosting,,,,,,,,,,,,,,,,,,,,,,COMPLETE
1475,1475,0.8690740740740741,2023-03-02 00:31:21.666924,2023-03-02 00:31:22.252757,0 days 00:00:00.585833,0.3008452547549661,0.11946546569749317,,,,,,,,,,,,,,Bayes,,,,,,,,,,,,,,,,,,,,,,COMPLETE
1476,1476,0.5,2023-03-02 00:31:22.182755,2023-03-02 00:31:24.339831,0 days 00:00:02.157076,,,441.7124679282736,friedman_mse,0.06925741993381163,exponential,19.0,0.7350343916768842,616.0655869914575,0.16631687627945702,0.2637977952160973,473.0,0.9561897388474391,0.16899435321422873,0.26043589586675164,Gradient Boosting,,,,,,,,,,,,,,,,,,,,,,COMPLETE
1477,1477,0.5,2023-03-02 00:31:22.255755,2023-03-02 00:31:24.274830,0 days 00:00:02.019075,,,461.834126194017,friedman_mse,0.05427926105021896,exponential,19.0,0.17629140792048936,618.6428294267049,0.18466348542162148,0.6506357635950474,465.0,0.9566930981993791,0.7151826110201767,0.30127652615271033,Gradient Boosting,,,,,,,,,,,,,,,,,,,,,,COMPLETE
1478,1478,0.8666666666666666,2023-03-02 00:31:24.282831,2023-03-02 00:31:24.626523,0 days 00:00:00.343692,0.04572252182600746,0.2800602273876375,,,,,,,,,,,,,,Bayes,,,,,,,,,,,,,,,,,,,,,,COMPLETE
1479,1479,0.8648148148148149,2023-03-02 00:31:24.307830,2023-03-02 00:31:24.590522,0 days 00:00:00.282692,0.20071128807590083,0.36365004368385834,,,,,,,,,,,,,,Bayes,,,,,,,,,,,,,,,,,,,,,,COMPLETE
1480,1480,0.8690740740740741,2023-03-02 00:31:24.346831,2023-03-02 00:31:24.665522,0 days 00:00:00.318691,0.0499719841920673,0.08059995006187091,,,,,,,,,,,,,,Bayes,,,,,,,,,,,,,,,,,,,,,,COMPLETE
1481,1481,0.8633333333333334,2023-03-02 00:31:24.595523,2023-03-02 00:31:24.909927,0 days 00:00:00.314404,0.014258671219303536,0.7017648760661859,,,,,,,,,,,,,,Bayes,,,,,,,,,,,,,,,,,,,,,,COMPLETE
1482,1482,0.8690740740740741,2023-03-02 00:31:24.633522,2023-03-02 00:31:24.944928,0 days 00:00:00.311406,0.24717332703789405,0.025620777341441192,,,,,,,,,,,,,,Bayes,,,,,,,,,,,,,,,,,,,,,,COMPLETE
1483,1483,0.8692592592592593,2023-03-02 00:31:24.669526,2023-03-02 00:31:24.947928,0 days 00:00:00.278402,0.338745256002531,0.09786451223081011,,,,,,,,,,,,,,Bayes,,,,,,,,,,,,,,,,,,,,,,COMPLETE
1484,1484,0.8631481481481482,2023-03-02 00:31:24.727927,2023-03-02 00:31:25.016927,0 days 00:00:00.289000,0.2492884908660542,0.5173640640928097,,,,,,,,,,,,,,Bayes,,,,,,,,,,,,,,,,,,,,,,COMPLETE
1485,1485,0.8646296296296296,2023-03-02 00:31:24.835927,2023-03-02 00:31:25.193927,0 days 00:00:00.358000,0.0014756461946033791,0.427594978104308,,,,,,,,,,,,,,Bayes,,,,,,,,,,,,,,,,,,,,,,COMPLETE
1486,1486,0.8690740740740741,2023-03-02 00:31:24.913928,2023-03-02 00:31:25.265592,0 days 00:00:00.351664,0.9927278440474916,0.1309099534553315,,,,,,,,,,,,,,Bayes,,,,,,,,,,,,,,,,,,,,,,COMPLETE
1487,1487,0.8688888888888889,2023-03-02 00:31:24.949929,2023-03-02 00:31:25.294592,0 days 00:00:00.344663,0.7271938759369749,0.13840820586679145,,,,,,,,,,,,,,Bayes,,,,,,,,,,,,,,,,,,,,,,COMPLETE
1488,1488,0.8690740740740741,2023-03-02 00:31:24.960927,2023-03-02 00:31:25.328592,0 days 00:00:00.367665,0.6494558474602512,0.13005323550224315,,,,,,,,,,,,,,Bayes,,,,,,,,,,,,,,,,,,,,,,COMPLETE
1489,1489,0.8622222222222222,2023-03-02 00:31:25.019927,2023-03-02 00:31:25.376595,0 days 00:00:00.356668,0.9786364089662727,0.8101096163049863,,,,,,,,,,,,,,Bayes,,,,,,,,,,,,,,,,,,,,,,COMPLETE
1490,1490,0.8688888888888888,2023-03-02 00:31:25.196928,2023-03-02 00:31:25.473942,0 days 00:00:00.277014,0.4693954094793292,0.07512501640894009,,,,,,,,,,,,,,Bayes,,,,,,,,,,,,,,,,,,,,,,COMPLETE
1491,1491,0.8629629629629629,2023-03-02 00:31:25.268592,2023-03-02 00:31:25.548461,0 days 00:00:00.279869,0.271801365634542,0.5912707955605659,,,,,,,,,,,,,,Bayes,,,,,,,,,,,,,,,,,,,,,,COMPLETE
1492,1492,0.8644444444444443,2023-03-02 00:31:25.297593,2023-03-02 00:31:25.566474,0 days 00:00:00.268881,0.6741221178001588,0.4293866991664361,,,,,,,,,,,,,,Bayes,,,,,,,,,,,,,,,,,,,,,,COMPLETE
1493,1493,0.8688888888888888,2023-03-02 00:31:25.333592,2023-03-02 00:31:25.626397,0 days 00:00:00.292805,0.22397918746475906,0.0745519252766274,,,,,,,,,,,,,,Bayes,,,,,,,,,,,,,,,,,,,,,,COMPLETE
1494,1494,0.8611111111111112,2023-03-02 00:31:25.379592,2023-03-02 00:31:25.643398,0 days 00:00:00.263806,0.2729534900941857,0.9583447216685235,,,,,,,,,,,,,,Bayes,,,,,,,,,,,,,,,,,,,,,,COMPLETE
1495,1495,0.867962962962963,2023-03-02 00:31:25.477942,2023-03-02 00:31:25.754053,0 days 00:00:00.276111,0.6230267118600539,0.1928688081324717,,,,,,,,,,,,,,Bayes,,,,,,,,,,,,,,,,,,,,,,COMPLETE
1496,1496,0.8692592592592593,2023-03-02 00:31:25.555459,2023-03-02 00:31:25.879347,0 days 00:00:00.323888,0.1383957484965213,0.09589044251581207,,,,,,,,,,,,,,Bayes,,,,,,,,,,,,,,,,,,,,,,COMPLETE
1497,1497,0.8675925925925927,2023-03-02 00:31:25.569474,2023-03-02 00:31:25.848786,0 days 00:00:00.279312,0.1390631509166804,0.17762837876173482,,,,,,,,,,,,,,Bayes,,,,,,,,,,,,,,,,,,,,,,COMPLETE
1498,1498,0.8690740740740741,2023-03-02 00:31:25.631397,2023-03-02 00:31:26.023527,0 days 00:00:00.392130,0.14244438760593617,0.10261458439369975,,,,,,,,,,,,,,Bayes,,,,,,,,,,,,,,,,,,,,,,COMPLETE
1499,1499,0.862962962962963,2023-03-02 00:31:25.656399,2023-03-02 00:31:26.047530,0 days 00:00:00.391131,0.8578572387355826,0.7465986111397678,,,,,,,,,,,,,,Bayes,,,,,,,,,,,,,,,,,,,,,,COMPLETE
1500,1500,0.8692592592592594,2023-03-02 00:31:25.760052,2023-03-02 00:31:26.145802,0 days 00:00:00.385750,0.4333346928565519,0.1102543106744597,,,,,,,,,,,,,,Bayes,,,,,,,,,,,,,,,,,,,,,,COMPLETE
1501,1501,0.8690740740740741,2023-03-02 00:31:25.799670,2023-03-02 00:31:26.200800,0 days 00:00:00.401130,0.14383823303649415,0.11815861873213748,,,,,,,,,,,,,,Bayes,,,,,,,,,,,,,,,,,,,,,,COMPLETE
1502,1502,0.8690740740740741,2023-03-02 00:31:25.851790,2023-03-02 00:31:26.251007,0 days 00:00:00.399217,0.10924241247110104,0.11547955837191388,,,,,,,,,,,,,,Bayes,,,,,,,,,,,,,,,,,,,,,,COMPLETE
1503,1503,0.8690740740740741,2023-03-02 00:31:25.884345,2023-03-02 00:31:26.285890,0 days 00:00:00.401545,0.30660438372491144,0.11612025800589326,,,,,,,,,,,,,,Bayes,,,,,,,,,,,,,,,,,,,,,,COMPLETE
1504,1504,0.8666666666666667,2023-03-02 00:31:26.036527,2023-03-02 00:31:26.327033,0 days 00:00:00.290506,0.10708948296624866,0.23878831756797786,,,,,,,,,,,,,,Bayes,,,,,,,,,,,,,,,,,,,,,,COMPLETE
1505,1505,0.8638888888888889,2023-03-02 00:31:26.060528,2023-03-02 00:31:26.346100,0 days 00:00:00.285572,0.11308754276358751,0.47305366836962287,,,,,,,,,,,,,,Bayes,,,,,,,,,,,,,,,,,,,,,,COMPLETE
1506,1506,0.8687037037037038,2023-03-02 00:31:26.148801,2023-03-02 00:31:26.442562,0 days 00:00:00.293761,0.9499201611394626,0.03329826332088569,,,,,,,,,,,,,,Bayes,,,,,,,,,,,,,,,,,,,,,,COMPLETE
1507,1507,0.8631481481481481,2023-03-02 00:31:26.205801,2023-03-02 00:31:26.510562,0 days 00:00:00.304761,0.11315363191199002,0.6269057525703587,,,,,,,,,,,,,,Bayes,,,,,,,,,,,,,,,,,,,,,,COMPLETE
1508,1508,0.8690740740740741,2023-03-02 00:31:26.253156,2023-03-02 00:31:26.555564,0 days 00:00:00.302408,0.2985996136344272,0.027341578826174398,,,,,,,,,,,,,,Bayes,,,,,,,,,,,,,,,,,,,,,,COMPLETE
1509,1509,0.8688888888888888,2023-03-02 00:31:26.290892,2023-03-02 00:31:26.610564,0 days 00:00:00.319672,0.40596346282639406,0.07579761476519081,,,,,,,,,,,,,,Bayes,,,,,,,,,,,,,,,,,,,,,,COMPLETE
1510,1510,0.867037037037037,2023-03-02 00:31:26.331588,2023-03-02 00:31:26.612562,0 days 00:00:00.280974,0.3426469987450045,0.22136995970743045,,,,,,,,,,,,,,Bayes,,,,,,,,,,,,,,,,,,,,,,COMPLETE
1511,1511,0.8666666666666667,2023-03-02 00:31:26.348099,2023-03-02 00:31:26.660563,0 days 00:00:00.312464,0.45132711716822554,0.3065866742729507,,,,,,,,,,,,,,Bayes,,,,,,,,,,,,,,,,,,,,,,COMPLETE
1512,1512,0.8668518518518519,2023-03-02 00:31:26.462562,2023-03-02 00:31:26.824655,0 days 00:00:00.362093,0.29029962835059897,0.284902123192149,,,,,,,,,,,,,,Bayes,,,,,,,,,,,,,,,,,,,,,,COMPLETE
1513,1513,0.8631481481481482,2023-03-02 00:31:26.512563,2023-03-02 00:31:26.898658,0 days 00:00:00.386095,0.7856888134316383,0.6146559643759523,,,,,,,,,,,,,,Bayes,,,,,,,,,,,,,,,,,,,,,,COMPLETE
1514,1514,0.8681481481481481,2023-03-02 00:31:26.558562,2023-03-02 00:31:26.971656,0 days 00:00:00.413094,0.18027170797570527,0.05131844829797,,,,,,,,,,,,,,Bayes,,,,,,,,,,,,,,,,,,,,,,COMPLETE
1515,1515,0.8633333333333333,2023-03-02 00:31:26.615562,2023-03-02 00:31:26.990831,0 days 00:00:00.375269,0.16762769632860375,0.7240798710342292,,,,,,,,,,,,,,Bayes,,,,,,,,,,,,,,,,,,,,,,COMPLETE
1516,1516,0.8681481481481481,2023-03-02 00:31:26.630563,2023-03-02 00:31:27.021352,0 days 00:00:00.390789,0.5338800169782523,0.054595027690516926,,,,,,,,,,,,,,Bayes,,,,,,,,,,,,,,,,,,,,,,COMPLETE
1517,1517,0.8655555555555556,2023-03-02 00:31:26.759562,2023-03-02 00:31:27.087352,0 days 00:00:00.327790,0.6438753881134778,0.33442479579935647,,,,,,,,,,,,,,Bayes,,,,,,,,,,,,,,,,,,,,,,COMPLETE
1518,1518,0.8679629629629629,2023-03-02 00:31:26.830657,2023-03-02 00:31:27.161351,0 days 00:00:00.330694,0.1685300238486917,0.0625763787500769,,,,,,,,,,,,,,Bayes,,,,,,,,,,,,,,,,,,,,,,COMPLETE
1519,1519,0.8633333333333333,2023-03-02 00:31:26.904658,2023-03-02 00:31:27.261351,0 days 00:00:00.356693,0.06411049640227312,0.5031059650890769,,,,,,,,,,,,,,Bayes,,,,,,,,,,,,,,,,,,,,,,COMPLETE
1520,1520,0.8692592592592593,2023-03-02 00:31:26.974656,2023-03-02 00:31:27.492729,0 days 00:00:00.518073,0.06182390867370751,0.0877222473290985,,,,,,,,,,,,,,Bayes,,,,,,,,,,,,,,,,,,,,,,COMPLETE
1521,1521,0.5,2023-03-02 00:31:26.995352,2023-03-02 00:31:27.505726,0 days 00:00:00.510374,,,,,,,,,,,,,,,,Tree,,,,,,,,,938.5879211085506,gini,0.22327342382099757,743.4457645798784,0.016446820147765218,0.23651910761959105,0.33618930409164205,random,,,,,,COMPLETE
1522,1522,0.8668518518518519,2023-03-02 00:31:27.031350,2023-03-02 00:31:27.493727,0 days 00:00:00.462377,0.8775192821371971,0.23590191447226103,,,,,,,,,,,,,,Bayes,,,,,,,,,,,,,,,,,,,,,,COMPLETE
1523,1523,0.5,2023-03-02 00:31:27.090351,2023-03-02 00:31:27.570727,0 days 00:00:00.480376,,,,,,,,,,,,,,,,Tree,,,,,,,,,181.53822072164428,gini,0.5499055974713988,492.1307592106963,0.33419276250612584,0.22070029838362026,0.3397291361260813,random,,,,,,COMPLETE
1524,1524,0.5,2023-03-02 00:31:27.163350,2023-03-02 00:31:27.647726,0 days 00:00:00.484376,,,,,,,,,,,,,,,,Tree,,,,,,,,,802.9610736185562,gini,0.5508430823013243,554.391639167367,0.020969119519645085,0.2177751862198879,0.20632689620928119,random,,,,,,COMPLETE
1525,1525,0.5,2023-03-02 00:31:27.265913,2023-03-02 00:31:27.708725,0 days 00:00:00.442812,,,,,,,,,,,,,,,,Tree,,,,,,,,,758.5285025722046,gini,0.5548067920134712,550.8487367574869,0.08103534176492624,0.22382849824212714,0.33097092635766384,random,,,,,,COMPLETE
1526,1526,0.8690740740740741,2023-03-02 00:31:27.511726,2023-03-02 00:31:27.824372,0 days 00:00:00.312646,0.5195096178048723,0.15259480588981242,,,,,,,,,,,,,,Bayes,,,,,,,,,,,,,,,,,,,,,,COMPLETE
1527,1527,0.8690740740740741,2023-03-02 00:31:27.521727,2023-03-02 00:31:27.839371,0 days 00:00:00.317644,0.5188231195268598,0.14393975442283116,,,,,,,,,,,,,,Bayes,,,,,,,,,,,,,,,,,,,,,,COMPLETE
1528,1528,0.8692592592592593,2023-03-02 00:31:27.537728,2023-03-02 00:31:27.895372,0 days 00:00:00.357644,0.2022229191629457,0.09357839970630086,,,,,,,,,,,,,,Bayes,,,,,,,,,,,,,,,,,,,,,,COMPLETE
1529,1529,0.8648148148148149,2023-03-02 00:31:27.586727,2023-03-02 00:31:27.910375,0 days 00:00:00.323648,0.20032363037188847,0.36990179274884066,,,,,,,,,,,,,,Bayes,,,,,,,,,,,,,,,,,,,,,,COMPLETE
1530,1530,0.8629629629629629,2023-03-02 00:31:27.649726,2023-03-02 00:31:27.967371,0 days 00:00:00.317645,0.2279362022715649,0.5824985895869883,,,,,,,,,,,,,,Bayes,,,,,,,,,,,,,,,,,,,,,,COMPLETE
1531,1531,0.8694444444444445,2023-03-02 00:31:27.720728,2023-03-02 00:31:28.116373,0 days 00:00:00.395645,0.22653805676015987,0.0918700694035487,,,,,,,,,,,,,,Bayes,,,,,,,,,,,,,,,,,,,,,,COMPLETE
1532,1532,0.8688888888888888,2023-03-02 00:31:27.828372,2023-03-02 00:31:28.218973,0 days 00:00:00.390601,0.2006775061438216,0.07624603954302338,,,,,,,,,,,,,,Bayes,,,,,,,,,,,,,,,,,,,,,,COMPLETE
1533,1533,0.8666666666666667,2023-03-02 00:31:27.851371,2023-03-02 00:31:28.232974,0 days 00:00:00.381603,0.9106195197768507,0.29127358976095674,,,,,,,,,,,,,,Bayes,,,,,,,,,,,,,,,,,,,,,,COMPLETE
1534,1534,0.8685185185185185,2023-03-02 00:31:27.899372,2023-03-02 00:31:28.301970,0 days 00:00:00.402598,0.01876734519561614,0.06772009335649035,,,,,,,,,,,,,,Bayes,,,,,,,,,,,,,,,,,,,,,,COMPLETE
1535,1535,0.8629629629629629,2023-03-02 00:31:27.913373,2023-03-02 00:31:28.288977,0 days 00:00:00.375604,0.6583671746480266,0.6684158313094843,,,,,,,,,,,,,,Bayes,,,,,,,,,,,,,,,,,,,,,,COMPLETE
1536,1536,0.8688888888888888,2023-03-02 00:31:27.970371,2023-03-02 00:31:28.354174,0 days 00:00:00.383803,0.6581631209832108,0.07175104480822235,,,,,,,,,,,,,,Bayes,,,,,,,,,,,,,,,,,,,,,,COMPLETE
1537,1537,0.8688888888888888,2023-03-02 00:31:28.122372,2023-03-02 00:31:28.417171,0 days 00:00:00.294799,0.02754162433294497,0.07129770143414371,,,,,,,,,,,,,,Bayes,,,,,,,,,,,,,,,,,,,,,,COMPLETE
1538,1538,0.8644444444444445,2023-03-02 00:31:28.221975,2023-03-02 00:31:28.512172,0 days 00:00:00.290197,0.023022728345654955,0.4035242336328958,,,,,,,,,,,,,,Bayes,,,,,,,,,,,,,,,,,,,,,,COMPLETE
1539,1539,0.8690740740740741,2023-03-02 00:31:28.243973,2023-03-02 00:31:28.541712,0 days 00:00:00.297739,0.3679682427241691,0.10037353986841267,,,,,,,,,,,,,,Bayes,,,,,,,,,,,,,,,,,,,,,,COMPLETE
1540,1540,0.8690740740740741,2023-03-02 00:31:28.291976,2023-03-02 00:31:28.584712,0 days 00:00:00.292736,0.37118689824592804,0.1000522448733185,,,,,,,,,,,,,,Bayes,,,,,,,,,,,,,,,,,,,,,,COMPLETE
1541,1541,0.8677777777777778,2023-03-02 00:31:28.305129,2023-03-02 00:31:28.603712,0 days 00:00:00.298583,0.00038690092870385245,0.1659968687008554,,,,,,,,,,,,,,Bayes,,,,,,,,,,,,,,,,,,,,,,COMPLETE
1542,1542,0.8690740740740741,2023-03-02 00:31:28.357172,2023-03-02 00:31:28.666235,0 days 00:00:00.309063,0.3637669072385851,0.10151018047498747,,,,,,,,,,,,,,Bayes,,,,,,,,,,,,,,,,,,,,,,COMPLETE
1543,1543,0.8690740740740741,2023-03-02 00:31:28.423171,2023-03-02 00:31:28.711234,0 days 00:00:00.288063,0.26090739802402485,0.11904555002556316,,,,,,,,,,,,,,Bayes,,,,,,,,,,,,,,,,,,,,,,COMPLETE
1544,1544,0.8642592592592593,2023-03-02 00:31:28.515713,2023-03-02 00:31:28.961393,0 days 00:00:00.445680,0.37186667280420055,0.43348256925831014,,,,,,,,,,,,,,Bayes,,,,,,,,,,,,,,,,,,,,,,COMPLETE
1545,1545,0.8664814814814814,2023-03-02 00:31:28.557713,2023-03-02 00:31:28.907394,0 days 00:00:00.349681,0.5665662884742785,0.2484993642907763,,,,,,,,,,,,,,Bayes,,,,,,,,,,,,,,,,,,,,,,COMPLETE
1546,1546,0.8685185185185185,2023-03-02 00:31:28.591715,2023-03-02 00:31:29.039392,0 days 00:00:00.447677,0.3352665496202209,0.041818595407277954,,,,,,,,,,,,,,Bayes,,,,,,,,,,,,,,,,,,,,,,COMPLETE
