,number,value,datetime_start,datetime_complete,duration,params_Bayes_prior_positive,params_Bayes_var_smoothing,params_GB_ccp_alpha,params_GB_criterion,params_GB_learning_rate,params_GB_loss,params_GB_max_depth,params_GB_max_features,params_GB_min_impurity_decrease,params_GB_min_samples_leaf,params_GB_min_samples_split,params_GB_n_estimators,params_GB_subsample,params_GB_tol,params_GB_validation_fraction,params_Method,params_SVM_C,params_SVM_coef0,params_SVM_decision_function_shape,params_SVM_degree,params_SVM_gamma,params_SVM_kernel,params_SVM_shrinking,params_SVM_tol,params_Tree_ccp_alpha,params_Tree_criterion,params_Tree_max_features,params_Tree_min_impurity_decrease,params_Tree_min_samples_leaf,params_Tree_min_samples_split,params_Tree_min_weight_fraction_leaf,params_Tree_splitter,params_kNN_algorithm,params_kNN_leaf_size,params_kNN_n_neighbors,params_kNN_p,params_kNN_weights,state
510,510,0.8675925925925927,2023-03-02 00:30:35.010703,2023-03-02 00:30:35.198870,0 days 00:00:00.188167,0.0844620915728794,0.17749917211353528,,,,,,,,,,,,,,Bayes,,,,,,,,,,,,,,,,,,,,,,COMPLETE
511,511,0.8664814814814814,2023-03-02 00:30:35.039873,2023-03-02 00:30:35.231873,0 days 00:00:00.192000,0.3170896289521583,0.2490081006377002,,,,,,,,,,,,,,Bayes,,,,,,,,,,,,,,,,,,,,,,COMPLETE
512,512,0.5,2023-03-02 00:30:35.061871,2023-03-02 00:30:35.311870,0 days 00:00:00.249999,,,,,,,,,,,,,,,,Tree,,,,,,,,,866.3977734632342,entropy,0.33818720858134776,713.6934303072205,0.45537950544634564,0.45494184315026615,0.4342177443653664,random,,,,,,COMPLETE
513,513,0.8627777777777779,2023-03-02 00:30:35.072871,2023-03-02 00:30:35.277871,0 days 00:00:00.205000,0.08104171123550521,0.6541383856940801,,,,,,,,,,,,,,Bayes,,,,,,,,,,,,,,,,,,,,,,COMPLETE
514,514,0.8633333333333334,2023-03-02 00:30:35.114873,2023-03-02 00:30:35.354871,0 days 00:00:00.239998,0.08330256022185906,0.527656932505085,,,,,,,,,,,,,,Bayes,,,,,,,,,,,,,,,,,,,,,,COMPLETE
515,515,0.5,2023-03-02 00:30:35.142871,2023-03-02 00:30:35.419872,0 days 00:00:00.277001,,,,,,,,,,,,,,,,Tree,,,,,,,,,734.442479562926,entropy,0.3375601461741337,373.3013838758857,0.3509452311137855,0.4306714899015657,0.49546317932154593,best,,,,,,COMPLETE
516,516,0.8629629629629629,2023-03-02 00:30:35.148874,2023-03-02 00:30:35.393871,0 days 00:00:00.244997,0.07711389781345768,0.6723077341463866,,,,,,,,,,,,,,Bayes,,,,,,,,,,,,,,,,,,,,,,COMPLETE
517,517,0.8681481481481481,2023-03-02 00:30:35.199871,2023-03-02 00:30:35.446871,0 days 00:00:00.247000,0.2878860922358132,0.06034230591029584,,,,,,,,,,,,,,Bayes,,,,,,,,,,,,,,,,,,,,,,COMPLETE
518,518,0.5,2023-03-02 00:30:35.209872,2023-03-02 00:30:35.481874,0 days 00:00:00.272002,,,,,,,,,,,,,,,,Tree,,,,,,,,,122.1706688340517,entropy,0.5247926453985086,416.4369453656001,0.4557368911965385,0.4496119822965749,0.3525634140256928,random,,,,,,COMPLETE
519,519,0.5,2023-03-02 00:30:35.236873,2023-03-02 00:30:35.500870,0 days 00:00:00.263997,,,,,,,,,,,,,,,,Tree,,,,,,,,,110.54516955762762,entropy,0.516648796195774,412.8214859440237,0.34143187775573214,0.45197422206690546,0.4990656608061709,best,,,,,,COMPLETE
520,520,0.5,2023-03-02 00:30:35.283873,2023-03-02 00:30:35.536337,0 days 00:00:00.252464,,,,,,,,,,,,,,,,Tree,,,,,,,,,450.9630194332934,entropy,0.5384164142829946,247.12559452596005,0.3434528867199138,0.4678207628596034,0.3462675333576779,random,,,,,,COMPLETE
521,521,0.8681481481481481,2023-03-02 00:30:35.313871,2023-03-02 00:30:35.534759,0 days 00:00:00.220888,0.28723255983117546,0.05810837879515883,,,,,,,,,,,,,,Bayes,,,,,,,,,,,,,,,,,,,,,,COMPLETE
522,522,0.8688888888888889,2023-03-02 00:30:35.357872,2023-03-02 00:30:35.582042,0 days 00:00:00.224170,0.12275372173096517,0.136013265352526,,,,,,,,,,,,,,Bayes,,,,,,,,,,,,,,,,,,,,,,COMPLETE
523,523,0.8688888888888888,2023-03-02 00:30:35.395874,2023-03-02 00:30:35.605041,0 days 00:00:00.209167,0.12244237198269901,0.08365647890342229,,,,,,,,,,,,,,Bayes,,,,,,,,,,,,,,,,,,,,,,COMPLETE
524,524,0.8688888888888888,2023-03-02 00:30:35.426870,2023-03-02 00:30:35.629042,0 days 00:00:00.202172,0.12643862012030516,0.08503474175699711,,,,,,,,,,,,,,Bayes,,,,,,,,,,,,,,,,,,,,,,COMPLETE
525,525,0.8633333333333334,2023-03-02 00:30:35.449873,2023-03-02 00:30:35.653043,0 days 00:00:00.203170,0.12588947601243286,0.5733125716167351,,,,,,,,,,,,,,Bayes,,,,,,,,,,,,,,,,,,,,,,COMPLETE
526,526,0.8688888888888889,2023-03-02 00:30:35.483873,2023-03-02 00:30:35.676043,0 days 00:00:00.192170,0.25649493436332127,0.1363269158459895,,,,,,,,,,,,,,Bayes,,,,,,,,,,,,,,,,,,,,,,COMPLETE
527,527,0.8635185185185185,2023-03-02 00:30:35.506872,2023-03-02 00:30:35.693041,0 days 00:00:00.186169,0.13313867990014197,0.5365736731251516,,,,,,,,,,,,,,Bayes,,,,,,,,,,,,,,,,,,,,,,COMPLETE
528,528,0.8662962962962963,2023-03-02 00:30:35.537930,2023-03-02 00:30:35.752044,0 days 00:00:00.214114,0.1195918054401408,0.32314182693398474,,,,,,,,,,,,,,Bayes,,,,,,,,,,,,,,,,,,,,,,COMPLETE
529,529,0.8692592592592593,2023-03-02 00:30:35.546043,2023-03-02 00:30:35.724043,0 days 00:00:00.178000,0.12956352978845795,0.0874723571482264,,,,,,,,,,,,,,Bayes,,,,,,,,,,,,,,,,,,,,,,COMPLETE
530,530,0.8625925925925927,2023-03-02 00:30:35.585042,2023-03-02 00:30:35.785626,0 days 00:00:00.200584,0.00011542389395332762,0.7847184777684917,,,,,,,,,,,,,,Bayes,,,,,,,,,,,,,,,,,,,,,,COMPLETE
531,531,0.8690740740740741,2023-03-02 00:30:35.607042,2023-03-02 00:30:35.802444,0 days 00:00:00.195402,0.2589282007473143,0.0021699576373913204,,,,,,,,,,,,,,Bayes,,,,,,,,,,,,,,,,,,,,,,COMPLETE
532,532,0.8690740740740741,2023-03-02 00:30:35.634043,2023-03-02 00:30:35.831057,0 days 00:00:00.197014,0.26364796699036275,0.00044070099358300974,,,,,,,,,,,,,,Bayes,,,,,,,,,,,,,,,,,,,,,,COMPLETE
533,533,0.8690740740740741,2023-03-02 00:30:35.656044,2023-03-02 00:30:35.855058,0 days 00:00:00.199014,0.2647624439966254,0.11558821577767495,,,,,,,,,,,,,,Bayes,,,,,,,,,,,,,,,,,,,,,,COMPLETE
534,534,0.8690740740740741,2023-03-02 00:30:35.680045,2023-03-02 00:30:35.871280,0 days 00:00:00.191235,0.394699867027787,0.11917445368103408,,,,,,,,,,,,,,Bayes,,,,,,,,,,,,,,,,,,,,,,COMPLETE
535,535,0.8690740740740741,2023-03-02 00:30:35.699041,2023-03-02 00:30:35.902928,0 days 00:00:00.203887,0.26030187252594095,0.11771612411195359,,,,,,,,,,,,,,Bayes,,,,,,,,,,,,,,,,,,,,,,COMPLETE
536,536,0.8690740740740741,2023-03-02 00:30:35.729042,2023-03-02 00:30:35.947928,0 days 00:00:00.218886,0.4062877185635565,0.11419546285193767,,,,,,,,,,,,,,Bayes,,,,,,,,,,,,,,,,,,,,,,COMPLETE
537,537,0.8690740740740741,2023-03-02 00:30:35.756042,2023-03-02 00:30:35.975379,0 days 00:00:00.219337,0.26662262563625977,0.11197847830853247,,,,,,,,,,,,,,Bayes,,,,,,,,,,,,,,,,,,,,,,COMPLETE
538,538,0.8688888888888889,2023-03-02 00:30:35.788624,2023-03-02 00:30:36.037162,0 days 00:00:00.248538,0.26305441067636903,0.03883884024763274,,,,,,,,,,,,,,Bayes,,,,,,,,,,,,,,,,,,,,,,COMPLETE
539,539,0.8688888888888889,2023-03-02 00:30:35.807725,2023-03-02 00:30:36.070465,0 days 00:00:00.262740,0.03983019565933889,0.03953452438045505,,,,,,,,,,,,,,Bayes,,,,,,,,,,,,,,,,,,,,,,COMPLETE
540,540,0.8638888888888889,2023-03-02 00:30:35.834060,2023-03-02 00:30:36.101981,0 days 00:00:00.267921,0.04784673892222788,0.4538465579453838,,,,,,,,,,,,,,Bayes,,,,,,,,,,,,,,,,,,,,,,COMPLETE
541,541,0.8648148148148148,2023-03-02 00:30:35.860195,2023-03-02 00:30:36.137982,0 days 00:00:00.277787,0.0473769812784294,0.3459776486508687,,,,,,,,,,,,,,Bayes,,,,,,,,,,,,,,,,,,,,,,COMPLETE
542,542,0.8688888888888889,2023-03-02 00:30:35.876280,2023-03-02 00:30:36.169982,0 days 00:00:00.293702,0.30345295544559,0.03863780059798586,,,,,,,,,,,,,,Bayes,,,,,,,,,,,,,,,,,,,,,,COMPLETE
543,543,0.6173148148148148,2023-03-02 00:30:35.905934,2023-03-02 00:30:36.410997,0 days 00:00:00.505063,,,,,,,,,,,,,,,,kNN,,,,,,,,,,,,,,,,,ball_tree,110.0,451.0,347.0,uniform,COMPLETE
544,544,0.8681481481481481,2023-03-02 00:30:35.953929,2023-03-02 00:30:36.276984,0 days 00:00:00.323055,0.040314322964549454,0.06331222311087337,,,,,,,,,,,,,,Bayes,,,,,,,,,,,,,,,,,,,,,,COMPLETE
545,545,0.3978703703703704,2023-03-02 00:30:35.980377,2023-03-02 00:30:36.460995,0 days 00:00:00.480618,,,,,,,,,,,,,,,,kNN,,,,,,,,,,,,,,,,,ball_tree,109.0,457.0,516.0,uniform,COMPLETE
546,546,0.5108333333333334,2023-03-02 00:30:36.042914,2023-03-02 00:30:36.481995,0 days 00:00:00.439081,,,,,,,,,,,,,,,,kNN,,,,,,,,,,,,,,,,,ball_tree,296.0,458.0,334.0,uniform,COMPLETE
547,547,0.590925925925926,2023-03-02 00:30:36.076464,2023-03-02 00:30:36.498994,0 days 00:00:00.422530,,,,,,,,,,,,,,,,kNN,,,,,,,,,,,,,,,,,ball_tree,84.0,441.0,324.0,uniform,COMPLETE
548,548,0.8685185185185185,2023-03-02 00:30:36.112984,2023-03-02 00:30:36.343995,0 days 00:00:00.231011,0.2220617317083228,0.06766042716989618,,,,,,,,,,,,,,Bayes,,,,,,,,,,,,,,,,,,,,,,COMPLETE
549,549,0.6237962962962962,2023-03-02 00:30:36.144983,2023-03-02 00:30:36.519995,0 days 00:00:00.375012,,,,,,,,,,,,,,,,kNN,,,,,,,,,,,,,,,,,ball_tree,93.0,439.0,321.0,uniform,COMPLETE
550,550,0.82,2023-03-02 00:30:36.177983,2023-03-02 00:30:36.439994,0 days 00:00:00.262011,,,,,,,,,,,,,,,,kNN,,,,,,,,,,,,,,,,,ball_tree,94.0,286.0,299.0,uniform,COMPLETE
551,551,0.5157407407407407,2023-03-02 00:30:36.279982,2023-03-02 00:30:36.598466,0 days 00:00:00.318484,,,,,,,,,,,,,,,,kNN,,,,,,,,,,,,,,,,,ball_tree,81.0,459.0,321.0,uniform,COMPLETE
552,552,0.8215740740740741,2023-03-02 00:30:36.346995,2023-03-02 00:30:36.567465,0 days 00:00:00.220470,,,,,,,,,,,,,,,,kNN,,,,,,,,,,,,,,,,,ball_tree,102.0,287.0,331.0,uniform,COMPLETE
553,553,0.8677777777777778,2023-03-02 00:30:36.413997,2023-03-02 00:30:36.548465,0 days 00:00:00.134468,0.1858678676253988,0.1638082507990144,,,,,,,,,,,,,,Bayes,,,,,,,,,,,,,,,,,,,,,,COMPLETE
554,554,0.8688888888888888,2023-03-02 00:30:36.441995,2023-03-02 00:30:36.610464,0 days 00:00:00.168469,0.34832440702174405,0.15821158935136848,,,,,,,,,,,,,,Bayes,,,,,,,,,,,,,,,,,,,,,,COMPLETE
555,555,0.867962962962963,2023-03-02 00:30:36.462994,2023-03-02 00:30:36.642465,0 days 00:00:00.179471,0.17871215269919394,0.20709187592615497,,,,,,,,,,,,,,Bayes,,,,,,,,,,,,,,,,,,,,,,COMPLETE
556,556,0.8633333333333333,2023-03-02 00:30:36.484994,2023-03-02 00:30:36.666465,0 days 00:00:00.181471,0.17967238389360496,0.5008650223924438,,,,,,,,,,,,,,Bayes,,,,,,,,,,,,,,,,,,,,,,COMPLETE
557,557,0.8694444444444445,2023-03-02 00:30:36.500997,2023-03-02 00:30:36.684468,0 days 00:00:00.183471,0.3394728440307171,0.08989416791089903,,,,,,,,,,,,,,Bayes,,,,,,,,,,,,,,,,,,,,,,COMPLETE
558,558,0.8694444444444445,2023-03-02 00:30:36.524463,2023-03-02 00:30:36.706464,0 days 00:00:00.182001,0.34232778595362723,0.09039305877183967,,,,,,,,,,,,,,Bayes,,,,,,,,,,,,,,,,,,,,,,COMPLETE
559,559,0.8635185185185186,2023-03-02 00:30:36.550465,2023-03-02 00:30:36.731465,0 days 00:00:00.181000,0.3465971325944551,0.4753244027339873,,,,,,,,,,,,,,Bayes,,,,,,,,,,,,,,,,,,,,,,COMPLETE
560,560,0.8692592592592593,2023-03-02 00:30:36.572466,2023-03-02 00:30:36.763478,0 days 00:00:00.191012,0.3384873162217973,0.09302441796646521,,,,,,,,,,,,,,Bayes,,,,,,,,,,,,,,,,,,,,,,COMPLETE
561,561,0.8688888888888889,2023-03-02 00:30:36.607465,2023-03-02 00:30:36.876476,0 days 00:00:00.269011,0.10125628383543413,0.08158094192655904,,,,,,,,,,,,,,Bayes,,,,,,,,,,,,,,,,,,,,,,COMPLETE
562,562,0.8688888888888888,2023-03-02 00:30:36.613465,2023-03-02 00:30:36.871477,0 days 00:00:00.258012,0.10224735166392883,0.07267220356258504,,,,,,,,,,,,,,Bayes,,,,,,,,,,,,,,,,,,,,,,COMPLETE
563,563,0.8614814814814815,2023-03-02 00:30:36.644465,2023-03-02 00:30:36.940476,0 days 00:00:00.296011,0.3832723796997935,0.918032854355251,,,,,,,,,,,,,,Bayes,,,,,,,,,,,,,,,,,,,,,,COMPLETE
564,564,0.8688888888888888,2023-03-02 00:30:36.668465,2023-03-02 00:30:36.957478,0 days 00:00:00.289013,0.10342588233968925,0.0741055221033797,,,,,,,,,,,,,,Bayes,,,,,,,,,,,,,,,,,,,,,,COMPLETE
565,565,0.8688888888888888,2023-03-02 00:30:36.686465,2023-03-02 00:30:37.002110,0 days 00:00:00.315645,0.30274760340869944,0.07199190619830093,,,,,,,,,,,,,,Bayes,,,,,,,,,,,,,,,,,,,,,,COMPLETE
566,566,0.8690740740740741,2023-03-02 00:30:36.711465,2023-03-02 00:30:37.048429,0 days 00:00:00.336964,0.3098074517984807,0.1433471472909946,,,,,,,,,,,,,,Bayes,,,,,,,,,,,,,,,,,,,,,,COMPLETE
567,567,0.8688888888888889,2023-03-02 00:30:36.732465,2023-03-02 00:30:37.070320,0 days 00:00:00.337855,0.6054780279168058,0.14016107651592105,,,,,,,,,,,,,,Bayes,,,,,,,,,,,,,,,,,,,,,,COMPLETE
568,568,0.8688888888888889,2023-03-02 00:30:36.765477,2023-03-02 00:30:37.102321,0 days 00:00:00.336844,0.31182376457272537,0.13915706930111815,,,,,,,,,,,,,,Bayes,,,,,,,,,,,,,,,,,,,,,,COMPLETE
569,569,0.5,2023-03-02 00:30:36.878477,2023-03-02 00:30:37.021107,0 days 00:00:00.142630,,,,,,,,,,,,,,,,SVM,87.2467752260655,-23.782791157095428,ovo,57.0,auto,poly,True,0.5909865661240763,,,,,,,,,,,,,,COMPLETE
570,570,0.5,2023-03-02 00:30:36.884477,2023-03-02 00:30:37.012108,0 days 00:00:00.127631,,,,,,,,,,,,,,,,SVM,89.74196080073528,-23.456350071479154,ovo,59.0,scale,poly,True,0.8723566691035692,,,,,,,,,,,,,,COMPLETE
571,571,0.8692592592592593,2023-03-02 00:30:36.944479,2023-03-02 00:30:37.170318,0 days 00:00:00.225839,0.3094019221140515,0.09928594676345329,,,,,,,,,,,,,,Bayes,,,,,,,,,,,,,,,,,,,,,,COMPLETE
572,572,0.8690740740740741,2023-03-02 00:30:36.967477,2023-03-02 00:30:37.160318,0 days 00:00:00.192841,0.29796966471974057,0.10190841484837697,,,,,,,,,,,,,,Bayes,,,,,,,,,,,,,,,,,,,,,,COMPLETE
573,573,0.8668518518518519,2023-03-02 00:30:37.007108,2023-03-02 00:30:37.207319,0 days 00:00:00.200211,0.24232647539250612,0.3102531287233535,,,,,,,,,,,,,,Bayes,,,,,,,,,,,,,,,,,,,,,,COMPLETE
574,574,0.8666666666666667,2023-03-02 00:30:37.022108,2023-03-02 00:30:37.210320,0 days 00:00:00.188212,0.22866697690844157,0.31742419563485613,,,,,,,,,,,,,,Bayes,,,,,,,,,,,,,,,,,,,,,,COMPLETE
575,575,0.8681481481481481,2023-03-02 00:30:37.031107,2023-03-02 00:30:37.247320,0 days 00:00:00.216213,0.15269418374592447,0.05349546280158577,,,,,,,,,,,,,,Bayes,,,,,,,,,,,,,,,,,,,,,,COMPLETE
576,576,0.8631481481481482,2023-03-02 00:30:37.051081,2023-03-02 00:30:37.223317,0 days 00:00:00.172236,0.23001905481615517,0.6194892889995125,,,,,,,,,,,,,,Bayes,,,,,,,,,,,,,,,,,,,,,,COMPLETE
577,577,0.8690740740740741,2023-03-02 00:30:37.072319,2023-03-02 00:30:37.268318,0 days 00:00:00.195999,0.23607508297857754,0.10267344053307133,,,,,,,,,,,,,,Bayes,,,,,,,,,,,,,,,,,,,,,,COMPLETE
578,578,0.864074074074074,2023-03-02 00:30:37.104318,2023-03-02 00:30:37.300318,0 days 00:00:00.196000,0.0303541726342118,0.44119637170113063,,,,,,,,,,,,,,Bayes,,,,,,,,,,,,,,,,,,,,,,COMPLETE
579,579,0.867962962962963,2023-03-02 00:30:37.164321,2023-03-02 00:30:37.362319,0 days 00:00:00.197998,0.22852147854816404,0.19024063289719584,,,,,,,,,,,,,,Bayes,,,,,,,,,,,,,,,,,,,,,,COMPLETE
580,580,0.867962962962963,2023-03-02 00:30:37.172318,2023-03-02 00:30:37.376318,0 days 00:00:00.204000,0.23708049318013613,0.193919838212936,,,,,,,,,,,,,,Bayes,,,,,,,,,,,,,,,,,,,,,,COMPLETE
581,581,0.8690740740740741,2023-03-02 00:30:37.212320,2023-03-02 00:30:37.406918,0 days 00:00:00.194598,0.15142720094398612,0.12880259805394367,,,,,,,,,,,,,,Bayes,,,,,,,,,,,,,,,,,,,,,,COMPLETE
582,582,0.8642592592592593,2023-03-02 00:30:37.219318,2023-03-02 00:30:37.405916,0 days 00:00:00.186598,0.018751097024609132,0.409813655278758,,,,,,,,,,,,,,Bayes,,,,,,,,,,,,,,,,,,,,,,COMPLETE
583,583,0.8601851851851852,2023-03-02 00:30:37.225321,2023-03-02 00:30:37.441916,0 days 00:00:00.216595,0.06108469789278732,0.9928343824930521,,,,,,,,,,,,,,Bayes,,,,,,,,,,,,,,,,,,,,,,COMPLETE
584,584,0.8666666666666667,2023-03-02 00:30:37.251318,2023-03-02 00:30:37.433917,0 days 00:00:00.182599,0.028720410855016396,0.2913737356953201,,,,,,,,,,,,,,Bayes,,,,,,,,,,,,,,,,,,,,,,COMPLETE
585,585,0.8683333333333334,2023-03-02 00:30:37.271322,2023-03-02 00:30:37.460916,0 days 00:00:00.189594,0.284168462448912,0.05050800758175406,,,,,,,,,,,,,,Bayes,,,,,,,,,,,,,,,,,,,,,,COMPLETE
586,586,0.8681481481481481,2023-03-02 00:30:37.301319,2023-03-02 00:30:37.491916,0 days 00:00:00.190597,0.285144732875812,0.053389538288997514,,,,,,,,,,,,,,Bayes,,,,,,,,,,,,,,,,,,,,,,COMPLETE
587,587,0.8690740740740741,2023-03-02 00:30:37.366320,2023-03-02 00:30:37.577063,0 days 00:00:00.210743,0.14843894596714058,0.018443070101784517,,,,,,,,,,,,,,Bayes,,,,,,,,,,,,,,,,,,,,,,COMPLETE
588,588,0.8648148148148147,2023-03-02 00:30:37.381318,2023-03-02 00:30:37.594063,0 days 00:00:00.212745,0.06335680781733456,0.3863568113775948,,,,,,,,,,,,,,Bayes,,,,,,,,,,,,,,,,,,,,,,COMPLETE
589,589,0.8622222222222222,2023-03-02 00:30:37.407918,2023-03-02 00:30:37.614063,0 days 00:00:00.206145,0.06527307819992109,0.8321328685888869,,,,,,,,,,,,,,Bayes,,,,,,,,,,,,,,,,,,,,,,COMPLETE
590,590,0.8687037037037038,2023-03-02 00:30:37.413917,2023-03-02 00:30:37.633065,0 days 00:00:00.219148,0.4196361462024223,0.08264512404541867,,,,,,,,,,,,,,Bayes,,,,,,,,,,,,,,,,,,,,,,COMPLETE
591,591,0.8688888888888889,2023-03-02 00:30:37.437917,2023-03-02 00:30:37.688065,0 days 00:00:00.250148,0.2835681283142292,0.08151495206538081,,,,,,,,,,,,,,Bayes,,,,,,,,,,,,,,,,,,,,,,COMPLETE
592,592,0.8635185185185186,2023-03-02 00:30:37.444917,2023-03-02 00:30:37.663064,0 days 00:00:00.218147,0.2835380598769236,0.48753630675070986,,,,,,,,,,,,,,Bayes,,,,,,,,,,,,,,,,,,,,,,COMPLETE
593,593,0.5,2023-03-02 00:30:37.462917,2023-03-02 00:30:38.761053,0 days 00:00:01.298136,,,645.2507460590548,friedman_mse,4.9292440881353,deviance,22.0,0.8806970096251866,457.1047764475559,0.3995479844518264,0.351601291942611,330.0,0.5531331775780677,0.2137206121247704,0.767367329598491,Gradient Boosting,,,,,,,,,,,,,,,,,,,,,,COMPLETE
594,594,0.8688888888888888,2023-03-02 00:30:37.494917,2023-03-02 00:30:37.728064,0 days 00:00:00.233147,0.2088584654020006,0.08340633460550255,,,,,,,,,,,,,,Bayes,,,,,,,,,,,,,,,,,,,,,,COMPLETE
595,595,0.5,2023-03-02 00:30:37.583066,2023-03-02 00:30:39.166059,0 days 00:00:01.582993,,,609.220390479807,friedman_mse,4.996544503977814,deviance,22.0,0.844276135839468,470.9778427203314,0.3932411748840983,0.33418113206565553,365.0,0.5861734668581773,0.21183893661415615,0.7456591114632065,Gradient Boosting,,,,,,,,,,,,,,,,,,,,,,COMPLETE
596,596,0.8690740740740741,2023-03-02 00:30:37.598064,2023-03-02 00:30:37.842066,0 days 00:00:00.244002,0.2101203046771753,0.11521343491245056,,,,,,,,,,,,,,Bayes,,,,,,,,,,,,,,,,,,,,,,COMPLETE
597,597,0.8664814814814814,2023-03-02 00:30:37.620063,2023-03-02 00:30:37.867062,0 days 00:00:00.246999,0.20995985585846494,0.2688418302128004,,,,,,,,,,,,,,Bayes,,,,,,,,,,,,,,,,,,,,,,COMPLETE
598,598,0.8690740740740741,2023-03-02 00:30:37.641062,2023-03-02 00:30:37.906063,0 days 00:00:00.265001,0.16825298266756256,0.12096418333369732,,,,,,,,,,,,,,Bayes,,,,,,,,,,,,,,,,,,,,,,COMPLETE
599,599,0.5,2023-03-02 00:30:37.668062,2023-03-02 00:30:39.376601,0 days 00:00:01.708539,,,643.0928962918921,friedman_mse,4.54459852879105,deviance,24.0,0.8763057684248602,530.3508236801705,0.39454316602796746,0.30735209827088866,359.0,0.5801371597519291,0.1988791793448917,0.7649853206026136,Gradient Boosting,,,,,,,,,,,,,,,,,,,,,,COMPLETE
600,600,0.8690740740740741,2023-03-02 00:30:37.692062,2023-03-02 00:30:37.977789,0 days 00:00:00.285727,0.2094738191962845,0.11998828484511899,,,,,,,,,,,,,,Bayes,,,,,,,,,,,,,,,,,,,,,,COMPLETE
601,601,0.5,2023-03-02 00:30:37.734062,2023-03-02 00:30:39.319601,0 days 00:00:01.585539,,,629.7796417392713,friedman_mse,4.85705352109346,deviance,23.0,0.8027861298083852,459.84530516621646,0.4081270080264411,0.3443102786220367,333.0,0.5694332941767895,0.22305980923839452,0.7612993373663819,Gradient Boosting,,,,,,,,,,,,,,,,,,,,,,COMPLETE
602,602,0.866111111111111,2023-03-02 00:30:37.847063,2023-03-02 00:30:38.180447,0 days 00:00:00.333384,0.0006708147875058822,0.32674311011051016,,,,,,,,,,,,,,Bayes,,,,,,,,,,,,,,,,,,,,,,COMPLETE
603,603,0.5,2023-03-02 00:30:37.869064,2023-03-02 00:30:39.422600,0 days 00:00:01.553536,,,639.4232281835929,friedman_mse,4.5198207169465325,deviance,23.0,0.8755166987750977,449.2325895145591,0.4001637093362814,0.30950567102182075,352.0,0.539131132586551,0.3132631723995549,0.7766152021514053,Gradient Boosting,,,,,,,,,,,,,,,,,,,,,,COMPLETE
604,604,0.5,2023-03-02 00:30:37.909066,2023-03-02 00:30:39.568600,0 days 00:00:01.659534,,,608.3187657392085,friedman_mse,4.66661413132257,deviance,23.0,0.8374098527959908,451.9223977154316,0.4128076496866656,0.3221510169831062,356.0,0.6235462854238486,0.25371526787167653,0.78329831826918,Gradient Boosting,,,,,,,,,,,,,,,,,,,,,,COMPLETE
605,605,0.5,2023-03-02 00:30:37.981787,2023-03-02 00:30:39.614720,0 days 00:00:01.632933,,,631.5717842466171,friedman_mse,4.728785501473117,deviance,23.0,0.8673684586151722,443.7203763635664,0.4082411977006232,0.29313979094560505,357.0,0.5457348193548515,0.27283701405655786,0.7494494641365479,Gradient Boosting,,,,,,,,,,,,,,,,,,,,,,COMPLETE
606,606,0.8692592592592593,2023-03-02 00:30:38.184448,2023-03-02 00:30:38.614534,0 days 00:00:00.430086,0.38710039392478934,0.09736650537745532,,,,,,,,,,,,,,Bayes,,,,,,,,,,,,,,,,,,,,,,COMPLETE
607,607,0.5,2023-03-02 00:30:38.622534,2023-03-02 00:30:39.707719,0 days 00:00:01.085185,,,186.0631331564299,friedman_mse,4.752922822238613,deviance,35.0,0.7810136227290226,751.9915708089486,0.3443506589777162,0.2838103671692042,119.0,0.6671570736906708,0.37422217874608016,0.8581290518529746,Gradient Boosting,,,,,,,,,,,,,,,,,,,,,,COMPLETE
608,608,0.8683333333333333,2023-03-02 00:30:38.777052,2023-03-02 00:30:39.156046,0 days 00:00:00.378994,0.10401730036162653,0.06629495410584978,,,,,,,,,,,,,,Bayes,,,,,,,,,,,,,,,,,,,,,,COMPLETE
609,609,0.8690740740740741,2023-03-02 00:30:39.162047,2023-03-02 00:30:39.514601,0 days 00:00:00.352554,0.3239668250018953,0.02651725778306148,,,,,,,,,,,,,,Bayes,,,,,,,,,,,,,,,,,,,,,,COMPLETE
610,610,0.8633333333333333,2023-03-02 00:30:39.171061,2023-03-02 00:30:39.504600,0 days 00:00:00.333539,0.3303438503801596,0.6968129208099603,,,,,,,,,,,,,,Bayes,,,,,,,,,,,,,,,,,,,,,,COMPLETE
611,611,0.8666666666666666,2023-03-02 00:30:39.328602,2023-03-02 00:30:39.636719,0 days 00:00:00.308117,0.3169278133337774,0.2803207121014717,,,,,,,,,,,,,,Bayes,,,,,,,,,,,,,,,,,,,,,,COMPLETE
