,number,value,datetime_start,datetime_complete,duration,params_Bayes_prior_positive,params_Bayes_var_smoothing,params_GB_ccp_alpha,params_GB_criterion,params_GB_learning_rate,params_GB_loss,params_GB_max_depth,params_GB_max_features,params_GB_min_impurity_decrease,params_GB_min_samples_leaf,params_GB_min_samples_split,params_GB_n_estimators,params_GB_subsample,params_GB_tol,params_GB_validation_fraction,params_Method,params_SVM_C,params_SVM_coef0,params_SVM_decision_function_shape,params_SVM_degree,params_SVM_gamma,params_SVM_kernel,params_SVM_shrinking,params_SVM_tol,params_Tree_ccp_alpha,params_Tree_criterion,params_Tree_max_features,params_Tree_min_impurity_decrease,params_Tree_min_samples_leaf,params_Tree_min_samples_split,params_Tree_min_weight_fraction_leaf,params_Tree_splitter,params_kNN_algorithm,params_kNN_leaf_size,params_kNN_n_neighbors,params_kNN_p,params_kNN_weights,state
1237,1237,0.8690740740740741,2023-03-02 00:31:08.865742,2023-03-02 00:31:09.242670,0 days 00:00:00.376928,0.6945752150508886,0.14425050551701565,,,,,,,,,,,,,,Bayes,,,,,,,,,,,,,,,,,,,,,,COMPLETE
1238,1238,0.8690740740740741,2023-03-02 00:31:08.989395,2023-03-02 00:31:09.267670,0 days 00:00:00.278275,0.5507702442696137,0.1552016717886122,,,,,,,,,,,,,,Bayes,,,,,,,,,,,,,,,,,,,,,,COMPLETE
1239,1239,0.8677777777777778,2023-03-02 00:31:09.018658,2023-03-02 00:31:09.308671,0 days 00:00:00.290013,0.5479879842267774,0.16900390831867232,,,,,,,,,,,,,,Bayes,,,,,,,,,,,,,,,,,,,,,,COMPLETE
1240,1240,0.8688888888888888,2023-03-02 00:31:09.046657,2023-03-02 00:31:09.339670,0 days 00:00:00.293013,0.46218965561181186,0.15680943616279502,,,,,,,,,,,,,,Bayes,,,,,,,,,,,,,,,,,,,,,,COMPLETE
1241,1241,0.8668518518518519,2023-03-02 00:31:09.056657,2023-03-02 00:31:09.340670,0 days 00:00:00.284013,0.008468100984676883,0.3129252946162016,,,,,,,,,,,,,,Bayes,,,,,,,,,,,,,,,,,,,,,,COMPLETE
1242,1242,0.8633333333333334,2023-03-02 00:31:09.191657,2023-03-02 00:31:09.483671,0 days 00:00:00.292014,0.0013846015267716533,0.5320956969936438,,,,,,,,,,,,,,Bayes,,,,,,,,,,,,,,,,,,,,,,COMPLETE
1243,1243,0.8687037037037038,2023-03-02 00:31:09.212657,2023-03-02 00:31:09.511868,0 days 00:00:00.299211,0.01197184099320499,0.03495592733736538,,,,,,,,,,,,,,Bayes,,,,,,,,,,,,,,,,,,,,,,COMPLETE
1244,1244,0.867037037037037,2023-03-02 00:31:09.246669,2023-03-02 00:31:09.536346,0 days 00:00:00.289677,0.019740573709337975,0.22254852330756852,,,,,,,,,,,,,,Bayes,,,,,,,,,,,,,,,,,,,,,,COMPLETE
1245,1245,0.8685185185185186,2023-03-02 00:31:09.257670,2023-03-02 00:31:09.563346,0 days 00:00:00.305676,0.7224471153024379,0.04675630505725066,,,,,,,,,,,,,,Bayes,,,,,,,,,,,,,,,,,,,,,,COMPLETE
1246,1246,0.8638888888888889,2023-03-02 00:31:09.282671,2023-03-02 00:31:09.566345,0 days 00:00:00.283674,0.015687117704712636,0.44841373999688,,,,,,,,,,,,,,Bayes,,,,,,,,,,,,,,,,,,,,,,COMPLETE
1247,1247,0.8646296296296296,2023-03-02 00:31:09.313670,2023-03-02 00:31:09.597353,0 days 00:00:00.283683,0.0004374738142048605,0.42067224440845213,,,,,,,,,,,,,,Bayes,,,,,,,,,,,,,,,,,,,,,,COMPLETE
1248,1248,0.8640740740740741,2023-03-02 00:31:09.343670,2023-03-02 00:31:09.652370,0 days 00:00:00.308700,0.35228071316605514,0.4116102778052959,,,,,,,,,,,,,,Bayes,,,,,,,,,,,,,,,,,,,,,,COMPLETE
1249,1249,0.8685185185185185,2023-03-02 00:31:09.352674,2023-03-02 00:31:09.640369,0 days 00:00:00.287695,0.0608470835063758,0.04155166495267072,,,,,,,,,,,,,,Bayes,,,,,,,,,,,,,,,,,,,,,,COMPLETE
1250,1250,0.8664814814814814,2023-03-02 00:31:09.485672,2023-03-02 00:31:09.867954,0 days 00:00:00.382282,0.8364698736497864,0.2685737799261271,,,,,,,,,,,,,,Bayes,,,,,,,,,,,,,,,,,,,,,,COMPLETE
1251,1251,0.8622222222222222,2023-03-02 00:31:09.515355,2023-03-02 00:31:09.883957,0 days 00:00:00.368602,0.05666010487144199,0.8091139598886419,,,,,,,,,,,,,,Bayes,,,,,,,,,,,,,,,,,,,,,,COMPLETE
1252,1252,0.8694444444444445,2023-03-02 00:31:09.539348,2023-03-02 00:31:09.928954,0 days 00:00:00.389606,0.06323404200507164,0.08788139434920005,,,,,,,,,,,,,,Bayes,,,,,,,,,,,,,,,,,,,,,,COMPLETE
1253,1253,0.8692592592592593,2023-03-02 00:31:09.568348,2023-03-02 00:31:09.940955,0 days 00:00:00.372607,0.3524207737224121,0.08777566021296662,,,,,,,,,,,,,,Bayes,,,,,,,,,,,,,,,,,,,,,,COMPLETE
1254,1254,0.8694444444444445,2023-03-02 00:31:09.581346,2023-03-02 00:31:09.960968,0 days 00:00:00.379622,0.059936637995676764,0.08945259428956141,,,,,,,,,,,,,,Bayes,,,,,,,,,,,,,,,,,,,,,,COMPLETE
1255,1255,0.8633333333333334,2023-03-02 00:31:09.607346,2023-03-02 00:31:09.926954,0 days 00:00:00.319608,0.9040126176083472,0.7063385651181211,,,,,,,,,,,,,,Bayes,,,,,,,,,,,,,,,,,,,,,,COMPLETE
1256,1256,0.8635185185185186,2023-03-02 00:31:09.643372,2023-03-02 00:31:10.019769,0 days 00:00:00.376397,0.4439299470266552,0.7140513097295855,,,,,,,,,,,,,,Bayes,,,,,,,,,,,,,,,,,,,,,,COMPLETE
1257,1257,0.8692592592592593,2023-03-02 00:31:09.655370,2023-03-02 00:31:10.038965,0 days 00:00:00.383595,0.3099056534141991,0.08775657433396952,,,,,,,,,,,,,,Bayes,,,,,,,,,,,,,,,,,,,,,,COMPLETE
1258,1258,0.8692592592592592,2023-03-02 00:31:09.870957,2023-03-02 00:31:10.174457,0 days 00:00:00.303500,0.8005595092379394,0.12575811800711292,,,,,,,,,,,,,,Bayes,,,,,,,,,,,,,,,,,,,,,,COMPLETE
1259,1259,0.8690740740740741,2023-03-02 00:31:09.892954,2023-03-02 00:31:10.176456,0 days 00:00:00.283502,0.19238004943932116,0.11790147914550188,,,,,,,,,,,,,,Bayes,,,,,,,,,,,,,,,,,,,,,,COMPLETE
1260,1260,0.8624074074074074,2023-03-02 00:31:09.930954,2023-03-02 00:31:10.253457,0 days 00:00:00.322503,0.3087278858734704,0.7925719604411827,,,,,,,,,,,,,,Bayes,,,,,,,,,,,,,,,,,,,,,,COMPLETE
1261,1261,0.8664814814814814,2023-03-02 00:31:09.941954,2023-03-02 00:31:10.215458,0 days 00:00:00.273504,0.3107762125267121,0.278467055471439,,,,,,,,,,,,,,Bayes,,,,,,,,,,,,,,,,,,,,,,COMPLETE
1262,1262,0.8690740740740741,2023-03-02 00:31:09.952955,2023-03-02 00:31:10.251459,0 days 00:00:00.298504,0.3046514280765759,0.12166973378181746,,,,,,,,,,,,,,Bayes,,,,,,,,,,,,,,,,,,,,,,COMPLETE
1263,1263,0.8690740740740741,2023-03-02 00:31:09.968967,2023-03-02 00:31:10.274457,0 days 00:00:00.305490,0.30809345759509654,0.12214558285812574,,,,,,,,,,,,,,Bayes,,,,,,,,,,,,,,,,,,,,,,COMPLETE
1264,1264,0.8690740740740741,2023-03-02 00:31:10.022402,2023-03-02 00:31:10.319363,0 days 00:00:00.296961,0.23902512260324008,0.12013177985738324,,,,,,,,,,,,,,Bayes,,,,,,,,,,,,,,,,,,,,,,COMPLETE
1265,1265,0.8690740740740741,2023-03-02 00:31:10.042968,2023-03-02 00:31:10.346362,0 days 00:00:00.303394,0.10287954877684093,0.12772590877329296,,,,,,,,,,,,,,Bayes,,,,,,,,,,,,,,,,,,,,,,COMPLETE
1266,1266,0.8683333333333333,2023-03-02 00:31:10.177460,2023-03-02 00:31:10.476378,0 days 00:00:00.298918,0.3129110398797967,0.06608198997198596,,,,,,,,,,,,,,Bayes,,,,,,,,,,,,,,,,,,,,,,COMPLETE
1267,1267,0.8683333333333333,2023-03-02 00:31:10.187459,2023-03-02 00:31:10.480375,0 days 00:00:00.292916,0.236510857440564,0.0664015897947969,,,,,,,,,,,,,,Bayes,,,,,,,,,,,,,,,,,,,,,,COMPLETE
1268,1268,0.867962962962963,2023-03-02 00:31:10.222457,2023-03-02 00:31:10.499375,0 days 00:00:00.276918,0.23560170530838553,0.2068733999402853,,,,,,,,,,,,,,Bayes,,,,,,,,,,,,,,,,,,,,,,COMPLETE
1269,1269,0.8688888888888888,2023-03-02 00:31:10.254458,2023-03-02 00:31:10.634370,0 days 00:00:00.379912,0.23672712431157325,0.07213229472171814,,,,,,,,,,,,,,Bayes,,,,,,,,,,,,,,,,,,,,,,COMPLETE
1270,1270,0.860925925925926,2023-03-02 00:31:10.266456,2023-03-02 00:31:10.662372,0 days 00:00:00.395916,0.3920531242869285,0.9690271350103893,,,,,,,,,,,,,,Bayes,,,,,,,,,,,,,,,,,,,,,,COMPLETE
1271,1271,0.8668518518518519,2023-03-02 00:31:10.277458,2023-03-02 00:31:10.693368,0 days 00:00:00.415910,0.81688643607717,0.23655526841858343,,,,,,,,,,,,,,Bayes,,,,,,,,,,,,,,,,,,,,,,COMPLETE
1272,1272,0.8683333333333333,2023-03-02 00:31:10.322364,2023-03-02 00:31:10.726369,0 days 00:00:00.404005,0.2149031218697776,0.06601434794870115,,,,,,,,,,,,,,Bayes,,,,,,,,,,,,,,,,,,,,,,COMPLETE
1273,1273,0.8633333333333333,2023-03-02 00:31:10.349364,2023-03-02 00:31:10.779370,0 days 00:00:00.430006,0.3771846088260099,0.48301072937742623,,,,,,,,,,,,,,Bayes,,,,,,,,,,,,,,,,,,,,,,COMPLETE
1274,1274,0.8690740740740741,2023-03-02 00:31:10.481375,2023-03-02 00:31:11.072869,0 days 00:00:00.591494,0.17087152995309846,0.10009511046523127,,,,,,,,,,,,,,Bayes,,,,,,,,,,,,,,,,,,,,,,COMPLETE
1275,1275,0.8692592592592593,2023-03-02 00:31:10.487375,2023-03-02 00:31:11.071868,0 days 00:00:00.584493,0.16341024484607308,0.014709582797100357,,,,,,,,,,,,,,Bayes,,,,,,,,,,,,,,,,,,,,,,COMPLETE
1276,1276,0.5,2023-03-02 00:31:10.509375,2023-03-02 00:31:10.890920,0 days 00:00:00.381545,,,,,,,,,,,,,,,,SVM,80.21442847552619,99.82632369010909,ovo,,scale,sigmoid,True,0.41523868911477485,,,,,,,,,,,,,,COMPLETE
1277,1277,0.5,2023-03-02 00:31:10.638371,2023-03-02 00:31:10.953796,0 days 00:00:00.315425,,,,,,,,,,,,,,,,SVM,51.52470913364698,-49.75178453883152,ovo,,scale,sigmoid,True,0.005917611763902375,,,,,,,,,,,,,,COMPLETE
1278,1278,0.5,2023-03-02 00:31:10.669371,2023-03-02 00:31:10.998403,0 days 00:00:00.329032,,,,,,,,,,,,,,,,SVM,99.37422165651452,-50.627966599153936,ovo,,scale,sigmoid,True,0.4244989460961683,,,,,,,,,,,,,,COMPLETE
1279,1279,0.8646296296296296,2023-03-02 00:31:10.703370,2023-03-02 00:31:11.258869,0 days 00:00:00.555499,0.2036587837529437,0.42549229340816136,,,,,,,,,,,,,,Bayes,,,,,,,,,,,,,,,,,,,,,,COMPLETE
1280,1280,0.5,2023-03-02 00:31:10.728372,2023-03-02 00:31:11.043879,0 days 00:00:00.315507,,,,,,,,,,,,,,,,SVM,99.57417428378693,-44.014768352642584,ovo,,scale,sigmoid,True,0.47852005403484016,,,,,,,,,,,,,,COMPLETE
1281,1281,0.5,2023-03-02 00:31:10.783369,2023-03-02 00:31:11.073869,0 days 00:00:00.290500,,,,,,,,,,,,,,,,SVM,63.556508795750325,97.51283940888598,ovo,,scale,sigmoid,True,0.48550249763673486,,,,,,,,,,,,,,COMPLETE
1282,1282,0.8692592592592593,2023-03-02 00:31:10.893807,2023-03-02 00:31:11.334870,0 days 00:00:00.441063,0.1617999645930746,0.09605205572611374,,,,,,,,,,,,,,Bayes,,,,,,,,,,,,,,,,,,,,,,COMPLETE
1283,1283,0.8664814814814815,2023-03-02 00:31:10.956795,2023-03-02 00:31:11.362870,0 days 00:00:00.406075,0.0927926117197792,0.24206053009722467,,,,,,,,,,,,,,Bayes,,,,,,,,,,,,,,,,,,,,,,COMPLETE
1284,1284,0.8692592592592593,2023-03-02 00:31:11.008403,2023-03-02 00:31:11.391869,0 days 00:00:00.383466,0.15935090979861397,0.09306296277378093,,,,,,,,,,,,,,Bayes,,,,,,,,,,,,,,,,,,,,,,COMPLETE
1285,1285,0.8694444444444445,2023-03-02 00:31:11.046870,2023-03-02 00:31:11.433870,0 days 00:00:00.387000,0.16068403746562698,0.0956087384137555,,,,,,,,,,,,,,Bayes,,,,,,,,,,,,,,,,,,,,,,COMPLETE
1286,1286,0.864074074074074,2023-03-02 00:31:11.074869,2023-03-02 00:31:11.481868,0 days 00:00:00.406999,0.8906675460314265,0.4628984149965394,,,,,,,,,,,,,,Bayes,,,,,,,,,,,,,,,,,,,,,,COMPLETE
1287,1287,0.8692592592592593,2023-03-02 00:31:11.085871,2023-03-02 00:31:11.503871,0 days 00:00:00.418000,0.42928405575917244,0.09795600216985526,,,,,,,,,,,,,,Bayes,,,,,,,,,,,,,,,,,,,,,,COMPLETE
1288,1288,0.8692592592592593,2023-03-02 00:31:11.095871,2023-03-02 00:31:11.463868,0 days 00:00:00.367997,0.7495977153829528,0.09808181563008095,,,,,,,,,,,,,,Bayes,,,,,,,,,,,,,,,,,,,,,,COMPLETE
1289,1289,0.8685185185185186,2023-03-02 00:31:11.261869,2023-03-02 00:31:11.593956,0 days 00:00:00.332087,0.49100434864945763,0.04694042225802886,,,,,,,,,,,,,,Bayes,,,,,,,,,,,,,,,,,,,,,,COMPLETE
1290,1290,0.8633333333333334,2023-03-02 00:31:11.336868,2023-03-02 00:31:11.703955,0 days 00:00:00.367087,0.09533708630097956,0.5719017638426124,,,,,,,,,,,,,,Bayes,,,,,,,,,,,,,,,,,,,,,,COMPLETE
1291,1291,0.8631481481481482,2023-03-02 00:31:11.365869,2023-03-02 00:31:11.742956,0 days 00:00:00.377087,0.335662625531304,0.6195575153996558,,,,,,,,,,,,,,Bayes,,,,,,,,,,,,,,,,,,,,,,COMPLETE
1292,1292,0.865,2023-03-02 00:31:11.394871,2023-03-02 00:31:11.763955,0 days 00:00:00.369084,0.3450848683577579,0.36298164626802465,,,,,,,,,,,,,,Bayes,,,,,,,,,,,,,,,,,,,,,,COMPLETE
1293,1293,0.5,2023-03-02 00:31:11.436871,2023-03-02 00:31:11.936957,0 days 00:00:00.500086,,,,,,,,,,,,,,,,Tree,,,,,,,,,229.58470575015212,gini,0.059194454478912695,271.32570756735333,0.29373569295295276,0.9389637867239271,0.2388694272211817,best,,,,,,COMPLETE
1294,1294,0.8664814814814814,2023-03-02 00:31:11.469869,2023-03-02 00:31:12.010889,0 days 00:00:00.541020,0.12328302147695236,0.26965785198703596,,,,,,,,,,,,,,Bayes,,,,,,,,,,,,,,,,,,,,,,COMPLETE
1295,1295,0.5,2023-03-02 00:31:11.484869,2023-03-02 00:31:12.000887,0 days 00:00:00.516018,,,,,,,,,,,,,,,,Tree,,,,,,,,,689.0016008266593,gini,0.04211064981670021,279.6444007152547,0.3055139240641434,0.06288223381880631,0.298102464401976,best,,,,,,COMPLETE
1296,1296,0.5,2023-03-02 00:31:11.518869,2023-03-02 00:31:12.026887,0 days 00:00:00.508018,,,,,,,,,,,,,,,,Tree,,,,,,,,,797.9596429554651,gini,0.04968000434040876,362.0735804701152,0.30755497095537404,0.6591481518694757,0.3056989263590781,best,,,,,,COMPLETE
1297,1297,0.8690740740740741,2023-03-02 00:31:11.600956,2023-03-02 00:31:12.119717,0 days 00:00:00.518761,0.036609919472191735,0.0278936826869179,,,,,,,,,,,,,,Bayes,,,,,,,,,,,,,,,,,,,,,,COMPLETE
1298,1298,0.5,2023-03-02 00:31:11.706958,2023-03-02 00:31:12.209716,0 days 00:00:00.502758,,,,,,,,,,,,,,,,Tree,,,,,,,,,845.0332179021458,gini,0.7926107835289284,793.3135553518498,0.32035623379903017,0.9487222836131586,0.19071027529456414,best,,,,,,COMPLETE
1299,1299,0.8690740740740741,2023-03-02 00:31:11.755957,2023-03-02 00:31:12.257717,0 days 00:00:00.501760,0.12266712917148752,0.022309800983653788,,,,,,,,,,,,,,Bayes,,,,,,,,,,,,,,,,,,,,,,COMPLETE
1300,1300,0.5,2023-03-02 00:31:11.775956,2023-03-02 00:31:12.222719,0 days 00:00:00.446763,,,,,,,,,,,,,,,,Tree,,,,,,,,,858.9848131742235,gini,0.1433818887239242,0.3025740405130932,0.32863142939127266,0.9503899499148785,0.03625242948220325,best,,,,,,COMPLETE
1301,1301,0.8635185185185185,2023-03-02 00:31:11.948956,2023-03-02 00:31:12.299716,0 days 00:00:00.350760,0.1213206548612562,0.5366512416005969,,,,,,,,,,,,,,Bayes,,,,,,,,,,,,,,,,,,,,,,COMPLETE
1302,1302,0.8668518518518519,2023-03-02 00:31:12.005887,2023-03-02 00:31:12.338720,0 days 00:00:00.332833,0.2582109398280578,0.30325128172025534,,,,,,,,,,,,,,Bayes,,,,,,,,,,,,,,,,,,,,,,COMPLETE
1303,1303,0.8646296296296296,2023-03-02 00:31:12.017888,2023-03-02 00:31:12.341718,0 days 00:00:00.323830,0.8569581174332636,0.3742620542002375,,,,,,,,,,,,,,Bayes,,,,,,,,,,,,,,,,,,,,,,COMPLETE
1304,1304,0.8688888888888888,2023-03-02 00:31:12.036888,2023-03-02 00:31:12.335719,0 days 00:00:00.298831,0.2618927983235095,0.07270380737877123,,,,,,,,,,,,,,Bayes,,,,,,,,,,,,,,,,,,,,,,COMPLETE
1305,1305,0.8688888888888888,2023-03-02 00:31:12.124719,2023-03-02 00:31:12.447727,0 days 00:00:00.323008,0.2690381068044137,0.07300395841376081,,,,,,,,,,,,,,Bayes,,,,,,,,,,,,,,,,,,,,,,COMPLETE
1306,1306,0.8681481481481481,2023-03-02 00:31:12.214717,2023-03-02 00:31:12.541804,0 days 00:00:00.327087,0.2623959461514772,0.055037859567987645,,,,,,,,,,,,,,Bayes,,,,,,,,,,,,,,,,,,,,,,COMPLETE
1307,1307,0.8648148148148148,2023-03-02 00:31:12.225721,2023-03-02 00:31:12.518806,0 days 00:00:00.293085,0.07788815755381677,0.3523488143522365,,,,,,,,,,,,,,Bayes,,,,,,,,,,,,,,,,,,,,,,COMPLETE
1308,1308,0.8677777777777778,2023-03-02 00:31:12.261719,2023-03-02 00:31:12.559953,0 days 00:00:00.298234,0.258048711883871,0.17389740151431046,,,,,,,,,,,,,,Bayes,,,,,,,,,,,,,,,,,,,,,,COMPLETE
1309,1309,0.8614814814814814,2023-03-02 00:31:12.301717,2023-03-02 00:31:12.695966,0 days 00:00:00.394249,0.758709004863186,0.9033599431449713,,,,,,,,,,,,,,Bayes,,,,,,,,,,,,,,,,,,,,,,COMPLETE
1310,1310,0.862962962962963,2023-03-02 00:31:12.342719,2023-03-02 00:31:12.743481,0 days 00:00:00.400762,0.04065699474456079,0.7786905154727642,,,,,,,,,,,,,,Bayes,,,,,,,,,,,,,,,,,,,,,,COMPLETE
1311,1311,0.8677777777777778,2023-03-02 00:31:12.352719,2023-03-02 00:31:12.732484,0 days 00:00:00.379765,0.1918457780311504,0.17394845988302704,,,,,,,,,,,,,,Bayes,,,,,,,,,,,,,,,,,,,,,,COMPLETE
1312,1312,0.8677777777777778,2023-03-02 00:31:12.362719,2023-03-02 00:31:12.754481,0 days 00:00:00.391762,0.1907532049077904,0.17458629756415353,,,,,,,,,,,,,,Bayes,,,,,,,,,,,,,,,,,,,,,,COMPLETE
1313,1313,0.8688888888888889,2023-03-02 00:31:12.450729,2023-03-02 00:31:12.851496,0 days 00:00:00.400767,0.9599972067566611,0.13500208077314935,,,,,,,,,,,,,,Bayes,,,,,,,,,,,,,,,,,,,,,,COMPLETE
1314,1314,0.8688888888888889,2023-03-02 00:31:12.522805,2023-03-02 00:31:12.919497,0 days 00:00:00.396692,0.04675042000954413,0.1380776604082372,,,,,,,,,,,,,,Bayes,,,,,,,,,,,,,,,,,,,,,,COMPLETE
1315,1315,0.8688888888888889,2023-03-02 00:31:12.547649,2023-03-02 00:31:12.934495,0 days 00:00:00.386846,0.36793162946759694,0.1328937321744303,,,,,,,,,,,,,,Bayes,,,,,,,,,,,,,,,,,,,,,,COMPLETE
1316,1316,0.8688888888888889,2023-03-02 00:31:12.568951,2023-03-02 00:31:12.966497,0 days 00:00:00.397546,0.04098861517031754,0.13546528346941028,,,,,,,,,,,,,,Bayes,,,,,,,,,,,,,,,,,,,,,,COMPLETE
1317,1317,0.8633333333333333,2023-03-02 00:31:12.699963,2023-03-02 00:31:13.016494,0 days 00:00:00.316531,0.04252897531890662,0.5019093431664886,,,,,,,,,,,,,,Bayes,,,,,,,,,,,,,,,,,,,,,,COMPLETE
1318,1318,0.8635185185185185,2023-03-02 00:31:12.735482,2023-03-02 00:31:13.066225,0 days 00:00:00.330743,0.3270842550637709,0.54812758631882,,,,,,,,,,,,,,Bayes,,,,,,,,,,,,,,,,,,,,,,COMPLETE
1319,1319,0.862962962962963,2023-03-02 00:31:12.747482,2023-03-02 00:31:13.032498,0 days 00:00:00.285016,0.3429455383477788,0.7290402062620815,,,,,,,,,,,,,,Bayes,,,,,,,,,,,,,,,,,,,,,,COMPLETE
1320,1320,0.8690740740740741,2023-03-02 00:31:12.757482,2023-03-02 00:31:13.100224,0 days 00:00:00.342742,0.7120094631490101,0.11344816869876502,,,,,,,,,,,,,,Bayes,,,,,,,,,,,,,,,,,,,,,,COMPLETE
1321,1321,0.8629629629629629,2023-03-02 00:31:12.854495,2023-03-02 00:31:13.163239,0 days 00:00:00.308744,0.3678432657657389,0.5922645444641985,,,,,,,,,,,,,,Bayes,,,,,,,,,,,,,,,,,,,,,,COMPLETE
1322,1322,0.8624074074074074,2023-03-02 00:31:12.923495,2023-03-02 00:31:13.232238,0 days 00:00:00.308743,0.3918490214091459,0.8271651271492949,,,,,,,,,,,,,,Bayes,,,,,,,,,,,,,,,,,,,,,,COMPLETE
1323,1323,0.8688888888888888,2023-03-02 00:31:12.945495,2023-03-02 00:31:13.260763,0 days 00:00:00.315268,0.7209890904386058,0.07671808564303151,,,,,,,,,,,,,,Bayes,,,,,,,,,,,,,,,,,,,,,,COMPLETE
1324,1324,0.8631481481481482,2023-03-02 00:31:12.968496,2023-03-02 00:31:13.292762,0 days 00:00:00.324266,0.8951540436205618,0.5182008867635725,,,,,,,,,,,,,,Bayes,,,,,,,,,,,,,,,,,,,,,,COMPLETE
1325,1325,0.8683333333333334,2023-03-02 00:31:13.019497,2023-03-02 00:31:13.334762,0 days 00:00:00.315265,0.3270834486457184,0.04965402246089834,,,,,,,,,,,,,,Bayes,,,,,,,,,,,,,,,,,,,,,,COMPLETE
1326,1326,0.8618518518518519,2023-03-02 00:31:13.041510,2023-03-02 00:31:13.347763,0 days 00:00:00.306253,0.0783226619786969,0.8561290353343676,,,,,,,,,,,,,,Bayes,,,,,,,,,,,,,,,,,,,,,,COMPLETE
1327,1327,0.862962962962963,2023-03-02 00:31:13.070229,2023-03-02 00:31:13.380763,0 days 00:00:00.310534,0.07923140546330695,0.7584889705782465,,,,,,,,,,,,,,Bayes,,,,,,,,,,,,,,,,,,,,,,COMPLETE
1328,1328,0.8690740740740741,2023-03-02 00:31:13.103228,2023-03-02 00:31:13.504761,0 days 00:00:00.401533,0.7836236648404236,0.07789299928465283,,,,,,,,,,,,,,Bayes,,,,,,,,,,,,,,,,,,,,,,COMPLETE
1329,1329,0.8627777777777779,2023-03-02 00:31:13.166243,2023-03-02 00:31:13.557617,0 days 00:00:00.391374,0.07598520596101481,0.6537828258996947,,,,,,,,,,,,,,Bayes,,,,,,,,,,,,,,,,,,,,,,COMPLETE
1330,1330,0.8694444444444445,2023-03-02 00:31:13.239238,2023-03-02 00:31:13.626968,0 days 00:00:00.387730,0.9277414244132434,0.10778688762525689,,,,,,,,,,,,,,Bayes,,,,,,,,,,,,,,,,,,,,,,COMPLETE
1331,1331,0.8629629629629629,2023-03-02 00:31:13.265762,2023-03-02 00:31:13.622965,0 days 00:00:00.357203,0.09862136508655389,0.6468769385060624,,,,,,,,,,,,,,Bayes,,,,,,,,,,,,,,,,,,,,,,COMPLETE
1332,1332,0.8692592592592594,2023-03-02 00:31:13.296761,2023-03-02 00:31:13.685967,0 days 00:00:00.389206,0.2156155282272602,0.10845376428678107,,,,,,,,,,,,,,Bayes,,,,,,,,,,,,,,,,,,,,,,COMPLETE
1333,1333,0.8694444444444445,2023-03-02 00:31:13.338761,2023-03-02 00:31:13.733966,0 days 00:00:00.395205,0.28850559061357106,0.10785342806765667,,,,,,,,,,,,,,Bayes,,,,,,,,,,,,,,,,,,,,,,COMPLETE
1334,1334,0.8664814814814815,2023-03-02 00:31:13.350762,2023-03-02 00:31:13.734969,0 days 00:00:00.384207,0.21986363497970088,0.2558021143182261,,,,,,,,,,,,,,Bayes,,,,,,,,,,,,,,,,,,,,,,COMPLETE
1335,1335,0.8629629629629629,2023-03-02 00:31:13.387761,2023-03-02 00:31:13.809965,0 days 00:00:00.422204,0.21042845001904872,0.6389210627324744,,,,,,,,,,,,,,Bayes,,,,,,,,,,,,,,,,,,,,,,COMPLETE
1336,1336,0.8629629629629629,2023-03-02 00:31:13.511764,2023-03-02 00:31:13.848968,0 days 00:00:00.337204,0.21414335360693326,0.6351424052881454,,,,,,,,,,,,,,Bayes,,,,,,,,,,,,,,,,,,,,,,COMPLETE
1337,1337,0.8635185185185185,2023-03-02 00:31:13.560778,2023-03-02 00:31:13.943966,0 days 00:00:00.383188,0.10289110721118566,0.5521145094970649,,,,,,,,,,,,,,Bayes,,,,,,,,,,,,,,,,,,,,,,COMPLETE
1338,1338,0.8633333333333334,2023-03-02 00:31:13.628970,2023-03-02 00:31:14.198030,0 days 00:00:00.569060,0.2894825855960156,0.715537428388253,,,,,,,,,,,,,,Bayes,,,,,,,,,,,,,,,,,,,,,,COMPLETE
1339,1339,0.8614814814814815,2023-03-02 00:31:13.644966,2023-03-02 00:31:14.048965,0 days 00:00:00.403999,0.2920812191071777,0.9285666335017344,,,,,,,,,,,,,,Bayes,,,,,,,,,,,,,,,,,,,,,,COMPLETE
1340,1340,0.5,2023-03-02 00:31:13.688967,2023-03-02 00:31:14.674739,0 days 00:00:00.985772,,,998.3673364871971,squared_error,9.989787862167475,deviance,27.0,0.5711003883173589,541.243786645972,0.09258568920035576,0.13666578404321328,56.0,0.7007313517056414,0.004022507151545618,0.14629458212927893,Gradient Boosting,,,,,,,,,,,,,,,,,,,,,,COMPLETE
1341,1341,0.5,2023-03-02 00:31:13.736966,2023-03-02 00:31:14.728739,0 days 00:00:00.991773,,,29.87837282290252,squared_error,7.527762417160751,deviance,27.0,0.5976891395898969,8.314561013489936,0.09496813014201577,0.9505232341026143,60.0,0.708274030375227,0.036102823087608316,0.4382391602702831,Gradient Boosting,,,,,,,,,,,,,,,,,,,,,,COMPLETE
