,number,value,datetime_start,datetime_complete,duration,params_Bayes_prior_positive,params_Bayes_var_smoothing,params_GB_ccp_alpha,params_GB_criterion,params_GB_learning_rate,params_GB_loss,params_GB_max_depth,params_GB_max_features,params_GB_min_impurity_decrease,params_GB_min_samples_leaf,params_GB_min_samples_split,params_GB_n_estimators,params_GB_subsample,params_GB_tol,params_GB_validation_fraction,params_Method,params_SVM_C,params_SVM_coef0,params_SVM_decision_function_shape,params_SVM_degree,params_SVM_gamma,params_SVM_kernel,params_SVM_shrinking,params_SVM_tol,params_Tree_ccp_alpha,params_Tree_criterion,params_Tree_max_features,params_Tree_min_impurity_decrease,params_Tree_min_samples_leaf,params_Tree_min_samples_split,params_Tree_min_weight_fraction_leaf,params_Tree_splitter,params_kNN_algorithm,params_kNN_leaf_size,params_kNN_n_neighbors,params_kNN_p,params_kNN_weights,state
1653,1653,0.8681481481481481,2023-03-02 00:31:34.918639,2023-03-02 00:31:35.355642,0 days 00:00:00.437003,0.1740391014593054,0.05847258018233854,,,,,,,,,,,,,,Bayes,,,,,,,,,,,,,,,,,,,,,,COMPLETE
1654,1654,0.8635185185185186,2023-03-02 00:31:34.943640,2023-03-02 00:31:35.375642,0 days 00:00:00.432002,0.5925877002152125,0.7128829872122481,,,,,,,,,,,,,,Bayes,,,,,,,,,,,,,,,,,,,,,,COMPLETE
1655,1655,0.8668518518518519,2023-03-02 00:31:34.988638,2023-03-02 00:31:35.423894,0 days 00:00:00.435256,0.621388370955519,0.2848093903869265,,,,,,,,,,,,,,Bayes,,,,,,,,,,,,,,,,,,,,,,COMPLETE
1656,1656,0.8679629629629629,2023-03-02 00:31:35.018642,2023-03-02 00:31:35.466751,0 days 00:00:00.448109,0.17768838994403716,0.061087568408170964,,,,,,,,,,,,,,Bayes,,,,,,,,,,,,,,,,,,,,,,COMPLETE
1657,1657,0.8681481481481481,2023-03-02 00:31:35.032640,2023-03-02 00:31:35.465752,0 days 00:00:00.433112,0.2380471465340519,0.05600526804526383,,,,,,,,,,,,,,Bayes,,,,,,,,,,,,,,,,,,,,,,COMPLETE
1658,1658,0.8681481481481481,2023-03-02 00:31:35.063641,2023-03-02 00:31:35.493749,0 days 00:00:00.430108,0.14942020687509175,0.05623296002225845,,,,,,,,,,,,,,Bayes,,,,,,,,,,,,,,,,,,,,,,COMPLETE
1659,1659,0.8681481481481481,2023-03-02 00:31:35.101639,2023-03-02 00:31:35.555750,0 days 00:00:00.454111,0.1504510749389682,0.057888295623325994,,,,,,,,,,,,,,Bayes,,,,,,,,,,,,,,,,,,,,,,COMPLETE
1660,1660,0.8690740740740741,2023-03-02 00:31:35.340641,2023-03-02 00:31:35.863600,0 days 00:00:00.522959,0.09227541721213169,0.14833607554806175,,,,,,,,,,,,,,Bayes,,,,,,,,,,,,,,,,,,,,,,COMPLETE
1661,1661,0.8688888888888889,2023-03-02 00:31:35.367638,2023-03-02 00:31:35.953337,0 days 00:00:00.585699,0.6837391376984595,0.14000710332620972,,,,,,,,,,,,,,Bayes,,,,,,,,,,,,,,,,,,,,,,COMPLETE
1662,1662,0.8629629629629629,2023-03-02 00:31:35.383641,2023-03-02 00:31:35.909666,0 days 00:00:00.526025,0.09039916507481902,0.6520447055805045,,,,,,,,,,,,,,Bayes,,,,,,,,,,,,,,,,,,,,,,COMPLETE
1663,1663,0.8690740740740741,2023-03-02 00:31:35.427053,2023-03-02 00:31:36.034241,0 days 00:00:00.607188,0.9336550242099925,0.1459862564511749,,,,,,,,,,,,,,Bayes,,,,,,,,,,,,,,,,,,,,,,COMPLETE
1664,1664,0.8627777777777779,2023-03-02 00:31:35.468750,2023-03-02 00:31:36.077240,0 days 00:00:00.608490,0.0940732506213179,0.6541504226150918,,,,,,,,,,,,,,Bayes,,,,,,,,,,,,,,,,,,,,,,COMPLETE
1665,1665,0.5,2023-03-02 00:31:35.482748,2023-03-02 00:31:37.523581,0 days 00:00:02.040833,,,348.08204397455216,squared_error,7.9600071555550365,deviance,25.0,0.9118274685432843,496.35755895127704,0.002922904212069255,0.3820913415243715,203.0,0.518594355782171,0.8284182732200294,0.37381443395971625,Gradient Boosting,,,,,,,,,,,,,,,,,,,,,,COMPLETE
1666,1666,0.8690740740740741,2023-03-02 00:31:35.504750,2023-03-02 00:31:36.111242,0 days 00:00:00.606492,0.03597411573696447,0.14865266157008394,,,,,,,,,,,,,,Bayes,,,,,,,,,,,,,,,,,,,,,,COMPLETE
1667,1667,0.5,2023-03-02 00:31:35.572750,2023-03-02 00:31:37.631581,0 days 00:00:02.058831,,,349.6991255017965,squared_error,7.769436707783347,deviance,15.0,0.5337166458310572,649.69886714492,0.0065452978574482845,0.3908325158306676,199.0,0.5064389817513518,0.9022870202875133,0.3981771917306943,Gradient Boosting,,,,,,,,,,,,,,,,,,,,,,COMPLETE
1668,1668,0.5,2023-03-02 00:31:35.868601,2023-03-02 00:31:37.724580,0 days 00:00:01.855979,,,244.4659267700416,squared_error,7.845782982130276,deviance,8.0,0.29547047003277066,32.9377063138914,0.32605347822151887,0.4156367293861617,194.0,0.3019993145075305,0.775202549972027,0.8070504760010268,Gradient Boosting,,,,,,,,,,,,,,,,,,,,,,COMPLETE
1669,1669,0.8633333333333334,2023-03-02 00:31:35.925668,2023-03-02 00:31:36.748513,0 days 00:00:00.822845,0.03883763772010006,0.5272717113031617,,,,,,,,,,,,,,Bayes,,,,,,,,,,,,,,,,,,,,,,COMPLETE
1670,1670,0.5,2023-03-02 00:31:35.959338,2023-03-02 00:31:39.249568,0 days 00:00:03.290230,,,357.882205178871,squared_error,7.633152571959109,deviance,40.0,0.3767868053640752,652.0713882908058,0.3273751150352346,0.36155556433009506,669.0,0.5127483314312528,0.6378253443319661,0.1788702289914682,Gradient Boosting,,,,,,,,,,,,,,,,,,,,,,COMPLETE
1671,1671,0.5,2023-03-02 00:31:36.043241,2023-03-02 00:31:39.131570,0 days 00:00:03.088329,,,358.27543773926755,squared_error,7.781737670204789,deviance,25.0,0.38127038237242283,660.4168388869194,0.3337377310933768,0.4409089974079553,620.0,0.5043129725311583,0.6397571973958107,0.42517157659242044,Gradient Boosting,,,,,,,,,,,,,,,,,,,,,,COMPLETE
1672,1672,0.5,2023-03-02 00:31:36.089243,2023-03-02 00:31:38.006760,0 days 00:00:01.917517,,,858.5271975706983,squared_error,2.325108455055295,deviance,9.0,0.25815357770815356,675.8603317728281,0.3360925327347598,0.3882724583254053,192.0,0.5051545902011695,0.8239096308240399,0.3576767525155833,Gradient Boosting,,,,,,,,,,,,,,,,,,,,,,COMPLETE
1673,1673,0.5,2023-03-02 00:31:36.122240,2023-03-02 00:31:37.946580,0 days 00:00:01.824340,,,237.64667348956544,squared_error,7.759425242921152,deviance,25.0,0.37684317168129355,659.1499950304452,0.03977443450252646,0.4042503562873337,201.0,0.14683166976823658,0.776959366170584,0.19597616944049523,Gradient Boosting,,,,,,,,,,,,,,,,,,,,,,COMPLETE
1674,1674,0.5,2023-03-02 00:31:36.758515,2023-03-02 00:31:39.511728,0 days 00:00:02.753213,,,237.81153362261557,squared_error,8.018315408022655,deviance,25.0,0.38186898828869426,667.3345429196614,0.0022000742775447335,0.3755404534457253,519.0,0.5033706731578028,0.7940772590841705,0.3889293253215902,Gradient Boosting,,,,,,,,,,,,,,,,,,,,,,COMPLETE
1675,1675,0.8690740740740741,2023-03-02 00:31:37.528582,2023-03-02 00:31:38.060758,0 days 00:00:00.532176,0.4140067948645166,0.10296634942886744,,,,,,,,,,,,,,Bayes,,,,,,,,,,,,,,,,,,,,,,COMPLETE
1676,1676,0.8690740740740741,2023-03-02 00:31:37.639581,2023-03-02 00:31:38.113760,0 days 00:00:00.474179,0.3107462100372693,0.1039150427535224,,,,,,,,,,,,,,Bayes,,,,,,,,,,,,,,,,,,,,,,COMPLETE
1677,1677,0.8690740740740741,2023-03-02 00:31:37.728580,2023-03-02 00:31:38.200758,0 days 00:00:00.472178,0.31109134683386497,0.10440821152981551,,,,,,,,,,,,,,Bayes,,,,,,,,,,,,,,,,,,,,,,COMPLETE
1678,1678,0.8666666666666667,2023-03-02 00:31:37.958966,2023-03-02 00:31:38.397760,0 days 00:00:00.438794,0.4232421051865514,0.3152291261820481,,,,,,,,,,,,,,Bayes,,,,,,,,,,,,,,,,,,,,,,COMPLETE
1679,1679,0.8692592592592593,2023-03-02 00:31:38.013758,2023-03-02 00:31:38.460402,0 days 00:00:00.446644,0.3097281173935943,0.01326346389173412,,,,,,,,,,,,,,Bayes,,,,,,,,,,,,,,,,,,,,,,COMPLETE
1680,1680,0.8668518518518519,2023-03-02 00:31:38.065758,2023-03-02 00:31:38.467402,0 days 00:00:00.401644,0.31840039569164136,0.229062447991271,,,,,,,,,,,,,,Bayes,,,,,,,,,,,,,,,,,,,,,,COMPLETE
1681,1681,0.8675925925925927,2023-03-02 00:31:38.118758,2023-03-02 00:31:38.543403,0 days 00:00:00.424645,0.01715431280663434,0.21842261406075303,,,,,,,,,,,,,,Bayes,,,,,,,,,,,,,,,,,,,,,,COMPLETE
1682,1682,0.8664814814814815,2023-03-02 00:31:38.209758,2023-03-02 00:31:38.702403,0 days 00:00:00.492645,0.3374967062995824,0.3174275406085748,,,,,,,,,,,,,,Bayes,,,,,,,,,,,,,,,,,,,,,,COMPLETE
1683,1683,0.8614814814814814,2023-03-02 00:31:38.403759,2023-03-02 00:31:38.926403,0 days 00:00:00.522644,0.020311131708622355,0.8871800056829713,,,,,,,,,,,,,,Bayes,,,,,,,,,,,,,,,,,,,,,,COMPLETE
1684,1684,0.8662962962962963,2023-03-02 00:31:38.468402,2023-03-02 00:31:39.024570,0 days 00:00:00.556168,0.23692582198284295,0.2623547097569716,,,,,,,,,,,,,,Bayes,,,,,,,,,,,,,,,,,,,,,,COMPLETE
1685,1685,0.8648148148148148,2023-03-02 00:31:38.483405,2023-03-02 00:31:38.979568,0 days 00:00:00.496163,0.02025788684110181,0.35070903814916876,,,,,,,,,,,,,,Bayes,,,,,,,,,,,,,,,,,,,,,,COMPLETE
1686,1686,0.867962962962963,2023-03-02 00:31:38.549402,2023-03-02 00:31:39.091571,0 days 00:00:00.542169,0.23493109713913746,0.18626034220140492,,,,,,,,,,,,,,Bayes,,,,,,,,,,,,,,,,,,,,,,COMPLETE
1687,1687,0.867962962962963,2023-03-02 00:31:38.717404,2023-03-02 00:31:39.162570,0 days 00:00:00.445166,0.2007316165539584,0.1878820229840933,,,,,,,,,,,,,,Bayes,,,,,,,,,,,,,,,,,,,,,,COMPLETE
1688,1688,0.8690740740740741,2023-03-02 00:31:38.931402,2023-03-02 00:31:39.370570,0 days 00:00:00.439168,0.0615831469319143,0.12995797373387025,,,,,,,,,,,,,,Bayes,,,,,,,,,,,,,,,,,,,,,,COMPLETE
1689,1689,0.8690740740740741,2023-03-02 00:31:38.987568,2023-03-02 00:31:39.427568,0 days 00:00:00.440000,0.23665124676236446,0.12983258091139815,,,,,,,,,,,,,,Bayes,,,,,,,,,,,,,,,,,,,,,,COMPLETE
1690,1690,0.8690740740740741,2023-03-02 00:31:39.032571,2023-03-02 00:31:39.462568,0 days 00:00:00.429997,0.19845852208042808,0.13046529164829668,,,,,,,,,,,,,,Bayes,,,,,,,,,,,,,,,,,,,,,,COMPLETE
1691,1691,0.8692592592592592,2023-03-02 00:31:39.095568,2023-03-02 00:31:39.510729,0 days 00:00:00.415161,0.12950969623815414,0.12267429928933829,,,,,,,,,,,,,,Bayes,,,,,,,,,,,,,,,,,,,,,,COMPLETE
1692,1692,0.8631481481481482,2023-03-02 00:31:39.139568,2023-03-02 00:31:39.633593,0 days 00:00:00.494025,0.0652393456520641,0.5171982618721004,,,,,,,,,,,,,,Bayes,,,,,,,,,,,,,,,,,,,,,,COMPLETE
1693,1693,0.8692592592592592,2023-03-02 00:31:39.177568,2023-03-02 00:31:39.662593,0 days 00:00:00.485025,0.0674949682738446,0.12555578959778857,,,,,,,,,,,,,,Bayes,,,,,,,,,,,,,,,,,,,,,,COMPLETE
1694,1694,0.8624074074074074,2023-03-02 00:31:39.256569,2023-03-02 00:31:39.725594,0 days 00:00:00.469025,0.05982796917178238,0.8211404955477539,,,,,,,,,,,,,,Bayes,,,,,,,,,,,,,,,,,,,,,,COMPLETE
1695,1695,0.8687037037037036,2023-03-02 00:31:39.374571,2023-03-02 00:31:39.845593,0 days 00:00:00.471022,0.1255159326190239,0.0710906575553296,,,,,,,,,,,,,,Bayes,,,,,,,,,,,,,,,,,,,,,,COMPLETE
1696,1696,0.8631481481481481,2023-03-02 00:31:39.435570,2023-03-02 00:31:39.881593,0 days 00:00:00.446023,0.2565116834246984,0.504080929195969,,,,,,,,,,,,,,Bayes,,,,,,,,,,,,,,,,,,,,,,COMPLETE
1697,1697,0.8690740740740741,2023-03-02 00:31:39.466785,2023-03-02 00:31:39.944594,0 days 00:00:00.477809,0.34486690825740957,0.07870624927152374,,,,,,,,,,,,,,Bayes,,,,,,,,,,,,,,,,,,,,,,COMPLETE
1698,1698,0.8646296296296296,2023-03-02 00:31:39.514594,2023-03-02 00:31:39.992781,0 days 00:00:00.478187,0.36229722837088163,0.4248584791151711,,,,,,,,,,,,,,Bayes,,,,,,,,,,,,,,,,,,,,,,COMPLETE
1699,1699,0.8640740740740741,2023-03-02 00:31:39.611593,2023-03-02 00:31:40.055781,0 days 00:00:00.444188,0.2581885681462017,0.4146270039321949,,,,,,,,,,,,,,Bayes,,,,,,,,,,,,,,,,,,,,,,COMPLETE
1700,1700,0.8688888888888888,2023-03-02 00:31:39.648593,2023-03-02 00:31:40.175782,0 days 00:00:00.527189,0.34438683387714725,0.0766767844814002,,,,,,,,,,,,,,Bayes,,,,,,,,,,,,,,,,,,,,,,COMPLETE
1701,1701,0.8688888888888888,2023-03-02 00:31:39.667593,2023-03-02 00:31:40.056782,0 days 00:00:00.389189,0.34538033069107965,0.07297640156617807,,,,,,,,,,,,,,Bayes,,,,,,,,,,,,,,,,,,,,,,COMPLETE
1702,1702,0.8690740740740741,2023-03-02 00:31:39.739593,2023-03-02 00:31:40.300780,0 days 00:00:00.561187,0.47672962742574143,0.026665534218868636,,,,,,,,,,,,,,Bayes,,,,,,,,,,,,,,,,,,,,,,COMPLETE
1703,1703,0.8688888888888889,2023-03-02 00:31:39.847593,2023-03-02 00:31:40.459781,0 days 00:00:00.612188,0.7855504630411856,0.03796288841128639,,,,,,,,,,,,,,Bayes,,,,,,,,,,,,,,,,,,,,,,COMPLETE
1704,1704,0.661111111111111,2023-03-02 00:31:39.894592,2023-03-02 00:31:43.506729,0 days 00:00:03.612137,,,,,,,,,,,,,,,,SVM,61.628338242814685,82.3462478374005,ovo,19.0,scale,poly,True,0.9370813099281388,,,,,,,,,,,,,,COMPLETE
1705,1705,0.8307407407407407,2023-03-02 00:31:39.946593,2023-03-02 00:31:40.397781,0 days 00:00:00.451188,,,,,,,,,,,,,,,,SVM,65.17896111594706,-72.37266000947334,ovo,18.0,scale,poly,True,0.3529678005751956,,,,,,,,,,,,,,COMPLETE
1706,1706,0.6453703703703705,2023-03-02 00:31:39.996782,2023-03-02 00:31:44.571198,0 days 00:00:04.574416,,,,,,,,,,,,,,,,SVM,65.16665893392471,86.04554041770662,ovo,17.0,scale,poly,True,0.9508316861974786,,,,,,,,,,,,,,COMPLETE
1707,1707,0.8690740740740741,2023-03-02 00:31:40.061782,2023-03-02 00:31:40.629937,0 days 00:00:00.568155,0.3967393746973532,0.1024970844945294,,,,,,,,,,,,,,Bayes,,,,,,,,,,,,,,,,,,,,,,COMPLETE
1708,1708,0.6592592592592592,2023-03-02 00:31:40.163781,2023-03-02 00:31:46.121289,0 days 00:00:05.957508,,,,,,,,,,,,,,,,SVM,61.935341497622,86.75520944632305,ovo,17.0,scale,poly,True,0.2496991702359665,,,,,,,,,,,,,,COMPLETE
1709,1709,0.8692592592592593,2023-03-02 00:31:40.186784,2023-03-02 00:31:40.613936,0 days 00:00:00.427152,0.2932821803309765,0.09870735740843126,,,,,,,,,,,,,,Bayes,,,,,,,,,,,,,,,,,,,,,,COMPLETE
1710,1710,0.8668518518518519,2023-03-02 00:31:40.306782,2023-03-02 00:31:40.684937,0 days 00:00:00.378155,0.5597520139373415,0.3026590558485223,,,,,,,,,,,,,,Bayes,,,,,,,,,,,,,,,,,,,,,,COMPLETE
1711,1711,0.8692592592592593,2023-03-02 00:31:40.400783,2023-03-02 00:31:40.720081,0 days 00:00:00.319298,0.6063207482670021,0.09815049541222332,,,,,,,,,,,,,,Bayes,,,,,,,,,,,,,,,,,,,,,,COMPLETE
1712,1712,0.8622222222222222,2023-03-02 00:31:40.462781,2023-03-02 00:31:40.776938,0 days 00:00:00.314157,0.6469746861799666,0.8000984662655015,,,,,,,,,,,,,,Bayes,,,,,,,,,,,,,,,,,,,,,,COMPLETE
1713,1713,0.8694444444444445,2023-03-02 00:31:40.617936,2023-03-02 00:31:40.870765,0 days 00:00:00.252829,0.17245151846130574,0.09198026177546048,,,,,,,,,,,,,,Bayes,,,,,,,,,,,,,,,,,,,,,,COMPLETE
1714,1714,0.8633333333333333,2023-03-02 00:31:40.631936,2023-03-02 00:31:40.856764,0 days 00:00:00.224828,0.16397484893193684,0.4858943831681606,,,,,,,,,,,,,,Bayes,,,,,,,,,,,,,,,,,,,,,,COMPLETE
1715,1715,0.8614814814814815,2023-03-02 00:31:40.686936,2023-03-02 00:31:40.942043,0 days 00:00:00.255107,0.09940039228540572,0.9227213512064645,,,,,,,,,,,,,,Bayes,,,,,,,,,,,,,,,,,,,,,,COMPLETE
1716,1716,0.8677777777777778,2023-03-02 00:31:40.722938,2023-03-02 00:31:40.973043,0 days 00:00:00.250105,0.0995135422106786,0.16265043927173128,,,,,,,,,,,,,,Bayes,,,,,,,,,,,,,,,,,,,,,,COMPLETE
1717,1717,0.8687037037037038,2023-03-02 00:31:40.779938,2023-03-02 00:31:41.007795,0 days 00:00:00.227857,0.04584096344348919,0.04132258783806565,,,,,,,,,,,,,,Bayes,,,,,,,,,,,,,,,,,,,,,,COMPLETE
1718,1718,0.8690740740740741,2023-03-02 00:31:40.858763,2023-03-02 00:31:41.112794,0 days 00:00:00.254031,0.04549295595135126,0.11260763811586409,,,,,,,,,,,,,,Bayes,,,,,,,,,,,,,,,,,,,,,,COMPLETE
1719,1719,0.8624074074074074,2023-03-02 00:31:40.885326,2023-03-02 00:31:41.227965,0 days 00:00:00.342639,0.8908002013342252,0.8212699287399465,,,,,,,,,,,,,,Bayes,,,,,,,,,,,,,,,,,,,,,,COMPLETE
1720,1720,0.8633333333333333,2023-03-02 00:31:40.946044,2023-03-02 00:31:41.270984,0 days 00:00:00.324940,0.0379206061817952,0.692486567801573,,,,,,,,,,,,,,Bayes,,,,,,,,,,,,,,,,,,,,,,COMPLETE
1721,1721,0.8631481481481482,2023-03-02 00:31:40.979043,2023-03-02 00:31:41.291981,0 days 00:00:00.312938,0.5311067832709557,0.7345514235690596,,,,,,,,,,,,,,Bayes,,,,,,,,,,,,,,,,,,,,,,COMPLETE
1722,1722,0.8690740740740741,2023-03-02 00:31:41.009796,2023-03-02 00:31:41.335981,0 days 00:00:00.326185,0.03503285323258732,0.11165612958640057,,,,,,,,,,,,,,Bayes,,,,,,,,,,,,,,,,,,,,,,COMPLETE
1723,1723,0.8666666666666666,2023-03-02 00:31:41.115796,2023-03-02 00:31:41.465980,0 days 00:00:00.350184,0.21053624643572036,0.29912464688735063,,,,,,,,,,,,,,Bayes,,,,,,,,,,,,,,,,,,,,,,COMPLETE
1724,1724,0.8629629629629629,2023-03-02 00:31:41.230622,2023-03-02 00:31:41.509929,0 days 00:00:00.279307,0.8532281620014454,0.612670114244656,,,,,,,,,,,,,,Bayes,,,,,,,,,,,,,,,,,,,,,,COMPLETE
1725,1725,0.8690740740740741,2023-03-02 00:31:41.274982,2023-03-02 00:31:41.560927,0 days 00:00:00.285945,0.3771867935937878,0.0778987365727811,,,,,,,,,,,,,,Bayes,,,,,,,,,,,,,,,,,,,,,,COMPLETE
1726,1726,0.8688888888888888,2023-03-02 00:31:41.303980,2023-03-02 00:31:41.561927,0 days 00:00:00.257947,0.8414081857959863,0.07377688940034773,,,,,,,,,,,,,,Bayes,,,,,,,,,,,,,,,,,,,,,,COMPLETE
1727,1727,0.5,2023-03-02 00:31:41.347982,2023-03-02 00:31:41.494817,0 days 00:00:00.146835,,,,,,,,,,,,,,,,SVM,5.308465355207929,81.62831889784788,ovo,,auto,sigmoid,True,0.934875551606674,,,,,,,,,,,,,,COMPLETE
1728,1728,0.8690740740740741,2023-03-02 00:31:41.468982,2023-03-02 00:31:41.787661,0 days 00:00:00.318679,0.914115815946215,0.018972694305819812,,,,,,,,,,,,,,Bayes,,,,,,,,,,,,,,,,,,,,,,COMPLETE
1729,1729,0.8644444444444445,2023-03-02 00:31:41.498102,2023-03-02 00:31:41.786661,0 days 00:00:00.288559,0.3771414073281701,0.3952615258158221,,,,,,,,,,,,,,Bayes,,,,,,,,,,,,,,,,,,,,,,COMPLETE
1730,1730,0.8635185185185186,2023-03-02 00:31:41.512927,2023-03-02 00:31:41.830179,0 days 00:00:00.317252,0.12799419413208915,0.4751239016051994,,,,,,,,,,,,,,Bayes,,,,,,,,,,,,,,,,,,,,,,COMPLETE
1731,1731,0.8694444444444445,2023-03-02 00:31:41.562929,2023-03-02 00:31:41.953181,0 days 00:00:00.390252,0.1391937787103046,0.09446026775698817,,,,,,,,,,,,,,Bayes,,,,,,,,,,,,,,,,,,,,,,COMPLETE
1732,1732,0.8629629629629629,2023-03-02 00:31:41.574927,2023-03-02 00:31:41.934181,0 days 00:00:00.359254,0.1403958241425648,0.6299220966502086,,,,,,,,,,,,,,Bayes,,,,,,,,,,,,,,,,,,,,,,COMPLETE
1733,1733,0.8681481481481481,2023-03-02 00:31:41.791660,2023-03-02 00:31:42.121629,0 days 00:00:00.329969,0.2966834979854496,0.056048516153635895,,,,,,,,,,,,,,Bayes,,,,,,,,,,,,,,,,,,,,,,COMPLETE
1734,1734,0.8683333333333334,2023-03-02 00:31:41.806660,2023-03-02 00:31:42.140629,0 days 00:00:00.333969,0.4836975760762723,0.04996945932509316,,,,,,,,,,,,,,Bayes,,,,,,,,,,,,,,,,,,,,,,COMPLETE
1735,1735,0.8261111111111112,2023-03-02 00:31:41.842180,2023-03-02 00:31:42.215629,0 days 00:00:00.373449,,,,,,,,,,,,,,,,kNN,,,,,,,,,,,,,,,,,kd_tree,226.0,311.0,814.0,distance,COMPLETE
1736,1736,0.8687037037037038,2023-03-02 00:31:41.941179,2023-03-02 00:31:42.242631,0 days 00:00:00.301452,0.30042328691526926,0.04588220402249417,,,,,,,,,,,,,,Bayes,,,,,,,,,,,,,,,,,,,,,,COMPLETE
1737,1737,0.8357407407407407,2023-03-02 00:31:41.956180,2023-03-02 00:31:42.156630,0 days 00:00:00.200450,,,,,,,,,,,,,,,,kNN,,,,,,,,,,,,,,,,,kd_tree,263.0,306.0,390.0,distance,COMPLETE
1738,1738,0.8625925925925927,2023-03-02 00:31:42.130631,2023-03-02 00:31:42.352630,0 days 00:00:00.221999,0.3299279304075562,0.7849580893598798,,,,,,,,,,,,,,Bayes,,,,,,,,,,,,,,,,,,,,,,COMPLETE
1739,1739,0.8664814814814814,2023-03-02 00:31:42.144629,2023-03-02 00:31:42.368629,0 days 00:00:00.224000,0.08465104123599668,0.26602877804839015,,,,,,,,,,,,,,Bayes,,,,,,,,,,,,,,,,,,,,,,COMPLETE
1740,1740,0.8677777777777778,2023-03-02 00:31:42.166631,2023-03-02 00:31:42.479631,0 days 00:00:00.313000,0.08285663032316315,0.16429584217131485,,,,,,,,,,,,,,Bayes,,,,,,,,,,,,,,,,,,,,,,COMPLETE
1741,1741,0.8690740740740741,2023-03-02 00:31:42.218631,2023-03-02 00:31:42.547848,0 days 00:00:00.329217,0.078032600428259,0.0007543071140545532,,,,,,,,,,,,,,Bayes,,,,,,,,,,,,,,,,,,,,,,COMPLETE
1742,1742,0.8614814814814814,2023-03-02 00:31:42.244629,2023-03-02 00:31:42.585848,0 days 00:00:00.341219,0.8140795565611513,0.8911478877659509,,,,,,,,,,,,,,Bayes,,,,,,,,,,,,,,,,,,,,,,COMPLETE
1743,1743,0.8694444444444445,2023-03-02 00:31:42.355629,2023-03-02 00:31:42.739721,0 days 00:00:00.384092,0.0032893380648575353,0.0895170123368852,,,,,,,,,,,,,,Bayes,,,,,,,,,,,,,,,,,,,,,,COMPLETE
1744,1744,0.8692592592592593,2023-03-02 00:31:42.371629,2023-03-02 00:31:42.747723,0 days 00:00:00.376094,0.0069750805014401965,0.09289369849052166,,,,,,,,,,,,,,Bayes,,,,,,,,,,,,,,,,,,,,,,COMPLETE
1745,1745,0.5,2023-03-02 00:31:42.490631,2023-03-02 00:31:42.725721,0 days 00:00:00.235090,,,,,,,,,,,,,,,,Tree,,,,,,,,,823.8389142859888,gini,0.16988501363526154,739.7259823312645,0.46985322815576136,0.5605829898297244,0.47663620868438267,random,,,,,,COMPLETE
1746,1746,0.864074074074074,2023-03-02 00:31:42.550849,2023-03-02 00:31:42.842732,0 days 00:00:00.291883,0.49447522032981583,0.44329690376211717,,,,,,,,,,,,,,Bayes,,,,,,,,,,,,,,,,,,,,,,COMPLETE
1747,1747,0.5,2023-03-02 00:31:42.596849,2023-03-02 00:31:42.832732,0 days 00:00:00.235883,,,,,,,,,,,,,,,,Tree,,,,,,,,,969.1922091371043,gini,0.181005360125588,503.00638224432834,0.38544109436029883,0.15602575505776695,0.47733863174881785,random,,,,,,COMPLETE
1748,1748,0.8690740740740741,2023-03-02 00:31:42.729721,2023-03-02 00:31:42.971733,0 days 00:00:00.242012,0.7545971593491001,0.117688011828109,,,,,,,,,,,,,,Bayes,,,,,,,,,,,,,,,,,,,,,,COMPLETE
1749,1749,0.8690740740740741,2023-03-02 00:31:42.742724,2023-03-02 00:31:42.969733,0 days 00:00:00.227009,0.2594230475509798,0.11541645448012844,,,,,,,,,,,,,,Bayes,,,,,,,,,,,,,,,,,,,,,,COMPLETE
1750,1750,0.8690740740740741,2023-03-02 00:31:42.764722,2023-03-02 00:31:42.969733,0 days 00:00:00.205011,0.26552476767757843,0.11564585645128822,,,,,,,,,,,,,,Bayes,,,,,,,,,,,,,,,,,,,,,,COMPLETE
1751,1751,0.8690740740740741,2023-03-02 00:31:42.836734,2023-03-02 00:31:43.265731,0 days 00:00:00.428997,0.7046756397895886,0.120760645081291,,,,,,,,,,,,,,Bayes,,,,,,,,,,,,,,,,,,,,,,COMPLETE
1752,1752,0.8633333333333333,2023-03-02 00:31:42.849733,2023-03-02 00:31:43.246728,0 days 00:00:00.396995,0.2546777915364497,0.6977970606839908,,,,,,,,,,,,,,Bayes,,,,,,,,,,,,,,,,,,,,,,COMPLETE
1753,1753,0.7206481481481481,2023-03-02 00:31:42.972734,2023-03-02 00:31:43.324732,0 days 00:00:00.351998,,,,,,,,,,,,,,,,SVM,92.63855467638604,,ovo,,scale,rbf,True,0.24585981464361883,,,,,,,,,,,,,,COMPLETE
