,number,value,datetime_start,datetime_complete,duration,params_Bayes_prior_positive,params_Bayes_var_smoothing,params_GB_ccp_alpha,params_GB_criterion,params_GB_learning_rate,params_GB_loss,params_GB_max_depth,params_GB_max_features,params_GB_min_impurity_decrease,params_GB_min_samples_leaf,params_GB_min_samples_split,params_GB_n_estimators,params_GB_subsample,params_GB_tol,params_GB_validation_fraction,params_Method,params_SVM_C,params_SVM_coef0,params_SVM_decision_function_shape,params_SVM_degree,params_SVM_gamma,params_SVM_kernel,params_SVM_shrinking,params_SVM_tol,params_Tree_ccp_alpha,params_Tree_criterion,params_Tree_max_features,params_Tree_min_impurity_decrease,params_Tree_min_samples_leaf,params_Tree_min_samples_split,params_Tree_min_weight_fraction_leaf,params_Tree_splitter,params_kNN_algorithm,params_kNN_leaf_size,params_kNN_n_neighbors,params_kNN_p,params_kNN_weights,state
612,612,0.8629629629629629,2023-03-02 00:30:39.384252,2023-03-02 00:30:39.668718,0 days 00:00:00.284466,0.38222119392725395,0.6083205039997581,,,,,,,,,,,,,,Bayes,,,,,,,,,,,,,,,,,,,,,,COMPLETE
613,613,0.8664814814814815,2023-03-02 00:30:39.426600,2023-03-02 00:30:39.718721,0 days 00:00:00.292121,0.32816400964666165,0.24246632962841258,,,,,,,,,,,,,,Bayes,,,,,,,,,,,,,,,,,,,,,,COMPLETE
614,614,0.8629629629629629,2023-03-02 00:30:39.510602,2023-03-02 00:30:39.767720,0 days 00:00:00.257118,0.09075842311698053,0.6660645367441191,,,,,,,,,,,,,,Bayes,,,,,,,,,,,,,,,,,,,,,,COMPLETE
615,615,0.867037037037037,2023-03-02 00:30:39.521603,2023-03-02 00:30:39.784719,0 days 00:00:00.263116,0.5201480875647836,0.22238047448497344,,,,,,,,,,,,,,Bayes,,,,,,,,,,,,,,,,,,,,,,COMPLETE
616,616,0.8631481481481481,2023-03-02 00:30:39.571603,2023-03-02 00:30:39.795719,0 days 00:00:00.224116,0.3679598921617003,0.5044691154427361,,,,,,,,,,,,,,Bayes,,,,,,,,,,,,,,,,,,,,,,COMPLETE
617,617,0.8653703703703703,2023-03-02 00:30:39.619723,2023-03-02 00:30:39.833719,0 days 00:00:00.213996,0.5057294019293601,0.33711669361050833,,,,,,,,,,,,,,Bayes,,,,,,,,,,,,,,,,,,,,,,COMPLETE
618,618,0.8690740740740741,2023-03-02 00:30:39.639721,2023-03-02 00:30:39.852719,0 days 00:00:00.212998,0.3800724492899907,0.10217238964831021,,,,,,,,,,,,,,Bayes,,,,,,,,,,,,,,,,,,,,,,COMPLETE
619,619,0.8677777777777778,2023-03-02 00:30:39.675719,2023-03-02 00:30:39.878719,0 days 00:00:00.203000,0.3669030678688508,0.1691581947457714,,,,,,,,,,,,,,Bayes,,,,,,,,,,,,,,,,,,,,,,COMPLETE
620,620,0.8690740740740741,2023-03-02 00:30:39.712719,2023-03-02 00:30:39.926720,0 days 00:00:00.214001,0.08835014353157568,0.1546950111964311,,,,,,,,,,,,,,Bayes,,,,,,,,,,,,,,,,,,,,,,COMPLETE
621,621,0.8677777777777778,2023-03-02 00:30:39.723719,2023-03-02 00:30:39.928719,0 days 00:00:00.205000,0.4438804562190775,0.16597124115406645,,,,,,,,,,,,,,Bayes,,,,,,,,,,,,,,,,,,,,,,COMPLETE
622,622,0.8681481481481481,2023-03-02 00:30:39.769719,2023-03-02 00:30:40.016730,0 days 00:00:00.247011,0.37170173993401573,0.05688068775258954,,,,,,,,,,,,,,Bayes,,,,,,,,,,,,,,,,,,,,,,COMPLETE
623,623,0.8668518518518519,2023-03-02 00:30:39.788719,2023-03-02 00:30:40.015727,0 days 00:00:00.227008,0.14124438290723507,0.29012592170056795,,,,,,,,,,,,,,Bayes,,,,,,,,,,,,,,,,,,,,,,COMPLETE
624,624,0.8681481481481481,2023-03-02 00:30:39.800719,2023-03-02 00:30:40.056729,0 days 00:00:00.256010,0.4463408372097648,0.05436164176179732,,,,,,,,,,,,,,Bayes,,,,,,,,,,,,,,,,,,,,,,COMPLETE
625,625,0.7366666666666667,2023-03-02 00:30:39.836720,2023-03-02 00:30:39.970727,0 days 00:00:00.134007,,,,,,,,,,,,,,,,SVM,39.16560071589035,,ovr,,scale,rbf,False,0.10186889147370559,,,,,,,,,,,,,,COMPLETE
626,626,0.8679629629629629,2023-03-02 00:30:39.857720,2023-03-02 00:30:40.086727,0 days 00:00:00.229007,0.42188216085032043,0.06285896723402962,,,,,,,,,,,,,,Bayes,,,,,,,,,,,,,,,,,,,,,,COMPLETE
627,627,0.8681481481481481,2023-03-02 00:30:39.880719,2023-03-02 00:30:40.131887,0 days 00:00:00.251168,0.1392191466580774,0.054900269407808316,,,,,,,,,,,,,,Bayes,,,,,,,,,,,,,,,,,,,,,,COMPLETE
628,628,0.7318518518518519,2023-03-02 00:30:39.929720,2023-03-02 00:30:40.110889,0 days 00:00:00.181169,,,,,,,,,,,,,,,,SVM,58.273868114121804,,ovr,,scale,rbf,False,0.43837810519738185,,,,,,,,,,,,,,COMPLETE
629,629,0.7264814814814814,2023-03-02 00:30:39.934719,2023-03-02 00:30:40.085730,0 days 00:00:00.151011,,,,,,,,,,,,,,,,SVM,53.27074831102051,,ovr,,auto,rbf,False,0.7589868850684369,,,,,,,,,,,,,,COMPLETE
630,630,0.8692592592592593,2023-03-02 00:30:39.972727,2023-03-02 00:30:40.191889,0 days 00:00:00.219162,0.024249900598866336,0.09936325070761404,,,,,,,,,,,,,,Bayes,,,,,,,,,,,,,,,,,,,,,,COMPLETE
631,631,0.8648148148148147,2023-03-02 00:30:40.020728,2023-03-02 00:30:40.250889,0 days 00:00:00.230161,0.4089354483348024,0.3808686173526205,,,,,,,,,,,,,,Bayes,,,,,,,,,,,,,,,,,,,,,,COMPLETE
632,632,0.8692592592592593,2023-03-02 00:30:40.025729,2023-03-02 00:30:40.231889,0 days 00:00:00.206160,0.02884904165861353,0.09675452612737719,,,,,,,,,,,,,,Bayes,,,,,,,,,,,,,,,,,,,,,,COMPLETE
633,633,0.8690740740740741,2023-03-02 00:30:40.061728,2023-03-02 00:30:40.257888,0 days 00:00:00.196160,0.044424921060042886,0.13197010836190987,,,,,,,,,,,,,,Bayes,,,,,,,,,,,,,,,,,,,,,,COMPLETE
634,634,0.8690740740740741,2023-03-02 00:30:40.090729,2023-03-02 00:30:40.299889,0 days 00:00:00.209160,0.03756963726360851,0.101768830531697,,,,,,,,,,,,,,Bayes,,,,,,,,,,,,,,,,,,,,,,COMPLETE
635,635,0.865,2023-03-02 00:30:40.097728,2023-03-02 00:30:40.288888,0 days 00:00:00.191160,0.02859437477638167,0.3620819163135965,,,,,,,,,,,,,,Bayes,,,,,,,,,,,,,,,,,,,,,,COMPLETE
636,636,0.8688888888888889,2023-03-02 00:30:40.115888,2023-03-02 00:30:40.330887,0 days 00:00:00.214999,0.45961342780948794,0.13300314577134392,,,,,,,,,,,,,,Bayes,,,,,,,,,,,,,,,,,,,,,,COMPLETE
637,637,0.8688888888888889,2023-03-02 00:30:40.135890,2023-03-02 00:30:40.340888,0 days 00:00:00.204998,0.03253746693601952,0.13383791604203674,,,,,,,,,,,,,,Bayes,,,,,,,,,,,,,,,,,,,,,,COMPLETE
638,638,0.8690740740740741,2023-03-02 00:30:40.196890,2023-03-02 00:30:40.406887,0 days 00:00:00.209997,0.24940497049652963,0.07870896065446939,,,,,,,,,,,,,,Bayes,,,,,,,,,,,,,,,,,,,,,,COMPLETE
639,639,0.862962962962963,2023-03-02 00:30:40.235888,2023-03-02 00:30:40.451889,0 days 00:00:00.216001,0.05171955971748325,0.7481391444471617,,,,,,,,,,,,,,Bayes,,,,,,,,,,,,,,,,,,,,,,COMPLETE
640,640,0.8614814814814815,2023-03-02 00:30:40.252891,2023-03-02 00:30:40.498888,0 days 00:00:00.245997,0.48684683748529844,0.9206563828282248,,,,,,,,,,,,,,Bayes,,,,,,,,,,,,,,,,,,,,,,COMPLETE
641,641,0.8614814814814815,2023-03-02 00:30:40.259888,2023-03-02 00:30:40.474887,0 days 00:00:00.214999,0.2499992692085635,0.9212756098792088,,,,,,,,,,,,,,Bayes,,,,,,,,,,,,,,,,,,,,,,COMPLETE
642,642,0.8690740740740741,2023-03-02 00:30:40.294891,2023-03-02 00:30:40.534888,0 days 00:00:00.239997,0.0007479406688787802,0.08081499273378782,,,,,,,,,,,,,,Bayes,,,,,,,,,,,,,,,,,,,,,,COMPLETE
643,643,0.5,2023-03-02 00:30:40.302891,2023-03-02 00:30:40.559888,0 days 00:00:00.256997,,,,,,,,,,,,,,,,Tree,,,,,,,,,564.8789437310298,gini,0.42143758758541805,507.9673257842321,0.3950993032898832,0.6232403083418308,0.43064413925139905,best,,,,,,COMPLETE
644,644,0.8690740740740741,2023-03-02 00:30:40.335890,2023-03-02 00:30:40.578888,0 days 00:00:00.242998,0.47579472069342826,0.0774497867798895,,,,,,,,,,,,,,Bayes,,,,,,,,,,,,,,,,,,,,,,COMPLETE
645,645,0.8688888888888889,2023-03-02 00:30:40.343888,2023-03-02 00:30:40.585889,0 days 00:00:00.242001,0.1139315248559702,0.03295799058518335,,,,,,,,,,,,,,Bayes,,,,,,,,,,,,,,,,,,,,,,COMPLETE
646,646,0.5,2023-03-02 00:30:40.411888,2023-03-02 00:30:40.686624,0 days 00:00:00.274736,,,,,,,,,,,,,,,,Tree,,,,,,,,,619.0522610928729,gini,0.12487513830302732,531.9388955382034,0.3932175470090782,0.8020749691108029,0.4186016097833379,best,,,,,,COMPLETE
647,647,0.5,2023-03-02 00:30:40.455888,2023-03-02 00:30:40.755624,0 days 00:00:00.299736,,,,,,,,,,,,,,,,Tree,,,,,,,,,740.7238836372661,gini,0.08347241555559781,522.2793050949649,0.3951324823496628,0.605224752931429,0.4054112784988558,best,,,,,,COMPLETE
648,648,0.8690740740740741,2023-03-02 00:30:40.483889,2023-03-02 00:30:40.718625,0 days 00:00:00.234736,0.17858143198893345,0.11816944657997273,,,,,,,,,,,,,,Bayes,,,,,,,,,,,,,,,,,,,,,,COMPLETE
649,649,0.8664814814814814,2023-03-02 00:30:40.501888,2023-03-02 00:30:40.738626,0 days 00:00:00.236738,0.1736215560375216,0.27506955524784793,,,,,,,,,,,,,,Bayes,,,,,,,,,,,,,,,,,,,,,,COMPLETE
650,650,0.5,2023-03-02 00:30:40.537888,2023-03-02 00:30:40.829003,0 days 00:00:00.291115,,,,,,,,,,,,,,,,Tree,,,,,,,,,901.530360536136,gini,0.014705519159321279,224.73353570762924,0.3917417709745312,0.6062225863955724,0.4069311945733865,best,,,,,,COMPLETE
651,651,0.8690740740740741,2023-03-02 00:30:40.571890,2023-03-02 00:30:40.785625,0 days 00:00:00.213735,0.1780909834106407,0.11290157554030988,,,,,,,,,,,,,,Bayes,,,,,,,,,,,,,,,,,,,,,,COMPLETE
652,652,0.8690740740740741,2023-03-02 00:30:40.586891,2023-03-02 00:30:40.810322,0 days 00:00:00.223431,0.18860871783775096,0.11294621498603023,,,,,,,,,,,,,,Bayes,,,,,,,,,,,,,,,,,,,,,,COMPLETE
653,653,0.8690740740740741,2023-03-02 00:30:40.598888,2023-03-02 00:30:40.833002,0 days 00:00:00.234114,0.17179139281388184,0.11194161235314168,,,,,,,,,,,,,,Bayes,,,,,,,,,,,,,,,,,,,,,,COMPLETE
654,654,0.8694444444444445,2023-03-02 00:30:40.693624,2023-03-02 00:30:40.916865,0 days 00:00:00.223241,0.1687686593142064,0.0955575620947656,,,,,,,,,,,,,,Bayes,,,,,,,,,,,,,,,,,,,,,,COMPLETE
655,655,0.8629629629629629,2023-03-02 00:30:40.720624,2023-03-02 00:30:40.940879,0 days 00:00:00.220255,0.065977777058732,0.5849045540682563,,,,,,,,,,,,,,Bayes,,,,,,,,,,,,,,,,,,,,,,COMPLETE
656,656,0.8633333333333334,2023-03-02 00:30:40.743625,2023-03-02 00:30:40.972442,0 days 00:00:00.228817,0.28973851565510883,0.7036576793238574,,,,,,,,,,,,,,Bayes,,,,,,,,,,,,,,,,,,,,,,COMPLETE
657,657,0.8688888888888888,2023-03-02 00:30:40.758627,2023-03-02 00:30:40.981440,0 days 00:00:00.222813,0.07076416335437588,0.07133300915598492,,,,,,,,,,,,,,Bayes,,,,,,,,,,,,,,,,,,,,,,COMPLETE
658,658,0.8644444444444443,2023-03-02 00:30:40.788624,2023-03-02 00:30:41.008440,0 days 00:00:00.219816,0.29196980750601464,0.43045868148513733,,,,,,,,,,,,,,Bayes,,,,,,,,,,,,,,,,,,,,,,COMPLETE
659,659,0.8694444444444445,2023-03-02 00:30:40.815325,2023-03-02 00:30:41.029440,0 days 00:00:00.214115,0.06606303835507508,0.08842185704229928,,,,,,,,,,,,,,Bayes,,,,,,,,,,,,,,,,,,,,,,COMPLETE
660,660,0.8685185185185185,2023-03-02 00:30:40.841002,2023-03-02 00:30:41.056953,0 days 00:00:00.215951,0.5394014777479152,0.06790943544660677,,,,,,,,,,,,,,Bayes,,,,,,,,,,,,,,,,,,,,,,COMPLETE
661,661,0.8629629629629629,2023-03-02 00:30:40.849002,2023-03-02 00:30:41.062954,0 days 00:00:00.213952,0.06441808945200378,0.594171132489882,,,,,,,,,,,,,,Bayes,,,,,,,,,,,,,,,,,,,,,,COMPLETE
662,662,0.8644444444444445,2023-03-02 00:30:40.919867,2023-03-02 00:30:41.133070,0 days 00:00:00.213203,0.06722361145347164,0.3979166110928233,,,,,,,,,,,,,,Bayes,,,,,,,,,,,,,,,,,,,,,,COMPLETE
663,663,0.8688888888888889,2023-03-02 00:30:40.948881,2023-03-02 00:30:41.173644,0 days 00:00:00.224763,0.2973764339215087,0.039759562348663714,,,,,,,,,,,,,,Bayes,,,,,,,,,,,,,,,,,,,,,,COMPLETE
664,664,0.8644444444444443,2023-03-02 00:30:40.976443,2023-03-02 00:30:41.176648,0 days 00:00:00.200205,0.11638103142539181,0.41953523307186735,,,,,,,,,,,,,,Bayes,,,,,,,,,,,,,,,,,,,,,,COMPLETE
665,665,0.8646296296296296,2023-03-02 00:30:40.983440,2023-03-02 00:30:41.175647,0 days 00:00:00.192207,0.3481804574273567,0.3770272183750753,,,,,,,,,,,,,,Bayes,,,,,,,,,,,,,,,,,,,,,,COMPLETE
666,666,0.8690740740740741,2023-03-02 00:30:41.010440,2023-03-02 00:30:41.220645,0 days 00:00:00.210205,0.3499289539194515,0.02553281485396608,,,,,,,,,,,,,,Bayes,,,,,,,,,,,,,,,,,,,,,,COMPLETE
667,667,0.8688888888888889,2023-03-02 00:30:41.031442,2023-03-02 00:30:41.230645,0 days 00:00:00.199203,0.34443800725364815,0.03775757911786689,,,,,,,,,,,,,,Bayes,,,,,,,,,,,,,,,,,,,,,,COMPLETE
668,668,0.8648148148148148,2023-03-02 00:30:41.059954,2023-03-02 00:30:41.286644,0 days 00:00:00.226690,0.10950881164579575,0.35001277835877936,,,,,,,,,,,,,,Bayes,,,,,,,,,,,,,,,,,,,,,,COMPLETE
669,669,0.862962962962963,2023-03-02 00:30:41.071952,2023-03-02 00:30:41.261646,0 days 00:00:00.189694,0.11577760542131899,0.7765104741783913,,,,,,,,,,,,,,Bayes,,,,,,,,,,,,,,,,,,,,,,COMPLETE
670,670,0.8633333333333334,2023-03-02 00:30:41.143661,2023-03-02 00:30:41.353644,0 days 00:00:00.209983,0.11238039975456311,0.5281016691207836,,,,,,,,,,,,,,Bayes,,,,,,,,,,,,,,,,,,,,,,COMPLETE
671,671,0.8690740740740741,2023-03-02 00:30:41.178646,2023-03-02 00:30:41.388649,0 days 00:00:00.210003,0.2657836409850315,0.1456370631378381,,,,,,,,,,,,,,Bayes,,,,,,,,,,,,,,,,,,,,,,COMPLETE
672,672,0.8690740740740741,2023-03-02 00:30:41.183645,2023-03-02 00:30:41.408646,0 days 00:00:00.225001,0.6051093325941433,0.14449159335479372,,,,,,,,,,,,,,Bayes,,,,,,,,,,,,,,,,,,,,,,COMPLETE
673,673,0.8690740740740741,2023-03-02 00:30:41.188645,2023-03-02 00:30:41.377644,0 days 00:00:00.188999,0.13865905309211113,0.1452093458692125,,,,,,,,,,,,,,Bayes,,,,,,,,,,,,,,,,,,,,,,COMPLETE
674,674,0.8688888888888889,2023-03-02 00:30:41.224645,2023-03-02 00:30:41.433646,0 days 00:00:00.209001,0.2682362805460036,0.14002953840631066,,,,,,,,,,,,,,Bayes,,,,,,,,,,,,,,,,,,,,,,COMPLETE
675,675,0.8635185185185185,2023-03-02 00:30:41.232645,2023-03-02 00:30:41.451644,0 days 00:00:00.218999,0.3194850514665761,0.5573974584130662,,,,,,,,,,,,,,Bayes,,,,,,,,,,,,,,,,,,,,,,COMPLETE
676,676,0.8690740740740741,2023-03-02 00:30:41.264645,2023-03-02 00:30:41.472644,0 days 00:00:00.207999,0.14074719435059724,0.1453986469617468,,,,,,,,,,,,,,Bayes,,,,,,,,,,,,,,,,,,,,,,COMPLETE
677,677,0.864074074074074,2023-03-02 00:30:41.289648,2023-03-02 00:30:41.493646,0 days 00:00:00.203998,0.2712968466619866,0.4682605582366396,,,,,,,,,,,,,,Bayes,,,,,,,,,,,,,,,,,,,,,,COMPLETE
678,678,0.8633333333333333,2023-03-02 00:30:41.362645,2023-03-02 00:30:41.559644,0 days 00:00:00.196999,0.2490312532280569,0.4916247539381464,,,,,,,,,,,,,,Bayes,,,,,,,,,,,,,,,,,,,,,,COMPLETE
679,679,0.8633333333333333,2023-03-02 00:30:41.382645,2023-03-02 00:30:41.585647,0 days 00:00:00.203002,0.31722836171403845,0.7244392803881148,,,,,,,,,,,,,,Bayes,,,,,,,,,,,,,,,,,,,,,,COMPLETE
680,680,0.8694444444444445,2023-03-02 00:30:41.393644,2023-03-02 00:30:41.608645,0 days 00:00:00.215001,0.24840627162996987,0.09226651560103301,,,,,,,,,,,,,,Bayes,,,,,,,,,,,,,,,,,,,,,,COMPLETE
681,681,0.867037037037037,2023-03-02 00:30:41.412648,2023-03-02 00:30:41.618819,0 days 00:00:00.206171,0.00032834288574976544,0.22493056499161412,,,,,,,,,,,,,,Bayes,,,,,,,,,,,,,,,,,,,,,,COMPLETE
682,682,0.8666666666666666,2023-03-02 00:30:41.435645,2023-03-02 00:30:41.646713,0 days 00:00:00.211068,1.6312340159255895e-05,0.29656823184891534,,,,,,,,,,,,,,Bayes,,,,,,,,,,,,,,,,,,,,,,COMPLETE
683,683,0.8694444444444445,2023-03-02 00:30:41.453646,2023-03-02 00:30:41.669713,0 days 00:00:00.216067,0.08926501614416374,0.09216345383294017,,,,,,,,,,,,,,Bayes,,,,,,,,,,,,,,,,,,,,,,COMPLETE
684,684,0.8666666666666667,2023-03-02 00:30:41.478644,2023-03-02 00:30:41.698715,0 days 00:00:00.220071,0.09394975419135111,0.25496811372096284,,,,,,,,,,,,,,Bayes,,,,,,,,,,,,,,,,,,,,,,COMPLETE
685,685,0.8692592592592593,2023-03-02 00:30:41.498644,2023-03-02 00:30:41.720713,0 days 00:00:00.222069,0.0005233134654610595,0.09355128151768383,,,,,,,,,,,,,,Bayes,,,,,,,,,,,,,,,,,,,,,,COMPLETE
686,686,0.8675925925925927,2023-03-02 00:30:41.561646,2023-03-02 00:30:41.776713,0 days 00:00:00.215067,0.014611166493939837,0.18299758159071666,,,,,,,,,,,,,,Bayes,,,,,,,,,,,,,,,,,,,,,,COMPLETE
687,687,0.8681481481481481,2023-03-02 00:30:41.592648,2023-03-02 00:30:41.775713,0 days 00:00:00.183065,0.01362551558231341,0.06356163462918943,,,,,,,,,,,,,,Bayes,,,,,,,,,,,,,,,,,,,,,,COMPLETE
688,688,0.8644444444444445,2023-03-02 00:30:41.611644,2023-03-02 00:30:41.825713,0 days 00:00:00.214069,0.21413350825971877,0.3989391740830739,,,,,,,,,,,,,,Bayes,,,,,,,,,,,,,,,,,,,,,,COMPLETE
689,689,0.8679629629629629,2023-03-02 00:30:41.621984,2023-03-02 00:30:41.840714,0 days 00:00:00.218730,0.09179625170198924,0.06134517206465339,,,,,,,,,,,,,,Bayes,,,,,,,,,,,,,,,,,,,,,,COMPLETE
690,690,0.8622222222222222,2023-03-02 00:30:41.649715,2023-03-02 00:30:41.959714,0 days 00:00:00.309999,0.4001332834068607,0.8069187749389689,,,,,,,,,,,,,,Bayes,,,,,,,,,,,,,,,,,,,,,,COMPLETE
691,691,0.8644444444444445,2023-03-02 00:30:41.671716,2023-03-02 00:30:42.024312,0 days 00:00:00.352596,0.20096176069675092,0.3976116453038961,,,,,,,,,,,,,,Bayes,,,,,,,,,,,,,,,,,,,,,,COMPLETE
692,692,0.8633333333333333,2023-03-02 00:30:41.700713,2023-03-02 00:30:42.074310,0 days 00:00:00.373597,0.21651471410186474,0.6219050209730881,,,,,,,,,,,,,,Bayes,,,,,,,,,,,,,,,,,,,,,,COMPLETE
693,693,0.8690740740740741,2023-03-02 00:30:41.725716,2023-03-02 00:30:42.105309,0 days 00:00:00.379593,0.22768981104308125,0.12212969040034083,,,,,,,,,,,,,,Bayes,,,,,,,,,,,,,,,,,,,,,,COMPLETE
694,694,0.8627777777777778,2023-03-02 00:30:41.778715,2023-03-02 00:30:42.193455,0 days 00:00:00.414740,0.19924235704039092,0.6013366494181108,,,,,,,,,,,,,,Bayes,,,,,,,,,,,,,,,,,,,,,,COMPLETE
695,695,0.5,2023-03-02 00:30:41.784713,2023-03-02 00:30:42.036834,0 days 00:00:00.252121,,,,,,,,,,,,,,,,SVM,69.67423900717027,57.780693259112724,ovo,,auto,sigmoid,True,0.9044766197172491,,,,,,,,,,,,,,COMPLETE
696,696,0.5,2023-03-02 00:30:41.828715,2023-03-02 00:30:42.125498,0 days 00:00:00.296783,,,,,,,,,,,,,,,,SVM,67.51398409851829,65.90962692144507,ovo,,auto,sigmoid,True,0.9857107743718423,,,,,,,,,,,,,,COMPLETE
697,697,0.5,2023-03-02 00:30:41.927712,2023-03-02 00:30:42.130209,0 days 00:00:00.202497,,,,,,,,,,,,,,,,SVM,68.58583966076577,64.9234644270957,ovo,,auto,sigmoid,True,0.9993199587913841,,,,,,,,,,,,,,COMPLETE
698,698,0.5,2023-03-02 00:30:41.969716,2023-03-02 00:30:42.154455,0 days 00:00:00.184739,,,,,,,,,,,,,,,,SVM,70.51294400217346,55.233496442414335,ovo,,auto,sigmoid,True,0.9729828938167016,,,,,,,,,,,,,,COMPLETE
699,699,0.5,2023-03-02 00:30:42.027311,2023-03-02 00:30:42.213454,0 days 00:00:00.186143,,,,,,,,,,,,,,,,SVM,10.11475991403676,-51.15478129509883,ovr,,scale,sigmoid,False,0.5694619202366209,,,,,,,,,,,,,,COMPLETE
700,700,0.8688888888888888,2023-03-02 00:30:42.042828,2023-03-02 00:30:42.291455,0 days 00:00:00.248627,0.32694836807868316,0.07686187194256838,,,,,,,,,,,,,,Bayes,,,,,,,,,,,,,,,,,,,,,,COMPLETE
701,701,0.8648148148148149,2023-03-02 00:30:42.081308,2023-03-02 00:30:42.308456,0 days 00:00:00.227148,0.3276316856171143,0.3694340246065217,,,,,,,,,,,,,,Bayes,,,,,,,,,,,,,,,,,,,,,,COMPLETE
702,702,0.8690740740740741,2023-03-02 00:30:42.107309,2023-03-02 00:30:42.334455,0 days 00:00:00.227146,0.6821423367646194,0.10404855928464848,,,,,,,,,,,,,,Bayes,,,,,,,,,,,,,,,,,,,,,,COMPLETE
703,703,0.8688888888888888,2023-03-02 00:30:42.131256,2023-03-02 00:30:42.355456,0 days 00:00:00.224200,0.3113297375284586,0.07623810452101089,,,,,,,,,,,,,,Bayes,,,,,,,,,,,,,,,,,,,,,,COMPLETE
704,704,0.8629629629629629,2023-03-02 00:30:42.144456,2023-03-02 00:30:42.341457,0 days 00:00:00.197001,0.29833987330850237,0.6484575382885898,,,,,,,,,,,,,,Bayes,,,,,,,,,,,,,,,,,,,,,,COMPLETE
705,705,0.8633333333333333,2023-03-02 00:30:42.161456,2023-03-02 00:30:42.377455,0 days 00:00:00.215999,0.3130151451860739,0.5090130966820148,,,,,,,,,,,,,,Bayes,,,,,,,,,,,,,,,,,,,,,,COMPLETE
706,706,0.8657407407407407,2023-03-02 00:30:42.200456,2023-03-02 00:30:42.405456,0 days 00:00:00.205000,0.3272867660227432,0.3324328220432388,,,,,,,,,,,,,,Bayes,,,,,,,,,,,,,,,,,,,,,,COMPLETE
707,707,0.8638888888888889,2023-03-02 00:30:42.218456,2023-03-02 00:30:42.415455,0 days 00:00:00.196999,0.32753551363457023,0.45337195586307166,,,,,,,,,,,,,,Bayes,,,,,,,,,,,,,,,,,,,,,,COMPLETE
708,708,0.8687037037037038,2023-03-02 00:30:42.296455,2023-03-02 00:30:42.514741,0 days 00:00:00.218286,0.15211479850461748,0.04600800676541918,,,,,,,,,,,,,,Bayes,,,,,,,,,,,,,,,,,,,,,,COMPLETE
709,709,0.8638888888888889,2023-03-02 00:30:42.310456,2023-03-02 00:30:42.521741,0 days 00:00:00.211285,0.6931834146290863,0.47160652568601424,,,,,,,,,,,,,,Bayes,,,,,,,,,,,,,,,,,,,,,,COMPLETE
710,710,0.8683333333333334,2023-03-02 00:30:42.337455,2023-03-02 00:30:42.522741,0 days 00:00:00.185286,0.27431768524675904,0.04825811514749601,,,,,,,,,,,,,,Bayes,,,,,,,,,,,,,,,,,,,,,,COMPLETE
711,711,0.8687037037037038,2023-03-02 00:30:42.346455,2023-03-02 00:30:42.558742,0 days 00:00:00.212287,0.05173005897389155,0.04615351407773852,,,,,,,,,,,,,,Bayes,,,,,,,,,,,,,,,,,,,,,,COMPLETE
712,712,0.8683333333333334,2023-03-02 00:30:42.361456,2023-03-02 00:30:42.557741,0 days 00:00:00.196285,0.7773332831167854,0.047896722579677045,,,,,,,,,,,,,,Bayes,,,,,,,,,,,,,,,,,,,,,,COMPLETE
713,713,0.867962962962963,2023-03-02 00:30:42.382455,2023-03-02 00:30:42.591742,0 days 00:00:00.209287,0.5014445186640083,0.20886788201060474,,,,,,,,,,,,,,Bayes,,,,,,,,,,,,,,,,,,,,,,COMPLETE
714,714,0.8685185185185186,2023-03-02 00:30:42.410455,2023-03-02 00:30:42.620742,0 days 00:00:00.210287,0.1584890333366947,0.046699151330474066,,,,,,,,,,,,,,Bayes,,,,,,,,,,,,,,,,,,,,,,COMPLETE
715,715,0.8642592592592593,2023-03-02 00:30:42.417455,2023-03-02 00:30:42.628795,0 days 00:00:00.211340,0.15034753169034726,0.4318673736592425,,,,,,,,,,,,,,Bayes,,,,,,,,,,,,,,,,,,,,,,COMPLETE
716,716,0.8690740740740741,2023-03-02 00:30:42.517744,2023-03-02 00:30:42.712829,0 days 00:00:00.195085,0.3571519136917796,0.12069983857883379,,,,,,,,,,,,,,Bayes,,,,,,,,,,,,,,,,,,,,,,COMPLETE
717,717,0.8629629629629629,2023-03-02 00:30:42.528741,2023-03-02 00:30:42.724830,0 days 00:00:00.196089,0.05000097332706811,0.6732604020801898,,,,,,,,,,,,,,Bayes,,,,,,,,,,,,,,,,,,,,,,COMPLETE
718,718,0.8690740740740741,2023-03-02 00:30:42.536742,2023-03-02 00:30:42.757829,0 days 00:00:00.221087,0.509455249138428,0.11590156805967503,,,,,,,,,,,,,,Bayes,,,,,,,,,,,,,,,,,,,,,,COMPLETE
