,number,value,datetime_start,datetime_complete,duration,params_Bayes_prior_positive,params_Bayes_var_smoothing,params_GB_ccp_alpha,params_GB_criterion,params_GB_learning_rate,params_GB_loss,params_GB_max_depth,params_GB_max_features,params_GB_min_impurity_decrease,params_GB_min_samples_leaf,params_GB_min_samples_split,params_GB_n_estimators,params_GB_subsample,params_GB_tol,params_GB_validation_fraction,params_Method,params_SVM_C,params_SVM_coef0,params_SVM_decision_function_shape,params_SVM_degree,params_SVM_gamma,params_SVM_kernel,params_SVM_shrinking,params_SVM_tol,params_Tree_ccp_alpha,params_Tree_criterion,params_Tree_max_features,params_Tree_min_impurity_decrease,params_Tree_min_samples_leaf,params_Tree_min_samples_split,params_Tree_min_weight_fraction_leaf,params_Tree_splitter,params_kNN_algorithm,params_kNN_leaf_size,params_kNN_n_neighbors,params_kNN_p,params_kNN_weights,state
1342,1342,0.5,2023-03-02 00:31:13.750968,2023-03-02 00:31:16.535670,0 days 00:00:02.784702,,,47.45964395817731,squared_error,2.7750388514910385,deviance,38.0,0.5853698105098395,555.1318180908648,0.10173268983932396,0.9532806888836334,799.0,0.3237983656578751,0.0010260594497906728,0.15990607101887455,Gradient Boosting,,,,,,,,,,,,,,,,,,,,,,COMPLETE
1343,1343,0.867962962962963,2023-03-02 00:31:13.812965,2023-03-02 00:31:14.371031,0 days 00:00:00.558066,0.02404199863687228,0.21115656085837137,,,,,,,,,,,,,,Bayes,,,,,,,,,,,,,,,,,,,,,,COMPLETE
1344,1344,0.5,2023-03-02 00:31:13.857966,2023-03-02 00:31:14.783740,0 days 00:00:00.925774,,,44.87509757895049,squared_error,2.7820310719411063,deviance,10.0,0.04945617368208177,512.5998675693636,0.09753952197946042,0.9408282013629407,43.0,0.7242099992403346,0.02388384533817317,0.16788455382356304,Gradient Boosting,,,,,,,,,,,,,,,,,,,,,,COMPLETE
1345,1345,0.5,2023-03-02 00:31:13.945967,2023-03-02 00:31:15.019739,0 days 00:00:01.073772,,,305.7510318920595,squared_error,9.905976927839205,deviance,27.0,0.02901718161922695,561.7127657190222,0.09369662087299782,0.14103666467301956,70.0,0.36089130989832446,0.02814339563949486,0.4805114887015018,Gradient Boosting,,,,,,,,,,,,,,,,,,,,,,COMPLETE
1346,1346,0.8629629629629629,2023-03-02 00:31:14.060710,2023-03-02 00:31:14.535673,0 days 00:00:00.474963,0.42563378952471487,0.609210273650211,,,,,,,,,,,,,,Bayes,,,,,,,,,,,,,,,,,,,,,,COMPLETE
1347,1347,0.8653703703703703,2023-03-02 00:31:14.201028,2023-03-02 00:31:14.604742,0 days 00:00:00.403714,0.6328229043704046,0.3416083006668501,,,,,,,,,,,,,,Bayes,,,,,,,,,,,,,,,,,,,,,,COMPLETE
1348,1348,0.864074074074074,2023-03-02 00:31:14.380028,2023-03-02 00:31:14.816739,0 days 00:00:00.436711,0.12498779419026278,0.446354722062577,,,,,,,,,,,,,,Bayes,,,,,,,,,,,,,,,,,,,,,,COMPLETE
1349,1349,0.8631481481481481,2023-03-02 00:31:14.539673,2023-03-02 00:31:15.022739,0 days 00:00:00.483066,0.623813480447852,0.6848551188371749,,,,,,,,,,,,,,Bayes,,,,,,,,,,,,,,,,,,,,,,COMPLETE
1350,1350,0.8618518518518519,2023-03-02 00:31:14.613739,2023-03-02 00:31:15.084220,0 days 00:00:00.470481,0.1393626495800577,0.8589788734201382,,,,,,,,,,,,,,Bayes,,,,,,,,,,,,,,,,,,,,,,COMPLETE
1351,1351,0.8681481481481481,2023-03-02 00:31:14.681742,2023-03-02 00:31:15.137832,0 days 00:00:00.456090,0.1357401043715661,0.054121814150668364,,,,,,,,,,,,,,Bayes,,,,,,,,,,,,,,,,,,,,,,COMPLETE
1352,1352,0.8685185185185186,2023-03-02 00:31:14.732743,2023-03-02 00:31:15.202833,0 days 00:00:00.470090,0.12357510906499512,0.04690461024680642,,,,,,,,,,,,,,Bayes,,,,,,,,,,,,,,,,,,,,,,COMPLETE
1353,1353,0.8681481481481481,2023-03-02 00:31:14.788741,2023-03-02 00:31:15.280834,0 days 00:00:00.492093,0.1265538062747903,0.0528245292519525,,,,,,,,,,,,,,Bayes,,,,,,,,,,,,,,,,,,,,,,COMPLETE
1354,1354,0.8681481481481481,2023-03-02 00:31:14.819741,2023-03-02 00:31:15.263831,0 days 00:00:00.444090,0.018928288904527038,0.055294755233009966,,,,,,,,,,,,,,Bayes,,,,,,,,,,,,,,,,,,,,,,COMPLETE
1355,1355,0.8638888888888889,2023-03-02 00:31:15.023739,2023-03-02 00:31:15.387519,0 days 00:00:00.363780,0.8855088248138263,0.47121462694240007,,,,,,,,,,,,,,Bayes,,,,,,,,,,,,,,,,,,,,,,COMPLETE
1356,1356,0.8690740740740741,2023-03-02 00:31:15.036740,2023-03-02 00:31:15.355831,0 days 00:00:00.319091,0.7613519497541358,0.07909198328527095,,,,,,,,,,,,,,Bayes,,,,,,,,,,,,,,,,,,,,,,COMPLETE
1357,1357,0.8644444444444445,2023-03-02 00:31:15.098831,2023-03-02 00:31:15.430519,0 days 00:00:00.331688,0.01915708611875943,0.4037790150040217,,,,,,,,,,,,,,Bayes,,,,,,,,,,,,,,,,,,,,,,COMPLETE
1358,1358,0.8688888888888889,2023-03-02 00:31:15.140831,2023-03-02 00:31:15.498522,0 days 00:00:00.357691,0.40054806599941195,0.08114942685383343,,,,,,,,,,,,,,Bayes,,,,,,,,,,,,,,,,,,,,,,COMPLETE
1359,1359,0.8601851851851852,2023-03-02 00:31:15.208831,2023-03-02 00:31:15.571519,0 days 00:00:00.362688,0.24573992251414015,0.9984611244587398,,,,,,,,,,,,,,Bayes,,,,,,,,,,,,,,,,,,,,,,COMPLETE
1360,1360,0.8629629629629629,2023-03-02 00:31:15.269835,2023-03-02 00:31:15.613245,0 days 00:00:00.343410,0.8805925303076758,0.5942167608862182,,,,,,,,,,,,,,Bayes,,,,,,,,,,,,,,,,,,,,,,COMPLETE
1361,1361,0.8688888888888888,2023-03-02 00:31:15.290830,2023-03-02 00:31:15.651244,0 days 00:00:00.360414,0.457248932771684,0.08343258914064554,,,,,,,,,,,,,,Bayes,,,,,,,,,,,,,,,,,,,,,,COMPLETE
1362,1362,0.8614814814814815,2023-03-02 00:31:15.358830,2023-03-02 00:31:15.710990,0 days 00:00:00.352160,0.24495346282757613,0.9317017873108235,,,,,,,,,,,,,,Bayes,,,,,,,,,,,,,,,,,,,,,,COMPLETE
1363,1363,0.8692592592592593,2023-03-02 00:31:15.398518,2023-03-02 00:31:15.741989,0 days 00:00:00.343471,0.24286060686373276,0.09597110870467879,,,,,,,,,,,,,,Bayes,,,,,,,,,,,,,,,,,,,,,,COMPLETE
1364,1364,0.8694444444444445,2023-03-02 00:31:15.433520,2023-03-02 00:31:15.781047,0 days 00:00:00.347527,0.47704675375535344,0.09096847649745882,,,,,,,,,,,,,,Bayes,,,,,,,,,,,,,,,,,,,,,,COMPLETE
1365,1365,0.8664814814814814,2023-03-02 00:31:15.503521,2023-03-02 00:31:15.846907,0 days 00:00:00.343386,0.35118829302495974,0.27774461817276686,,,,,,,,,,,,,,Bayes,,,,,,,,,,,,,,,,,,,,,,COMPLETE
1366,1366,0.8690740740740741,2023-03-02 00:31:15.575520,2023-03-02 00:31:16.044496,0 days 00:00:00.468976,0.35003723024247524,0.11185101295939213,,,,,,,,,,,,,,Bayes,,,,,,,,,,,,,,,,,,,,,,COMPLETE
1367,1367,0.8690740740740741,2023-03-02 00:31:15.619245,2023-03-02 00:31:16.060493,0 days 00:00:00.441248,0.3428329170360466,0.15443881789145314,,,,,,,,,,,,,,Bayes,,,,,,,,,,,,,,,,,,,,,,COMPLETE
1368,1368,0.8690740740740741,2023-03-02 00:31:15.663245,2023-03-02 00:31:16.133170,0 days 00:00:00.469925,0.9165903120188427,0.11513260666820098,,,,,,,,,,,,,,Bayes,,,,,,,,,,,,,,,,,,,,,,COMPLETE
1369,1369,0.8690740740740741,2023-03-02 00:31:15.713989,2023-03-02 00:31:16.164172,0 days 00:00:00.450183,0.3572112966827899,0.024024420940608804,,,,,,,,,,,,,,Bayes,,,,,,,,,,,,,,,,,,,,,,COMPLETE
1370,1370,0.8692592592592593,2023-03-02 00:31:15.747989,2023-03-02 00:31:16.205170,0 days 00:00:00.457181,0.351822643338383,0.00399608819618387,,,,,,,,,,,,,,Bayes,,,,,,,,,,,,,,,,,,,,,,COMPLETE
1371,1371,0.8690740740740741,2023-03-02 00:31:15.785564,2023-03-02 00:31:16.222172,0 days 00:00:00.436608,0.3517412862615447,0.149804180840165,,,,,,,,,,,,,,Bayes,,,,,,,,,,,,,,,,,,,,,,COMPLETE
1372,1372,0.8690740740740741,2023-03-02 00:31:15.859904,2023-03-02 00:31:16.311170,0 days 00:00:00.451266,0.8267920659722808,0.12187475687873092,,,,,,,,,,,,,,Bayes,,,,,,,,,,,,,,,,,,,,,,COMPLETE
1373,1373,0.867962962962963,2023-03-02 00:31:16.049496,2023-03-02 00:31:16.393851,0 days 00:00:00.344355,0.060235311086695255,0.19105055157647757,,,,,,,,,,,,,,Bayes,,,,,,,,,,,,,,,,,,,,,,COMPLETE
1374,1374,0.8629629629629629,2023-03-02 00:31:16.070495,2023-03-02 00:31:16.431812,0 days 00:00:00.361317,0.9248516469087398,0.6615640384031598,,,,,,,,,,,,,,Bayes,,,,,,,,,,,,,,,,,,,,,,COMPLETE
1375,1375,0.8633333333333334,2023-03-02 00:31:16.138171,2023-03-02 00:31:16.530673,0 days 00:00:00.392502,0.5831077443609712,0.5657801860835233,,,,,,,,,,,,,,Bayes,,,,,,,,,,,,,,,,,,,,,,COMPLETE
1376,1376,0.8635185185185185,2023-03-02 00:31:16.167170,2023-03-02 00:31:16.500812,0 days 00:00:00.333642,0.3821393706156687,0.5613662041118543,,,,,,,,,,,,,,Bayes,,,,,,,,,,,,,,,,,,,,,,COMPLETE
1377,1377,0.8685185185185185,2023-03-02 00:31:16.210170,2023-03-02 00:31:16.595203,0 days 00:00:00.385033,0.05895705627290544,0.06815590219839424,,,,,,,,,,,,,,Bayes,,,,,,,,,,,,,,,,,,,,,,COMPLETE
1378,1378,0.8635185185185185,2023-03-02 00:31:16.241170,2023-03-02 00:31:16.609377,0 days 00:00:00.368207,0.06314452107238205,0.5613760341938556,,,,,,,,,,,,,,Bayes,,,,,,,,,,,,,,,,,,,,,,COMPLETE
1379,1379,0.8683333333333333,2023-03-02 00:31:16.314170,2023-03-02 00:31:16.661377,0 days 00:00:00.347207,0.06224003430861996,0.06517528397431765,,,,,,,,,,,,,,Bayes,,,,,,,,,,,,,,,,,,,,,,COMPLETE
1380,1380,0.8685185185185185,2023-03-02 00:31:16.406813,2023-03-02 00:31:16.741385,0 days 00:00:00.334572,0.5682104829273867,0.06719919517156346,,,,,,,,,,,,,,Bayes,,,,,,,,,,,,,,,,,,,,,,COMPLETE
1381,1381,0.8688888888888888,2023-03-02 00:31:16.435813,2023-03-02 00:31:16.865930,0 days 00:00:00.430117,0.3207978862305825,0.07166948382662851,,,,,,,,,,,,,,Bayes,,,,,,,,,,,,,,,,,,,,,,COMPLETE
1382,1382,0.8692592592592593,2023-03-02 00:31:16.505668,2023-03-02 00:31:16.910930,0 days 00:00:00.405262,0.1855715025053637,0.09989259990646362,,,,,,,,,,,,,,Bayes,,,,,,,,,,,,,,,,,,,,,,COMPLETE
1383,1383,0.8672222222222223,2023-03-02 00:31:16.537671,2023-03-02 00:31:16.939927,0 days 00:00:00.402256,0.29584708835872525,0.2200724300592307,,,,,,,,,,,,,,Bayes,,,,,,,,,,,,,,,,,,,,,,COMPLETE
1384,1384,0.8648148148148147,2023-03-02 00:31:16.549672,2023-03-02 00:31:16.970043,0 days 00:00:00.420371,0.18900213166735425,0.38505466200352445,,,,,,,,,,,,,,Bayes,,,,,,,,,,,,,,,,,,,,,,COMPLETE
1385,1385,0.866111111111111,2023-03-02 00:31:16.598348,2023-03-02 00:31:17.020691,0 days 00:00:00.422343,0.18455674959766263,0.3281383242759085,,,,,,,,,,,,,,Bayes,,,,,,,,,,,,,,,,,,,,,,COMPLETE
1386,1386,0.8651851851851852,2023-03-02 00:31:16.619377,2023-03-02 00:31:16.967985,0 days 00:00:00.348608,0.6560995492975721,0.3425888384451202,,,,,,,,,,,,,,Bayes,,,,,,,,,,,,,,,,,,,,,,COMPLETE
1387,1387,0.8648148148148148,2023-03-02 00:31:16.664377,2023-03-02 00:31:17.080676,0 days 00:00:00.416299,0.2756796997175812,0.34915943607150024,,,,,,,,,,,,,,Bayes,,,,,,,,,,,,,,,,,,,,,,COMPLETE
1388,1388,0.8688888888888889,2023-03-02 00:31:16.744386,2023-03-02 00:31:17.164908,0 days 00:00:00.420522,0.32619062083895084,0.03984906748232698,,,,,,,,,,,,,,Bayes,,,,,,,,,,,,,,,,,,,,,,COMPLETE
1389,1389,0.8688888888888889,2023-03-02 00:31:16.867927,2023-03-02 00:31:17.193908,0 days 00:00:00.325981,0.1030166188928244,0.0382152456486915,,,,,,,,,,,,,,Bayes,,,,,,,,,,,,,,,,,,,,,,COMPLETE
1390,1390,0.8687037037037038,2023-03-02 00:31:16.913929,2023-03-02 00:31:17.241922,0 days 00:00:00.327993,0.5258131588828755,0.035739950014210674,,,,,,,,,,,,,,Bayes,,,,,,,,,,,,,,,,,,,,,,COMPLETE
1391,1391,0.8690740740740741,2023-03-02 00:31:16.942928,2023-03-02 00:31:17.284919,0 days 00:00:00.341991,0.26406283409027914,0.1274087276894445,,,,,,,,,,,,,,Bayes,,,,,,,,,,,,,,,,,,,,,,COMPLETE
1392,1392,0.8631481481481482,2023-03-02 00:31:16.971045,2023-03-02 00:31:17.337934,0 days 00:00:00.366889,0.10119097058984165,0.7325214531639539,,,,,,,,,,,,,,Bayes,,,,,,,,,,,,,,,,,,,,,,COMPLETE
1393,1393,0.8690740740740741,2023-03-02 00:31:16.998836,2023-03-02 00:31:17.320936,0 days 00:00:00.322100,0.27322154953569205,0.1298224982310834,,,,,,,,,,,,,,Bayes,,,,,,,,,,,,,,,,,,,,,,COMPLETE
1394,1394,0.8688888888888889,2023-03-02 00:31:17.031691,2023-03-02 00:31:17.366934,0 days 00:00:00.335243,0.7053976067679899,0.03993752889918585,,,,,,,,,,,,,,Bayes,,,,,,,,,,,,,,,,,,,,,,COMPLETE
1395,1395,0.8690740740740741,2023-03-02 00:31:17.082678,2023-03-02 00:31:17.573598,0 days 00:00:00.490920,0.8489098261724989,0.13126936172202353,,,,,,,,,,,,,,Bayes,,,,,,,,,,,,,,,,,,,,,,COMPLETE
1396,1396,0.8694444444444445,2023-03-02 00:31:17.166908,2023-03-02 00:31:17.664734,0 days 00:00:00.497826,0.10159222564744085,0.09491439803035591,,,,,,,,,,,,,,Bayes,,,,,,,,,,,,,,,,,,,,,,COMPLETE
1397,1397,0.8462962962962963,2023-03-02 00:31:17.196909,2023-03-02 00:31:17.870734,0 days 00:00:00.673825,,,,,,,,,,,,,,,,SVM,82.47936362094521,,ovr,,,linear,False,0.28894146224821027,,,,,,,,,,,,,,COMPLETE
1398,1398,0.8500925925925926,2023-03-02 00:31:17.248919,2023-03-02 00:31:17.979734,0 days 00:00:00.730815,,,,,,,,,,,,,,,,SVM,83.01467924734318,,ovr,,,linear,False,0.7770778390568005,,,,,,,,,,,,,,COMPLETE
1399,1399,0.8668518518518519,2023-03-02 00:31:17.287919,2023-03-02 00:31:17.751737,0 days 00:00:00.463818,0.9573878670930865,0.3037839320884579,,,,,,,,,,,,,,Bayes,,,,,,,,,,,,,,,,,,,,,,COMPLETE
1400,1400,0.8468518518518517,2023-03-02 00:31:17.326933,2023-03-02 00:31:18.238011,0 days 00:00:00.911078,,,,,,,,,,,,,,,,SVM,82.974393993175,,ovr,,,linear,False,0.30272971878687205,,,,,,,,,,,,,,COMPLETE
1401,1401,0.8496296296296296,2023-03-02 00:31:17.340934,2023-03-02 00:31:18.104257,0 days 00:00:00.763323,,,,,,,,,,,,,,,,SVM,81.54292571161511,,ovr,,,linear,False,0.809176491485655,,,,,,,,,,,,,,COMPLETE
1402,1402,0.46527777777777773,2023-03-02 00:31:17.383933,2023-03-02 00:31:17.750732,0 days 00:00:00.366799,,,,,,,,,,,,,,,,kNN,,,,,,,,,,,,,,,,,ball_tree,125.0,248.0,995.0,uniform,COMPLETE
1403,1403,0.8487037037037037,2023-03-02 00:31:17.578599,2023-03-02 00:31:18.152973,0 days 00:00:00.574374,,,,,,,,,,,,,,,,SVM,82.75698986529417,,ovr,,,linear,False,0.8015739384155841,,,,,,,,,,,,,,COMPLETE
1404,1404,0.8356481481481481,2023-03-02 00:31:17.667735,2023-03-02 00:31:17.847733,0 days 00:00:00.179998,,,,,,,,,,,,,,,,kNN,,,,,,,,,,,,,,,,,ball_tree,352.0,186.0,433.0,uniform,COMPLETE
1405,1405,0.8464814814814814,2023-03-02 00:31:17.753733,2023-03-02 00:31:18.095259,0 days 00:00:00.341526,,,,,,,,,,,,,,,,SVM,43.59481761972479,,ovr,,,linear,False,0.7985690713145004,,,,,,,,,,,,,,COMPLETE
1406,1406,0.8497222222222223,2023-03-02 00:31:17.765733,2023-03-02 00:31:18.348012,0 days 00:00:00.582279,,,,,,,,,,,,,,,,SVM,81.90659031251002,,ovr,,,linear,False,0.7886641012423888,,,,,,,,,,,,,,COMPLETE
1407,1407,0.8466666666666667,2023-03-02 00:31:17.849735,2023-03-02 00:31:18.593010,0 days 00:00:00.743275,,,,,,,,,,,,,,,,SVM,82.35617099068,,ovr,,,linear,False,0.17974545205416848,,,,,,,,,,,,,,COMPLETE
1408,1408,0.862037037037037,2023-03-02 00:31:17.875734,2023-03-02 00:31:17.938734,0 days 00:00:00.063000,0.02323323432724053,0.8021186287840987,,,,,,,,,,,,,,Bayes,,,,,,,,,,,,,,,,,,,,,,COMPLETE
1409,1409,0.862962962962963,2023-03-02 00:31:17.940735,2023-03-02 00:31:18.007733,0 days 00:00:00.066998,0.7318481861068874,0.779241451468476,,,,,,,,,,,,,,Bayes,,,,,,,,,,,,,,,,,,,,,,COMPLETE
1410,1410,0.8644444444444443,2023-03-02 00:31:17.982734,2023-03-02 00:31:18.061734,0 days 00:00:00.079000,0.1509610951110343,0.4182294360174011,,,,,,,,,,,,,,Bayes,,,,,,,,,,,,,,,,,,,,,,COMPLETE
1411,1411,0.864074074074074,2023-03-02 00:31:18.010734,2023-03-02 00:31:18.073734,0 days 00:00:00.063000,0.44698407827161396,0.44432399083041496,,,,,,,,,,,,,,Bayes,,,,,,,,,,,,,,,,,,,,,,COMPLETE
1412,1412,0.8614814814814815,2023-03-02 00:31:18.065733,2023-03-02 00:31:18.516013,0 days 00:00:00.450280,0.3016534558804184,0.943530214910792,,,,,,,,,,,,,,Bayes,,,,,,,,,,,,,,,,,,,,,,COMPLETE
1413,1413,0.5,2023-03-02 00:31:18.075733,2023-03-02 00:31:18.493011,0 days 00:00:00.417278,,,,,,,,,,,,,,,,Tree,,,,,,,,,281.8440529556178,entropy,0.8554129950157505,694.7953966282942,0.49840818495177064,0.16200123284041013,0.2570698816995972,best,,,,,,COMPLETE
1414,1414,0.8688888888888888,2023-03-02 00:31:18.105786,2023-03-02 00:31:18.589011,0 days 00:00:00.483225,0.00030025689880677775,0.0860522485450891,,,,,,,,,,,,,,Bayes,,,,,,,,,,,,,,,,,,,,,,COMPLETE
1415,1415,0.8688888888888888,2023-03-02 00:31:18.120973,2023-03-02 00:31:18.546012,0 days 00:00:00.425039,0.49157090895375705,0.08561973242564694,,,,,,,,,,,,,,Bayes,,,,,,,,,,,,,,,,,,,,,,COMPLETE
1416,1416,0.5,2023-03-02 00:31:18.157973,2023-03-02 00:31:18.635573,0 days 00:00:00.477600,,,,,,,,,,,,,,,,Tree,,,,,,,,,762.8254159766793,entropy,0.854959223192082,688.6228469582804,0.4161600957335076,0.008432714087764026,0.25286615791404216,best,,,,,,COMPLETE
1417,1417,0.5,2023-03-02 00:31:18.242012,2023-03-02 00:31:18.727572,0 days 00:00:00.485560,,,,,,,,,,,,,,,,Tree,,,,,,,,,888.0894071226963,entropy,0.006984856364861347,600.1628941806429,0.36959551837400306,0.17633020035678948,0.2614256840505733,best,,,,,,COMPLETE
1418,1418,0.5,2023-03-02 00:31:18.373010,2023-03-02 00:31:18.744571,0 days 00:00:00.371561,,,,,,,,,,,,,,,,Tree,,,,,,,,,373.7134078139256,entropy,0.37720156399306987,582.2481825590684,0.26969333146744345,0.3092141426388837,0.08464806007259057,best,,,,,,COMPLETE
1419,1419,0.8694444444444445,2023-03-02 00:31:18.505011,2023-03-02 00:31:18.929572,0 days 00:00:00.424561,0.02880177406764514,0.10753621527482632,,,,,,,,,,,,,,Bayes,,,,,,,,,,,,,,,,,,,,,,COMPLETE
1420,1420,0.8694444444444445,2023-03-02 00:31:18.525012,2023-03-02 00:31:18.940572,0 days 00:00:00.415560,0.6927468932915222,0.1082002693550882,,,,,,,,,,,,,,Bayes,,,,,,,,,,,,,,,,,,,,,,COMPLETE
1421,1421,0.8694444444444445,2023-03-02 00:31:18.549014,2023-03-02 00:31:18.999572,0 days 00:00:00.450558,0.2318350502138179,0.10737163493198691,,,,,,,,,,,,,,Bayes,,,,,,,,,,,,,,,,,,,,,,COMPLETE
1422,1422,0.8694444444444445,2023-03-02 00:31:18.597011,2023-03-02 00:31:19.049571,0 days 00:00:00.452560,0.5072668125118039,0.1072851955709124,,,,,,,,,,,,,,Bayes,,,,,,,,,,,,,,,,,,,,,,COMPLETE
1423,1423,0.8690740740740741,2023-03-02 00:31:18.607011,2023-03-02 00:31:19.035572,0 days 00:00:00.428561,0.3849146630988549,0.10483674936213581,,,,,,,,,,,,,,Bayes,,,,,,,,,,,,,,,,,,,,,,COMPLETE
1424,1424,0.8692592592592594,2023-03-02 00:31:18.646572,2023-03-02 00:31:19.050571,0 days 00:00:00.403999,0.03469539549761398,0.11016172134057614,,,,,,,,,,,,,,Bayes,,,,,,,,,,,,,,,,,,,,,,COMPLETE
1425,1425,0.8690740740740741,2023-03-02 00:31:18.730571,2023-03-02 00:31:19.145817,0 days 00:00:00.415246,0.030592441390156565,0.15433098757682295,,,,,,,,,,,,,,Bayes,,,,,,,,,,,,,,,,,,,,,,COMPLETE
1426,1426,0.8690740740740741,2023-03-02 00:31:18.838571,2023-03-02 00:31:19.157818,0 days 00:00:00.319247,0.03918655634453577,0.14763969044362618,,,,,,,,,,,,,,Bayes,,,,,,,,,,,,,,,,,,,,,,COMPLETE
1427,1427,0.8688888888888888,2023-03-02 00:31:18.931571,2023-03-02 00:31:19.255817,0 days 00:00:00.324246,0.40597923899789967,0.1583230620490599,,,,,,,,,,,,,,Bayes,,,,,,,,,,,,,,,,,,,,,,COMPLETE
1428,1428,0.8690740740740741,2023-03-02 00:31:18.958571,2023-03-02 00:31:19.287817,0 days 00:00:00.329246,0.32010819520492484,0.15488596340901464,,,,,,,,,,,,,,Bayes,,,,,,,,,,,,,,,,,,,,,,COMPLETE
1429,1429,0.8614814814814814,2023-03-02 00:31:19.003572,2023-03-02 00:31:19.322816,0 days 00:00:00.319244,0.49954030370379915,0.8969720906922676,,,,,,,,,,,,,,Bayes,,,,,,,,,,,,,,,,,,,,,,COMPLETE
1430,1430,0.864074074074074,2023-03-02 00:31:19.037572,2023-03-02 00:31:19.372816,0 days 00:00:00.335244,0.17164209492723023,0.46404227370070306,,,,,,,,,,,,,,Bayes,,,,,,,,,,,,,,,,,,,,,,COMPLETE
1431,1431,0.8614814814814814,2023-03-02 00:31:19.052572,2023-03-02 00:31:19.358816,0 days 00:00:00.306244,0.1477093142606361,0.8943006604439201,,,,,,,,,,,,,,Bayes,,,,,,,,,,,,,,,,,,,,,,COMPLETE
1432,1432,0.8688888888888888,2023-03-02 00:31:19.061573,2023-03-02 00:31:19.488816,0 days 00:00:00.427243,0.31809134087405366,0.07259841595785012,,,,,,,,,,,,,,Bayes,,,,,,,,,,,,,,,,,,,,,,COMPLETE
1433,1433,0.8688888888888888,2023-03-02 00:31:19.149816,2023-03-02 00:31:19.544816,0 days 00:00:00.395000,0.3187504115536768,0.07148710399465949,,,,,,,,,,,,,,Bayes,,,,,,,,,,,,,,,,,,,,,,COMPLETE
1434,1434,0.8607407407407407,2023-03-02 00:31:19.163818,2023-03-02 00:31:19.584818,0 days 00:00:00.421000,0.32060306102084424,0.9776008558061964,,,,,,,,,,,,,,Bayes,,,,,,,,,,,,,,,,,,,,,,COMPLETE
1435,1435,0.8679629629629629,2023-03-02 00:31:19.259817,2023-03-02 00:31:19.671936,0 days 00:00:00.412119,0.32148559711400365,0.061041034453802615,,,,,,,,,,,,,,Bayes,,,,,,,,,,,,,,,,,,,,,,COMPLETE
1436,1436,0.8631481481481481,2023-03-02 00:31:19.294817,2023-03-02 00:31:19.707935,0 days 00:00:00.413118,0.1702188303118179,0.6764575534987549,,,,,,,,,,,,,,Bayes,,,,,,,,,,,,,,,,,,,,,,COMPLETE
1437,1437,0.8692592592592593,2023-03-02 00:31:19.327817,2023-03-02 00:31:19.723936,0 days 00:00:00.396119,0.14991040145483575,0.08778421060290238,,,,,,,,,,,,,,Bayes,,,,,,,,,,,,,,,,,,,,,,COMPLETE
1438,1438,0.8688888888888888,2023-03-02 00:31:19.361819,2023-03-02 00:31:19.753935,0 days 00:00:00.392116,0.07948992034477737,0.08560855764991797,,,,,,,,,,,,,,Bayes,,,,,,,,,,,,,,,,,,,,,,COMPLETE
1439,1439,0.862962962962963,2023-03-02 00:31:19.384817,2023-03-02 00:31:19.799935,0 days 00:00:00.415118,0.07877296637116654,0.7545043576062938,,,,,,,,,,,,,,Bayes,,,,,,,,,,,,,,,,,,,,,,COMPLETE
1440,1440,0.8688888888888888,2023-03-02 00:31:19.491817,2023-03-02 00:31:19.815935,0 days 00:00:00.324118,0.42117036386173556,0.0858306088245931,,,,,,,,,,,,,,Bayes,,,,,,,,,,,,,,,,,,,,,,COMPLETE
1441,1441,0.8688888888888888,2023-03-02 00:31:19.547817,2023-03-02 00:31:19.898938,0 days 00:00:00.351121,0.08395379803497367,0.08561245157841846,,,,,,,,,,,,,,Bayes,,,,,,,,,,,,,,,,,,,,,,COMPLETE
1442,1442,0.8611111111111112,2023-03-02 00:31:19.588820,2023-03-02 00:31:19.915935,0 days 00:00:00.327115,0.09027956044655386,0.9604166426671625,,,,,,,,,,,,,,Bayes,,,,,,,,,,,,,,,,,,,,,,COMPLETE
1443,1443,0.8618518518518519,2023-03-02 00:31:19.682935,2023-03-02 00:31:20.007938,0 days 00:00:00.325003,0.08359438282257553,0.8637413702643182,,,,,,,,,,,,,,Bayes,,,,,,,,,,,,,,,,,,,,,,COMPLETE
1444,1444,0.8690740740740741,2023-03-02 00:31:19.711938,2023-03-02 00:31:20.021935,0 days 00:00:00.309997,0.0906938304336177,0.02054981352010765,,,,,,,,,,,,,,Bayes,,,,,,,,,,,,,,,,,,,,,,COMPLETE
1445,1445,0.8633333333333333,2023-03-02 00:31:19.745935,2023-03-02 00:31:20.162104,0 days 00:00:00.416169,0.2848935072171124,0.4942373867863939,,,,,,,,,,,,,,Bayes,,,,,,,,,,,,,,,,,,,,,,COMPLETE
